id,created_at,text
1584183265195601920,2022-10-23 14:01:37+00:00,"Today, the unknown miner’s SHA256 hashpower commands around 54% of the #Bitcoinsv’s computational power during the… https://t.co/cHZazmeSX5"
1584145658927517696,2022-10-23 11:32:11+00:00,"Peter #Schiff has warned that the United States Federal Reserve's actions to rein in #inflation could lead to a ""ma… https://t.co/ZYlRSevmcc"
1584138238209724421,2022-10-23 11:02:42+00:00,"Interview With Evan Luza, Cool Cats Co-Founder and Advisor to Bitcoin․com Verse NFT Collection https://t.co/sxBPJ23Mnc"
1584115700758478851,2022-10-23 09:33:09+00:00,"The 4,000 individuals who participated in the scheme were convinced they were purchasing bitcoin mining equipment.… https://t.co/LMWaEunHRw"
1584085084692688896,2022-10-23 07:31:29+00:00,"Where necessary the advisory committee will propose changes that bring about ""a more efficient and business-friendl… https://t.co/T9BHWA4QCk"
1584070331580325888,2022-10-23 06:32:52+00:00,#OSCE holds course on #crypto and #darkweb investigations for law enforcement agents in #Uzbekistan. https://t.co/tpkMaMMa36
1584055168035098624,2022-10-23 05:32:37+00:00,"Bloomberg Intelligence's senior commodity strategist says #bitcoin ""may be entering an inexorable phase of its migr… https://t.co/DsgG9alPEF"
1584047770234544128,2022-10-23 05:03:13+00:00,CoinEx Supports the Dream of Every Common Man by Sponsoring Rugby League World Cup 2021 https://t.co/nefEwVaPdV
1584024824204386305,2022-10-23 03:32:02+00:00,A new report estimates that $1.1 trillion in #Web3 economic value will be added to India's GDP by 2032. https://t.co/CA59HuIWpZ
1583994489730834433,2022-10-23 01:31:30+00:00,"#Bitcoin is now less volatile than #Nasdaq and #S&amp;P 500. $BTC's volatility is at multi-year lows, according to data… https://t.co/A9sgPBy1nb"
1583964671023144962,2022-10-22 23:33:00+00:00,Tesla CEO Elon Musk expects a global #recession to last until the spring of 2024. #inflation #Tesla #Spacex https://t.co/fcOHg9ExnW
1583934430925946880,2022-10-22 21:32:51+00:00,#Uzbekistan police and security officers attend #OSCE course on #cryptocurrencies. https://t.co/tpkMaN4jhe
1583904368784703488,2022-10-22 19:33:23+00:00,The VC-backed blockchain token #aptos (APT) managed to situate itself within the top 60 largest crypto market capit… https://t.co/MgCj0msNjC
1583875988684820481,2022-10-22 17:40:37+00:00,Decentralized finance (#DeFi) action has subsided a great deal in terms of the total value locked during the last s… https://t.co/PZV4siiD2b
1583866349587079169,2022-10-22 17:02:19+00:00,#Crypto exchange #Binance authorized by #Cyprus to offer services for #digitalassets. https://t.co/F0os2tQvQg
1583851117343281152,2022-10-22 16:01:47+00:00,"Since August 14, 2022, $BUSD’s market capitalization has grown 22.88% higher from $17.7 billion to today’s $21.78 b… https://t.co/lA1f1l3vmv"
1583836243355635713,2022-10-22 15:02:41+00:00,"According to #Tether CTO Paolo Ardoino, ""Adding #tether tokens to ATMs across #Brazil provides the opportunity to i… https://t.co/D0KlQMt6Oe"
1583822263035404288,2022-10-22 14:07:08+00:00,"#QNT up 10%, racing past key resistance point to start the weekend. https://t.co/a8Uvk7xJXR"
1583805985801764864,2022-10-22 13:02:27+00:00,#Cryptoqueen Ruja Ignatova learned details about police investigations into #Onecoin before she disappeared. https://t.co/cwW0N24qk5
1583801784304214016,2022-10-22 12:45:45+00:00,"#ETH starts the weekend rallying back above $1,300. https://t.co/80BKwUjfEd"
1583775833373626368,2022-10-22 11:02:38+00:00,Bitcoin․com Launches NFT Project - Buyers in VERSE Token Sale to Receive Exclusive NFTs https://t.co/Dgx6dRE2j9
1583760919909134336,2022-10-22 10:03:22+00:00,Turkish authorities have reportedly seized $40 million in #cryptocurrency and detained 46 people in an illegal bett… https://t.co/7i1GjwqC76
1583730447376211970,2022-10-22 08:02:17+00:00,#Binance registers as #crypto asset services provider in #Cyprus. https://t.co/F0os2tQvQg
1583707943509274624,2022-10-22 06:32:52+00:00,Russia’s crypto mining industry expects annual turnover of less than $1.4 billion this year as sanctions affect bus… https://t.co/eR4ggCxsrx
1583700340251463680,2022-10-22 06:02:39+00:00,"#Tether announced that #USDT will be available at more than 24,000 ATMs on a national level thanks to the integrati… https://t.co/Z42AzybAIs"
1583670084987338752,2022-10-22 04:02:26+00:00,Leaked #police documents reportedly alerted Onecoin’s mastermind about arrest efforts. https://t.co/cwW0N2ltm5
1583640042622242819,2022-10-22 02:03:03+00:00,"With the hashrate so high, a person observing #Bitcoin’s computational power would not be able to tell that some… https://t.co/LsGNqK7COm"
1583609655078817793,2022-10-22 00:02:18+00:00,"#Fidelity Digital Assets, a subsidiary of Fidelity Investments, will start offering #ethereum trading and custody s… https://t.co/l3H70oeWi2"
1583594501855412225,2022-10-21 23:02:05+00:00,Relictum Pro Thrives in Bear Market with Its Token Price Surging 4 Times https://t.co/GS5caQ8XoX
1583572039599763457,2022-10-21 21:32:50+00:00,"#Bitcoin mining revenue in #Russia increased 18 times in 4 years before recent decline, report shows. https://t.co/dZq78AA3Gx"
1583558185570353152,2022-10-21 20:37:47+00:00,"The objective of this experience is to help in the enforcement of law worldwide, allowing #Interpol members to expe… https://t.co/DD2EgiGFpD"
1583533998286209024,2022-10-21 19:01:40+00:00,"The funding round led by Bain Capital #Crypto and #Polychain Capital was oversubscribed four times, and according t… https://t.co/0Obe1Sfeon"
1583526720224649216,2022-10-21 18:32:45+00:00,"On Friday, a hacker siphoned 30,437 OHM tokens from the #OlympusDAO after finding a loophole in the rebase project’… https://t.co/22VYnXWwzb"
1583511434071199744,2022-10-21 17:32:00+00:00,The economist's remarks came just days after the currency's parallel market #exchange rate reportedly touched a new… https://t.co/Ztn5IVMiur
1583503931065663489,2022-10-21 17:02:11+00:00,Organic Communities in Web3 No Longer a Myth: Player Nodes in the Upland Metaverse Feature Multi-Property Takeovers https://t.co/9a0gN56SHO
1583496132344565760,2022-10-21 16:31:12+00:00,Jed Graham believes the Fed will pivot by December depending “on how financial markets act between now and then.”… https://t.co/cUw27IkmQN
1583485023071924225,2022-10-21 15:47:03+00:00,"#QNT rebounds on Friday, #UNI drops close to 8%. https://t.co/8qXy1DnWLI"
1583451261239586816,2022-10-21 13:32:54+00:00,Indian authority says it has frozen 44.5 additional #bitcoins as part of a money laundering investigation into a mo… https://t.co/QpkSdaJpTw
1583439125050712064,2022-10-21 12:44:40+00:00,"#BTC moves below $19,000, U.S. dollar higher on Friday. https://t.co/aUM726sFCP"
1583420882789097477,2022-10-21 11:32:11+00:00,"#Interpol, the International Criminal Police Organization, has announced the launch of the first police-focused… https://t.co/bvvUcvV2FR"
1583419588976709633,2022-10-21 11:27:03+00:00,"Top #Cryptocurrencies in Red — #BTC Below $19K, #ADA, #SOL Down Over 5%; #RobertKiyosaki Says #USD Is 'Toast' — Dai… https://t.co/4Dgt8n0kRH"
1583413561698549762,2022-10-21 11:03:06+00:00,Eunoia - a Knowledge Community DAO Platform for Professionals https://t.co/txmgopSSth
1583398095764660226,2022-10-21 10:01:38+00:00,"#Celestia, a project that aims to tackle the problem of #blockchain deployment complexity, has announced it raised… https://t.co/tL86qZy89P"
1583375529092136960,2022-10-21 08:31:58+00:00,"Tatonga Rusike asserts that the naira will likely continue to weaken against the dollar, which has been gaining gro… https://t.co/51addADItj"
1583360336811282432,2022-10-21 07:31:36+00:00,Couple and lawyer charged in #Germany for helping Onecoin’s #Cryptoqueen Ruja Ignatova. https://t.co/u7RKZPg8Rz
1583345503924031488,2022-10-21 06:32:39+00:00,The Japan Virtual and Crypto Assets Exchange Association plans to allow #crypto trading platforms to list coins wit… https://t.co/salVYniAva
1583330183980859396,2022-10-21 05:31:47+00:00,"Nubank's token #Nucoin will be issued on top of #Ethereum and will use #Polygon, a scaling layer, to allow users to… https://t.co/3fXmOMFqkf"
1583315285905657857,2022-10-21 04:32:35+00:00,Hong Kong's SFC has confirmed that the regulator is considering letting retail investors invest directly in #crypto… https://t.co/A87eEkaf25
1583300131369410560,2022-10-21 03:32:22+00:00,"#Russian nationals arrested in #Europe face extradition to the U.S. on allegations of shipping #oil, sourcing dual-… https://t.co/Hpn4UNGIdY"
1583285184589287424,2022-10-21 02:32:58+00:00,#JPMorgan Chase has hired a former executive at bankrupt #crypto lender #Celsius Network as its new head of digital… https://t.co/9vw3mYbjf8
1583254759288414208,2022-10-21 00:32:04+00:00,"Rich Dad Poor Dad author Robert #Kiyosaki says the U.S. dollar is toast, citing Saudi Arabia's request to join the… https://t.co/yiB5GiICPr"
1583224434168516609,2022-10-20 22:31:34+00:00,Three people face trial in #German court for their roles in the #Onecoin crypto scam. https://t.co/u7RKZPg8Rz
1583194282898313216,2022-10-20 20:31:46+00:00,"#Nubank, the #Brazil-based institution which has offices all across #Latam, will issue its own #cryptocurrency call… https://t.co/MUIQd5tHLR"
1583179437121499137,2022-10-20 19:32:46+00:00,German #cryptocurrency platform #Nuri to stop trading after November as it goes out of business. https://t.co/EgFyLaAe4r
1583164227912859648,2022-10-20 18:32:20+00:00,A group of #Russians and #Venezuelans charged in the #U.S. for #sanctions evasion using #crypto. https://t.co/Q2TDyTioLf
1583134149602598913,2022-10-20 16:32:49+00:00,"The investor thinks that within the next five years, the greenback could very well “lose its status as the world's… https://t.co/urNi2THfNB"
1583134041569923072,2022-10-20 16:32:23+00:00,"The CEO said: ""This Declaration will open the door to many of the large traditional financial institutions (TradFi)… https://t.co/xpU1SE2xkm"
1583118922135482369,2022-10-20 15:32:18+00:00,"#DOGE snaps 2-day losing streak, climbing above $0.06000 in the process. https://t.co/Xr5p3zHTE7"
1583088716234444800,2022-10-20 13:32:16+00:00,Tesla is still holding $218 million in #bitcoin. CEO Elon Musk expects the company to be worth more than #Apple and… https://t.co/c3NRj3G4DO
1583084481891561472,2022-10-20 13:15:27+00:00,"#BTC rebounds on Thursday, climbing back above $19,000. https://t.co/awc8s6GMvC"
1583059627935432704,2022-10-20 11:36:41+00:00,"#Crypto Markets Hold Steady, Consolidating as Dark #Predictions of #Recession, News of Social Unrest Fill Headlines… https://t.co/pqBj28yMe8"
1583043536366075904,2022-10-20 10:32:45+00:00,Insolvent #crypto #bank #Nuri tells clients to withdraw funds after failing to find investors. https://t.co/EgFyLaAe4r
1582998136280096768,2022-10-20 07:32:21+00:00,"""Recommendations not fully remediated or significantly progressed by October 2022 can lead South Africa to be place… https://t.co/3zu0rDXckj"
1582952773934407680,2022-10-20 04:32:05+00:00,"A #Walmart executive discusses crypto's role in the company's future. ""#Crypto will become an important part of how… https://t.co/EiAROoO8Tz"
1582922553001066496,2022-10-20 02:32:00+00:00,"#Goldman Sachs CEO David Solomon has warned about a U.S. #recession, urging investors to be cautious and prepared.… https://t.co/9AgBH7IM9Y"
1582907695425761280,2022-10-20 01:32:58+00:00,Moola told the attacker that contact had been made with #law enforcement and that steps have been taken to make it… https://t.co/39EbMbbIxt
1582892506831675392,2022-10-20 00:32:37+00:00,"Jim Rogers expects the bear market to get much worse, adding that this #recession will be the worst in his lifetime… https://t.co/bqT8c8jV5C"
1582870011420454912,2022-10-19 23:03:13+00:00,While Everyone Is Trying to Build a Super App Blockbank Has Done It https://t.co/Ah2NWypAUb
1582862095862837248,2022-10-19 22:31:46+00:00,"The group of 55 Finder’s experts think #bitcoin will increase in value by more than 10% by the year’s end, hitting… https://t.co/MuftuUbuvz"
1582842530227363841,2022-10-19 21:14:01+00:00,Join us on Twitter Spaces to hear about Bitcoin․com’s journey going multi-chain https://t.co/UexorHUJ7h
1582832240958271489,2022-10-19 20:33:08+00:00,The playing card firm plans to launch a classic #Bicycle card deck featuring the company’s Bored Ape #NFT. https://t.co/0f4OvnkndE
1582832034892115969,2022-10-19 20:32:19+00:00,"""We are confident that G+D’s technological #expertise and their strong regional presence in our continent will allo… https://t.co/TNQlwXUu7E"
1582801637948633088,2022-10-19 18:31:32+00:00,"According to Eurostat on Wednesday, Euro area annual #inflation is up to 9.9% in September, up from 9.1% in August.… https://t.co/ASH0EYzF90"
1582794340539457536,2022-10-19 18:02:32+00:00,Brussels takes steps to reduce #power consumption in #crypto mining data centers. https://t.co/Yn97CN16O7
1582779193662005249,2022-10-19 17:02:21+00:00,Understanding TRON Grand Hackathon 2022 Season 3 and the Hacker House Event #HackaTRON #TronStrong💎 #TRON #TRONICS… https://t.co/Dyj3TXRmXJ
1582771793856991238,2022-10-19 16:32:56+00:00,"Twitter user Igor Igamberdiev revealed the attacker initiated the process with 243,000 #CELO tokens obtained from… https://t.co/VRZ2WpLO04"
1582763899480600579,2022-10-19 16:01:34+00:00,"Banks must only approve requests for foreign exchange if the customer's objective is to import food, medicines, or… https://t.co/DeJ2ikADbL"
1582760932761276417,2022-10-19 15:49:47+00:00,"#XMR climbs to 10-day high, whilst #AAVE remains close to highest level in 5-weeks. https://t.co/8l8fKze591"
1582733905463242757,2022-10-19 14:02:23+00:00,"Researchers from the crypto analysis platform Cryptoquant identified an outflow of 48,000 #bitcoin coming from the… https://t.co/NdW4iHq1py"
1582720714515173382,2022-10-19 13:09:58+00:00,"#ETH falls below $1,300, as strong Q3 earnings strengthen USD. https://t.co/o0lZpXJ7Cr"
1582697950773665793,2022-10-19 11:39:31+00:00,Top #Cryptocurrencies Shed 1-3% in Value as Markets Consolidate; EU Commissioner on 'Global Regulation of #Crypto'… https://t.co/5f304TSjhc
1582696133381754880,2022-10-19 11:32:17+00:00,"A #CBDC diagnostic study found that ""a retail CBDC presented the strongest and direct opportunity for the adoption… https://t.co/rIAOMCBSQf"
1582658438277976069,2022-10-19 09:02:30+00:00,#EU to develop energy efficiency label for #cryptocurrency mining. https://t.co/Yn97CMIXzZ
1582627996610924546,2022-10-19 07:01:32+00:00,"The Ethiopian minister of industry, Melaku Alebel Addis, suggested in a tweet that the restrictions are needed beca… https://t.co/TyetUDpIlU"
1582605464826699776,2022-10-19 05:32:00+00:00,"Called #Flipverse, this #metaverse will allow customers to experience shopping as if they were physically present i… https://t.co/vpX2m0SLvG"
1582583019709210625,2022-10-19 04:02:49+00:00,The European Commission's financial services commissioner has urged U.S. lawmakers to establish new rules to regula… https://t.co/OuCqtiH0Qo
1582552837619437570,2022-10-19 02:02:53+00:00,Bank of America CEO Brian Moynihan and JPMorgan &amp; Chase CEO Jamie Dimon both agree that the U.S. #economy is doing… https://t.co/PkzUYpxqCE
1582522460477480961,2022-10-19 00:02:11+00:00,"U.S. President Joe Biden says that the U.S. economy is ""strong as hell,"" and the White House claims ""he has done th… https://t.co/OKgOnoNE86"
1582492294464229377,2022-10-18 22:02:18+00:00,"Societe Generale-Forge, a subsidiary of France's third-largest bank, #SocieteGenerale, has obtained registration as… https://t.co/DRSM1IMna8"
1582492274755239941,2022-10-18 22:02:14+00:00,#Cryptocurrency and #cybercrime to be the main focus of Interpol’s General Assembly in #India this week. https://t.co/05QUJfJlYi
1582469973573881856,2022-10-18 20:33:37+00:00,"The program would include not only foods and beverages but also other kinds of products, including cleaning supplie… https://t.co/UojmgE9pY4"
1582469559335862272,2022-10-18 20:31:58+00:00,"#Flipkart, one of the biggest #India-based e-commerce companies, has announced it will pilot its own #metaverse sho… https://t.co/Fh8jflW4vR"
1582447162553950209,2022-10-18 19:02:58+00:00,#Bitcoin has been added to the Guinness World Records list this year as it holds the record for being the first dec… https://t.co/h6GeimR2sb
1582424435830554626,2022-10-18 17:32:40+00:00,"The study issued by #Ericsson determined that at a global level, 6 of every 10 #5G adopters believe this technology… https://t.co/bh8kgC9SBy"
1582424154426384385,2022-10-18 17:31:33+00:00,"While $ETHW has shed 35% in USD value, the #crypto network’s token economy and decentralized finance (defi) ecosyst… https://t.co/TFLoQHqGye"
1582416780278263809,2022-10-18 17:02:14+00:00,Register Here for Our Weekly Technical Analysis Update https://t.co/bsbMCdAg0c
1582401662198902784,2022-10-18 16:02:10+00:00,"While the blockchain-enabled Bidchain platform is this year’s bronze-winning project, two projects that use artific… https://t.co/PJD8JlLX6C"
1582401507286482946,2022-10-18 16:01:33+00:00,The co-founders from the troubled #crypto hedge fund Three Arrows Capital (#3AC) are reportedly being investigated… https://t.co/gUqcgH3tvX
1582388721902837760,2022-10-18 15:10:45+00:00,"#MATIC hits 5-week high, #ATOM rises for third straight session. https://t.co/BE8pTeL6Xp"
1582378886155108354,2022-10-18 14:31:40+00:00,The fintech bill broadens the regulatory reach of the Financial Market Commission in #Chile to include the supervis… https://t.co/CVfKhyu8Jp
1582371557808087041,2022-10-18 14:02:33+00:00,"#Bitcoin has seen gains in October ten times out of the last 13 years, which has led #crypto enthusiasts to call th… https://t.co/3zAtVWlE4A"
1582356373827858433,2022-10-18 13:02:12+00:00,"#Interpol sets up unit to tackle crimes associated with #cryptocurrencies, top executive unveils. https://t.co/05QUJg0WPQ"
1582348297028894721,2022-10-18 12:30:07+00:00,"#BTC, #ETH surge past key resistance levels, both hitting 5-day highs. https://t.co/0vvF6bFOXU"
1582334063443968000,2022-10-18 11:33:33+00:00,"Sergio Massa, minister of the treasury of #Argentina, has proposed a system of price controls called ""Fair Prices""… https://t.co/MUgSTtg1WQ"
1582330955213443072,2022-10-18 11:21:12+00:00,"#Polygon up 5%, #BTC, #ETH Hold Steady — Bitcoin․com News Daily Price Update 10.18.22 https://t.co/2ytSnb1H81"
1582326392234323969,2022-10-18 11:03:04+00:00,TheTrade Is a Game-Changer in the Uniswap V3 Market of 2023 https://t.co/c6gZFoAFEr
1582310945988104193,2022-10-18 10:01:42+00:00,"A new #blockchain network called #Aptos announced the launch of its mainnet on Monday, following a slew of capital… https://t.co/sdY0QwUzjy"
1582288533645295617,2022-10-18 08:32:38+00:00,"A recent study issued by #Ericsson, the Swedish telecom giant, deals with the effects powerful data transmission te… https://t.co/qjBGnqUtpA"
1582265758817882113,2022-10-18 07:02:08+00:00,Princess Nourah bint Abdulrahman University is also organizing local and international partnerships as well as hold… https://t.co/0Aa3WLJAd3
1582242983407067136,2022-10-18 05:31:38+00:00,A fintech-related bill that seeks to bring clarity to institutions operating digital and #cryptocurrency services i… https://t.co/eq3PnT6RQC
1582213012001157120,2022-10-18 03:32:32+00:00,"India plans to discuss #crypto regulations during its #G20 presidency to arrive at a ""technology-driven regulatory… https://t.co/Q5qC0aPIGF"
1582182660272984065,2022-10-18 01:31:56+00:00,"#Mastercard has introduced ""Crypto Source"" to enable financial institutions to offer #crypto trading and other rela… https://t.co/EyxLTn4gan"
1582152679274315777,2022-10-17 23:32:48+00:00,Hackers from the notorious crime syndicate Lazarus Group are reportedly targeting #crypto companies in Japan. https://t.co/H16BuDZOl5
1582122415961669633,2022-10-17 21:32:33+00:00,Developers from Ripplex and Peersyst introduced the first step toward #Ethereum Virtual Machine compatibility with… https://t.co/o6w2Ia58aC
1582107237296001024,2022-10-17 20:32:14+00:00,Interest in #crypto among Russian #Telegram users expected to shrink further after latest #EU restrictions. https://t.co/gul3vVidAm
1582092280680226816,2022-10-17 19:32:48+00:00,"According to the statistical agency’s latest data, Ghanaian prices only went up by 2% between August and September.… https://t.co/ApIzSqGoQS"
1582092241950343168,2022-10-17 19:32:38+00:00,Regulators from the state of Texas and the state’s attorney general are objecting to #FTX purchasing… https://t.co/h2qdPlB4iY
1582077126890885126,2022-10-17 18:32:35+00:00,"The architect of this project is #Curitiba councilor Noemia Rocha, who suggested the city should consider how to ta… https://t.co/0MDLuyniAE"
1582062137127497728,2022-10-17 17:33:01+00:00,South Korea’s Financial Supervisory Service has said five major commercial banks are involved in the $7.2 billion m… https://t.co/IvcZQOh5WJ
1582061787423584256,2022-10-17 17:31:38+00:00,"During the last three months, the #stablecoin #USDC’s market valuation has dropped by more than 19%, shedding appro… https://t.co/PexX8WRexp"
1582046861002579968,2022-10-17 16:32:19+00:00,"Individuals found to be in violation of Macau's laws will be fined between $123 and $1,237 (1,000 patacas and 10,00… https://t.co/ZG6XpxGLKt"
1582035425287606272,2022-10-17 15:46:52+00:00,"#QNT climbed to its highest point since December 12, 2021, on Monday. https://t.co/Jj2OFJFxHc"
1582016435886268416,2022-10-17 14:31:25+00:00,"RT @BitcoinCom: https://t.co/H6z5iTXy68's official token $VERSE is going on sale Nov 1st and we’re giving away $10k+ in crypto!

To partici…"
1582009191379918848,2022-10-17 14:02:38+00:00,"The number of #bitcoin stored in these types of treasuries dropped by 57,481 bitcoin, worth around $1.1 billion usi… https://t.co/zePnKFlSqL"
1581986775329050625,2022-10-17 12:33:33+00:00,"#BTC back above $19,000, following weekend sell-off. https://t.co/RwKZ4gOxAO"
1581975399550287872,2022-10-17 11:48:21+00:00,"#Ethereum up Nearly 3%, African Currencies Struggle Against US #Fed Policy, #PeterSchiff Speculates on Financial… https://t.co/bpAcyZJYKi"
1581971337668874240,2022-10-17 11:32:13+00:00,"Russian #crypto channels on #Telegram lose audience amid #sanctions and low prices, report. https://t.co/gul3vVidAm"
1581963860960944128,2022-10-17 11:02:30+00:00,Blockchain Security Company Hexens Raises $4․2 Million in Seed Funding Led by IOSG Ventures https://t.co/7pXrq7SSY3
1581956379455016961,2022-10-17 10:32:46+00:00,Some traders in the country’s Ashanti region have reportedly protested against the #cedi’s depreciation and Ghana’s… https://t.co/ULvm7hLNQT
1581949000113999872,2022-10-17 10:03:27+00:00,RT @BTCTN: Watch @McLarenF1 @okx Formula 1 Driver @danielricciardo talk #crypto and #F1 with https://t.co/UtJJm85D5m News at #TOKEN2049 ⬇️…
1581941223614742531,2022-10-17 09:32:33+00:00,"#Curitiba, the capital of the state of #Parana in #Brazil, is considering accepting payments in #cryptocurrency for… https://t.co/C27a3Wfqdx"
1581926235332300801,2022-10-17 08:32:59+00:00,Prosecutors are also hoping to uncover the source and destination of the laundered funds using the virtual currency… https://t.co/tJmPGTQzZV
1581910957961273345,2022-10-17 07:32:17+00:00,"Macau’s draft bill seeks to ensure that digital money and other forms of money have ""equal status.""… https://t.co/L4R5TZVsum"
1581880774617272321,2022-10-17 05:32:21+00:00,98% of CEOs surveyed are preparing for a U.S. recession while 99% are preparing for EU #recession. #inflation https://t.co/g8NMs1uvta
1581865234397990912,2022-10-17 04:30:36+00:00,#Crypto exchange #Binance announces $500-million #mining #lending project. https://t.co/aRmUGdECaa
1581850510268956673,2022-10-17 03:32:05+00:00,"Kevin O'Leary expects #bitcoin to go up when the #Stablecoin Transparency Act passes, which could be soon after the… https://t.co/QPPx3mQkl3"
1581835389639479296,2022-10-17 02:32:00+00:00,"#Meta #metaverse app, Horizon Worlds, is also struggling to acquire new users and has lowered its goal of reaching… https://t.co/SMIuNzq6OX"
1581820476506054658,2022-10-17 01:32:45+00:00,"Economist Peter #Schiff warned the #Fed's action could lead to market #crashes, a massive financial #crisis, and se… https://t.co/jBi2kyQii8"
1581790195833536512,2022-10-16 23:32:25+00:00,"Elon Musk says #Spacex will keep funding #Ukraine for free even though #Starlink is losing money, with $80 million… https://t.co/gGhLN8aYNE"
1581760139828563968,2022-10-16 21:32:59+00:00,"Terra’s total value locked (TVL) in decentralized finance #DeFi has increased from $350,174 to today’s $41.55 milli… https://t.co/w55Xr9v9Tf"
1581729333890383872,2022-10-16 19:30:34+00:00,#Binance Pool looking to support #bitcoin #miners through loans. https://t.co/aRmUGdnz8a
1581699485834825733,2022-10-16 17:31:58+00:00,"As part of a keynote, #Meta presented a demo showing an early look at the new graphical presentation of #metaverse… https://t.co/vIt19mkBWO"
1581684326567055360,2022-10-16 16:31:44+00:00,"Shunichi Suzuki said: ""We cannot tolerate excessive #volatility in the currency market driven by #speculative moves… https://t.co/hMLUCyGOri"
1581669220068139010,2022-10-16 15:31:42+00:00,FX strategists from the financial institution Citi argue that $EUR could eventually hit 0.86 against the $USD.… https://t.co/Um1nsJ1zTS
