id,created_at,text1541519776257916930,2022-06-27 20:32:09+00:00,"The wallet, dubbed #Meta Pay, will be an evolution of what's known today as #Facebook Pay, but with a new focus on… https://t.co/3QNKoQjmJi"
1541504862244016128,2022-06-27 19:32:53+00:00,The prominent rap stars Eminem and Snoop Dogg released a new music video that showcases the Bored Ape Yacht Club… https://t.co/jt4ktEJkus
1541489707321856001,2022-06-27 18:32:40+00:00,"#Binance stated that it has enrolled the services of Latam Gateway, a payments processing company that will substit… https://t.co/A2IxUM7rEM"
1541474519449309187,2022-06-27 17:32:19+00:00,"Reports say Russia has defaulted on its foreign currency debt. However, the Kremlin disagrees and says the debt was… https://t.co/hw3ToqFJ1j"
1541466849208111108,2022-06-27 17:01:50+00:00,How Pionex’s Trading Bots Can Help Manage Risk https://t.co/HIwiViReRh
1541452169169305600,2022-06-27 16:03:30+00:00,The unit supposedly has been under wraps since earlier this year. #Tencent aims to have a staff of more than 300 pe… https://t.co/HPXY1XmbvZ
1541451800754225152,2022-06-27 16:02:02+00:00,"#DOGE climbs close to a 20-day high, as #TRX extends recent upwards momentum. https://t.co/szPYYn6ZoN"
1541421771039047683,2022-06-27 14:02:43+00:00,"According to a recent report, analysts say that a number of loans backed by #bitcoin mining machines are underwater. https://t.co/aDfu5NT5mb"
1541414223363940354,2022-06-27 13:32:43+00:00,"#Crypto mining restrictions are ousting #Iran from the global #coin minting industry, critics say. https://t.co/JXQoWwwKT6"
1541410706653945856,2022-06-27 13:18:45+00:00,"#BTC, ETH consolidate on Monday, as key resistance levels are hit. https://t.co/GAYhPLLOdW"
1541383873791148032,2022-06-27 11:32:07+00:00,#Meta announced the launch of a new digital wallet that will support the economy of users in the upcoming iteration… https://t.co/iiRFzlIS9F
1541380928496230400,2022-06-27 11:20:25+00:00,"#Dogecoin Jumps 10%, Stealing the No. 10 Spot From Polkadot, as #Markets Remain Largely Flat; #Iran #Mining Ban Spa… https://t.co/Z0uJvtumen"
1541376532656046081,2022-06-27 11:02:57+00:00,Pocket Network Advances Its Multichain Strategy With Latest Milestone https://t.co/KdMenz9XP1
1541353803831713792,2022-06-27 09:32:38+00:00,"#Binance, one of the leading #cryptocurrency exchanges by volumes traded, has announced a new partnership to solve… https://t.co/bUrTmeZnrW"
1541316265339412485,2022-06-27 07:03:28+00:00,"#Tencent, one of the biggest Chinese software companies, has taken another step toward getting into the #metaverse,… https://t.co/zCaQQVi7hS"
1541285658240716803,2022-06-27 05:01:51+00:00,My Liquidity Partner (MLP) Is Now Available for Trading on LBank Exchange https://t.co/pRAa5QQ75V
1541278320339320832,2022-06-27 04:32:41+00:00,Seasonal #mining ban in #Iran provokes backlash from the local #crypto community. https://t.co/JXQoWwwKT6
1541240491718709251,2022-06-27 02:02:22+00:00,"Mark Zuckerberg hopes to get billions of people to use the #metaverse, generating hundreds of billions of dollars f… https://t.co/r7Z76kxUwc"
1541202913841844226,2022-06-26 23:33:03+00:00,"SEC Chairman Gary Gensler has proposed ""one rule book"" for the regulation of #crypto, noting that it ""will really h… https://t.co/CSvRQ87W5f"
1541187704406376448,2022-06-26 22:32:37+00:00,Central Bank of Iran to initiate the pilot phase of its #digitalcurrency project this summer. https://t.co/j9ySs1LnkU
1541165010822594565,2022-06-26 21:02:26+00:00,Yuga Labs has sued the artist dubbed Ryder Ripps and several collaborators for attempting to devalue the #BAYC bran… https://t.co/9bWt8nlncd
1541127320043503617,2022-06-26 18:32:40+00:00,Mudit Gupta says the #HorizonBridge attacker allegedly took control of the multi-signature wallet leveraged in… https://t.co/yjYC9knkYy
1541127092645072899,2022-06-26 18:31:46+00:00,The recently introduced digital currency — the e-naira — is thought by Emefiele to ensure Nigeria will remain compe… https://t.co/nVnuc4h3xZ
1541096772440936450,2022-06-26 16:31:17+00:00,Lebanon needs to have a government in place in order for it to access a further $11 billion that was pledged by don… https://t.co/v0gP6f3d9e
1541089706527653895,2022-06-26 16:03:12+00:00,The #crypto company Voyager has secured funds from Alameda Ventures in order to get more access to liquidity. https://t.co/oPCwRaTdHr
1541051803801976832,2022-06-26 13:32:36+00:00,#Iran prepares to launch the #crypto rial pilot in the coming weeks. https://t.co/j9ySs1LnkU
1541021463523823617,2022-06-26 11:32:02+00:00,"Big names offered assurance of #crypto's bright future in spite of bearish #markets this week, as Russia's #ruble t… https://t.co/HboHrykt9S"
1540991190711111681,2022-06-26 09:31:44+00:00,"Godwin Emefiele said a #digital currency ""would be necessary in the future to ensure Nigeria is #competitive as the… https://t.co/HQEhA5DQlz"
1540976265301213185,2022-06-26 08:32:26+00:00,Central Bank of Russia plans to begin testing real #transactions with the #digitalruble next April. https://t.co/W2WFtcXFes
1540960869252726784,2022-06-26 07:31:15+00:00,The politicians’ failure to create a new government is delaying the implementation of key reforms that allow Lebano… https://t.co/Bo9TmhI5aR
1540945810501865473,2022-06-26 06:31:25+00:00,"#Crypto mining hardware worth 100 million rubles stolen in Russia’s mining capital, #Irkutsk. https://t.co/o7EsD3PVMR"
1540933144093884416,2022-06-26 05:41:05+00:00,"If a Netherlands customer sends #crypto off #Coinbase, they must identify the wallet owner, the purpose of transfer… https://t.co/kFx7KaNz3I"
1540901049246031872,2022-06-26 03:33:33+00:00,"#Binance's VIP program allows users to ""get rewarded with more discounts and VIP privileges"" as their trading volum… https://t.co/BJSYntDJq5"
1540870477773676544,2022-06-26 01:32:04+00:00,"“I hate the patronizing idea of regulators telling people what they can and can’t do with their money,” said the Br… https://t.co/qxas8U3IsQ"
1540840362612330496,2022-06-25 23:32:24+00:00,"Bank of Russia to present a roadmap for the #digitalruble in 2023, ahead of schedule. https://t.co/W2WFtcXFes"
1540809909847183363,2022-06-25 21:31:24+00:00,#Russian police investigate a large theft of #crypto mining equipment in #Siberia. https://t.co/o7EsD3PVMR
1540779882249977856,2022-06-25 19:32:04+00:00,A newly published report claims sources say the #crypto lender #Celsius is now working with the restructuring advis… https://t.co/8HGOi6TDK5
1540765010435129344,2022-06-25 18:32:59+00:00,Financial watchdog to expand Albania’s #crypto regulatory framework this year. https://t.co/C9vdGpPcPD
1540749920310665216,2022-06-25 17:33:01+00:00,The four #bitcoin block rewards were mined in 2010 and the 200 bitcoin worth $4.27 million were transferred to an u… https://t.co/kDJfjU2IhB
1540719675264249857,2022-06-25 15:32:50+00:00,"The total value locked across the entire #DeFi ecosystem has improved, jumping over 7% during the last five days. https://t.co/miQ1zwEWZ2"
1540715638989107200,2022-06-25 15:16:48+00:00,"Be sure to follow Bitcoin․com News on TikTok to keep up on the latest developments moving the crypto markets! 


https://t.co/RZHbImjBKS"
1540704383691739139,2022-06-25 14:32:04+00:00,"#SHIB now up nearly 50% in the last week, #NEAR hits 2-week high. https://t.co/k0een6zPmg"
1540704248127578113,2022-06-25 14:31:32+00:00,"Keito Noguchi said that through the $10 million fundraise his company would now ""maximize the impact of Brave group… https://t.co/iW2t6DPB9X"
1540699268561793025,2022-06-25 14:11:45+00:00,"#ETH moved into the $1,200 region to start the weekend, as #prices rose for a third consecutive session. #BTC was b… https://t.co/40aKqqL3lM"
1540629110090874881,2022-06-25 09:32:58+00:00,Authorities in #Albania to start taxing #crypto-related #income in 2023. https://t.co/C9vdGpPcPD
1540613692693397504,2022-06-25 08:31:42+00:00,"#Bybit stated that this decision was made ""taking into account the level of penetration and the rapid growth in the… https://t.co/4XfPzGyonv"
1540583602852958208,2022-06-25 06:32:08+00:00,"In an email #Uphold stated: ""We're very sorry to tell you that Uphold has decided to withdraw from #Venezuela owing… https://t.co/WRAmEe1xdn"
1540568344864112641,2022-06-25 05:31:30+00:00,"Brave Group will use the new capital to strengthen its existing business operations and to ""expand its solution ser… https://t.co/X42jYYH91g"
1540561288098619392,2022-06-25 05:03:27+00:00,Saddle․Finance Creates New Standards for DeFi Trading https://t.co/nIrVIm32cz
1540508134975881216,2022-06-25 01:32:15+00:00,A Chinese state-run newspaper has warned about #bitcoin’s price falling to zero. #cryptocurrency #crypto $BTC https://t.co/VPC3RhHEGz
1540477791203987456,2022-06-24 23:31:40+00:00,"#Bybit, a Singapore-based, top-ten #cryptocurrency exchange by volume traded, has announced that it will expand its… https://t.co/jp9gTTP5DV"
1540447702131015681,2022-06-24 21:32:06+00:00,"#Uphold, a New York-headquartered #cryptocurrency exchange and stock trading platform, has announced today that it… https://t.co/hgazrEdDuD"
1540432771813982212,2022-06-24 20:32:47+00:00,"Followers of Ronaldo, who is also known as CR7, will also have the opportunity to join the 37-year-old footballer’s… https://t.co/6EwYQC8XB9"
1540417584461488129,2022-06-24 19:32:26+00:00,"It was recently revealed by developers that the public beta of #Shibarium, a #SHIB scaling solution, will launch in… https://t.co/aSHchpyirz"
1540402487966011392,2022-06-24 18:32:27+00:00,New bill to impose fines on non-registered #crypto #exchange and #investment platforms in #Russia. https://t.co/FdP0Q4fawl
1540387423993094145,2022-06-24 17:32:35+00:00,"Today, John McAfee’s body is still in a Spanish morgue as a legal case involving an independent autopsy is still un… https://t.co/FJrZpXIaIb"
1540379724715028480,2022-06-24 17:01:59+00:00,Bitcoin of America Is Working to Solve the Gender Problem in the Crypto Industry https://t.co/2R7JtDerZe
1540372272791408646,2022-06-24 16:32:23+00:00,#Swiss financial watchdog executive urges #regulators to protect #investors from “abusive” #crypto market. https://t.co/nRR3eB3ZHt
1540357272580268032,2022-06-24 15:32:46+00:00,"#XRP, #AVAX near multi-week highs, following Friday's flurry. https://t.co/ui4WPBDi0s"
1540342054483550211,2022-06-24 14:32:18+00:00,"Samuel Nuungulu said: ""Blockchain is the future and we thought it was necessary to use this degree as a forerunner… https://t.co/hEQPk3hcvL"
1540334568921784322,2022-06-24 14:02:33+00:00,The first #crypto derivatives investment vehicle from #Coinbase Derivatives Exchange will be a “nano bitcoin future… https://t.co/eiqFisCo2V
1540320323895164929,2022-06-24 13:05:57+00:00,"#ETH hits a 1-week high, as price moves towards $1,200. https://t.co/3MMxeYHa9r"
1540296866537115648,2022-06-24 11:32:44+00:00,"Through the partnership arrangement, followers of the prolific footballer will have an opportunity to “own an iconi… https://t.co/1yBxv9BtRr"
1540294633778864128,2022-06-24 11:23:52+00:00,"#XRP ⬆️ 14% as Supporters Await Key #SEC vs #Ripple Lawsuit Decisions, #Bitcoin Hovering Around $21K —… https://t.co/HREsrctAlt"
1540289262289035264,2022-06-24 11:02:31+00:00,GRN (G) Is Now Available for Trading on LBank Exchange https://t.co/dgnfnlo46i
1540266581762215937,2022-06-24 09:32:24+00:00,Draft law targeting illegal issuance and #exchange of digital assets filed in #Russian parliament. https://t.co/FdP0Q4fawl
1540236349470642179,2022-06-24 07:32:16+00:00,#Swiss regulator compares current #crypto market to the U.S. #stock market of the late 1920s. https://t.co/nRR3eB3ZHt
1540206114205220864,2022-06-24 05:32:07+00:00,"By introducing the blockchain course, the university hopes to ""lay the foundation for possible incubation of tech-s… https://t.co/USBw7maATx"
1540198266435997696,2022-06-24 05:00:56+00:00,NoVa Battles’ NoVa (NVA) Token Is Now Listed in Bitrue. #NoVaBattles #Gamefi #PlayToEarn #Cryptogame https://t.co/lfFOggkBcl
1540176041720926208,2022-06-24 03:32:38+00:00,"""#Crypto assets and decentralized finance (#defi) have the potential to pose real risks to financial stability,"" sa… https://t.co/2niyE36uai"
1540145720161964033,2022-06-24 01:32:08+00:00,"Fed Chair Jerome Powell said the central bank is ""not really seeing significant macroeconomic implications"" from… https://t.co/SQhNc77R4D"
1540115335579328513,2022-06-23 23:31:24+00:00,"""Despite this warning, #Bybit and #Kucoin did not contact the OSC by the deadline and continued operations in Ontar… https://t.co/k5ArNu7cSi"
1540108211818303490,2022-06-23 23:03:06+00:00,The new rules presented by the #Spanish Ministry of Treasury specify that #cryptocurrency holders might have to dis… https://t.co/WVumwkdoqW
1540108081220272128,2022-06-23 23:02:35+00:00,"""Play to Earn"" to Own Remitano Network's RENEC Token https://t.co/uG4SEB3orH"
1540085394926346240,2022-06-23 21:32:26+00:00,Terraform Labs (TFL) founder Do Kwon said he was “devastated” by the #LUNA and #UST implosion that took place in mi… https://t.co/4FcxGO1qub
1540070183787806721,2022-06-23 20:31:59+00:00,"The Forum will focus on ""action-based projects such as implementation prototyping, hackathons, plugfests, and open-… https://t.co/tMxQuv0EW3"
1540061470762958848,2022-06-23 19:57:22+00:00,The e-commerce and online auction giant #Ebay has announced the company has acquired the #NFT marketplace Knownorig… https://t.co/TGdXTT0QcK
1540025161079996417,2022-06-23 17:33:05+00:00,Central Bank of Russia to test #digitalruble payments in #realestate transactions. https://t.co/OGyOIUdp5E
1540024690340777984,2022-06-23 17:31:13+00:00,"In a letter to investors, Voyager’s management explained that 3AC potentially defaulted on a $655 million loan. It… https://t.co/A75Gbod3tH"
1540017830334267395,2022-06-23 17:03:57+00:00,Cryptostone Announces CPS Token Launch Date for Its Revolutionary Financial Ecosystem https://t.co/SqTQLd0sDO
1539994716514795520,2022-06-23 15:32:06+00:00,"#MATIC moves back into #crypto top 20, after rising by over 25% on Thursday. https://t.co/rq4vJN3RuG"
1539979552440606722,2022-06-23 14:31:51+00:00,"The core team also warned that ""no timelines can be absolute in software development."" #ada #cardanotestnet https://t.co/xaCnesFy86"
1539972308399321089,2022-06-23 14:03:04+00:00,"The #Spanish treasury has proposed a new set of rules that will apply to #cryptocurrency holders and operators, imp… https://t.co/U91FoVx1jl"
1539959425703845890,2022-06-23 13:11:52+00:00,"#BTC, #ETH rebound on Thursday, following yesterday's sell-off. https://t.co/446nnliaJD"
1539934280406777857,2022-06-23 11:31:57+00:00,"#Meta, #Microsoft, and other companies like #Epic Games have gathered together to found the #Metaverse Standards Fo… https://t.co/6DlEzYg4pI"
1539929665606803456,2022-06-23 11:13:37+00:00,"Don’t forget to follow Bitcoin․com News on TikTok to keep up on the latest developments moving the crypto markets! 

https://t.co/RZHbImjBKS"
1539929258641874945,2022-06-23 11:12:00+00:00,"#MATIC ⬆️ 23% With News of #Polygon Achieving ‘Carbon Neutrality,’ #Cardano #Vasil Hard Fork Postponed —… https://t.co/GP9d44tUXh"
1539889257501827072,2022-06-23 08:33:03+00:00,Bank of Russia to start trials with smart contracts on the #digitalruble platform. https://t.co/OGyOIUdp5E
1539843652196909056,2022-06-23 05:31:50+00:00,"The IOG team hinted that some seven outstanding bugs, none of which have been ranked as severe, necessitated the de… https://t.co/7tW1pFPGGA"
1539836129750417408,2022-06-23 05:01:56+00:00,LBank Exchange Continues to Hire Amid the Massive Crypto Job Cuts https://t.co/7IOdLgY3zj
1539798547444416512,2022-06-23 02:32:36+00:00,"""I can't see the point of #crypto. I don't think anybody needs to own it,"" said the billionaire. #cryptocurrency… https://t.co/RifHjBGcvN"
1539768310241394688,2022-06-23 00:32:27+00:00,"""You just cannot defy gravity... At some point, you really have to face the music,"" said the BIS chief about… https://t.co/YanjfhSUT9"
1539745796500996097,2022-06-22 23:02:59+00:00,Tencent’s #Wechat to ban accounts from providing transaction channels and guidance for #cryptocurrencies. https://t.co/5VYw5tuPBu
1539738235865268224,2022-06-22 22:32:57+00:00,"On June 22, at #Bitcoin block height 741,888, Bitcoin’s mining difficulty decreased 2.35% lower than two weeks ago. https://t.co/UQfxptlr55"
1539707972301062147,2022-06-22 20:32:41+00:00,"According to a recent report, #3AC’s over-the-counter (OTC) operation TPS Capital pitched a #GBTC arbitrage opportu… https://t.co/9hPS9f3eUB"
1539707916944637952,2022-06-22 20:32:28+00:00,"""This is a new tool that adds to the ability to do that. There are plenty of people who want to hide their money fr… https://t.co/Pnpv8ohWyE"
1539677928912572419,2022-06-22 18:33:18+00:00,#Ukraine sells #Cryptopunk #NFT to raise funds amid ongoing military conflict with #Russia. https://t.co/3fHPJgX6oy
1539662407957708801,2022-06-22 17:31:38+00:00,"#Tether has announced the launch of another fiat-pegged stablecoin called #GBPT on Wednesday, tied to the value of… https://t.co/gnwue91tOw"
1539647536578928642,2022-06-22 16:32:32+00:00,Bitcoin․com Exchange Market Insights Report for June 2022 https://t.co/fByIK6aC0N
1539647281519009794,2022-06-22 16:31:31+00:00,"According to one Twitter user, #bitcoin's value, just like the value of a fiat currency, is determined entirely by… https://t.co/pGtdrOawxN"
1539639952618708998,2022-06-22 16:02:24+00:00,"#UNI rose by nearly 15% on Wednesday, as #SHIB hit highest level since May. https://t.co/bgLK1Adfg8"
1539617209110204416,2022-06-22 14:32:02+00:00,"The move comes as #Telegram seeks to monetize its userbase, which recently reached a milestone of 700 million month… https://t.co/o4jrLB1nEr"
1539609893396684803,2022-06-22 14:02:57+00:00,#Wechat to sanction public accounts facilitating secondary trading of #NFTs. https://t.co/5VYw5tuPBu
1539594747576291332,2022-06-22 13:02:46+00:00,"#ETH falls closer to $1,000 on hump day, as 2-day winning streak comes to an end. https://t.co/T6O1YCoHUh"
1539573202157875200,2022-06-22 11:37:09+00:00,"Vitalik #Buterin Slams #S2F Price Model, Plan B Fires Back; Top #Crypto Assets in Red Today —… https://t.co/hPUfYmlllz"
1539572012036853762,2022-06-22 11:32:26+00:00,The Greater Fool Theory asserts that prices rise because investors can sell overpriced #securities to other investo… https://t.co/uJ3PyrBay8
1539564397516963840,2022-06-22 11:02:10+00:00,Embr Releases Checkout to Future-Proof Trust in Web3 Payment Experiences https://t.co/a8XKm0bcEU
1539542023702732800,2022-06-22 09:33:16+00:00,"Ukrainian government collects over $100,000 from the sale of a #Cryptopunk collectible. https://t.co/3fHPJgX6oy"
1539511373285232640,2022-06-22 07:31:28+00:00,The president also suggested to his followers that the CAR’s adoption of #bitcoin is for the benefit of future gene… https://t.co/0f5gsJbtLm
1539496673080225793,2022-06-22 06:33:03+00:00,"Bank of #Spain's registry has been successful with local companies, with these implementing compliance tools for an… https://t.co/WO2CvHoLP8"
1539481305204793345,2022-06-22 05:31:59+00:00,"#Telegram, one of the most popular messaging apps among #cryptocurrency circles, has announced it will introduce a… https://t.co/B2d87Gkg8B"
1539451189577887744,2022-06-22 03:32:19+00:00,Vitalik Buterin denounced the #S2F #bitcoin price model and said “financial models that give people a false sense o… https://t.co/wI8P37zNRW
1539420907013300226,2022-06-22 01:31:59+00:00,"Goldman Sachs says: ""We now see #recession risk as higher and more front-load. #inflation https://t.co/DXM6LHcHoK"
1539390970999062537,2022-06-21 23:33:02+00:00,"Elon Musk has shared his views on a variety of topics, including #crypto investing, #dogecoin, ""unresolved matters""… https://t.co/r07anXRe4W"
1539360766553358338,2022-06-21 21:33:01+00:00,"The registry of virtual asset service providers of the Bank of #Spain reached a number of 17 companies last week, w… https://t.co/dXnpvLkMdZ"
1539345287046733831,2022-06-21 20:31:30+00:00,Iranian authorities to halt authorized #crypto mining operations amid rising #power demand. https://t.co/eKcFq7YywE
1539330606319927296,2022-06-21 19:33:10+00:00,#Blockfi’s co-founder Zac Prince announced on Twitter that the company will use the capital to bolster Blockfi’s “b… https://t.co/05nsscoSs2
1539330539756261376,2022-06-21 19:32:54+00:00,"#Visa partnered with several #crypto startups in #Latam, including Lemon Cash and Satoshi Tango in #Argentina, and… https://t.co/TOZ2GjW4qB"
1539300187373543425,2022-06-21 17:32:18+00:00,"On Monday, Russia's #ruble had risen to its highest value against the #USdollar since 2015 and economists have been… https://t.co/1pV1bs1GtC"
1539292664176205838,2022-06-21 17:02:24+00:00,"People reported negative results by using the #VR #metaverse setup, experiencing 42% more frustration, 11% more anx… https://t.co/Xp7OCBBmd8"
1539277818319843331,2022-06-21 16:03:24+00:00,"#SHIB up 15% on Tuesday, as #DOGE extends gains following Elon Musk backing. https://t.co/OKtsjyekCX"
1539247231466971138,2022-06-21 14:01:52+00:00,"Since the end of April, the top #privacy coins went from a combined value of $10.7 billion to today’s valuation of… https://t.co/uTxcik2u5s"
1539232396813512705,2022-06-21 13:02:55+00:00,"#ETH, #BTC higher for a second consecutive session, for the first time in over 2 weeks. https://t.co/TCNV5HPRrT"
1539210542497161216,2022-06-21 11:36:05+00:00,"Turbulent #Crypto Markets See Healing #Green for 2nd Day in a Row, #Bitcoin ⬆️ 2.5%, #SOL ⬆️ 6%; #USDD Still Under… https://t.co/X8IAUMv7cG"
1539209376543690752,2022-06-21 11:31:27+00:00,#Iran to shut down licensed #crypto miners as #electricity consumption spikes. https://t.co/eKcFq7YywE
1539202183241125888,2022-06-21 11:02:52+00:00,"LBank Exchange Will List MintMe․com Coin (MINTME) on June 22, 2022 https://t.co/zCOcF6sPSQ"
1539194635993636868,2022-06-21 10:32:52+00:00,"#Visa, one of the leading payments companies, announced last week that it launched its first crypto-enabled cards i… https://t.co/sYFSZKN4Gs"
1539156762267459584,2022-06-21 08:02:22+00:00,A recent #metaverse study found that today's #VR tech may be unable to successfully support remote work application… https://t.co/iAfUZTbfvw
1539118725433110535,2022-06-21 05:31:14+00:00,"Since June 12, 2022, the #Tron based stablecoin #USDD has remained below a U.S. dollar in value and it hit a low of… https://t.co/0LYmnnayyg"
1539111473930289159,2022-06-21 05:02:25+00:00,BOSO TOKYO Looks to Bring Japanese Culture to the World via Innovative Use of Metaverse Capabilities https://t.co/sXCQDy5vU9
1539081107152543744,2022-06-21 03:01:45+00:00,"""In response to these developments, we now expect an earlier and somewhat more severe #recession,"" said Deutsche Ba… https://t.co/vWS7MvDFUe"
1539043471713091584,2022-06-21 00:32:12+00:00,President Joe Biden and Treasury Secretary Janet Yellen say that a U.S. #recession is not inevitable. #inflation https://t.co/YizXfr0Hh0
1539013320933507072,2022-06-20 22:32:23+00:00,"""I caution the public. If it seems too good to be true, it just may well be too good to be true,"" said the SEC chai… https://t.co/9EV1lPsije"
1538983325892808705,2022-06-20 20:33:12+00:00,"Russian government may allow international #crypto #payments only for small business transactions, finance ministry… https://t.co/RY7tg9qqhL"
1538968088871374850,2022-06-20 19:32:39+00:00,Cleveland Federal Reserve Bank president Loretta Mester doesn't think a #recession will take place in the United St… https://t.co/ibQOVtYXmv
1538952685835141120,2022-06-20 18:31:27+00:00,"Prior to receiving its latest license, Coinmena had secured two #digital assets licenses, one from the Central Bank… https://t.co/aPpb4G8rzo"
1538937742813499395,2022-06-20 17:32:04+00:00,"Google Trends data shows that the search phrase “#bitcoin is dead,” is estimated to hit an all-time high this week. https://t.co/0d7CruPcn1"
1538922510464569344,2022-06-20 16:31:32+00:00,"#MKR climbs nearly 20% following recent losses, whilst #AVAX also rebounds. https://t.co/2JgslD1uRG"
1538922472242032641,2022-06-20 16:31:23+00:00,"#Meta's store, which will be rolling to different markets this week, will feature digital designs created by… https://t.co/cVcL5wjQEL"
1538884872051249154,2022-06-20 14:01:59+00:00,"While digital currencies suffered this past month, #NFT sales dropped by 74.44% during the last 30 days. https://t.co/xbQEUPPtwA"
1538869731968565252,2022-06-20 13:01:49+00:00,"#BTC moves back above $20,000 as #crypto bulls appear to ""buy the dip."" https://t.co/raOQj88LDr"
1538847418766217218,2022-06-20 11:33:09+00:00,"#Russia does not consider #bitcoin a payment option for #oil exports, finance ministry official indicates. https://t.co/JeAiQqZRg2"
1538841257555816448,2022-06-20 11:08:40+00:00,"#Bitcoin ⬆️ 4%, #ETH ⬆️ 7%, as #Solana Surges Over 10% in the Last 24h; Shark Tank’s O’Leary Says: ‘I’m Not Selling… https://t.co/epPt9EntNv"
1538839783979503621,2022-06-20 11:02:49+00:00,Bitflex Commences BETA Testing With Zero-Trading Fees https://t.co/Ziup5uOoX4
1538816782936555521,2022-06-20 09:31:25+00:00,"The provisional license allows #Coinmena to continue its operations in Dubai while ""it undertakes the in-depth proc… https://t.co/I9ImoR0Bxx"
