id,created_at,text1554844901061398528,2022-08-03 15:01:26+00:00,"With the investment, https://t.co/mBEhg5ud96 will receive a 24.5% stake in #Barca Studios, as announced, and it wil… https://t.co/09XoCu3Lna"
1554822179841245185,2022-08-03 13:31:09+00:00,"#Solana is suffering from issues after it was discovered that close to 8,000 Solana-based wallets have been comprom… https://t.co/98dYkpAFYk"
1554814818800078848,2022-08-03 13:01:54+00:00,Singapore High Court grants troubled #crypto #lender Vauld #creditor protection until Nov. 7. https://t.co/2cMdqPc32T
1554807659458600960,2022-08-03 12:33:27+00:00,"#BTC, #ETH rebounded on Wednesday, as markets reacted to #Pelosi's visit to Taiwan. https://t.co/m6qGC1UpSl"
1554792126398943232,2022-08-03 11:31:44+00:00,"Growing number of Koreans invest in #crypto to dodge taxes, tax authority alleges. https://t.co/yfmSpPBRxf"
1554788435290095621,2022-08-03 11:17:04+00:00,"#Solana Price Down 2.5% After Reported #Exploit, Other Top #Cryptocurrencies in Green — Daily Price Update 8.3.22 https://t.co/FO3ruxgBhy"
1554769503766077443,2022-08-03 10:01:50+00:00,"The #cryptocurrency bill, identified with the number 4.401/2021, is set to be addressed this week by the Deputy Cha… https://t.co/olw2zUIvIA"
1554739435660578819,2022-08-03 08:02:21+00:00,"The Professor said: ""The number of transactions tied to #illicit transactions in the real world of rands and dollar… https://t.co/vQKLUQnEMh"
1554708991770611714,2022-08-03 06:01:23+00:00,"https://t.co/mBEhg5ud96, a company that designs fan engagement tools for sports clubs, announced it will invest $10… https://t.co/v4gInTVrFF"
1554678906485096449,2022-08-03 04:01:50+00:00,"#Vauld to have 3 months for restructuring, due diligence by #Nexo. https://t.co/2cMdqPc32T"
1554649011788910592,2022-08-03 02:03:03+00:00,"The New York State Department of Financial Services has fined #Robinhood #Crypto $30 million ""for significant failu… https://t.co/pFJOmCuLjZ"
1554618560751828992,2022-08-03 00:02:02+00:00,"""I encourage workers in #crypto companies who may have witnessed misconduct to file a whistleblower complaint,"" Let… https://t.co/GiUeQ6EBaK"
1554588570807058435,2022-08-02 22:02:52+00:00,#Binance US is delisting #crypto token $AMP after the SEC says it's a security. #cryptocurrency https://t.co/esIoXnHPMj
1554565646284988425,2022-08-02 20:31:47+00:00,"The solution to Nigeria’s currency woes ""has to be psychological too"" because the current ""panic buying is driven m… https://t.co/zFCqCFohRV"
1554557781042241537,2022-08-02 20:00:31+00:00,"On August 2, the Atlanta-based Bitpay revealed the company has integrated #apecoin and #EUROC into the firm’s platf… https://t.co/sto5HZ2dsu"
1554527976540217350,2022-08-02 18:02:05+00:00,"The Nomad cross-chain bridge attack was the third-biggest #CryptoHeist of 2022, and the ninth largest of all time.… https://t.co/weyHBpMqzI"
1554498821593382912,2022-08-02 16:06:14+00:00,"Today, the value locked across the #DeFi ecosystem is $86.22 billion as the TVL has lost 3.34% during the past 24 h… https://t.co/am6xX839yo"
1554490304438353920,2022-08-02 15:32:24+00:00,"#DOT declines nearly 10%, moving away from recent 6-week high. https://t.co/5qMi8wwXg5"
1554467577522540544,2022-08-02 14:02:05+00:00,"During the last few weeks, reports note that the global economy could crater if there’s a Chinese military attack o… https://t.co/AaiQR4SAZL"
1554429741024821250,2022-08-02 11:31:44+00:00,Aminu Gwadabe has also advised the #Central Bank of Nigeria (CBN) to consider helping the #naira by intervening in… https://t.co/av014jr3lx
1554420185465225216,2022-08-02 10:53:46+00:00,"#Crypto Markets Shudder as Geopolitical Tension, Volatility Affect Risk Appetite, #Bitcoin Falls Below $23K, #ETH… https://t.co/E5urjk4LN9"
1554399673737220097,2022-08-02 09:32:16+00:00,"According to Chandler Guo, an influential Chinese #bitcoin miner, a proof-of-work (PoW) version of #Ethereum is “co… https://t.co/NRtby7fcEl"
1554369509393309697,2022-08-02 07:32:24+00:00,The #crypto hardware wallet company Ledger is reportedly looking to raise at least $100 million from strategic inve… https://t.co/agaCCGb4NM
1554339113247117312,2022-08-02 05:31:37+00:00,Former Pakistani Prime Minister Imran Khan's Instagram account was compromised and used to promote a… https://t.co/P19fL9AEFj
1554293785701584896,2022-08-02 02:31:30+00:00,"""In Santa Lucia, we are all going to participate in this project,"" said a local business owner about #Bitcoin Valle… https://t.co/2OaosTnS4a"
1554256305484976129,2022-08-02 00:02:34+00:00,"The U.S. SEC has charged 4 founders and 7 promoters of #Forsage, calling it ""a fraudulent #crypto pyramid and Ponzi… https://t.co/rZajc1dn5d"
1554233846064889856,2022-08-01 22:33:19+00:00,"The Central Bank of #Honduras stated: ""#Cryptocurrency assets do not have support, so they are not regulated ... th… https://t.co/yOqTRPHxo0"
1554218617306324993,2022-08-01 21:32:49+00:00,"""Our collaboration with Bitwage on creating and deploying the Request for Address protocol represents our laser foc… https://t.co/pcFPd9qgd8"
1554203161925242882,2022-08-01 20:31:24+00:00,"The funding round led by Localglobe, 7percent Ventures, and Deeptech Labs, will reportedly allow #Condense to devel… https://t.co/f2cXpg7Wiw"
1554180901826924548,2022-08-01 19:02:56+00:00,"""#NFTiffs represent a collection of 250 digital passes, offered by Tiffany &amp; Co.,"" Tiffany's said. #NFTs… https://t.co/kTEx1cK20X"
1554180618078019584,2022-08-01 19:01:49+00:00,"The central bank's letter said: ""You are thereafter required, within seven days of the date of the letter to confir… https://t.co/fFZkyGMDiN"
1554150537154658305,2022-08-01 17:02:17+00:00,"The Central Bank of #Uruguay stated that the call to save or invest must be made by authorized institutions, and or… https://t.co/SCAR0odDtc"
1554143271026319361,2022-08-01 16:33:25+00:00,"While the #stablecoin economy is worth roughly $153 billion today, euro-backed stablecoin issuance has increased 1,… https://t.co/WbWciCjv1p"
1554127979151872000,2022-08-01 15:32:39+00:00,"#APE nears 2-month high, #FIL up almost 70% in last seven days. https://t.co/tAdW451haB"
1554097941069045760,2022-08-01 13:33:17+00:00,The Central Bank of #Honduras has recently issued a release that clarifies the position it takes on the utilization… https://t.co/Yua51Jqx9u
1554097742351417347,2022-08-01 13:32:30+00:00,Alexander Vinnik’s #Greek lawyer is fighting his possible #extradition to the United States. https://t.co/QbDjVzYjNP
1554085182067597313,2022-08-01 12:42:35+00:00,"#BTC begins August below $24,000, #ETH falls under $1,700. https://t.co/00GmySesZd"
1554082681763336194,2022-08-01 12:32:39+00:00,"The Power of Loyalty Points and the Importance of Getting Them Right - Dennis Jarvis, CEO of Bitcoin․com https://t.co/4ioJapWvVC"
1554067261824057345,2022-08-01 11:31:23+00:00,"#Condense, a Bristol, England-based company that offers #metaverse streaming technology, has announced it has raise… https://t.co/oCKn0wJgvO"
1554067175966900225,2022-08-01 11:31:02+00:00,"#Polkadot ⬆️ 4% Ahead of Upcoming #RustConf2022, Other Top Coins in Red; Vitalik #Buterin Criticizes Corporate… https://t.co/7y9wQSnASQ"
1554059844633722882,2022-08-01 11:01:54+00:00,A One-of-a-Kind GameFi Ecosystem Is Set to Blow the Competition out of the Water – Introducing Ryber https://t.co/FxgCW06RSo
1554044707893919744,2022-08-01 10:01:45+00:00,"The order came barely 24 hours after the CBK governor, Patrick Njoroge, was quoted stating that the two entities ar… https://t.co/Vxius0p63H"
1554014633752764417,2022-08-01 08:02:15+00:00,"The Central Bank of #Uruguay has recently issued a summon to Binance, one of the most popular #crypto exchanges in… https://t.co/DOiH6fRhlG"
1553999543225782272,2022-08-01 07:02:17+00:00,YOLOREKT dApp Is Live Now. Discover More About the Gamified-Social Price Prediction Platform. https://t.co/dWQHNiOzh3
1553992076613894144,2022-08-01 06:32:37+00:00,#Ethereum co-founder Vitalik Buterin took to Twitter and gave his perspective on the “existing corporate attempts t… https://t.co/Wu72xvgdPf
1553976669425246209,2022-08-01 05:31:24+00:00,"#Guaido team considered this a victory, and considered this decision a ""step towards protecting #Venezuela's sovere… https://t.co/nWbHYWWFoE"
1553961838961999872,2022-08-01 04:32:28+00:00,"BTC-e’s Alexander #Vinnik will be a hostage in the U.S., his lawyer in #Greece warns. https://t.co/QbDjVzYjNP"
1553931750384058369,2022-08-01 02:32:54+00:00,Charles #Schwab’s $655 billion asset management arm is launching its first #crypto-related #ETF. #cryptocurrency https://t.co/wVuAi6bNgp
1553923786319319047,2022-08-01 02:01:15+00:00,Mint Your Lucky Number NFT Domain Exclusively at Quik․com Like 888․metaverse https://t.co/WrPiIxDjmr
1553901507011088385,2022-08-01 00:32:44+00:00,"Regulators in the U.S. and U.K. met to discuss broader #crypto regulatory initiatives. They are ""committed to conti… https://t.co/SiJqkWNwLB"
1553871330436681736,2022-07-31 22:32:49+00:00,"On Sunday, #Aave announced that the Aave DAO has approved a new collateral-backed #stablecoin for the ecosystem cal… https://t.co/zqyT0D3D2O"
1553840767256363010,2022-07-31 20:31:22+00:00,"The High Court of #London has determined that the management of the #Venezuelan gold corresponds to Juan Guaido, th… https://t.co/m1kQTcUCVL"
1553818485742075905,2022-07-31 19:02:50+00:00,The BCAS’ Herve Ndoba and the CAR’s Minister of Finance and Budget both signed the statement that revealed the latt… https://t.co/Wf2fSKYG91
1553810899965825025,2022-07-31 18:32:41+00:00,A recent poll indicates more than 33% of the survey’s respondents think #Ethereum could split into two blockchains… https://t.co/w74DzvwKOW
1553780625743675392,2022-07-31 16:32:23+00:00,"John Cochrane, a professor of #economics at Stanford University said the Fed should increase rates above 9% to tame… https://t.co/FszcqvMr6t"
1553757815352737794,2022-07-31 15:01:45+00:00,The Central Commission for Discipline Inspection in Henan also announced it is now investigating an official charge… https://t.co/tPDCstSXFP
1553742842295717890,2022-07-31 14:02:15+00:00,"ETH prices are much lower, but the bear market has given way to the lowest #ethereum network fees in months. https://t.co/UwUShScXqC"
1553727893364146176,2022-07-31 13:02:51+00:00,"Recent drop in the valuations of #cryptocurrencies impacted pricing of second-hand #luxury #watches, report reveals. https://t.co/BkokgUTYwb"
1553712472003170304,2022-07-31 12:01:34+00:00,#BRICS nations have revealed they're “creating an international reserve #currency” analysts believe is meant to cha… https://t.co/dH5GFXaQXi
1553682582553780227,2022-07-31 10:02:48+00:00,The announcement of the two parties' rapprochement followed a meeting of the #Central African Monetary Union minist… https://t.co/ytUcAKxhKh
1553652513743818753,2022-07-31 08:03:19+00:00,FFDW announced it will be supporting an initiative with Harvard University’s Library Innovation Lab (LIL).… https://t.co/A9Y4HvJt8A
1553621901351714816,2022-07-31 06:01:40+00:00,Authorities in the province are now moving to pacify the restive bank clients who have been protesting against the… https://t.co/K4Tb6yXlfv
1553606966349537281,2022-07-31 05:02:20+00:00,New legislation to further restrict the use of #cash for business and private deals in #Israel. https://t.co/tUJ3R3CZGe
1553591992927518720,2022-07-31 04:02:50+00:00,"#Crypto market decline depresses prices of #luxury timepieces, #watch trading platform says. https://t.co/BkokgUTYwb"
1553561784866557952,2022-07-31 02:02:47+00:00,"""More bear markets are coming … The next one is going to be the worst in my lifetime,"" said veteran investor Jim Ro… https://t.co/n1opq7kvR7"
1553531666836197378,2022-07-31 00:03:07+00:00,"Rich Dad Poor Dad author Robert Kiyosaki has shared his view on the ""best investment value today."" #RobertKiyosaki… https://t.co/BR0bzrfsv0"
1553501169221308441,2022-07-30 22:01:56+00:00,A panel of industry experts says now is the time to sell #dogecoin. The majority expect $DOGE to completely lose it… https://t.co/mWRcEL4YZz
1553471067297136641,2022-07-30 20:02:19+00:00,#Israel tightens restrictions on #cash #payments for companies and individuals. https://t.co/tUJ3R3CZGe
1553463516182503424,2022-07-30 19:32:18+00:00,"A balanced regulation ""could see funds stream into South Africa while growing the country's burgeoning #crypto ecos… https://t.co/wyfCJjl7H0"
1553441035635900416,2022-07-30 18:02:59+00:00,The first event in which this #MetaHKUST #metaverse based system will be tested is the opening of the #Guangzhou ca… https://t.co/o7w8KIe4GS
1553440850461528064,2022-07-30 18:02:14+00:00,"The funding will go toward a #BAYC-centric news publication called The Bored Ape Gazette with $150,000 for the firs… https://t.co/ZQnU1cQaSX"
1553425804603826178,2022-07-30 17:02:27+00:00,Non Custodial Crypto Exchange Changeangel Adds Cashback and Affiliate Programs https://t.co/kj5FM8jEtM
1553418258988023813,2022-07-30 16:32:28+00:00,"""The #USD rate on the #crypto floor is used in determining the value of the local currency,"" claimed Aminu Gwadabe.… https://t.co/D25FDE1q2i"
1553410184692875268,2022-07-30 16:00:23+00:00,"Victims of the #Terra collapse have filed a class-action lawsuit against Terraform Labs, Do Kwon, and Nicholas Plat… https://t.co/P6QFU64E39"
1553395414275182592,2022-07-30 15:01:42+00:00,#Crypto exchange #Binance to sell #NFT tickets for Italian soccer club #Lazio. https://t.co/HmJVt6qZIn
1553376623319212032,2022-07-30 13:47:01+00:00,"#FIL climbs 25% on Saturday, whilst #DOT hits multi-week high. https://t.co/68tlzK5XSf"
1553372714802487296,2022-07-30 13:31:30+00:00,"According to the CAR’s leadership, #bitcoin is an ""optimal solution for a digital store of value, allowing citizens… https://t.co/T8Lk09LE2e"
1553357944611282944,2022-07-30 12:32:48+00:00,The two corporations Funko and Paramount plan to introduce a series of #NFTs based on the #AvatarLegends universe. https://t.co/noFcy4qwme
1553350125841518593,2022-07-30 12:01:44+00:00,"#BTC, #ETH fall below key resistance levels to start the weekend. https://t.co/ugpaOBy50q"
1553327606002597888,2022-07-30 10:32:15+00:00,"Greg Rodrigues said:""#Crypto is global and highly fluid, tending to flow into markets where #regulations are welcom… https://t.co/Bl5sC6Pd1B"
1553305133794172930,2022-07-30 09:02:57+00:00,The Hong Kong university announced its plan to create a joint #metaverse that will integrate both of its campus loc… https://t.co/sxj6yRl5Vn
1553289870713520133,2022-07-30 08:02:18+00:00,"MaskEX Global Held the Futurization of Urban Lifestyle Summit in Dubai, UAE https://t.co/5qL0YxtDiS"
1553282354084462593,2022-07-30 07:32:26+00:00,The currency’s rapid #depreciation is reportedly being fueled by Nigerians who are converting their savings from… https://t.co/6CYW0fwkZx
1553282301597044736,2022-07-30 07:32:13+00:00,"Restricting the amount of Europe’s digital #currency in circulation will preserve the current #financial system,… https://t.co/aZsUTtsS45"
1553259512697602048,2022-07-30 06:01:40+00:00,#Lazio fans to buy #NFT tickets from the #Binance Fan Token Platform. https://t.co/HmJVt6qZIn
1553237205274984448,2022-07-30 04:33:02+00:00,"#Santander CEO in #Brazil, Mario Leão, stated: ""We expect in the next few months to have definitions about it, who… https://t.co/FGVG5wPisn"
1553236814848204800,2022-07-30 04:31:29+00:00,The CAR has now raised approximately $1.26 million since the commencement of the sale on July 25. #sangocoin… https://t.co/vzkmsQNL4s
1553214237366960128,2022-07-30 03:01:46+00:00,#Ripple's counsel has urged U.S. lawmakers to urgently pass “sensible #crypto legislation” amid the SEC lawsuit ove… https://t.co/yUEWxh3FXv
1553192180285571072,2022-07-30 01:34:07+00:00,SEC Chairman Gary Gensler published a video explaining how the securities watchdog plans to regulate #crypto tradin… https://t.co/YcACgoFw1O
1553169100960108548,2022-07-30 00:02:24+00:00,A U.S. lawmaker wants answers from #Apple CEO Tim Cook and Google CEO Sundar Pichai about how they prevent fake… https://t.co/zXWdL38jp8
1553154186329657344,2022-07-29 23:03:08+00:00,Why Is Alchemy Pay (ACH) On The Rise? https://t.co/mE8coC5uaL
1553146395602964481,2022-07-29 22:32:11+00:00,#ECB economists suggest limiting access to the #digitaleuro to protect commercial #banks. https://t.co/NWaClCylkS
1553123742003482625,2022-07-29 21:02:10+00:00,#Chainalysis identified 54 pro-Russian groups that have “collectively received over $2.2 million worth of… https://t.co/HTPFRyJF0z
1553116061230415872,2022-07-29 20:31:39+00:00,"According to the IMF, the #CBK’s digital shilling paper must make clear that the proposed #digital currency will ""d… https://t.co/o203Fa36tt"
1553101305157242880,2022-07-29 19:33:01+00:00,"#Santander, one of the biggest financial institutions in the world, serving more than 153 million customers, announ… https://t.co/A7zBYb3tex"
1553093648191049728,2022-07-29 19:02:35+00:00,"According to some Kenya-based activists, raising funds through #cryptocurrency and #NFT sales is not only faster bu… https://t.co/bzGRiN3nnC"
1553070892904861701,2022-07-29 17:32:10+00:00,"Police in #Greece carry out operation to locate #Onecoin’s mastermind, sources tell local media. https://t.co/KzHab7Qynn"
1553070883190853633,2022-07-29 17:32:07+00:00,"Bitfarms' #bitcoin mining facility dubbed “The Bunker,” now has approximately 3.8 exahash per second (EH/s), after… https://t.co/ZIsezMxrdx"
1553051634602856451,2022-07-29 16:15:38+00:00,"#GRT, #LINK rally to 6-week highs on Friday. https://t.co/6UnPgBxXv7"
1553048318036639744,2022-07-29 16:02:27+00:00,Iranian #crypto miners allowed to source green #energy from across the country. https://t.co/B7WCVeiMDF
1553025591229796354,2022-07-29 14:32:09+00:00,"The #IMF stated that ""Inflation has accelerated throughout the region, amid rebounding domestic demand, lingering s… https://t.co/Pq894nMOlq"
1553018107949682688,2022-07-29 14:02:25+00:00,The letter sent to #Voyager Digital highlights that the company's FDIC insurance claims are false and misleading.… https://t.co/qOAUb5nuMJ
1552999080091074561,2022-07-29 12:46:48+00:00,"#Bitcoin climbs above $24,000, hitting a 6-week high on Friday. https://t.co/x5MAeqegre"
1552995274792079360,2022-07-29 12:31:41+00:00,"#Meta announced that its #metaverse division, Reality Labs, had lost more than $2.8 billion dollars even while raki… https://t.co/HuQ5kwPShi"
1552980151088062466,2022-07-29 11:31:35+00:00,The #IMF said a #CBDC can potentially lower transaction costs to the point of driving #mobile money operators such… https://t.co/ujRHkGf943
1552957743702708224,2022-07-29 10:02:33+00:00,Herve Ndoba reportedly wants the regional #central bank to establish a common legal framework for regulating… https://t.co/UqcXpvjzC0
1552934964781633536,2022-07-29 08:32:02+00:00,Greek law enforcement reportedly tried to arrest missing #Onecoin #Cryptoqueen Ruja Ignatova. https://t.co/KzHab7Qynn
1552912398759100416,2022-07-29 07:02:22+00:00,Iran revises regulations to ease #crypto miners’ access to green #power. https://t.co/B7WCVeiMDF
1552889687605485569,2022-07-29 05:32:07+00:00,"The International Monetary Fund #IMF predicts that #Latam will grow by 3% in 2022, fueled by the economic recovery… https://t.co/79kE5yhrML"
1552859374619615232,2022-07-29 03:31:40+00:00,"#Meta, the first company that announced a pivot from its social media business to the #metaverse, is battling to ma… https://t.co/DMGino3JPG"
1552829254341206018,2022-07-29 01:31:59+00:00,An #IMF director has warned of further #crypto selloffs and more crypto tokens failing. #cryptocurrency https://t.co/jdwCc8JzL5
1552799158997843968,2022-07-28 23:32:23+00:00,#Goldman Sachs and #JPMorgan have updated their economic forecasts and are now predicting an imminent #recession in… https://t.co/HbLpYJNe6e
1552780139154575362,2022-07-28 22:16:49+00:00,"The Law Commission said reforms will ""protect the rights of users and maximise the potential of #digital assets.""… https://t.co/qHIhjQ36Bj"
1552769201663889408,2022-07-28 21:33:21+00:00,One #Celsius client said his situation was a dire emergency in order to “keep a roof over my family and food on the… https://t.co/N3tjsLwCTK
1552738571496431616,2022-07-28 19:31:38+00:00,"#Meta joins #Alphabet and #Microsoft, as all three fail to meet Q2 earnings expectations. https://t.co/LB27OHdQm8"
1552723759571812354,2022-07-28 18:32:47+00:00,The #UN document reportedly claimed that both the Islamic State and al-Qaeda might be seeking to receive donations… https://t.co/95EDUMQxY5
1552708546466353157,2022-07-28 17:32:20+00:00,"Foundry, the subsidiary of DCG, announced the launch of Foundry Logistics in order to advance standards in the… https://t.co/hFPku4v2ro"
1552701066659201024,2022-07-28 17:02:36+00:00,Sango - The First Digital Monetary System Built on Bitcoin https://t.co/sepejJUQxj
1552693355385131009,2022-07-28 16:31:58+00:00,European Banking Authority faces staffing problems threatening its ability to regulate EU’s #crypto market. https://t.co/BSXLvF8Rot
1552689604112924674,2022-07-28 16:17:03+00:00,"#UNI surges by bearly 30%, hitting 3-month high on Thursday https://t.co/3lqpl1TTYW"
1552670606390337540,2022-07-28 15:01:34+00:00,The U.S. economy has declined for the second-straight quarter as the country’s gross domestic product (GDP) decline… https://t.co/0NMySAkczT
1552644238520864769,2022-07-28 13:16:47+00:00,"The commission said there is a need for laws that allow ""a more diverse range of people, groups and companies to in… https://t.co/CQ6dDceOXc"
1552635890748489728,2022-07-28 12:43:37+00:00,"#BTC climbs $2,000 higher following Fed's 0.75% #InterestRate hike. https://t.co/mTAXuq0oYC"
1552633141872975875,2022-07-28 12:32:42+00:00,"During the last two weeks, #ETC has climbed more than 124% against the U.S. dollar, and the network’s hashrate has… https://t.co/Js4zz86zlc"
1552618053724413953,2022-07-28 11:32:44+00:00,The British National Crime Agency (NCA) has seized $33 million in #cryptocurrency. #crypto #bitcoin https://t.co/4rVP50317k
1552610654774771712,2022-07-28 11:03:20+00:00,ROLA Brings You the Best Predict-to-Earn Ecosystem https://t.co/3JOgYpbzLb
1552587849471787008,2022-07-28 09:32:43+00:00,"South Africa has emerged as an important centre for ""facilitating transfers of funds"" from the group to its affilia… https://t.co/ZKLQnXR6Vs"
1552557453748961281,2022-07-28 07:31:56+00:00,Europe’s #banking regulator worried about lack of experts needed to oversee #crypto sector. https://t.co/BSXLvF8Rot
1552542440900509700,2022-07-28 06:32:17+00:00,"#Electricity rates and logistics determine Russian miners’ choice of location for #crypto farms, researchers say. https://t.co/iRb9ZxYIdW"
1552527217925693441,2022-07-28 05:31:47+00:00,"""Since the $BNB chain ecosystem continues to grow, the price may reach as high as $3,000 in 2030,"" said one expert… https://t.co/HAT74AsVnD"
1552519688709705729,2022-07-28 05:01:52+00:00,The Web 3․0 Winter Is Coming: Bucking the Trend With Karmaverse Zombie https://t.co/X3wmoLCCZy
1552497239704100865,2022-07-28 03:32:40+00:00,"During the last two weeks, #ETC has climbed more than 124% against the U.S. dollar, and the network’s hashrate has… https://t.co/8rcCRKq08L"
1552466889280028672,2022-07-28 01:32:04+00:00,"#Ripple's CEO expects to win against the SEC in the lawsuit over $XRP. ""I'm betting that because the law is on our… https://t.co/ehuBBUuZyV"
1552436780011589632,2022-07-27 23:32:25+00:00,"""Big Short"" investor Michael Burry is pretty sure the SEC does not have the resources or IQ points to correctly inv… https://t.co/edxlMBLtp1"
1552429125079650304,2022-07-27 23:02:00+00:00,Pocket DAO Passes Two Key Proposals on Node Incentives https://t.co/9tYWcl6ITK
1552421581065842688,2022-07-27 22:32:02+00:00,#Russia to regulate #NFTs through changes in the Civil Code and the law “On Digital Financial Assets.” https://t.co/6BthJCXfLT
1552406540618973185,2022-07-27 21:32:16+00:00,Study lists capital #Moscow among most popular #crypto mining destinations in #Russia. https://t.co/iRb9ZxYIdW
1552391491863068672,2022-07-27 20:32:28+00:00,"The law enforcement agency claimed that it has received 7,000 messages from people interested in the tokens.… https://t.co/zlAuV31V8C"
1552376401449328641,2022-07-27 19:32:30+00:00,Unstoppable Domains announced the #crypto company has secured $65 million in financing in a Series A funding round… https://t.co/solOoKWjB9
1552368884266704907,2022-07-27 19:02:38+00:00,"The survey found that ""women are nearly two times more likely to unfollow someone with an #NFT profile than men.""… https://t.co/iJaRp9iWXe"
1552363714346622976,2022-07-27 18:42:05+00:00,"On Wednesday, the U.S. Federal Reserve raised the federal funds rate by 75 bps in order to tame #inflation and stab… https://t.co/HiZXJ0gImc"
1552345627002028032,2022-07-27 17:30:13+00:00,Ultimate Fighting Championship (UFC) strawweight Luana Pinheiro will be the first female UFC fighter to be paid in… https://t.co/5xDxCPvq6H
1552338773639323650,2022-07-27 17:02:59+00:00,The #metaverse courses will serve to introduce high school students to the possible career paths they can take at t… https://t.co/BcjSYhMYEn
1552338754454667269,2022-07-27 17:02:54+00:00,Gamestar+ Confirms Partnership With Ava Labs and Impending Launch on Avalanche https://t.co/fcaqVUA71i
