id,created_at,text
1554463559458770944,2022-08-02 13:46:07+00:00,Google is reinventing the popular BAYC NFTs into paintings through its AI technology. https://t.co/RLnDB3NAJY
1554463280978165761,2022-08-02 13:45:01+00:00,"ADA joins Sygnum’s growing crypto-staking portfolio, which features three proof-of-stake (PoS) protocols; Internet… https://t.co/gj4o5HgxKc"
1554459583229431808,2022-08-02 13:30:19+00:00,The Nomad token bridge appears to have experienced a security exploit that has allowed hackers to systematically dr… https://t.co/GP4ZAkjMhp
1554459393738977280,2022-08-02 13:29:34+00:00,"Hardware wallet maker, Ledger, is reportedly seeking $100 million in additional funding to strengthen business oper… https://t.co/KwRRlZv0He"
1554457519484833792,2022-08-02 13:22:07+00:00,"""Cayman Islands is a key jurisdiction for us — our parent company is domiciled there and it is a recognised global… https://t.co/6bwRV3W2n7"
1554455742975037442,2022-08-02 13:15:04+00:00,"Singapore wants to implement regulations that address the specific risks of stablecoins, but what will that look li… https://t.co/fZQ971H6xi"
1554455360756277248,2022-08-02 13:13:33+00:00,A win-win? Kazakhstan's new amendments will tie tax rates to the prices crypto mining operators pay for electricity… https://t.co/C26p7tCpMO
1554452153128951814,2022-08-02 13:00:48+00:00,Ethereum hits a historic first in its battle against Bitcoin. https://t.co/axzNtZ85Wp
1554448192623747073,2022-08-02 12:45:04+00:00,"This Friday 🚨
Tune into NFT Steez on Aug 5 at 12 pm ET to hear @asyncart CEO @Conlan chat with @ohihello1 and… https://t.co/Bi6IWVf9XH"
1554446486242467846,2022-08-02 12:38:17+00:00,"Konzum officially started accepting cryptocurrencies as payment for its products in December 2021, allowing custome… https://t.co/T5GPMCYIbQ"
1554444502915481600,2022-08-02 12:30:24+00:00,A recent study conducted by the European Central Bank on identifying the ultimate cross-border payment medium crown… https://t.co/Rxj68dty6R
1554443914836250624,2022-08-02 12:28:04+00:00,The metaverse isn’t going anywhere: market share to surpass $50 billion by 2026. https://t.co/1sKZvhyIsA
1554441921669394432,2022-08-02 12:20:08+00:00,"Where to from here? Bitcoin traders have support and resistance targets ready as $23,000 slips. https://t.co/loShZSRyZO"
1554439390574804993,2022-08-02 12:10:05+00:00,"Halborn noted that at an initial glance, the email looks authentic with a MetaMask header and logo and with message… https://t.co/jEPTgJnUy0"
1554438249501691906,2022-08-02 12:05:33+00:00,Kim Kardashian's lawyers file to dismiss EthereumMax class-action complaint after 2021 Instagram stories promotion: https://t.co/HZ8p1DsiIN
1554437045728190465,2022-08-02 12:00:46+00:00,"What is new in the crypto and regulations marriage this week?

Law Decoded is out to keep you posted. https://t.co/H7ziR5kZsK"
1554431199027806210,2022-08-02 11:37:32+00:00,What will you do after the merge if there is an ETHPoW chain?
1554429369057165312,2022-08-02 11:30:16+00:00,Will hype surrounding The Merge be enough to keep ETH from consolidating? https://t.co/vlV1VV1TSg
1554425567981748224,2022-08-02 11:15:09+00:00,"According to the Tether transparency report, there is now 66.3 billion USDT in circulation. 

This gives the stable… https://t.co/sS09V2OCJM"
1554421931218243585,2022-08-02 11:00:42+00:00,"The bears aren’t finished feeding, according to Glassnode. 

With several on-chain metrics for Bitcoin still in a b… https://t.co/CPG0WA7LbL"
1554421777144627200,2022-08-02 11:00:06+00:00,"Explained: The layers of blockchain technology

https://t.co/QkQl8jNVhJ https://t.co/etbF4HuOU7"
1554418498419339265,2022-08-02 10:47:04+00:00,"Open Interest in Ethereum options exceeded that of Bitcoin by 32% on August 1, making the first instance in history. https://t.co/cxvXfcCX30"
1554417446647373825,2022-08-02 10:42:53+00:00,"The first mint in almost three months occurred on Friday, and there have been three more, with the latest on Tuesda… https://t.co/ilK1GmOM3j"
1554416483530207233,2022-08-02 10:39:03+00:00,"Singapore wants to implement regulations that address the specific risks of stablecoins, but what will that look li… https://t.co/wqC3Bm24qj"
1554414467038846976,2022-08-02 10:31:03+00:00,"Cardano joins Sygnum’s crypto staking portfolio, which features three PoS protocols —Ethereum 2.0, Internet Compute… https://t.co/DhQBJlxAd1"
1554414246481768448,2022-08-02 10:30:10+00:00,"“Blows out anything” from Call of Duty? 

Gaming YouTube streamer Dr DisRespect’s NFT game is falling short of the… https://t.co/gSfqkgqP8d"
1554410633684205569,2022-08-02 10:15:49+00:00,"However, Nomad later suggested to Cointelegraph that some of the funds were withdrawn by “white hat friends” who to… https://t.co/SzrwWSZLaZ"
1554410439647404032,2022-08-02 10:15:03+00:00,Embattled crypto lending platform Vauld has been granted a short period of reprieve from creditors after being give… https://t.co/P72K1ouPqE
1554406764300345345,2022-08-02 10:00:26+00:00,"Not exactly starting with a bang.

Bitcoin and Ethereum face resistance in the early days of August, but there's pl… https://t.co/BARAOOrmvU"
1554399162371801089,2022-08-02 09:30:14+00:00,"Is this a sign that the bear run may be over? 

Tether has expanded its circulating supply following almost three m… https://t.co/vd719HfGdj"
1554391674973036544,2022-08-02 09:00:29+00:00,The Securities and Exchange Commission has charged 11 individuals for their alleged role in the creation of a “frau… https://t.co/aKl62TmdMc
1554387289739931648,2022-08-02 08:43:03+00:00,The ECB thinks #CBDC is better than #Bitcoin for cross-border payments. Do you agree? https://t.co/3O260njOXf
1554384005071605760,2022-08-02 08:30:00+00:00,The Nomad token bridge appears to have experienced a security exploit that has allowed hackers to systematically dr… https://t.co/IfGqJBKfJS
1554368940519763968,2022-08-02 07:30:08+00:00,"Given crypto companies' recent crashes and failures, regulations to prevent this contagion from spreading further a… https://t.co/NZyDxA06Iu"
1554357656898387968,2022-08-02 06:45:18+00:00,"Wait...how much $BTC does the Minister of Digital and Financial Services of Gibraltar hold? 

@JoeNakamoto sat down… https://t.co/kZ5jboBMgk"
1554348031939469317,2022-08-02 06:07:03+00:00,"Despite the Ethereum Merge just 48 days away, one asset manager says he's turned cautious on ETH prices — warning m… https://t.co/lcR9ZID5Dr"
1554344636239400961,2022-08-02 05:53:34+00:00,Glassnode’s latest report explains that the recent price pump may be short-lived if network demand continues to be… https://t.co/e5ibxdM1we
1554334933447053312,2022-08-02 05:15:00+00:00,Binance US will preemptively stop AMP trades from August 15th after the SEC claimed the token is a security.  https://t.co/0AahDsRI3d
1554331183219097600,2022-08-02 05:00:06+00:00,"Explained: zk-STARKs vs. zk-SNARKs
https://t.co/liFJEqAdQY https://t.co/Jj5CAidTED"
1554331049135525888,2022-08-02 04:59:34+00:00,"Barca’s Johan Cruyff NFT was auctioned off for $700K, Funko is set to release digital collectibles from the Avatar… https://t.co/U1RqIClHnY"
1554321858211655685,2022-08-02 04:23:03+00:00,USDT supply has increased for the first time following a 20% reduction over the past three months. Is it a sign of… https://t.co/3pCdgd2zhC
1554319834695041024,2022-08-02 04:15:01+00:00,"What's new in the crypto and regulations marriage this week?

Law Decoded is out to keep you posted. https://t.co/H7ziR5kZsK"
1554314045825712128,2022-08-02 03:52:00+00:00,"Bitcoin accepted here! 

A small tourist town in Honduras has begun accepting BTC payments as part of the Bitcoin V… https://t.co/1A5fCFr2yN"
1554312285648207872,2022-08-02 03:45:01+00:00,"Too fast, too soon? 

Vitalik Buterin claims Meta is jumping the gun with #metaverse innovation because “it is far… https://t.co/G4MxcugjCC"
1554308510413979648,2022-08-02 03:30:01+00:00,"Have you witnessed something fishy during this bear market?

New York Attorney General Letitia James wants to hear… https://t.co/lODuYcwf8G"
1554305247333343232,2022-08-02 03:17:03+00:00,The Singapore High Court has granted embattled crypto lender Vauld with a three-month moratorium — granting it temp… https://t.co/kojHAEUU9q
1554304735720738820,2022-08-02 03:15:01+00:00,"It's not a secret that blockchain is changing the world, but how do the advantages of the new technology apply to i… https://t.co/2UWQ5DYhJ2"
1554300959072948227,2022-08-02 03:00:00+00:00,"It's not a nation, it's not a bear, it's not a bull.

It's backwardation. https://t.co/A5BjlHrN4w"
1554297182605418497,2022-08-02 02:45:00+00:00,"Binance launched BAB, a token to solve identity issues in the decentralized society. 
https://t.co/lz8CJsFrva"
1554293802717700098,2022-08-02 02:31:34+00:00,The Securities and Exchange Commission has laid charges against 11 people that allegedly took part in a $300 millio… https://t.co/zZjbQFP262
1554293435829555203,2022-08-02 02:30:07+00:00,"Gibraltar-based firm Huobi jumps to Australia.

The exchange recently got licensed to operate in the country and pl… https://t.co/ij9xUEi1Cy"
1554291397406105600,2022-08-02 02:22:01+00:00,Chicago Board Options Exchange expenses went up 312% due to unforeseen weak performance of previously acquired firm… https://t.co/S3ofsJovqN
1554287618942275584,2022-08-02 02:07:00+00:00,"Given crypto companies' recent crashes and failures, regulations to prevent this contagion from spreading further a… https://t.co/omrLprh4sP"
1554285877202919424,2022-08-02 02:00:05+00:00,"You own a lot of Bitcoin, but do you actually know how it works? 

https://t.co/X7Nq3x2mEC https://t.co/B9aC4RomTZ"
1554282085799575552,2022-08-02 01:45:01+00:00,"W3BCloud will go public through NYSE-listed Social Leverage Acquisition Corp I.
 
The cloud infrastructure company… https://t.co/QHzSybIcfl"
1554278342458851328,2022-08-02 01:30:08+00:00,"Many people think of market correction and the bear market as the same thing, but they are not.

Here are the key d… https://t.co/sjJItdio30"
1554274540498345985,2022-08-02 01:15:02+00:00,"Binance CEO @cz_binance had a talk with several countries' governments, and one thing was clear to him: segregated… https://t.co/aKPto44URg"
1554268747824861185,2022-08-02 00:52:01+00:00,Binance US will preemptively halt AMP trades from August 15th after the SEC claimed the token is a security.  https://t.co/0AahDsRI3d
1554266984585592835,2022-08-02 00:45:00+00:00,"Crypto winter in Croatia is not as cold as in other parts of the world.

The country's largest supermarket chain, K… https://t.co/Yz128n51On"
1554264101504688128,2022-08-02 00:33:33+00:00,"The Nomad token bridge appears to be the latest token bridge to suffer a security exploit, losing nearly all of its… https://t.co/xeqFzfvQA5"
1554263208571162630,2022-08-02 00:30:00+00:00,"W3BCloud will go public through NYSE-listed Social Leverage Acquisition Corp I. 

The cloud infrastructure firm gen… https://t.co/jaD7CrmgOE"
1554259434586660864,2022-08-02 00:15:00+00:00,"Blockchain gaming and the Metaverse have managed to ""sidestep"" the ""Lehman brothers-like"" collapse of Terra in May,… https://t.co/yhEiBDFlyy"
1554255739052597251,2022-08-02 00:00:19+00:00,"Bitcoin accepted here! 

A small tourist town in Honduras has begun accepting #Bitcoin payments as part of the Bitc… https://t.co/D6fIGppzlA"
1554251885854576641,2022-08-01 23:45:00+00:00,"It is not a secret that blockchain is changing the world, but how do the advantages of the new technology apply to… https://t.co/FZgE5DBHBP"
1554249870701125632,2022-08-01 23:37:00+00:00,"Too fast, too soon? 

Vitalik Buterin claims Meta is jumping the gun with metaverse innovation because “it is far t… https://t.co/fEVathcyBy"
1554248109584224257,2022-08-01 23:30:00+00:00,"The trading volume on CryptoPunks shot up over 1,800% after revealing a unique collaboration with Tiffany &amp; Co. https://t.co/t1LCrvPkpt"
1554246099216617474,2022-08-01 23:22:01+00:00,"Binance launched BAB, a token designed to solve identity issues in the decentralized society.  https://t.co/lz8CJsFrva"
1554242392160714752,2022-08-01 23:07:17+00:00,"“Bitcoin adoption will be enormous”

@JoeNakamoto sat down with the Minister of Digital and Financial Services of G… https://t.co/TiSfLIsz0p"
1554240651402805248,2022-08-01 23:00:22+00:00,"Gibraltar-based firm Huobi gets licensed to operate in Australia.
 
The exchange plans to expand to the Americas in… https://t.co/VQf5EUqteA"
1554236788897628161,2022-08-01 22:45:01+00:00,"Worried about fake crypto apps stealing your tokens? 

Here's our guide on how to protect yourself. https://t.co/znpDpAUdDd"
1554234770422390784,2022-08-01 22:37:00+00:00,"The latest album from Muse will be released entirely as an NFT. 

Is this the future of record sales? https://t.co/7cgOcFedlD"
1554230995553058823,2022-08-01 22:22:00+00:00,"Israel dumps cash for digital payments.

On Monday, authorities in Israel put further restrictions on cash payments… https://t.co/IfXO2Y3Yvx"
1554229963255054337,2022-08-01 22:17:54+00:00,What's easier?
1554229252513746944,2022-08-01 22:15:04+00:00,"Forget diamond rings; crypto bling-bling is the new cool. 

Luxury jewelry brand Tiffany &amp; Co has announced the sal… https://t.co/kMLjXRmycp"
1554225460657143816,2022-08-01 22:00:00+00:00,"In March,  a new Dubai law had crypto exchanges scrambling. 

Here are the companies currently  approved to operate… https://t.co/Jc2hOFoxo7"
1554221684353388545,2022-08-01 21:45:00+00:00,"Have you witnessed something fishy during this bear market?

NY Attorney General Letitia James wants to hear from y… https://t.co/Xzx1OgQk1H"
1554217937812193280,2022-08-01 21:30:07+00:00,"The British Financial Conduct Authority (FCA) wants more warnings for high-risk assets, but crypto is surprisingly… https://t.co/7AEBmapoMV"
1554214137126862848,2022-08-01 21:15:00+00:00,"Many people think of market correction and the bear market as the same event, but they are not.

Here are the key d… https://t.co/OB7rssblzU"
1554210394109104128,2022-08-01 21:00:08+00:00,"Given crypto companies' recent crashes and failures, regulations to prevent this contagion from spreading further a… https://t.co/7TO72B1ABa"
1554205327700234240,2022-08-01 20:40:00+00:00,Chicago Board Options Exchange costs went up 312% due to unforeseen weak performance of previously acquired firm Er… https://t.co/YnA2AGhjLS
1554200797424009217,2022-08-01 20:22:00+00:00,What's on the menu for Bitcoin in August after 17% monthly gains? Some analysts are optimistic about the future. https://t.co/5QGnYmYKo0
1554199048889958401,2022-08-01 20:15:03+00:00,"W3BCloud will go public through NYSE-listed Social Leverage Acquisition Corp I.
 
The cloud infrastructure firm gen… https://t.co/CU3yqXVH9t"
1554195540870500356,2022-08-01 20:01:07+00:00,"Probes into Coinbase and Kraken, postponement of the stablecoin bill in the U.S., IMF's dark forecast and other maj… https://t.co/PTELsfyTOA"
1554195298959986688,2022-08-01 20:00:09+00:00,"Under the mattress, in the seams of a piece of luggage or even rolled into a cigar, what are the worst and best way… https://t.co/YG9PqOtWTi"
1554191487402971138,2022-08-01 19:45:00+00:00,"Crypto winter in Croatia is not as cold as in other parts of the world.

The country experienced a rise in Bitcoin… https://t.co/bRomd52naG"
1554187730854313988,2022-08-01 19:30:05+00:00,"Be careful. 

A cybersecurity firm has issued warnings over a new phishing campaign targeting users of the popular… https://t.co/uD4pAZ0YEG"
1554183938507153410,2022-08-01 19:15:00+00:00,"It's not a nation, it's not a bear, it's not a bull.

It is backwardation. https://t.co/A5BjlHrN4w"
1554181938881052672,2022-08-01 19:07:04+00:00,"Uh oh, AMP is getting delisted from Binance US ""out of an abundance of caution"" the SEC may see the token as a secu… https://t.co/EfzchxWVvY"
1554181718378024964,2022-08-01 19:06:11+00:00,🇬🇮🇬🇮🇬🇮 https://t.co/rqclICujkG
1554181716981428225,2022-08-01 19:06:11+00:00,"Revealed in an exclusive interview with Cointelegraph's @JoeNakamoto, The Minister for Digital and Financial Servic… https://t.co/xQF8gW2yaL"
1554178169162399746,2022-08-01 18:52:05+00:00,"Blockchain gaming and the Metaverse have managed to ""sidestep"" the ""Lehman brothers-like"" collapse of Terra in May,… https://t.co/cmRN6NTvxg"
1554176533316923392,2022-08-01 18:45:35+00:00,"RT @CointelegraphCS: In Q2 2022, #Web3 dominated venture capital interest in the #blockchain sector. 📈👀

The top investors 🏆 were @animocab…"
1554170599257284608,2022-08-01 18:22:00+00:00,"A new job posting by America's biggest ticketing company, Ticketmaster, reveals mainstream interest in exploring ne… https://t.co/YZPUJTUFSY"
1554166824442515456,2022-08-01 18:07:00+00:00,"Binance CEO @cz_binance had some talks with several countries' governments, and one thing was clear to him: segrega… https://t.co/AUZ9LI4vaZ"
1554165342842208258,2022-08-01 18:01:07+00:00,The CBOE released its most recent earnings and there is a surprise in operating costs: they went up 685%. https://t.co/oV2RsjNi4b
1554163049057189895,2022-08-01 17:52:00+00:00,"The bulls went through July with some victories under the belt, but the bears are not surrendering yet.

Here are o… https://t.co/77Hxq0oGpW"
1554161291106963459,2022-08-01 17:45:01+00:00,"Be careful. 

A cybersecurity firm has issued warnings over a new phishing campaign targeting users of the popular… https://t.co/wNHrtFL24V"
1554158400371564544,2022-08-01 17:33:32+00:00,@FlowPrinciple https://t.co/rwwBnE7Kym
1554157597871247361,2022-08-01 17:30:20+00:00,"Let us show you the @beconomy_hq Istanbul 2022 summit through our lens.

PS: The bear market did not break anyone's… https://t.co/215bQowwZZ"
1554151724419530752,2022-08-01 17:07:00+00:00,"Forget diamond rings; crypto bling-bling is the new cool. 

Luxury jewelry brand Tiffany &amp; Co has announced the sal… https://t.co/4veB5BCbE0"
1554150051106246658,2022-08-01 17:00:21+00:00,"Isreal dumps cash for digital payments.
https://t.co/LL790CHQYX"
1554147949852200960,2022-08-01 16:52:00+00:00,Can you smell what Bitcoin is cooking? BTC miners are expected to make a comeback in August as profits look more li… https://t.co/yph6wWEv4Y
1554146190735933440,2022-08-01 16:45:01+00:00,"Tether, the issuer of $USDT, says that hedge funds that attempted to short its stablecoin after Terra's collapse in… https://t.co/7uTMvdMfPg"
1554142954859573251,2022-08-01 16:32:09+00:00,Polygon has lost TVL despite its price going up 83% in a month. What gives? https://t.co/E5X0P9cEFl
1554142946995216384,2022-08-01 16:32:07+00:00,Bitcoin may be above key resistance levels but few believe that the bears are back in hibernation. https://t.co/oXYeNhQXdQ
1554142499874160640,2022-08-01 16:30:21+00:00,"The trading volume on CryptoPunks shot up over 1,800% after they announced a unique collaboration with Tiffany &amp; Co. https://t.co/t1LCrvPkpt"
1554140402793545728,2022-08-01 16:22:01+00:00,"See mom, #blockchain is not just about crypto! https://t.co/a05RN1cc8U"
1554136889292075008,2022-08-01 16:08:03+00:00,The US-based data service company W3BCloud is going public via a SPAC worth over $1B. The company is backed by AMD… https://t.co/dIP6J7WEe0
1554134948226924545,2022-08-01 16:00:20+00:00,"Under the mattress, in the seams of a piece of luggage,  or even rolled into a cigar, what are the worst and best w… https://t.co/FTyeoVXdGq"
1554131088188080128,2022-08-01 15:45:00+00:00,"Given crypto companies' recent crashes and failures, regulations to prevent this contagion from spreading further a… https://t.co/QVmJcYDyr3"
1554129090386374656,2022-08-01 15:37:04+00:00,Have you been deceived or affected by a crypto scam? The New York Attorney General would like to hear from you. https://t.co/sivrreLkt0
1554129076134232066,2022-08-01 15:37:00+00:00,"Worried about fake crypto apps stealing your tokens? 

Here's how to protect yourself. https://t.co/znpDpAUdDd"
1554127367114719232,2022-08-01 15:30:13+00:00,"Bitcoin's consolidation at the $24,000 resistance increases the likelihood that continuation will occur, and this c… https://t.co/OSsWi6B7pd"
1554125301893971972,2022-08-01 15:22:00+00:00,"The latest album from Muse will be released entirely as an NFT. 

Is this the future of music sales? https://t.co/7cgOcFedlD"
1554123538914738179,2022-08-01 15:15:00+00:00,"In a move to gain investors' trust, BitGet will back itself by using a combination of Bitcoin and USDT. 

The compa… https://t.co/2ne00p2jQ0"
1554121793887014912,2022-08-01 15:08:04+00:00,"For the price of 30 ETH, Punk NFT owners can receive a custom-made Tiffany pendant delivered to their doorstep. https://t.co/hXqG8Rcty5"
1554121526588440578,2022-08-01 15:07:00+00:00,"In March,  a new Dubai law had crypto exchanges scrambling. 

Here are the companies that are currently approved to… https://t.co/Xh62s0dVd3"
1554119899441774596,2022-08-01 15:00:32+00:00,"Traders have been pondering how Ethereum's upcoming Merge upgrade could shake the #ETH price up.

@noshitcoins expl… https://t.co/GwExGoFBTZ"
1554117770047983617,2022-08-01 14:52:05+00:00,Bitcoin and most major altcoins are seeing improving sentiment. https://t.co/StiIWSiq19
1554115744371298306,2022-08-01 14:44:02+00:00,"This August go to the beach and hodl your Bitcoin towel after a bath in the sea.
https://t.co/TX2A6x8njW https://t.co/WFH3xmODuC"
1554114114246414336,2022-08-01 14:37:33+00:00,Moving things from one region to another could be more efficient than it is today. Are you wondering how? Blockchai… https://t.co/7JYQbnvjX8
1554113977508036610,2022-08-01 14:37:00+00:00,"The British Financial Conduct Authority (FCA) wants more warnings for high-risk assets, but crypto is strangely exe… https://t.co/9etqoQfvPI"
1554110200453500928,2022-08-01 14:22:00+00:00,"These clubs are revolutionizing the beautiful game. 

@SaoPauloFC signed midfielder Giuliano Galoppo in a deal wort… https://t.co/6M2GMpefCY"
1554106355727867904,2022-08-01 14:06:43+00:00,"RT @CointelegraphZN: Given crypto companies' recent crashes and failures, regulations to prevent this contagion from spreading further are…"
1554104710910672898,2022-08-01 14:00:11+00:00,"New Episode 🔊
Tune into NFT Steez on Aug 5 at 12 pm ET to hear @asyncart CEO @Conlan chat with @ohihello1 and… https://t.co/6FHhyhPbEa"
1554101276513673221,2022-08-01 13:46:32+00:00,Muse’s new NFT album becomes the newest chart-eligible format since 2015. https://t.co/Gc8QNTbaF3
1554100888813408257,2022-08-01 13:45:00+00:00,"Crypto bling-bling!

Luxury jewelry brand Tiffany &amp; Co has announced the sale of 250 diamond and gemstone encrusted… https://t.co/h4fGKggfka"
1554097637485613056,2022-08-01 13:32:05+00:00,High risk? Higher responsibility. The British Financial Conduct Authority demands more explicit and prominent risk… https://t.co/xgUc2TOjxo
1554097630254247937,2022-08-01 13:32:03+00:00,Do you double-check before you download crypto applications? You probably should! Scammers are using fake crypto ap… https://t.co/RXlWgVv9WU
1554097142385475585,2022-08-01 13:30:07+00:00,"A new job posting by America's biggest ticketing company, Ticketmaster, reveals mainstream interest in exploring ne… https://t.co/wMpuAvW5ry"
1554095102125039619,2022-08-01 13:22:00+00:00,"What's on the menu for #Bitcoin in August after 17% monthly gains? https://t.co/5QGnYmYKo0

(Reporting via @WilliamSuberg)"
1554093488261672961,2022-08-01 13:15:35+00:00,"In March, Dubai established a new regulator to oversee service providers that wish to operate within the region. https://t.co/Sy4tP0tR3z"
1554091592679428097,2022-08-01 13:08:03+00:00,The new Binance Account Bound token will function as a Binance identity and can be used by third-party protocols to… https://t.co/SRTyZHDres
1554091328673382400,2022-08-01 13:07:01+00:00,"The merge or the split? 

After the hard fork, some miners could revolt against the PoS upgrade by continuing to mi… https://t.co/lNqLWpZml8"
1554086441088684034,2022-08-01 12:47:35+00:00,These limited-edition NFTs by @degenpassnft grant access to casinos in the crypto space as the use cases for Web3 a… https://t.co/XrkKkQe0pb
1554085804758253569,2022-08-01 12:45:04+00:00,"Can you imagine ETH outpacing Visa?

Polygon's co-founder @mihailobjelic can. https://t.co/7Qh3nlgOAN"
1554085042065907713,2022-08-01 12:42:02+00:00,What crypto are you watching this week? 📈👀
1554080006271340544,2022-08-01 12:22:01+00:00,"We're seeing hyper &amp; ultra-rare editions of the Cristobal Balenciaga ""To The Moon"" NFT collection going for up to 4… https://t.co/ZWBm9D9Zl4"
1554072988248469504,2022-08-01 11:54:08+00:00,Huobi gets the all-clear to set up cryptocurrency services in Australia. https://t.co/LyarZBvBUe
1554072455488094208,2022-08-01 11:52:01+00:00,"Tether, the issuer of $USDT, says that hedge funds that attempted to short its stablecoin after Terra's collapse in… https://t.co/LsXGGVWdlr"
1554067692071505921,2022-08-01 11:33:05+00:00,"Croatia is “at the top in the European Union” regarding cryptocurrency adoption, a spokesperson for the Konzum supe… https://t.co/FOXM1AFONi"
1554067684479811584,2022-08-01 11:33:03+00:00,"While they share similarities, there are critical differences between a market correction and a bear market. Which… https://t.co/oIgIoKTCkV"
