id,created_at,text
1516357326055243776,2022-04-19 10:05:33+00:00,Did you know KuCoin had a venture capital arm and a new NFT marketplace? Both outfits have allocated $100 million t… https://t.co/2b6TOhlGAs
1516355999686434817,2022-04-19 10:00:17+00:00,"Is Bitcoin back from the dead?

BTC returns to the green after the Easter weekend, while some altcoins are making s… https://t.co/qnMbaZdj4P"
1516355435753738244,2022-04-19 09:58:03+00:00,"Data hints we have hodlers to thank for keeping Bitcoin above $25,000. https://t.co/IL73xIkaxu"
1516337055340670976,2022-04-19 08:45:00+00:00,"Be careful iPhone users. 

@MetaMask has sent out a warning to the community regarding Apple iCloud phishing attack… https://t.co/TIdTcQgRHn"
1516330779025948672,2022-04-19 08:20:04+00:00,Ethereum price isn't out of the woods yet despite ETH rebounding to $3K. https://t.co/O8AGoWjzkX
1516329508542033921,2022-04-19 08:15:01+00:00,"What is wash trading crypto?

It occurs when a trader buys and sells the same securities multiple times in a short… https://t.co/bHld5ZKGGn"
1516327004001296393,2022-04-19 08:05:04+00:00,".@CoinDCX scores yet another funding round of $135 million. Education, innovation and compliance are key areas of f… https://t.co/imlOCBY8i9"
1516323718712201217,2022-04-19 07:52:01+00:00,"Hyundai is releasing a nonfungible token. 

The South Korean automobile manufacturer has partnered with the Meta Ko… https://t.co/iI97xnOqLf"
1516318181761105921,2022-04-19 07:30:01+00:00,"Can #NFTs join the space race?

American astronaut Scott Kelly recognizes that blockchain has a lot of potential an… https://t.co/xAz8nd1mVC"
1516310629866430465,2022-04-19 07:00:00+00:00,"Terra UST is now the third-largest stablecoin. 

#UST is a USD-pegged stablecoin that was launched in September 202… https://t.co/Mw0H4pjpNE"
1516295541755297798,2022-04-19 06:00:03+00:00,Who will be next to list their exchange as a public company in the United States? https://t.co/jPlYmaFcX7 could go… https://t.co/Ou7SOYRyIh
1516292144738160641,2022-04-19 05:46:33+00:00,"Animoca Brands has snapped up a major stake in Aussie marketing agency Be Media, with the firm set to seek out loca… https://t.co/aHOcIZm5Te"
1516288495207165953,2022-04-19 05:32:03+00:00,Ireland is seeking to ban donations to political parties that use cryptocurrencies as fears mount over foreign inte… https://t.co/Z8IPoW9nw7
1516284210306244608,2022-04-19 05:15:01+00:00,Change a law from 1934? Not so fast. https://t.co/W4WemfJ7Pa
1516276661402152963,2022-04-19 04:45:01+00:00,"Ripple supporters rejoice, Coin Center weighs in on the exchange argument, and Brazil is working on a new CBDC. 

A… https://t.co/8cWmvaXKRq"
1516272922108829699,2022-04-19 04:30:10+00:00,"Is Andre Cronje back? 

After an abrupt exit from the space, the Yearn founder had some cryptic words about his ret… https://t.co/bl5ZNNUHpE"
1516270128890933249,2022-04-19 04:19:04+00:00,"While the Ethereum Foundation holds about 0.3% of the entire current ETH supply, it also boasts an impressive $300… https://t.co/yOmOKStho4"
1516267097017487368,2022-04-19 04:07:01+00:00,"Atari is calling it quits on its token ATRI, terminating a joint venture with previous blockchain affiliates. 

But… https://t.co/w6NeB1xiSi"
1516263459960225792,2022-04-19 03:52:34+00:00,"The Moonbirds NFT project has generated $290 million worth of sales since launching last weekend, placing it ahead… https://t.co/4pd6AnFvXL"
1516254011355189249,2022-04-19 03:15:01+00:00,"At the end of the day, traders are going to trade. With Ethereum's migration approaching, this is how options trade… https://t.co/LXg6Pfgf4P"
1516244446169423880,2022-04-19 02:37:01+00:00,Crypto is starting to buy its way into politics. $9M was raised by a crypto-focused political action committee to s… https://t.co/tVNkb4BIZx
1516236895604387840,2022-04-19 02:07:00+00:00,"Who doesn't love a good discount? 

Markets are debating whether sub $40K BTC is cheap. https://t.co/cK64oANhAV"
1516232630793953280,2022-04-19 01:50:04+00:00,Running a crypto business in New York is about to get a lot more expensive with the state government requiring comp… https://t.co/WU9Gi9pCh7
1516229346234617856,2022-04-19 01:37:00+00:00,"Is @kevinolearytv's next move a crypto exchange? @WonderFi, backed by Kevin O'Leary, is buying @CoinberryHQ for ove… https://t.co/wHxZir2dIW"
1516226844575485953,2022-04-19 01:27:04+00:00,Several government agencies have taken notice of how efficient North Korean hackers are at extracting value from cr… https://t.co/DHfzXr6rYn
1516223813117173764,2022-04-19 01:15:01+00:00,"The DCR price increases 45% as it awaits a hard fork in three weeks.

The update aims to avoid malicious miners wit… https://t.co/ore8jKErXl"
1516218024306565122,2022-04-19 00:52:01+00:00,"Being a P2E gamer doesn’t always mean being glued to your chair. 

The new “move-to-earn” model is catching fire am… https://t.co/bKPdEE7wEO"
1516212515847426053,2022-04-19 00:30:08+00:00,"Is it time to look into BNB again? 

A Thai holding company has decided to invest in Binance US, citing a desire to… https://t.co/BrfWRC2O7z"
1516206774898073602,2022-04-19 00:07:19+00:00,"Are we ready for the ""programmable economy""? 

With the growth and adoption of cryptocurrency, new forms of value e… https://t.co/NzEvqKBDGu"
1516202921880301570,2022-04-18 23:52:00+00:00,"How will we see NFTs in the future?

The landing of nonfungible tokens on the internet not only meant a new way to… https://t.co/YTuNMSKXdq"
1516201160578895880,2022-04-18 23:45:00+00:00,"Why are institutions interested in crypto?

“It's just becoming too big in terms of mindshare for people to ignore”… https://t.co/YUVTOgilCd"
1516197421331669007,2022-04-18 23:30:09+00:00,"Can NFTs join the space race?

American astronaut Scott Kelly recognizes that blockchain has a lot of potential and… https://t.co/5hvDaYt31E"
1516197106570391553,2022-04-18 23:28:54+00:00,@ankr There is a massive monetary incentive for infrastructure providers to power as many of these Web3 ecosystems… https://t.co/sI0w50HzqF
1516193611297304580,2022-04-18 23:15:01+00:00,"The fear and greed index tells you when it’s a good moment to buy or not, but when you are in the neutral zone, you… https://t.co/r3lk6j6Osg"
1516189871978725376,2022-04-18 23:00:09+00:00,"Terra UST is now the third-largest stablecoin. 

$UST is a USD-pegged stablecoin that was launched in September 202… https://t.co/fBmE2HrDGr"
1516186061151551490,2022-04-18 22:45:01+00:00,"Get your utensils ready, @monero is initiating a mainnet hard fork that will include changes to fee structures and… https://t.co/Xf8wA3Pas1"
1516184049030729733,2022-04-18 22:37:01+00:00,"Is Andre Cronje back? 

After an abrupt exit from the space, the Yearn founder had some cryptic words about his ret… https://t.co/yJd5FiFvuO"
1516182286567448585,2022-04-18 22:30:01+00:00,"Hyundai is releasing a nonfungible token. 

The South Korean automobile manufacturer has partnered with the Meta Ko… https://t.co/NIFjX0J5uB"
1516178510091624451,2022-04-18 22:15:00+00:00,"Atari is calling it quits on its token ATRI, terminating a joint venture with previous blockchain affiliates. 

But… https://t.co/w3yLJ88sRl"
1516174901585096707,2022-04-18 22:00:40+00:00,"Every cryptocurrency has a unique utility and purpose, much like corporations. 
What is your cryptocurrency of choi… https://t.co/eETf3BzuCV"
1516172726750351361,2022-04-18 21:52:01+00:00,"Crypto is starting to bully its way into politics. 

$9M was raised by Protect Our Future, a political action commi… https://t.co/BHjOz9U7Gu"
1516170962915536899,2022-04-18 21:45:01+00:00,"Ripple supporters rejoice, Coin Center weighs in on the exchange argument, and Brazil is working on a new CBDC. 

A… https://t.co/N5P75I8PrD"
1516168950568173569,2022-04-18 21:37:01+00:00,Who doesn't love a good discount? Markets are debating whether sub $40K BTC is cheap. https://t.co/cK64oANhAV
1516167957675532293,2022-04-18 21:33:04+00:00,"Andre Cronje declares ""Long live Crypto"" in Medium post, while calling for stricter regulation. (Reporting via… https://t.co/aCPKYcsHO4"
1516165176378204167,2022-04-18 21:22:01+00:00,Credit-based stablecoin protocol Beanstalk Farms lost all of its $182 million collateral from a security breach cau… https://t.co/Jpdiiph2zV
1516164179001978881,2022-04-18 21:18:03+00:00,Republicans on the Financial Services Committee fault new SEC definitions proposed for ’34 Act. https://t.co/U3r7bPYstk
1516161398212108288,2022-04-18 21:07:00+00:00,Self-regulatory organizations (SROs) can help fill the gaps while we wait for regulation from financial bodies. https://t.co/xwOBrxS55T
1516160904949207041,2022-04-18 21:05:03+00:00,"The former video-game giant has cut ties with its namesake token, but promised investors that they will be able to… https://t.co/QGlgBsHJ3l"
1516159705231642652,2022-04-18 21:00:17+00:00,"Is @kevinolearytv's next move a crypto exchange? @WonderFi, backed by Kevin O'Leary, is buying @CoinberryHQ for ove… https://t.co/I10lMXlhl5"
1516154604693729290,2022-04-18 20:40:01+00:00,"The DCR price climbs 45% as it awaits a hard fork in three weeks.

The update aims to avoid malicious miners with a… https://t.co/Gbcu7atpmd"
1516153605983649792,2022-04-18 20:36:03+00:00,"Check out how pro traders use $ETH options to maximize gains ahead of the upcoming #Ethereum merge, according to… https://t.co/kHYHbMDo4m"
1516152086819483651,2022-04-18 20:30:00+00:00,"Be careful iPhone users. 

MetaMask has sent out a warning to the community regarding Apple iCloud phishing attacks… https://t.co/fxkn5zmQGF"
1516150336792137728,2022-04-18 20:23:03+00:00,"Bitcoin and altcoins continue to slump, but dwindling BTC supply at centralized exchanges suggests that longer-term… https://t.co/EkbNBH2qBa"
1516148312356888585,2022-04-18 20:15:00+00:00,"Being a P2E gamer doesn’t necessarily mean being glued to your chair anymore. 

The new “move-to-earn” model is cat… https://t.co/1G1a02491E"
1516145175428419587,2022-04-18 20:02:33+00:00,The captains of the industry shared some ideas on crypto policy and regulation while hanging out in Paris last week. https://t.co/Tg9nDeE6VW
1516144637794209799,2022-04-18 20:00:24+00:00,"Why are institutions interested in investing in crypto?

“It's just becoming too big in terms of mindshare for peop… https://t.co/hubPOImQ02"
1516144293756518405,2022-04-18 19:59:02+00:00,"Data points to wash trading and money laundering in the #NFT ecosystem. What does that mean, and how can users spot… https://t.co/yRtnmRy9bd"
1516139170015580160,2022-04-18 19:38:41+00:00,The CTO of #Tether reveals the stablecoin's plan to preserve dominance. Watch here: https://t.co/fUicwUyg8o
1516138750098739205,2022-04-18 19:37:01+00:00,"Data points to wash trading and money laundering in the #NFT ecosystem. 

What does that mean, and how can users sp… https://t.co/wO44Fc8hWd"
1516137876609650689,2022-04-18 19:33:32+00:00,SROs are seeking a place alongside regulators in the cryptosphere. https://t.co/Mlxp8hF7L9
1516136988684046343,2022-04-18 19:30:01+00:00,"How will we see NFTs in 30 years?

The creation of nonfungible tokens on the internet ushered in a revolutionary wa… https://t.co/3pVmgptLBP"
1516131551205015559,2022-04-18 19:08:24+00:00,"Okay, folks! Let's settle it with a poll. 

What stablecoin do you prefer?"
1516129952797667332,2022-04-18 19:02:03+00:00,"Money in politics, whether it's crypto or fiat, continues to be a contentious issue in the United States https://t.co/4kfqIdrc01"
1516129571279720452,2022-04-18 19:00:32+00:00,Someone is bullying the bulls. https://t.co/3A4wEKhhz9
1516125664273125376,2022-04-18 18:45:01+00:00,"UK-based crypto firm @Exmo_Com leaves Russia and Belarus.

The company also states that Russian, Belarusian, and Ka… https://t.co/0nYtcL18is"
1516122658697474053,2022-04-18 18:33:04+00:00,Bitcoin options signal fear while other metrics suggest BTC is a bargain below $40k. https://t.co/gq1slpJ3j3
1516118123581222917,2022-04-18 18:15:03+00:00,"Is play-to-earn gaming the future of video games?

While there still are a lot of skeptics, @JamCityHQ’s CEO… https://t.co/Xma15jEJMS"
1516115356922056706,2022-04-18 18:04:03+00:00,XMR hard forks only improve the underlying protocol and do not result in the creation of a new coin. https://t.co/C3cNFqni87
1516114358350356484,2022-04-18 18:00:05+00:00,Russian developers have been banned from the open-source platform @Github after the latest wave of international sa… https://t.co/V0NZPynMWv
1516110564145221632,2022-04-18 17:45:01+00:00,"“[Anonymity] makes it practically impossible to enforce seizure of assets”.

The Association of Banks of Russia mak… https://t.co/T507TmJmr0"
1516108552947089413,2022-04-18 17:37:01+00:00,"Are you using subsidized energy for mining crypto?

Make sure you know your local regulations. https://t.co/V5mSxtiL3d"
1516106774700453893,2022-04-18 17:29:57+00:00,RT @Cointelegraph: Send this video to your friend who still doesn't understand what the Metaverse is: https://t.co/61sfrOdw5R https://t.co/…
1516106108427026432,2022-04-18 17:27:18+00:00,"According to CoinGecko, $UST’s total market cap has surged 15% over the past 30 days to sit at roughly $17.5 billio… https://t.co/uBj5EM3mLC"
1516104782556983296,2022-04-18 17:22:02+00:00,WonderFi investor Kevin O’Leary said that there are more acquisitions to come in the future. https://t.co/KcVULioD8F
1516104776030765060,2022-04-18 17:22:01+00:00,"Is it time to look at BNB again? 

A Thai holding company has decided to strategically invest in Binance US, citing… https://t.co/FLFGIGpjWs"
1516100999970185216,2022-04-18 17:07:00+00:00,"Will #Bitcoin keep its support over $40K?

The market witnesses a crucial battle between bulls and bears that could… https://t.co/uWkWboIEVK"
1516099398337499139,2022-04-18 17:00:38+00:00,"What does your portfolio look like? 

Join us tomorrow as our hosts @BY_DeFi, @noshitcoins, @CryptoDuality, and… https://t.co/yhFrQy8zOb"
1516095465762271236,2022-04-18 16:45:01+00:00,"What’s cracking in the DeFi world this week?

Check out our latest Finance Redefined and stay informed of the big m… https://t.co/EoLdqbeai4"
1516091963967086592,2022-04-18 16:31:06+00:00,"“Bitcoin has returned more than 100% per year on avg. over the last 10 years, compared to around 10% per year for e… https://t.co/AqpKAYcfma"
1516091956048277509,2022-04-18 16:31:04+00:00,Being a P2E gamer doesn’t necessarily mean being glued to your chair anymore. The new “move-to-earn” model is catch… https://t.co/6rt754Eizo
1516091768101613571,2022-04-18 16:30:19+00:00,"Wen Moon? Lambo? People investing with these things in mind tend to get burned. 

Much like traditional investments… https://t.co/lPCgPn8Gl1"
1516088779773288452,2022-04-18 16:18:27+00:00,"Thanks to crypto, not only can migrants send money to loved ones back home for less, but those loved ones back home… https://t.co/vlAjd95OEv"
1516087914450542599,2022-04-18 16:15:01+00:00,"How does information asymmetry affect the crypto market? 

Even if @Coinbase is making an effort on transparency, v… https://t.co/3QW2mXqz61"
1516084273803108356,2022-04-18 16:00:33+00:00,"UK-based crypto firm @Exmo_Com takes off from Russia and Belarus. 

The company also states that Russian, Belarusia… https://t.co/WTvOHcCdB7"
1516080751652921350,2022-04-18 15:46:33+00:00,Thailand-based Gulf Energy Development has invested in Binance US and is pursuing a joint venture with the Binance… https://t.co/uoqOBUm9Eb
1516080364019757060,2022-04-18 15:45:00+00:00,"Is play-to-earn gaming the future of video games?

While there still are plenty of skeptics, @JamCityHQ’s CEO… https://t.co/kbnCGR6RHH"
1516073846620635136,2022-04-18 15:19:06+00:00,Decred pumps 40% but recent history suggests that such DCR price rallies are short-lived. https://t.co/F8KCS8QEM1
1516071916171411459,2022-04-18 15:11:26+00:00,"*Drum roll please* 🥁 For our #1, We have Biden’s crypto executive order making headlines, as it did NOT contain res… https://t.co/F7lENQKkLm"
1516071914015449097,2022-04-18 15:11:26+00:00,"#2 While gas prices are on the rise, Ethereum gas fees seem to have dropped, reaching their lowest levels since Aug… https://t.co/X66LxCucgP"
1516071911582797826,2022-04-18 15:11:25+00:00,"Take me to Dubai for #3, where the sun shines, and a new law that creates a legal framework for crypto was introduc… https://t.co/W1CuQ5SK2o"
1516071908948783106,2022-04-18 15:11:25+00:00,"For #4, We head to Romania, where the central bank approved a blockchain firm’s request to acquire a payment proces… https://t.co/2pjFilrIPZ"
1516071906469945344,2022-04-18 15:11:24+00:00,#5 The new owners of LimeWire salvaged the P2P file-sharing website and are entering the digital collectibles marke… https://t.co/fxZbb4jORJ
1516071904326606859,2022-04-18 15:11:23+00:00,"📰 Top Crypto News 📰 
03/07-03/11

📜 Biden’s executive order 
🌆 Dubai’s legal framework for crypto
🏦 The Romanian ce… https://t.co/QVpmYMRtnz"
1516071091638358023,2022-04-18 15:08:10+00:00,"With #Bitcoin below $40K and major alts in red, what is your outlook for the new week?"
1516070432826224645,2022-04-18 15:05:33+00:00,Do you want to play hero? NFTs make it possible for fans to be part of the storytelling process through collaborati… https://t.co/bZXVQQlYb3
1516065221349150728,2022-04-18 14:44:50+00:00,"In the UK, a new campaign called Women Rise aims to get 100K women into crypto by the end of 2022. The nonprofit Wo… https://t.co/mjsJuLs7Xh"
1516065014922321929,2022-04-18 14:44:01+00:00,Russian developers were banned from the open-source platform @Github after the latest wave of international sanctio… https://t.co/L772JuKjHH
1516059476733968396,2022-04-18 14:22:00+00:00,"The Association of Banks of Russia feels like controlling crypto.

So they asked lawmakers to criminalize non-custo… https://t.co/xhDDF78ib8"
1516054325977518085,2022-04-18 14:01:32+00:00,"Gold beats Bitcoin hands down this Easter as gold price approaches $2,000. https://t.co/Am9oobRmSH"
1516054037061373956,2022-04-18 14:00:24+00:00,"Are you using subsidized energy to mine crypto?

Make sure you know your local regulations. https://t.co/V5mSxtiL3d"
1516048154143215617,2022-04-18 13:37:01+00:00,Bitcoin is anything but born again this Easter as it drops below $40K. What should you look out for this week? https://t.co/exPibJ6mg2
1516043380865740805,2022-04-18 13:18:03+00:00,The DeFi world saw another week of increased on-chain and developer activity while token prices entered the second… https://t.co/cXega239EB
1516041627915104274,2022-04-18 13:11:05+00:00,Exmo crypto exchange expects a 30% revenue decrease after leaving Russia but still aims to become a unicorn in thre… https://t.co/mxpOVfm9qd
1516041619962667010,2022-04-18 13:11:03+00:00,Exchanges like Coinbase are making moves to be more transparent with sensitive information like listings. https://t.co/jADtn4qD2t
1516040602697228288,2022-04-18 13:07:01+00:00,"Can NFTs join the space race? 

American astronaut Scott Kelly recognizes that blockchain has a lot of potential an… https://t.co/MVjzy2jcmN"
1516035067084263431,2022-04-18 12:45:01+00:00,"Are we going to see more volatility today? 

As the Easter long weekend continues for the United States and much of… https://t.co/aHR9Qw4i8J"
1516030049916358665,2022-04-18 12:25:05+00:00,"According to Chris DeWolfe, the blockchain gaming business model “provides players more control and agency over the… https://t.co/I8C7DauzXk"
1516027527122329609,2022-04-18 12:15:03+00:00,What is your favorite stablecoin?
1516023738931851273,2022-04-18 12:00:00+00:00,"Terra UST is now the third-largest stablecoin. 

UST is a USD-pegged stablecoin that was launched in September 2020… https://t.co/jO4ixd1VHk"
1516017953040478213,2022-04-18 11:37:00+00:00,South Korean automobile manufacturer Hyundai has partnered with the Meta Kongz NFT project to create a limited coll… https://t.co/mxQbYkXCWS
1516012174837108740,2022-04-18 11:14:03+00:00,Github has suspended over a dozen accounts of Russian developers associated with organizations sanctioned by the U.… https://t.co/GEOnFKoKqn
1516010404551483392,2022-04-18 11:07:01+00:00,Credit-based stablecoin protocol Beanstalk Farms lost all of its $182 million collateral from a security breach cau… https://t.co/jrJFmqamYL
1516008776347791366,2022-04-18 11:00:33+00:00,Those in Iran using subsidized energy to mine crypto can now face jail time. https://t.co/z4pWl30jF2
1516006890731237379,2022-04-18 10:53:03+00:00,Russian lawmakers are considering introducing new criminal liabilities for the anonymous use of noncustodial wallet… https://t.co/N1uuq4RUTH
1516002856054267905,2022-04-18 10:37:01+00:00,"Watch out iPhone users. 

MetaMask has sent out a warning to the community regarding Apple iCloud phishing attacks,… https://t.co/y81YnPFEnE"
1515995304428027905,2022-04-18 10:07:01+00:00,"Data points to wash trading and money laundering in the nonfungible tokens ecosystem. 

What does that mean, and ho… https://t.co/ZMnRqvfwcf"
1515995293631852544,2022-04-18 10:06:58+00:00,"It's Easter Monday, and the market does not look born again. 

Bitcoin has dropped below $40,000 while Decred and S… https://t.co/9rQp3Oqbyw"
1515989770735919107,2022-04-18 09:45:01+00:00,CT vibe check: How do you feel about the crypto market?
1515986001692438535,2022-04-18 09:30:03+00:00,"How do exchange coins like $BNB and $FTT work? 

Hodlers of exchange coins can access reduced fees, personalized co… https://t.co/ggPBx7GSXI"
1515985991340748801,2022-04-18 09:30:00+00:00,"Cryptocurrency use continues to hit all-time highs globally, leaving little belief that a single country can regula… https://t.co/BWcYbJNKzs"
1515980207563411456,2022-04-18 09:07:01+00:00,Opera released a beta version of its Web3 browser with a built-in crypto wallet on Friday for iOS devices. https://t.co/2p4egCsdG3
1515979584801452033,2022-04-18 09:04:33+00:00,The veteran astronaut recently released an NFT collection with all the proceeds going to Ukrainian aid efforts. https://t.co/zJ6F543jah
1515977446041870347,2022-04-18 08:56:03+00:00,"If you are waiting for a sign to send your #Bitcoin, here it is: BTC transaction fees are at their lowest since Jul… https://t.co/YBgq00juKn"
1515976429825146881,2022-04-18 08:52:01+00:00,"Your reputation in #Web3 is important.

An ambitious new decentralized autonomous organization has built a data ser… https://t.co/l72UZX5okX"
1515968390728282113,2022-04-18 08:20:04+00:00,Bitcoin is anything but born again this Easter. What should you look out for this week? https://t.co/hKKV95PY3W
1515952021538549766,2022-04-18 07:15:01+00:00,"Web3 is not a boy's club.

By breaking the exclusivity narrative, and making women feel included, the future of Web… https://t.co/Twt3xGdXLW"
1515933173481357319,2022-04-18 06:00:07+00:00,"How can you bridge assets from any blockchain to the BNB chain using Binance Bridge 2.0?

Here is a guide that migh… https://t.co/mjXGURQjPx"
1515925616712986624,2022-04-18 05:30:06+00:00,"Banks? Where we're going, we don't need banks!

Back in the day, sending money to support your family would be a ha… https://t.co/6V9aOlScd8"
1515922839073095685,2022-04-18 05:19:03+00:00,Automobile giant Hyundai is creating a limited collection of NFTs in collaboration with Meta Kongz whilst hinting a… https://t.co/yed2ydbRYn
1515921074810081280,2022-04-18 05:12:03+00:00,"UST’s market cap has surged 15% over the past 30 days to sit at roughly $17.5 billion, placing it just ahead of BUS… https://t.co/jFU0HUtAkn"
1515918043569926147,2022-04-18 05:00:00+00:00,"Great news from AMC Theaters.

Its mobile app will now accept crypto payments on iOS and Android devices, as announ… https://t.co/JEBk7TzYy6"
1515910743756996611,2022-04-18 04:31:00+00:00,"Crypto bros exist but are less than 20% of the market, so who are the other 80+%?

Anyone with a smartphone can use… https://t.co/XLuhJ0DxAR"
1515903087931965441,2022-04-18 04:00:34+00:00,"What should you watch out for when entering the DeFi space?

Let us tell you: https://t.co/qy26rONl4A"
1515902702860963847,2022-04-18 03:59:03+00:00,"Beanstalk Farms is the latest DeFi protocol to be hit by a major exploit. In this case, the governance procedures w… https://t.co/6v4CW3imTx"
1515893772932030466,2022-04-18 03:23:34+00:00,"MetaMask has urged Apple users to check their iCloud storage settings for the wallet app, as they could be automati… https://t.co/lZts7zOBRh"
1515887885135847429,2022-04-18 03:00:10+00:00,One of the richest men in Mexico says Bitcoin has a battle to fight to become legal tender. He's willing to advocat… https://t.co/k4z9TydEdf
1515872745837449217,2022-04-18 02:00:00+00:00,Fortnite on the Metaverse! Epic Games raised $2B to fund their Metaverse plans and more in our Hodler's Digest. https://t.co/7r4rQBGJZq
1515863180337029120,2022-04-18 01:22:00+00:00,"Every currency is volatile, but being able to navigate the volatility is where the real opportunity lies.… https://t.co/8X9VKL085g"
1515857778862170114,2022-04-18 01:00:32+00:00,"Web3 is not a boy's club!

By breaking the exclusivity narrative, and making women feel included, the future of Web… https://t.co/UpLPds4yDt"
1515842547595284482,2022-04-18 00:00:00+00:00,"How can you bridge assets from any blockchain to the BNB chain using Binance Bridge 2.0?

Well, here is a guide tha… https://t.co/T4SZa3wOnh"
