id,created_at,text1510769241431052291,2022-04-04 00:00:30+00:00,"Twitter Spaces 🔊 Announcing @BlockShowcom DAO (powered by Cointelegraph) along with exclusive NFTdrop details. 

Tu… https://t.co/NyKKi9D2lj"
1510758003846397954,2022-04-03 23:15:51+00:00,"Cointelegraph made it to the red carpet at the #Grammys!

@Rachelwolf00 and @BY_DeFi are excited to talk #NFTs with… https://t.co/vVmHtaKwvA"
1510755798837723138,2022-04-03 23:07:05+00:00,Blockchain technology has come a long way since its introduction in the form of Bitcoin. Let’s take a look at how i… https://t.co/5iWG9uXnsP
1510755778822651908,2022-04-03 23:07:00+00:00,"If augmented reality is not just for gaming, what is it, and how does it work?

Well, let us tell you: https://t.co/Z1rz0kOnUt"
1510739067931185155,2022-04-03 22:00:36+00:00,"Crypto is the next big thing in Indonesia.

While tech leaders are welcoming cryptocurrency with open arms, the reg… https://t.co/8kuyPGY93n"
1510726595840933888,2022-04-03 21:11:03+00:00,"A slew of Indonesian celebrities have jumped onto the blockchain bandwagon, including NFT projects. https://t.co/NkgLUZ1rVd"
1510723816644874254,2022-04-03 21:00:00+00:00,"Confused about what Web3 domains are and how they differ from standard DNS?

Don't worry, we've got you covered: https://t.co/YyHhTSZ7uv"
1510717538694426626,2022-04-03 20:35:03+00:00,"Bitcoin price might be rangebound, but @noshitcoins says pro traders capitalize on sideways markets by using this n… https://t.co/dmDT9fNSgZ"
1510716269376512003,2022-04-03 20:30:01+00:00,"From having a Ph.D. in chemistry to founding @YoubiCapital

Check out what @ChenLLII's wish is for the young, ambit… https://t.co/YzJUHVi1JL"
1510708716743675913,2022-04-03 20:00:00+00:00,"Can science be decentralized?

Blockchain technology can democratize access to scientific collaborations, making it… https://t.co/h2VqFdir6V"
1510703687437537282,2022-04-03 19:40:01+00:00,"Twitter Spaces 🔊 Announcing @BlockShowcom DAO (powered by Cointelegraph) along with exclusive NFTdrop details. 

🗓T… https://t.co/Txtd8CLSZ2"
1510693714464804865,2022-04-03 19:00:23+00:00,"Uh-Oh!

After users warned Trezor of ongoing phishing attacks, the crypto hardware wallet provider started investig… https://t.co/Z210cPEENr"
1510686961610080256,2022-04-03 18:33:33+00:00,"Traders expect Bitcoin to have a go at $50,000 this week, a move which could pave the way for $VET, $RUNE, THETA an… https://t.co/POe49ITutm"
1510678650563317761,2022-04-03 18:00:32+00:00,"If the Australian government wants to regulate DAOs, some changes are needed, and a few laws need to be passed. https://t.co/Hn7RLUQaHQ"
1510666065478574084,2022-04-03 17:10:31+00:00,"Watching a presidential debate sparked something in @Nicholas_Merten, which led him to start DataDash, one of the b… https://t.co/u4QrUvl4Uz"
1510663511399145479,2022-04-03 17:00:22+00:00,The status-quo that places fiat currencies at the center of finance can become much more democratic with the emerge… https://t.co/p5VPadCPj9
1510655903179157508,2022-04-03 16:30:08+00:00,"Sundays are chill days, but not for Bitcoin, as it might be heading towards the best weekly close of the year. https://t.co/KWC8Cwn9BH"
1510646910809477126,2022-04-03 15:54:24+00:00,"RT @CointelegraphZN: From having a Ph.D. in chemistry to founding @YoubiCapital

Check out what @ChenLLII's wish  is for the young, ambitio…"
1510633341636251656,2022-04-03 15:00:29+00:00,"DAOs are much more than just a Utopian experiment, and they are proving that by tackling pressing issues such as cl… https://t.co/oauw0SQooD"
1510619020365508610,2022-04-03 14:03:35+00:00,Bitcoin hovers near record weekly close for 2022 but the BTC chart gives bulls zero certainties. https://t.co/bhA7EUDJ4o
1510619012761206785,2022-04-03 14:03:33+00:00,It’s hard to ignore the growing number of crypto influencers with an .eth at the end of their names. Learn what the… https://t.co/2zpuQUcVzm
1510618265260863493,2022-04-03 14:00:35+00:00,"For many years, gold was the asset everyone turned to hedge against inflation. But it appears it's now Bitcoin's ti… https://t.co/2xnlBS2psw"
1510603138180562953,2022-04-03 13:00:28+00:00,"As the Polkadot ecosystem gains momentum thanks to the first chains integrated with Ethereum, projects like ASTAR e… https://t.co/cmVuqhghA0"
1510587921354694658,2022-04-03 12:00:00+00:00,Last week witnessed the top 100 DeFi tokens hit significant highs and the major crypto hack in history to AxieInfin… https://t.co/WDHtPefTHd
1510587412891774978,2022-04-03 11:57:59+00:00,"RT @animalconcerts: 📢 Announcement 📢

A new hit song by @SnoopDogg &amp; @BillyRayCyrus, A Hard Working Man, is about to dominate the charts! 🎶…"
1510576105383624706,2022-04-03 11:13:03+00:00,"Blockchain's vast potential even touches the world of scientific research, where it utilizes transparency and effic… https://t.co/e7XwN39E75"
1510572962503659522,2022-04-03 11:00:34+00:00,"Ah man, another BTC ETF denied. 

This time, it's 21Shares left going back to the drawing board. https://t.co/uTnPvixFWJ"
1510565409749037058,2022-04-03 10:30:33+00:00,Many users have reported an ongoing phishing campaign against #Trezor users. Investors are advised to be on the loo… https://t.co/9IZPGJThdo
1510557749205164035,2022-04-03 10:00:06+00:00,"Crypto is the next big thing in Indonesia.

While tech leaders are welcoming cryptocurrency with open arms, the reg… https://t.co/FBRNYEUO5p"
1510542737971589132,2022-04-03 09:00:27+00:00,"If augmented reality is not just for gaming, what is it, and how does it work?

Well, let us tell explain: https://t.co/Z1rz0kOnUt"
1510527653534736388,2022-04-03 08:00:31+00:00,"Whether it's centralized or decentralized, streaming is here to stay. 

However, the good news for NFT artists is t… https://t.co/40wETBv4Jk"
1510516203491627010,2022-04-03 07:15:01+00:00,"Days after former CEO @MagicalTux shared plans to compensate creditors, a staggering 6,800 BTC was transferred to a… https://t.co/YVwWeUGY9B"
1510497326321831936,2022-04-03 06:00:00+00:00,"Carpe Diem!

Bitcoin could be heading towards $50,000 next week, and the bulls are enjoying life. https://t.co/fK2eKN7uzy"
1510487526225502217,2022-04-03 05:21:04+00:00,"Lawmakers are making progress on DAO regulations, but what will they look like? In this three-part series, blockcha… https://t.co/DWdrJ2P3DK"
1510482320628895745,2022-04-03 05:00:23+00:00,"Another all-time high for BTC!

However, this time, it's not the price. After the 19th millionth Bitcoin was mined… https://t.co/DYrT9r908c"
1510467189450723332,2022-04-03 04:00:15+00:00,"Did you know that the sanctions imposed on Russia also extend to crypto?

Take a deeper dive into these sanctions w… https://t.co/ZXUBRvQ47X"
1510452048210403337,2022-04-03 03:00:05+00:00,"DAOs are much more than just a Utopian experiment, and they are proving that by tackling pressing issues such as cl… https://t.co/jo9nOmba4o"
1510440713783164932,2022-04-03 02:15:03+00:00,How will civic engagement look in the world of Web3? @Xcelerator co-founder Luke Kim suggests a society built on li… https://t.co/eZ1qMhbnk5
1510436928700788737,2022-04-03 02:00:01+00:00,"Crypto is the next big thing in Indonesia.

While tech leaders are welcoming cryptocurrency with open arms, the reg… https://t.co/r4o4rNEvmv"
1510421847627739138,2022-04-03 01:00:05+00:00,"As @BillyRayCyrus said, “don’t think inside the box or outside the box, think there is no box."" 

We took it seriou… https://t.co/5fGaUIFX0H"
1510406752067633160,2022-04-03 00:00:06+00:00,"Daring and sharp minds have identified an opportunity in the Metaverse to make a profit from it. 

But in such an e… https://t.co/aujxaGXxKO"
1510399196729417729,2022-04-02 23:30:05+00:00,"If you pay, you must say.

The new US law on crypto will force companies to notify any ransomware within 24 hours a… https://t.co/qN186hyNOk"
1510392016605093888,2022-04-02 23:01:33+00:00,Inflation is nearing levels that haven’t been seen in years. How does Bitcoin stand up against other assets as a to… https://t.co/oMpAJmMTU3
1510378293240999945,2022-04-02 22:07:01+00:00,"No one likes taxes, but this isn't so horrible. Indonesia is instituting a 0.1% crypto tax that begins this month. https://t.co/wfZApaFfZo"
1510369011594313730,2022-04-02 21:30:08+00:00,"If this was an F1 race, who would be the winner at the end?

Data from: @BTCtreasuries https://t.co/l7FaBLgV2V"
1510361576297091072,2022-04-02 21:00:35+00:00,"If augmented reality is not just for gaming, what is it, and how does it work?

Well, let us tell you: https://t.co/Z1rz0kOnUt"
1510346491055034377,2022-04-02 20:00:39+00:00,"Streaming is here to stay, whether it's centralized or decentralized.

However, the good news for NFT artists is th… https://t.co/zJ9VZHXJQF"
1510331358446600199,2022-04-02 19:00:31+00:00,"After former CEO Mark Karpeles shared his plans to compensate creditors, Mt. Gox transferred a staggering 6,800 BTC… https://t.co/oW2uQd2ebb"
1510319917718986762,2022-04-02 18:15:03+00:00,"As @BillyRayCyrus said, “don’t think inside the box or outside the box, think there is no box."" 

We took it seriou… https://t.co/ggDgvtW0sH"
1510316199950880773,2022-04-02 18:00:17+00:00,"The Bulls are loving life right now as Bitcoin could be heading towards $50,000 next week. https://t.co/fK2eKN7uzy"
1510310050962755592,2022-04-02 17:35:51+00:00,"To end the night, a little NFT party.

After all, a little NFT party never hurt nobody. https://t.co/TjuxOWe8vG"
1510309533431836680,2022-04-02 17:33:47+00:00,"NFT LA was full of surprises!

Here, @therealmix talks about the beauty of NFTs as he unveils his new project… Bit… https://t.co/qEMFK7IoIa"
1510306414731927556,2022-04-02 17:21:24+00:00,"We didn’t just make one panel!

Our very own @Ana_dwsn also moderated a panel titled “Trends in Play-to-Earn-Gaming… https://t.co/8e5N4GuSth"
1510305899344183301,2022-04-02 17:19:21+00:00,"Our very own @Rachelwolf00 was a moderator on a panel titled “The future of fashion commerce, NFTs and beyond. https://t.co/OSGP126cyA"
1510305557923737600,2022-04-02 17:17:59+00:00,"🧵#NFTLA was eventful and saw many interesting discussions.

Here are some of them:"
1510301297429393411,2022-04-02 17:01:04+00:00,"Another all-time high for BTC!

However, this time, it's not the price but rather the Bitcoin network difficulty re… https://t.co/FNKTONUj0P"
1510286157447417859,2022-04-02 16:00:54+00:00,"Someone created a Will Smith Slap DAO. I guess you can say it rocks 👀

Jokes aside, Metamask iOS users can now buy… https://t.co/UnA8Rw61nA"
1510278431887532037,2022-04-02 15:30:12+00:00,"Is something big happening in April?

The spring might be Solana's favorite season as it puts on its floral shirt a… https://t.co/BCULl4NyrU"
1510272854817841152,2022-04-02 15:08:02+00:00,"Local tech leaders in Indonesia are embracing crypto with open arms, and regulators are racing to catch up. https://t.co/DQ0zxUbJPg"
1510270833490542593,2022-04-02 15:00:00+00:00,"Did you know that the sanctions imposed on Russia also extend to crypto?

Take a deeper dive into these sanctions f… https://t.co/fJtp7eQZOH"
1510256876109254660,2022-04-02 14:04:33+00:00,"While the virtual reality aspects of the Metaverse are much more glamorous, augmented reality and its ability to en… https://t.co/jl8vOMYsJe"
1510255970584350722,2022-04-02 14:00:57+00:00,Are DAOs misunderstood? DAOs are not just a Utopian experiment. They are an integral tool in developing DeFi. https://t.co/LGWXBN0YI5
1510243679235047441,2022-04-02 13:12:06+00:00,"As the scope of NFTs and Web3 expands, musicians stand to benefit by gaining control of their content. https://t.co/8Fh5l5hvGl"
1510243671446237187,2022-04-02 13:12:04+00:00,"SOL is technically overbought, but that didn't stop the Solana bulls last time. https://t.co/Pq6uRaySOT"
1510240634505945090,2022-04-02 13:00:00+00:00,"Bitcoin mining company PrimeBlock recently announced it will merge with 10X Capital Venture.

The company expects t… https://t.co/NZfulZuRy5"
1510210446296449024,2022-04-02 11:00:03+00:00,"It's alive! Mt. Gox just transferred 6,800 #BTC to an unknown wallet days after former CEO @MagicalTux shared plans… https://t.co/0bHJKJVesC"
1510203780188442628,2022-04-02 10:33:34+00:00,"Bitcoin passes a ""crucial"" support test with $50,000 now on the menu next week. https://t.co/GfdgGgOpAz"
1510195484358590466,2022-04-02 10:00:36+00:00,"As the Polkadot ecosystem gains momentum thanks to the first chains integrated with Ethereum, projects like ASTAR e… https://t.co/xaIxhgYMjW"
1510165181170601988,2022-04-02 08:00:11+00:00,"Daring and sharp minds have identified a chance in the Metaverse to make a profit from it. 

But in such an embryon… https://t.co/PSY6aQua7p"
1510142518771556354,2022-04-02 06:30:08+00:00,"Last week witnessed most of the top 100 DeFi tokens hit significant highs and the major crypto hack in history, amo… https://t.co/JdIN3wwLXP"
1510138476544548864,2022-04-02 06:14:04+00:00,#Bitcoin records a new network difficulty ATH of 28.587 trillion. https://t.co/QrklJoLGrc
1510125143896440833,2022-04-02 05:21:05+00:00,"Despite lazy claims to the contrary, crypto has proven not to be be a loophole for Russian sanctions. International… https://t.co/t1Kg7PXaOu"
1510116066982338561,2022-04-02 04:45:01+00:00,"Ah man, another BTC ETF gets denied. 

This time, it's 21Shares going back to the drawing board. https://t.co/uTnPvixFWJ"
1510108517927112706,2022-04-02 04:15:01+00:00,"Gold on the blockchain, a @MicroStrategy subsidiary buying more Bitcoin, and Terra scooping up $139M worth of BTC,… https://t.co/dEJYVwXWEc"
1510100966166642689,2022-04-02 03:45:01+00:00,"Bitcoin mining company PrimeBlock recently announced it will merge with 10X Capital Venture.

The company expects $… https://t.co/rU5hIticN4"
1510093414850875394,2022-04-02 03:15:00+00:00,"No one likes taxes, but this isn't so horrible. Indonesia is instituting a 0.1% crypto tax that begins this month. https://t.co/wfZApaFfZo"
1510089720692367368,2022-04-02 03:00:20+00:00,"Sharp and daring minds have identified an opportunity in the Metaverse to make a profit from it. 

But in such an e… https://t.co/xMHDZjQSys"
1510085865065922562,2022-04-02 02:45:00+00:00,"Crypto mining corporation @RiotBlockchain will sell $500 million worth of stock to face some expenses.

The RIOT st… https://t.co/RvQTsUB7x5"
1510082089370193922,2022-04-02 02:30:00+00:00,As well known crypto skeptic Sen. Elizabeth Warren puts forward a bill related to Russian actors’ potential use of… https://t.co/1M2kFsHoDb
1510078321505103877,2022-04-02 02:15:02+00:00,It appears that DAOs have found themselves in the crosshairs of mainstream media. While publications are right to r… https://t.co/bSh51HZr1g
1510078318338576384,2022-04-02 02:15:01+00:00,"If @GalaxyDigitalHQ fails to acquire @BitGo before the end of 2022, they risk paying a termination fee worth $100M. https://t.co/kEZ8QJQpO2"
1510070766624198657,2022-04-02 01:45:01+00:00,Netflix’s new crypto documentary titled Trust No One: The Hunt for the Crypto King has made quite the splash since… https://t.co/GhQd5tvhT1
1510064980284088327,2022-04-02 01:22:01+00:00,"Last week witnessed the top 100 DeFi tokens hit significant highs and the major crypto hack in history, among other… https://t.co/uCgDibOi5b"
1510061201631367176,2022-04-02 01:07:00+00:00,"As the Polkadot ecosystem gains momentum thanks to the first chains integrated with Ethereum, projects like ASTAR e… https://t.co/UwUBauMlSL"
1510055668484657155,2022-04-02 00:45:01+00:00,Woah! American investment firm VanEck believes that #Bitcoin will hit $4.8 million per coin. Can BTC become the glo… https://t.co/IumELj85nw
1510051928159526914,2022-04-02 00:30:09+00:00,"Since FTX acquired Storybook Brawl developers Good Luck Games, the game has received 600 negative reviews from cryp… https://t.co/FEViB6nd3U"
1510048118833913860,2022-04-02 00:15:01+00:00,"The 19th million #Bitcoin was just mined! 🥂

This means there are only 2 million BTC left to come up before we reac… https://t.co/r8IqNr6XGm"
1510044472352120838,2022-04-02 00:00:32+00:00,"Case dismissed. 

A federal judge dismisses a class action complaint asserting @binance violated U.S. securities la… https://t.co/Aszqd9uRe9"
1510040567438319618,2022-04-01 23:45:01+00:00,"Regulation, innovation, and the digital yuan became the three axes in the discussion after George Mason University’… https://t.co/6brpVvsVef"
1510036791704829957,2022-04-01 23:30:00+00:00,"Let's turn that AVAX frown upside down. 

Despite dropping in smart contract use, traders are optimistic that Avala… https://t.co/7ZZtctLduN"
1510033017670090760,2022-04-01 23:15:01+00:00,"Bitcoin mining company PrimeBlock recently announced it will merge with 10X Capital Venture.

The company expects t… https://t.co/2crRaEMhzt"
1510029240347115524,2022-04-01 23:00:00+00:00,"Number go up. 

Terraform Labs CEO @stablekwon has conceded that a crash in the price of Bitcoin would be “negative… https://t.co/2jDJY4oYBB"
1510025468405334018,2022-04-01 22:45:01+00:00,"The crypto field is mostly green and now that #Bitcoin seems consolidated at $46K, the bulls have a chance to push… https://t.co/6chQmmcWrc"
1510022961226428417,2022-04-01 22:35:03+00:00,"$AVAX broke its long-term downtrend and looks positioned to hit new highs, but @noshitcoins says a decline in Avala… https://t.co/yyxooPllji"
1510021701920296969,2022-04-01 22:30:03+00:00,"ApeCoin holders might have experienced goosebumps after its 70% fall in the last two weeks, but the drop might not… https://t.co/ZRAwmbC6Kb"
1510019681326977029,2022-04-01 22:22:01+00:00,"Ah man, another BTC ETF denied. 

This time, it's 21Shares left going back to the drawing board. https://t.co/uTnPvixFWJ"
1510017917957689344,2022-04-01 22:15:01+00:00,"If you pay, you must say.

The new US law on crypto will force companies to report any ransomware within 24 hours a… https://t.co/Bs3pXr42Xt"
1510015903315943426,2022-04-01 22:07:00+00:00,"BTC has held the $46K support level, but traders are waiting for $48K to pop the champagne. 

Here's to hoping for… https://t.co/l2mM1Vm75h"
1510014303004512274,2022-04-01 22:00:39+00:00,"Fearless minds have identified an opportunity in the Metaverse to make a profit from it. 

But in such an embryonic… https://t.co/qoywcozoFL"
1510010370957750282,2022-04-01 21:45:01+00:00,"From India to Uruguay, the Metaverse offers a wide array of opportunities for global talent. 

What countries will… https://t.co/AL3VaN2h8m"
1510008418370732038,2022-04-01 21:37:16+00:00,"After a long day of coverage, we really enjoyed @pauloakenfold's set at #NFTLA. 

For those who went, what was your… https://t.co/DfgDnX2PbM"
1510006654426877952,2022-04-01 21:30:15+00:00,As the well known crypto skeptic Sen. Elizabeth Warren puts forth a bill related to Russian actors’ potential use o… https://t.co/s7atcMRLo0
1510004580393889792,2022-04-01 21:22:01+00:00,"Gold on the blockchain, a new @MicroStrategy subsidiary buying Bitcoin, and Terra scooping up $139M worth of BTC, t… https://t.co/3nKrnhQVuK"
1510002818224201730,2022-04-01 21:15:01+00:00,"If @GalaxyDigitalHQ fail to acquire @BitGo before the end of 2022, it risks paying a termination fee worth $100M. https://t.co/kEZ8QJQpO2"
1509999818638180353,2022-04-01 21:03:05+00:00,"ARK 21Shares, WisdomTree, SkyBridge, NYDIG, Global X, Fidelity's Wise Origin... all proposed crypto ETF products re… https://t.co/GDOLE5UpgM"
1509999809448488960,2022-04-01 21:03:03+00:00,"Bitcoin swiftly reclaimed the $46,000 level, but traders caution that macroeconomic and geopolitical challenges cou… https://t.co/5lpS7WPcmh"
1509999068180844544,2022-04-01 21:00:06+00:00,After an EU Parliament committee voted in favor of a regulatory package for tighter Know Your Customer and Anti-Mon… https://t.co/uoni9cZP6u
1509997811282161668,2022-04-01 20:55:07+00:00,"In his decision on Thursday, judge Andrew Carter said that as the investors waited more than a year after purchasin… https://t.co/9kiRPAVICd"
1509995271484289026,2022-04-01 20:45:01+00:00,Netflix’s new crypto documentary Trust No One: The Hunt for the Crypto King has made a major splash since it was re… https://t.co/r7rxQwbrwW
1509993831621615622,2022-04-01 20:39:18+00:00,"RT @animalconcerts: A new hit song by @SnoopDogg &amp; @BillyRayCyrus, A Hard Working Man, is about to dominate the charts! 🎵

The best part? W…"
1509993255768928260,2022-04-01 20:37:01+00:00,Daring and sharp minds have identified an opportunity in the Metaverse to make a profit from it. But in such an emb… https://t.co/VyBnkWdqjd
1509992516531023872,2022-04-01 20:34:04+00:00,The exploiter behind the Ronin bridge attack not only drained millions of dollars worth of ETH but also went to sho… https://t.co/5JzrQIqqH0
1509991493578203148,2022-04-01 20:30:01+00:00,"Better together? 

A top official from the Bank of Japan tells G7 nations that a common framework for regulating di… https://t.co/xkN7rNojI8"
1509989483835535367,2022-04-01 20:22:01+00:00,"The 19th million #Bitcoin was just mined! 🥂

This means there are only 2 million BTC left to come up before we hit… https://t.co/d92kageD4e"
1509985707493842951,2022-04-01 20:07:01+00:00,"No one likes taxes, but this isn't so horrible. 

Indonesia is instituting a 0.1% crypto tax that begins this month. https://t.co/wfZApaFfZo"
1509985464677134338,2022-04-01 20:06:03+00:00,"For all the talk of #Bitcoin being digital gold, the traditional bullion industry is looking to blockchain to solve… https://t.co/jO3G9QAPPj"
1509983825580888067,2022-04-01 19:59:32+00:00,Astar quickly became the top #Polkadot-based network by TVL after investors flooded into $ASTR in anticipation of t… https://t.co/0kBTa5NYtI
1509980170576441347,2022-04-01 19:45:01+00:00,"Regulation, innovation, and the digital yuan came up as the three axes in the discussion after George Mason Univers… https://t.co/0OwQbSOMPF"
1509976489562972160,2022-04-01 19:30:23+00:00,"Since FTX acquired Storybook Brawl developers Good Luck Games, the game was bombarded by 600 negative reviews from… https://t.co/jTzuhw0VLc"
1509973638174314496,2022-04-01 19:19:03+00:00,The firm shared its goal of achieving net-zero carbon emissions by 2050. (Reporting via @Bio_Chameleon) https://t.co/fRYKRBnUwD
1509972619596120068,2022-04-01 19:15:01+00:00,"If you pay, you must say.

The new US law on crypto will force companies to notify any ransomware within 24 hours a… https://t.co/ul6pK6f03L"
1509969128291024904,2022-04-01 19:01:08+00:00,"Case dismissed. 

A federal judge dismisses a class action complaint asserting that @binance violated U.S. securiti… https://t.co/VuapoaIVsD"
1509965080783462403,2022-04-01 18:45:03+00:00,"On Thursday, U.S. companies that safeguard their clients’ crypto-assets received new accounting guidance.

Crypto M… https://t.co/oKfzH7yOaj"
1509964698631884805,2022-04-01 18:43:32+00:00,"Bulls bought the dips at underlying support levels, bringing Bitcoin and select altcoins back to the highs achieved… https://t.co/MeIeHHdsHN"
1509962318003679234,2022-04-01 18:34:05+00:00,Indonesia will reportedly be able to impose income and value-added taxes on crypto assets 'because they are a commo… https://t.co/QXSi8CQLuw
1509961350105161735,2022-04-01 18:30:14+00:00,Digital asset sporting project @Chiliz has announced the launch of the Scoville testnet for the newly established l… https://t.co/p6vXSiIbB7
1509957521750081551,2022-04-01 18:15:01+00:00,Woah! American investment firm VanEck believes that Bitcoin will hit $4.8 million per coin. Can #BTC become the glo… https://t.co/wMmo9ZufJf
1509955012125868033,2022-04-01 18:05:03+00:00,The Bitcoin mining company will have a market cap of close to $3 billion after the offer completes. (Reporting via… https://t.co/483p5UhEFU
1509953901079973894,2022-04-01 18:00:38+00:00,"Number go up. 

Terraform Labs CEO @stablekwon concedes that a crash in the price of Bitcoin would be “negative” fo… https://t.co/bGiXVAK0qD"
1509949969607897096,2022-04-01 17:45:00+00:00,"ApeCoin holders might have experienced goosebumps after its 70% drop in the last two weeks, but the fall might not… https://t.co/DS60l952eS"
1509946319774887938,2022-04-01 17:30:30+00:00,"As @BillyRayCyrus said, “don’t think inside the box or outside the box, think there is no box”. 

We took it seriou… https://t.co/mWGTZkYdfl"
1509942692796514306,2022-04-01 17:16:05+00:00,"A big day for Bitcoin! 19 million down, just 2 million BItcoin to go. https://t.co/hZTV5oqUzn"
1509942419923644421,2022-04-01 17:15:00+00:00,"From India to Uruguay, the Metaverse opens up a wide array of opportunities for global talent. 

What countries wil… https://t.co/14kuih2lWf"
1509938921077104647,2022-04-01 17:01:06+00:00,"Is it time for Bitcoin bonds? 

@MicroStrategy CEO @saylor believes that the traditional financial market “is not q… https://t.co/aGhw9ZreqJ"
1509934898978738187,2022-04-01 16:45:07+00:00,"Daring and sharp minds have identified an opportunity in the Metaverse to make a profit from it. 

But in such an e… https://t.co/SeDvlASfgM"
1509931121261305864,2022-04-01 16:30:07+00:00,As well known crypto skeptic Sen. Elizabeth Warren puts forth a bill related to Russian actors’ potential use of di… https://t.co/CX76xgGDfK
