id,created_at,text1582061461630636034,2022-10-17 17:30:20+00:00,"Called “Crypto Source,” the program is designed to allow users to buy, hold and sell cryptocurrencies, complemented… https://t.co/Nz7uroyui0"
1582058879718162433,2022-10-17 17:20:04+00:00,Bitcoin’s tight range-bound trading and investors' expectation of a spike in volatility could create an upside brea… https://t.co/5PYpcRSxme
1582057603047206912,2022-10-17 17:15:00+00:00,"As Ripple gains confidence in its legal battle against the SEC, XRP hodlers are feeling unstoppable. 

They might b… https://t.co/FDCQhPQ0ev"
1582053828299739137,2022-10-17 17:00:00+00:00,"Where we’re going we don’t need fiat. 

@adam3us, the co-founder of Blockstream, challenged Cointelegraph’s… https://t.co/3zUsIg2nZc"
1582051839796994049,2022-10-17 16:52:06+00:00,Gemini said its new board of directors aims to bring local leadership to its European operations. https://t.co/AgffrvC8Gb
1582050052616622085,2022-10-17 16:45:00+00:00,"The market is down, but a fan token powerhouse is feeling bullish. 

Blockchain company @Chiliz, creator of Socios,… https://t.co/OaStgbJIuX"
1582046375285358600,2022-10-17 16:30:23+00:00,"Let's talk #DAOs! 📣🙌
 
We'll be discussing insights from the new #DAO report by @CointelegraphCS available at… https://t.co/5gBfVYckNY"
1582046349922807811,2022-10-17 16:30:17+00:00,Australian authorities temporarily halt three crypto funds because their target market determinations were “too bro… https://t.co/6sQHawc4aM
1582042521244700672,2022-10-17 16:15:04+00:00,How is your DeFi portfolio looking this week? https://t.co/T9ZXMCANo5
1582040490404630530,2022-10-17 16:07:00+00:00,"Are you a struggling crypto miner? @binance is here to help. 

Binance Pool, a mining subsidiary of the exchange, h… https://t.co/GBPheERErM"
1582040258610597890,2022-10-17 16:06:05+00:00,"The place offers education on Lightning Network, Bitcoin workshops for kids and other types of Bitcoin-related even… https://t.co/Guu3mmm6Iv"
1582038862435536897,2022-10-17 16:00:32+00:00,"Another week, another week of The Market Report hosts @BY_DeFi @noshitcoins &amp; @forgeforth_ yelling at you through a… https://t.co/tUAmpT9Klj"
1582034970666598400,2022-10-17 15:45:04+00:00,"A big start for @binance. 

The crypto exchange announced it will launch its first index product, the Top 10 Equal-… https://t.co/lsuxMwm5qO"
1582032940749705216,2022-10-17 15:37:00+00:00,"The EU announced crypto-related sanctions for Russia. 

What happens now with users and exchanges? https://t.co/YZ0JbAhpjc"
1582031197072654341,2022-10-17 15:30:04+00:00,"No more plastic ID cards in South Korea.

The country expects nearly 45 million citizens to embrace blockchain-base… https://t.co/K8Yd9RhjCf"
1582027424987955201,2022-10-17 15:15:05+00:00,"Devs are loving the DOT. 

Polkadot recognized more than 500 contributions every day in September — an all-time hig… https://t.co/mMfP4rspLE"
1582026305515581441,2022-10-17 15:10:38+00:00,When a normie tells you Bitcoin is going to $0: https://t.co/XmE0CnKP9e
1582023854268243975,2022-10-17 15:00:54+00:00,How is the future looking for blockchain gaming? https://t.co/MzwPWIsS7B
1582019601910464513,2022-10-17 14:44:00+00:00,"Users have mixed reactions to the VR set, with some gawking at the price yet praising the technology, while others… https://t.co/aT1Piurt0y"
1582018482321125376,2022-10-17 14:39:33+00:00,"Grim manufacturing data from the U.S. sees risk assets inch higher, with BTC on the way to $20,000. https://t.co/JX64OYfrHB"
1582016819363139585,2022-10-17 14:32:56+00:00,"RT @CointelegraphZN: Where were you when Terra crashed? 

@sunnya97 the co-founder of @osmosiszone, relives the dark days that the protocol…"
1582016299416563714,2022-10-17 14:30:52+00:00,What crypto are you watching this week?
1582016173289648128,2022-10-17 14:30:22+00:00,"Q. What does the future look like for decentralized autonomous organizations? 🤔
 
Mark Mason, Head of Business Deve… https://t.co/flf6nNGkiz"
1582014710802944000,2022-10-17 14:24:34+00:00,Bitcoin could crash to as low as $12K after the U.S. midterm elections despite favorable on-chain metrics. https://t.co/QHrGaxmmnd
1582012308716285952,2022-10-17 14:15:01+00:00,"When it comes to crypto economies, who comes out on top? 

The answer may surprise you. 

(Reporting via… https://t.co/Eez8TN5u6B"
1582010679602864129,2022-10-17 14:08:33+00:00,"Decentralized exchanges have proven to be a good alternative for those who believe in ""not your keys, not your coin… https://t.co/kXYm7nbpLQ"
1582008528775966720,2022-10-17 14:00:00+00:00,P2E vs. M2E Games. Which one do you prefer? https://t.co/bao2REW8rd
1582004754104070145,2022-10-17 13:45:00+00:00,"Commemorate some of the industry’s biggest moments with our Historical NFT collection, in which every Cointelegraph… https://t.co/fgd5bkpfQT"
1582001122977656834,2022-10-17 13:30:34+00:00,Payment mogul Mastercard is preparing to launch a crypto trading platform for banks as the firm is confident that t… https://t.co/i8upeCqfpY
1582000989758185474,2022-10-17 13:30:02+00:00,"Magic, scam, or none of both?
Most of what you heard about automated crypto trading is probably not accurate. https://t.co/7tAfnnP2Gy"
1581999663947083776,2022-10-17 13:24:46+00:00,🥁 And at #1... Binance launches a $500M lending project to support crypto miners. https://t.co/8QayCEDGC4
1581998350341050370,2022-10-17 13:19:33+00:00,"Sam Bankman-Fried is back in the news at #2.

The founder and CEO of cryptocurrency exchange FTX has backed the ide… https://t.co/OO0QboJMWf"
1581997135339622406,2022-10-17 13:14:43+00:00,"Japan isn't happy with North Korea at #3, as it blames North Korea's Lazarus for years of crypto hacks. https://t.co/99r5WVlaQ0"
1581996059659997189,2022-10-17 13:10:27+00:00,There's a new NFT king at #4 after Academy Award winner Anthony Hopkins sells out his nonfungible token collection… https://t.co/p9Zz8F11fl
1581994762357288960,2022-10-17 13:05:18+00:00,"Our countdown begins in the United States, where #5 sees member of the U.S. Federal Reserve Board of Governors Chri… https://t.co/ohcKoAKT1a"
1581993742411517953,2022-10-17 13:01:14+00:00,"📰 Top Crypto News 📰 

🇺🇲Fed governor on a U.S. CBDC 
🤑 Anthony Hopkins' NFT collection
🕵️ North Korea’s Lazarus and… https://t.co/llS9GHG5aT"
1581992185339473923,2022-10-17 12:55:03+00:00,Proof-of-Back: The co-founder of Blockstream tells @JoeNakamoto why humanity needs Bitcoin in space. https://t.co/pAMhWfEWMQ
1581991419954487298,2022-10-17 12:52:01+00:00,"Up or down?

Bitcoin is hovering comfy around the $19K level waiting for volatility to hit while traders agree it's… https://t.co/DHdJhi4BN1"
1581987641334984704,2022-10-17 12:37:00+00:00,"Looking to use Ethereum as payment? 🤔 
Here is how! https://t.co/bao2REW8rd"
1581987389412880384,2022-10-17 12:36:00+00:00,@iamstevenmorse 🎉happy birthday!
1581987172621914112,2022-10-17 12:35:08+00:00,The latest round of EU sanctions placed on Russia will have a major impact on crypto exchanges. What should be expe… https://t.co/o1iMMKMfyd
1581985978058932224,2022-10-17 12:30:23+00:00,"Prague is a city of many firsts in crypto, as it is home to the first hardware wallet, Bitcoin mining pool, and BTC… https://t.co/Y3amodMdoO"
1581985393658187777,2022-10-17 12:28:04+00:00,"Despite making some developments in the NFT industry, Chiliz remains committed to fan tokens as the firm's primary… https://t.co/eu8tvbG0rJ"
1581983872278937602,2022-10-17 12:22:01+00:00,Doesn't it feel like the day before your birthday? https://t.co/3q7OBXNYMj
1581982375134625793,2022-10-17 12:16:04+00:00,Do you use a Web3 browser?
1581978598390779904,2022-10-17 12:01:04+00:00,Meta’s VR headset upgrades user experience as digital avatars but sparks privacy concerns over data collection. https://t.co/XYH6Rm4LTj
1581978475216240640,2022-10-17 12:00:34+00:00,From taxes and legislation to the local startups and professional associations — how is #crypto adoption going in W… https://t.co/BqLqrKjYzj
1581976963954376705,2022-10-17 11:54:34+00:00,Germany topped the list of the global crypto economy with its rewarding tax policies for long-term holders and clea… https://t.co/Th24oh8ZoH
1581976118432714752,2022-10-17 11:51:12+00:00,What are your thoughts on the Merge so far?
1581974562237206528,2022-10-17 11:45:01+00:00,KYC before staking? It might be a thing sooner than later.  https://t.co/k50knGAWbo
1581970833542905857,2022-10-17 11:30:12+00:00,Bitcoin sticks to $19K amid an unmoving market while traders are keen for action. https://t.co/GTHjr3DVF5
1581970164610129922,2022-10-17 11:27:33+00:00,BNB Chain is filled with gratitude for the swift response of the team and the community support after the cross-cha… https://t.co/RLOaO7qAzx
1581968696242671616,2022-10-17 11:21:43+00:00,How was your portfolio's weekend? Tell us in a gif. https://t.co/uZbCZI7Kmb
1581967005317730305,2022-10-17 11:15:00+00:00,"Are you a struggling crypto miner? @binance is here to help. 

Binance Pool, a mining subsidiary of the exchange, l… https://t.co/GmdDOG89BR"
1581966542241398784,2022-10-17 11:13:09+00:00,"The latest report by EUBlockchain Observatory, named “EU Blockchain Ecosystem Developments,” tries to measure the c… https://t.co/VHh1vtrkP2"
1581963314560897025,2022-10-17 11:00:20+00:00,"The mammoth task of merging Ethereum and Beacon Chain is finally complete, but what are the risks? https://t.co/QjeXK3bCL4"
1581961098680733696,2022-10-17 10:51:31+00:00,National cryptocurrency exchanges in the U.S. are regulated at the state level through a patchwork of money transmi… https://t.co/vgz1rglrkp
1581960273900212224,2022-10-17 10:48:15+00:00,@1CryptoQuest https://t.co/ICS29RM3rU
1581959458057785344,2022-10-17 10:45:00+00:00,"A big start for @binance. 

The crypto exchange announced it will launch its first index product, the Top 10 Equal-… https://t.co/xrUNyDf6KE"
1581956807307632640,2022-10-17 10:34:28+00:00,GM! How are we taking our coffee this Monday? https://t.co/6AtPhI04Il
1581956323310436352,2022-10-17 10:32:33+00:00,XRP price looks set for a 35% rally. Here's why. https://t.co/9aW0u8CjnQ
1581955723344289793,2022-10-17 10:30:10+00:00,Hiring 📈 Multiple positions currently open looking for passionate crypto natives to come work for Cointelegraph. Ta… https://t.co/2fbQCfjm9Q
1581952251878604801,2022-10-17 10:16:22+00:00,"@forgeforth_ As Cointelegraph reported, it seems like the duo wants to develop an alternative to SWIFT, the dominan… https://t.co/zbbQt8G9yC"
1581951909010677761,2022-10-17 10:15:01+00:00,"Devs are loving the DOT. 

Polkadot recognized more than 500 contributions each day in September — an all-time high… https://t.co/ZYDzqqhuq2"
1581948300718387200,2022-10-17 10:00:40+00:00,"Took a break from the markets this weekend? Well, you didn't miss much.

The major cryptocurrencies remained in fam… https://t.co/6V7SgOoQnb"
1581944357338644481,2022-10-17 09:45:00+00:00,India's finance minister said that #crypto development is on the agenda during the  G20 presidency. https://t.co/r5slTEEwgA
1581940665860046848,2022-10-17 09:30:20+00:00,"Join our Telegram channel and never miss out on breaking news again!

https://t.co/9EnmFEk37B https://t.co/DQ2oOUWs26"
1581936806760960000,2022-10-17 09:15:00+00:00,"Mexico is the second-largest recipient of remittances in the world, according to 2021 World Bank statistics. Crypto… https://t.co/d7pOXvbXYq"
1581933119997104131,2022-10-17 09:00:21+00:00,"Prior to a $160 million hack, Wintermute still has payments to make despite the repayment of TrueFi's loan. https://t.co/AgEuN589Dk"
1581924238071824385,2022-10-17 08:25:03+00:00,Are you ready? Bitcoin pundits prepare for BTC price to make a big move this month. https://t.co/kor7YhkxGA
1581919694940180483,2022-10-17 08:07:00+00:00,Cryptocurrencies and the impact they have on economic stability. https://t.co/ldUGN7Jmdl
1581914298368274437,2022-10-17 07:45:33+00:00,Binance Pool has half a billion dollars to lend to crypto miners during the bear market. https://t.co/8QayCEDGC4
1581911438691401729,2022-10-17 07:34:12+00:00,Moving funds back and forth from bank accounts to crypto wallets is a hassle. This payments ecosystem wants to simp… https://t.co/wvgMe4sNoo
1581910435548143616,2022-10-17 07:30:12+00:00,"Commemorate some of the industry’s biggest moments with our Historical NFT collection, in which every Cointelegraph… https://t.co/VO6rfTbmvo"
1581904596191965185,2022-10-17 07:07:00+00:00,SEC rejects WisdomTree’s application for a spot Bitcoin ETF… again. Keep track of what else happened this week on o… https://t.co/GLHDqj8zuN
1581902361785958400,2022-10-17 06:58:08+00:00,"Crypto exchange @binance is launching its first index product, kickstarting its Binance CoinMarketCap Index Series,… https://t.co/IcxmX4mvAt"
1581890014317006849,2022-10-17 06:09:04+00:00,"Aussie asset manager Holon has had its Bitcoin, Ethereum, and FileCoin crypto funds placed on a temporary halt by A… https://t.co/L078p5G3qt"
1581888372389597184,2022-10-17 06:02:32+00:00,The network has seen significant development activity one year after the launch of its signature parachain auctions. https://t.co/Cf4INOltIF
1581887760939462657,2022-10-17 06:00:06+00:00,"The mammoth task of merging Ethereum’s main net and Beacon Chain is finally complete, but what are the risks? https://t.co/QjeXK3sFN4"
1581886868094087168,2022-10-17 05:56:34+00:00,Tech-savvy South Koreans could be handing in their physical ID cards in lieu of a blockchain-based identification s… https://t.co/uYja1x4O4g
1581874394967646208,2022-10-17 05:07:00+00:00,"What do you know about Web3 browsers? 👀

Learn more with one click. https://t.co/r4u6Fbgv4x"
1581873275990609920,2022-10-17 05:02:33+00:00,"Magic Eden has followed in the footsteps of X2Y2, introducing optional royalties for NFT buyers, but the community… https://t.co/N2xE56jaod"
1581865098577993730,2022-10-17 04:30:03+00:00,All you need to know about blockchain and crypto in Western Europe. https://t.co/GlwX7iaUWJ
1581857534151110656,2022-10-17 04:00:00+00:00,Europe gained a competitive edge over the US with a unified licensing regime for cryptocurrency exchanges. https://t.co/KRT3MtSMno
1581842520124067840,2022-10-17 03:00:20+00:00,"How do you integrate toys in Web3?

Let NFT Steez hosts Ray Salmond and Alyssa Expósito shine some light on it with… https://t.co/YqhM7g3wuY"
1581840557042995202,2022-10-17 02:52:32+00:00,"SBF says he's all for disclosures and knowledge tests aimed at ""household retail"" derivative traders but argues cry… https://t.co/vUNcBZXw7J"
1581837432106127361,2022-10-17 02:40:07+00:00,Crypto has come a long way since the Bitcoin blockchain launched back in 2009. Commemorate some of the industry’s b… https://t.co/Pfr62syj9V
1581828479276167168,2022-10-17 02:04:33+00:00,North Korea-affiliated Lazarus Group has been officially named by the Japanese government as being behind several y… https://t.co/cSQBUlyUQG
1581827338420965378,2022-10-17 02:00:01+00:00,India confirms that #crypto development in the country is part of their agenda. https://t.co/r5slTEmn2s
1581819849616998400,2022-10-17 01:30:15+00:00,"The founder of Cardano  ( @IOHK_Charles ) did not hold back while referring to the flaws found in BTC and ETH. 

Wa… https://t.co/jJiORpDamH"
1581812262838620160,2022-10-17 01:00:06+00:00,Wintermute still owes $75 million to Maple Finance after repaying TrueFi’s loan. https://t.co/AgEuN589Dk
1581804698524594177,2022-10-17 00:30:03+00:00,"Hiring 📈 Passionate crypto natives to come work for Cointelegraph. We have multiple positions open, tag someone who… https://t.co/XC3sx5UlO2"
1581797152824913922,2022-10-17 00:00:04+00:00,A Fed says CBDCs are not the powerup to fiat that some might think it is. https://t.co/R4AZvGySFz
1581794382709424133,2022-10-16 23:49:03+00:00,Federal regulators are targeting crypto from a range of new angles. The CFTC's action against Ooki DAO is the lates… https://t.co/GsdeFJfvrW
1581789591534989312,2022-10-16 23:30:01+00:00,"Never miss a crucial news story when you follow Cointelegraph’s Telegram! 

📰 Breaking news 
📈 Market updates… https://t.co/JTKXzGqFU2"
1581783800597860352,2022-10-16 23:07:00+00:00,"BNY Mellon launches crypto services, and Google taps Coin base to bring crypto payments to cloud services. Keep tra… https://t.co/AZOOkj4148"
1581775752432738304,2022-10-16 22:35:02+00:00,"Q. How can blockchain decentralized autonomous organizations evolve in the future? 🤔
 
Mark Mason, Head of Business… https://t.co/WqwCInVK7q"
1581767003739561984,2022-10-16 22:00:16+00:00,Web3 browsers allow users to integrate crypto among other things. Learn more here. https://t.co/r4u6Fbgv4x
1581759652739833858,2022-10-16 21:31:03+00:00,Crypto is helping Mexicans living abroad send money home. https://t.co/dZwYo8BKI1
1581759400309465088,2022-10-16 21:30:03+00:00,A new era of web3 media has arrived. #HistoricalCollection. Get ready to collect the news stories that are valuable… https://t.co/ZvYbdSWVoi
1581753108195344384,2022-10-16 21:05:03+00:00,Gamers are beginning to see more diverse types of blockchain games across various genres. https://t.co/cDIymWN8j3
1581751868795289602,2022-10-16 21:00:07+00:00,A unified licensing regime for cryptocurrency exchanges in Europe could leave the United States behind.  https://t.co/KRT3MtSMno
1581744435377082368,2022-10-16 20:30:35+00:00,Have you ever woken up in the middle of the night wondering if your positions liquidated? It’s time for you to lear… https://t.co/Ve4P8IcDIS
1581744337775656960,2022-10-16 20:30:12+00:00,"With hard work and consistency, anything can be achieved. That’s exactly what Josipa Majic ( @josipamajic) proved a… https://t.co/WuZxu6pivc"
1581736738136858625,2022-10-16 20:00:00+00:00,From taxes and legislation to the local startups and professional associations — all you need to know about blockch… https://t.co/uMu8FMLA0l
1581729214788956160,2022-10-16 19:30:06+00:00,"October already broke the record of crypto hacks of the year with a total hacked value of $718 million.

And we are… https://t.co/NSBVIEmxdR"
1581721655562289152,2022-10-16 19:00:04+00:00,"Nirmala Sitharaman, the Indian finance minister, confirms that crypto will be part of India’s agenda as G20 preside… https://t.co/3OrMrdtVwU"
1581712972493508608,2022-10-16 18:25:34+00:00,It's very likely that regulators in the United States will begin telling node validators to impose KYC and AML requ… https://t.co/uVbQQ6TsUA
1581706674565353473,2022-10-16 18:00:32+00:00,"Did you miss it? 

Cointelegraph's @Rachelwolf00 spoke to Josh Cowell, co-founder and head of product at… https://t.co/5x1Fsp5Zwi"
1581699254003040256,2022-10-16 17:31:03+00:00,Don't get too comfy — Bitcoin analysts are all but guaranteeing a return to volatility for BTC. https://t.co/8FCWFR1uTa
1581699043667107841,2022-10-16 17:30:13+00:00,A new era of web3 media has arrived. #HistoricalCollection. Get ready to collect the news stories that are valuable… https://t.co/m4tE6AwAxm
1581691523254870017,2022-10-16 17:00:20+00:00,Wintermute still has payments to make despite the repayment of TrueFi's loan. https://t.co/AgEuN589Dk
1581687665014951936,2022-10-16 16:45:00+00:00,"Got rugged? 

Unfortunately, being scammed by a dodgy crypto project isn't nightmarish enough; the legal battle to… https://t.co/oFWoMwCxim"
1581683930092032001,2022-10-16 16:30:09+00:00,Ever heard of CC0 NFTs? let us tell you all about it. https://t.co/c5fAooXnTC
1581676393921884160,2022-10-16 16:00:13+00:00,You have 48 hours to tune in The Market Report and not missing the coolest analysis by @BY_DeFi @noshitcoins &amp;… https://t.co/T4FlWlyqQQ
1581661255542091777,2022-10-16 15:00:03+00:00,"BNY Mellon launches crypto services, and PayPal says policy to punish users for misinformation was ‘in error'. Keep… https://t.co/X6lpKivYzr"
1581646155275857920,2022-10-16 14:00:03+00:00,All you need to know about Web3 browsers in one place. https://t.co/r4u6Fbgv4x
1581642631209451525,2022-10-16 13:46:03+00:00,"We all have heard about the wonders of the Ethereum Merge for a while, but how much do we know about its flaws? https://t.co/BCJqel7SYE"
1581634450043334656,2022-10-16 13:13:32+00:00,"Despite regulatory hurdles, crypto has found a home in Western Europe. https://t.co/t1hvXg2hxP"
1581631058121871361,2022-10-16 13:00:04+00:00,Europe will leave the United States behind unless lawmakers act to provide clear regulatory definitions for cryptoc… https://t.co/vQzvtXZdHW
1581616146767568897,2022-10-16 12:00:49+00:00,"With a more reliable service and a clear upper hand in cloud computing, Node providers are undermining Big Tech. Th… https://t.co/PzCEbxOsY5"
1581608411040428033,2022-10-16 11:30:04+00:00,Grayscale’s BTC trust has been trading at a discount to their actual holdings and the reason might come as a surpri… https://t.co/EFkO4mRh6y
1581600866666442752,2022-10-16 11:00:05+00:00,Crypto .com invests $145M in new European headquarters and JPMorgan and Visa team up on cross-border blockchain pay… https://t.co/ntkZ6s3cCj
1581594304102813696,2022-10-16 10:34:01+00:00,"Q. How does a decentralized autonomous organization operate compared to traditional structures? 🤔
 
Vlad Shavlidze,… https://t.co/DHkG3Rwqv5"
1581585778194333696,2022-10-16 10:00:08+00:00,"Want to get the fastest, most important crypto news in your pocket? Follow our Telegram for news and market updates… https://t.co/FGOQvEtMM2"
1581570758782128129,2022-10-16 09:00:27+00:00,Node providers are undermining Big Tech with a more reliable service and a clear upper hand in cloud computing. https://t.co/Yy3Hd0LBqA
1581564622234353664,2022-10-16 08:36:04+00:00,Indian finance minister Nirmala Sitharaman confirms that #crypto will be part of India's agenda as G20 president. https://t.co/Ugr8SWTop2
1581555691176988674,2022-10-16 08:00:35+00:00,"Bitcoin at $35,000? 

Trader advises to not act on emotion as the bear market is looking similar to previous ones. https://t.co/kZkwjtGugr"
1581544219834953728,2022-10-16 07:15:00+00:00,"Voyager failed to explain the methodology used in the disclosure statement, according to the SSB and DOB. https://t.co/9whOe2gxIK"
1581519568476200962,2022-10-16 05:37:02+00:00,"After repayment of TrueFi’s $92 million loan, Wintermute still owes $97.4 million to Maple Finance and Clearpool in… https://t.co/dZM3XzRPhM"
1581517799209734145,2022-10-16 05:30:01+00:00,"Grayscale’s BTC trust has been trading at a discount to their actual holdings and the reason might surprise you.
https://t.co/vjlVCtQ1Kd"
1581502712616980480,2022-10-16 04:30:04+00:00,"Commemorate some of the industry’s biggest moments with our Historical NFT collection, in which every Cointelegraph… https://t.co/itGR46O4Cd"
1581487655107563521,2022-10-16 03:30:14+00:00,"Sometimes slow and steady wins the race!

In a conversation with @PigniGiovanni, @IOHK_Charles dives into BTC and E… https://t.co/qTxEZMhBpc"
1581480062406123523,2022-10-16 03:00:04+00:00,"BNY Mellon, America’s oldest bank, launches crypto serviced and JPMorgan and Visa team up on cross-border blockchai… https://t.co/WLhETH0Vnc"
1581464950026797056,2022-10-16 02:00:00+00:00,Anthony Hopkins' debut NFT collection sold out in less than 10 minutes. https://t.co/jKAqKwZe85
1581457398799036416,2022-10-16 01:30:00+00:00,"With a more reliable service and a clear upper hand in cloud computing, Node providers are undermining Big Tech. https://t.co/Yy3Hd12EsA"
1581449922637070336,2022-10-16 01:00:18+00:00,Are you ready for the next bull market? Here are the trends you need to keep your eye on. https://t.co/MVS1FRzCzu
1581442318271672320,2022-10-16 00:30:05+00:00,"October already broke the record of crypto hacks of the year with a total hacked value of $718 million.

And we are… https://t.co/uCyDhKLs2D"
1581434802904780802,2022-10-16 00:00:13+00:00,"Bitcoin market participants should not act on emotion, one trader advises.🤔https://t.co/kZkwjtol2j"
1581427199651246080,2022-10-15 23:30:00+00:00,All you need to know about CC0 NFTs in one place. https://t.co/c5fAopfx7K
1581419684108578817,2022-10-15 23:00:08+00:00,A new era of web3 media has arrived. #HistoricalCollection. Get ready to collect the news stories that are valuable… https://t.co/s2WaH005Ze
1581408360032653312,2022-10-15 22:15:08+00:00,"Want the news delivered straight to your phone? 

Join our Telegram group
https://t.co/9EnmFEk37B https://t.co/H3nHEbFuT2"
1581404582751522817,2022-10-15 22:00:08+00:00,Voyager's disclosure statement failed to convince the SSB and DOB. https://t.co/9whOe2gxIK
1581389579881357312,2022-10-15 21:00:31+00:00,"How do you integrate toys in Web3?

Let NFT Steez hosts Alyssa Expósito and Ray Salmond shine some light on it with… https://t.co/JnblvhNAOA"
1581381915071782912,2022-10-15 20:30:03+00:00,Grayscale’s BTC trust has been trading at a discount to their actual holdings and the reason might not be what you… https://t.co/SPkI2UnwCa
1581378015413825536,2022-10-15 20:14:34+00:00,The world of DApps and digital economies is made available by Web3 internet browsers. Learn how they differ from th… https://t.co/SoH6TaaTKm
1581374408689520640,2022-10-15 20:00:14+00:00,"How different would the Ethereum Merge be executed if it was up to @IOHK_Charles?

In a conversation with… https://t.co/LS5u7RBxuk"
