id,created_at,text1507819693440131077,2022-03-26 20:40:03+00:00,"India’s government strikes a 30% tax on crypto by law. 

The new rule will be effective on April 1st, and it’s expe… https://t.co/aNHYOAzWIm"
1507817166741164040,2022-03-26 20:30:01+00:00,"Before investing in crypto or stocks, here are the key differences you need to know: https://t.co/hVkKpx0Zks"
1507809733624967174,2022-03-26 20:00:28+00:00,"Cash-rich, but crypto-poor? Eat your crypto ramen every night, and wear this shirt when you eat it.… https://t.co/G40bQA8nUf"
1507802121567150080,2022-03-26 19:30:14+00:00,"Create, mint, sell and repeat. 

If you don't already know, this is how you sell your art as an NFT: https://t.co/l1NsmOgh8z"
1507796916507009025,2022-03-26 19:09:33+00:00,"Improving fundamentals, steady growth within its ecosystem and GameStop’s plan to build its NFT marketplace on Loop… https://t.co/SU0N46sKku"
1507794538936811520,2022-03-26 19:00:06+00:00,"What implications do digital assets have on the energy and climate?

That's the question the Office of Science and… https://t.co/dQmSqeaHL7"
1507779415727652866,2022-03-26 18:00:00+00:00,"A vibe shift is happening in crypto, argues @DomSchiener

The geopolitical tensions that 2022 started with created… https://t.co/ZSChPTJXjw"
1507764347002671113,2022-03-26 17:00:07+00:00,"In an attempt to comply with local jurisdictions, Coinbase users in certain countries will have to provide addition… https://t.co/2fYbrheOaw"
1507749385987371014,2022-03-26 16:00:40+00:00,"Is it Bull season yet?

For Terra's founder, that's a yes, as he plans to buy $10 billion worth of BTC.

Check out… https://t.co/tzfck5bQsd"
1507734159153901570,2022-03-26 15:00:10+00:00,"A lack of user-friendly design in Web3 applications might be acting as a barrier to entry. 

However, as time goes… https://t.co/qO9JJamBiD"
1507729086579359745,2022-03-26 14:40:01+00:00,"Bitcoin is lingering under $45,000. But after two ""fake breakouts,"" third time could be the charm. https://t.co/ztuF2TSTXZ"
1507724097245097989,2022-03-26 14:20:11+00:00,Our Markets Pro service works around the clock so you don't have to. Find out more here: https://t.co/ZFDbkbBLIl https://t.co/Pk09rWhDNc
1507724067654156293,2022-03-26 14:20:04+00:00,"Cointelegraph takes a look at Illuvium, a crypto video game based on the Ethereum blockchain. https://t.co/lLmu3qQsnw"
1507720538776432640,2022-03-26 14:06:03+00:00,"While cryptocurrency and stocks are often presented as rival mediums, the reality is a bit more complicated. Explor… https://t.co/zfvp7gdPCC"
1507719157307088906,2022-03-26 14:00:33+00:00,"Confused about what Web3 is?

Worry not! We've got you covered: https://t.co/YXqtuasPeK"
1507710120716820483,2022-03-26 13:24:39+00:00,"What implications do digital assets have on the energy and climate?

That's the question the Office of Science and… https://t.co/h7v4m8qbYs"
1507705566394675200,2022-03-26 13:06:33+00:00,"NFTs are a massive opportunity for artists to expand their audience, but seem complicated to those without coding e… https://t.co/XFgOyVdxSf"
1507704017769672710,2022-03-26 13:00:24+00:00,The search for digital gold might just be over as Bitcoin keeps proving itself as a good store of value. https://t.co/usAYwyROWW
1507694617109557250,2022-03-26 12:23:02+00:00,"Nice as the current BTC price action is, Bitcoin traders are all about the mettle of $46,000. https://t.co/LoGPtu8Orl"
1507678514593492992,2022-03-26 11:19:03+00:00,"Since the beginning of 2022, Crypto has found itself embroiled in geopolitical conflicts and the culture wars. What… https://t.co/4HgEEq3BQv"
1507613835787530244,2022-03-26 07:02:03+00:00,"Effective from April 1, Coinbase will require recipient information from users in Canada, Singapore and Japan. https://t.co/9Xtf2z1bCq"
1507587411580051461,2022-03-26 05:17:03+00:00,"While the positives are infinite for Web3, that doesn't mean there aren't concerns. Is now the best time to address… https://t.co/mSjGLGjehQ"
1507575573815730180,2022-03-26 04:30:00+00:00,“We will never let any single day of this period disappear from the ledger of world history.” Ukraine launched an o… https://t.co/V2w4BzU8or
1507564250251902977,2022-03-26 03:45:01+00:00,"US Secretary of the Treasury @SecYellen softens up and shows a friendlier view on crypto in CNBC’s Squawk Box.

Bar… https://t.co/cCAENUIB9S"
1507558464373071875,2022-03-26 03:22:01+00:00,Fancy yourself a crypto millionaire? Follows these 5 rules for a path to riches. https://t.co/jv62A7bRS9
1507552924943138817,2022-03-26 03:00:00+00:00,"What awaits institutional blockchain investors in Africa?

Executives from @Nexo and @ambergroup_io give their insi… https://t.co/m6bXQfh9qj"
1507549151076233223,2022-03-26 02:45:01+00:00,"The Oscars will serve more than awards this year.

The giant @Cryptocom teamed up with the Red Cross and will use i… https://t.co/8GfUnk9qev"
1507543364408905734,2022-03-26 02:22:01+00:00,"Some see a bright April coming. 

Latest #Bitcoin inflows suggest reaching $50K by next month, according to BITO's… https://t.co/ufIlavhUpX"
1507542364880924680,2022-03-26 02:18:03+00:00,Has Bitcoin finally proven its claim as a hedge against instability? Based on its response during COVID-19 and the… https://t.co/pLO638ixbG
1507537825041989637,2022-03-26 02:00:00+00:00,You'll be able to easily invest in smart contract alternatives if you're an accredited investor thanks to… https://t.co/ekTVSGf1J2
1507532039955914752,2022-03-26 01:37:01+00:00,"Crypto-killing tax law gets passed in India’s parliament, effective on April Fool’s.

The government will cut a 30%… https://t.co/VL5utqClnE"
1507526501914320897,2022-03-26 01:15:01+00:00,"“We will never let any single day of this period disappear from the ledger of world history.” 

Ukraine erected an… https://t.co/43uDQwccJS"
1507522723488190464,2022-03-26 01:00:00+00:00,"Is #Bitcoin the only really decentralized crypto?

Some European Bitcoin-only exchanges seem to think like that, an… https://t.co/wt6HNObvlf"
1507518954599849992,2022-03-26 00:45:01+00:00,"US Secretary of the Treasury, Janet Yellen, softens up and shows a friendlier view on crypto in CNBC’s Squawk Box.… https://t.co/Fuc7nCBc3Z"
1507518302007963653,2022-03-26 00:42:26+00:00,@Vayu108 @saylor https://t.co/uBNWxOn9nY
1507518188778520578,2022-03-26 00:41:59+00:00,@AltcoinArchive @PeterSchiff https://t.co/hSSN398STt
1507516953660956676,2022-03-26 00:37:04+00:00,"It's the weekend. Treat yourself.

50% off select items at the Cointelegraph Store. Hurry though, it's your last ch… https://t.co/Jj5BaD1zk3"
1507515176555319299,2022-03-26 00:30:01+00:00,The @satoshiisland project gets Vanuatu’s Prime Minister's blessing to develop a fully crypto-operated smart city.… https://t.co/Crsy9agsZ0
1507511412515614725,2022-03-26 00:15:03+00:00,"What awaits institutional blockchain investors in Africa?

Executives from @Nexo and @ambergroup_io give their insi… https://t.co/PtcpSjcyd8"
1507507769930362881,2022-03-26 00:00:35+00:00,The European Union draft on Markets in Crypto Assets moves forward as banning PoW-based digital assets is not on th… https://t.co/lP8Yn4OpbY
1507507668591820802,2022-03-26 00:00:10+00:00,@DenarisMy Head on over to your local CT Store: https://t.co/w8Lt57mTmI https://t.co/HUDU9yD5hw
1507501847052967938,2022-03-25 23:37:03+00:00,"Welcome to the party! 

South Korean tech giant @LGUS has officially added blockchain and cryptocurrency as new bus… https://t.co/tl4c9P7c9J"
1507496303135268865,2022-03-25 23:15:01+00:00,"England's CBDC is under the microscope of @MIT, who is zooming in on the studies of Central Bank Digital Currency. https://t.co/ToVeYiYpIe"
1507492745413230598,2022-03-25 23:00:53+00:00,@crypto_bitlord7 https://t.co/6vtxdGexoC
1507492581063766019,2022-03-25 23:00:13+00:00,Republican senator Gillibrand teams up with democrat senator Lummis to work on a regulatory framework on crypto.… https://t.co/y2M9CzmTez
1507488754088529922,2022-03-25 22:45:01+00:00,"The Oscars will serve more than awards this year.

The giant @Cryptocom partnered with the Red Cross and will use i… https://t.co/dbHX3rjvSE"
1507482964774559744,2022-03-25 22:22:01+00:00,"South Korean crypto exchanges are now compliant with the country’s Travel Rule, which flags any transfers worth mor… https://t.co/PR90oZWCdj"
1507477496694022145,2022-03-25 22:00:17+00:00,"What are your favorite $3 or less altcoins? 

Join @BY_DeFi, @noshitcoins, @CryptoDuality, and @forgeforth_ as they… https://t.co/xOEK7V09G7"
1507473654933860354,2022-03-25 21:45:01+00:00,"A bullish wave seems to take the market, and #Bitcoin is committed to conquering the $45K as support.

While some m… https://t.co/3G5Nzdp0Nl"
1507472279449444353,2022-03-25 21:39:33+00:00,"The NFTs are based on Twitter posts from government officials, photos from news outlets, and the response of world… https://t.co/VijmoHt6Sy"
1507470397461073920,2022-03-25 21:32:04+00:00,The Bank of England heads across the Atlantic for more CBDC research. https://t.co/aB36fCNDH0
1507469923580215300,2022-03-25 21:30:11+00:00,"Israel’s Leumi Bank recently launched a crypto trading platform powered by @PaxosGlobal, and currently operates lim… https://t.co/SAA2dr3Yex"
1507466625615687682,2022-03-25 21:17:05+00:00,"Secretary Yellen acknowledged crypto's role, but advised caution on financial stability and consumer protection. St… https://t.co/dLgYpPIOa4"
1507466103194148865,2022-03-25 21:15:01+00:00,"Some see a rather bright April on the horizon. 

Latest #Bitcoin inflows suggest reaching $50K by next month, accor… https://t.co/CSLxyjSiSe"
1507462374579572736,2022-03-25 21:00:12+00:00,You'll be able to easily invest in smart contract alternatives if you're an accredited investor thanks to… https://t.co/LNM7pqz77X
1507459190503051265,2022-03-25 20:47:32+00:00,Cointelegraph participated in the Blockchain Africa Conference 2022 to get the latest insights on cryptocurrency in… https://t.co/DapGZhf8w4
1507457298234757120,2022-03-25 20:40:01+00:00,"Can you mint it like Beckham? 

The iconic footballer has become a global brand ambassador for the @DigitalBitsOrg… https://t.co/XLRrg5EARH"
1507455541307617283,2022-03-25 20:33:02+00:00,Making a fortune is just one part of the journey — the real challenge is keeping it. @CryptoDuality shares five tip… https://t.co/3JtrAKt472
1507452768348700672,2022-03-25 20:22:01+00:00,"Rapper @YG appears to be one of the biggest celeb hodlers based on his recent music video ""Scared Money,"" but Reddi… https://t.co/7u3zaDDjER"
1507448989418983428,2022-03-25 20:07:00+00:00,"Did you hear about Jam-Dex?

No, it isn’t a band, it is Jamaica’s anticipated CBDC, and it's launching soon. https://t.co/ke5pYxeWby"
1507445215514267658,2022-03-25 19:52:01+00:00,"Welcome to the Zuckerverse. 

Meta has new trademark applications surrounding Web3, including advertising services… https://t.co/EYOtoQ8ZrF"
1507442833984159748,2022-03-25 19:42:33+00:00,"Lights, camera, action! Crypto .com is heading to this year's Oscars with an important message. https://t.co/kv2BJ1dAJy"
1507442108956745731,2022-03-25 19:39:40+00:00,@EclecticMethod https://t.co/RWhmjjzL7M
1507441441982844931,2022-03-25 19:37:01+00:00,The 40-page report by U.K. regulators states that cryptoassets and DeFi pose a “limited” risk to the stability of t… https://t.co/VF4CREgaKt
1507437665389588488,2022-03-25 19:22:00+00:00,"Why go to a doctor when you can hop on the Metaverse? 

Virtual reality could provide a new channel for medical pro… https://t.co/FcONSyJayr"
1507435454664257536,2022-03-25 19:13:13+00:00,@Dindadiniarti https://t.co/yiu2LNYfzE
1507433900900950016,2022-03-25 19:07:03+00:00,"Traders have set new bullish targets for Bitcoin and altcoins, but first $42,500 needs to be confirmed as support. https://t.co/41Fxn5AGNh"
1507433891380236289,2022-03-25 19:07:01+00:00,"Whether right or wrong, much has been said about blockchain technology carbon footprint. 

But in a fossil fuel add… https://t.co/9GfPqJJCL0"
1507430117718515714,2022-03-25 18:52:01+00:00,"If crypto had its own #Oscars, who would win Best Actor?"
1507424649600192515,2022-03-25 18:30:17+00:00,"Crypto-killing tax law gets passed in India’s parliament, effective on April Fool’s.

The government will slap a 30… https://t.co/ulnsLHkHCF"
1507421582926356480,2022-03-25 18:18:06+00:00,Bitcoin remains in demand among institutions. https://t.co/Iw3OiQmySJ
1507420839045644326,2022-03-25 18:15:09+00:00,"Is #Bitcoin the only really decentralized crypto?

Some European Bitcoin-only brokers seem to think like that, and… https://t.co/feKys07iUb"
1507417791564967938,2022-03-25 18:03:02+00:00,Grayscale gives investors the ability to invest in a batch of ETH competitors. Qualcomm launched a $100 million Met… https://t.co/Ul9RMjUrhn
1507415016135348229,2022-03-25 17:52:00+00:00,"Is a whale about to ruin your weekend? 

As Bitcoin looks to conquer $45K, an entity which purchased BTC near $34,0… https://t.co/gfojG0kuV6"
1507411242113191943,2022-03-25 17:37:01+00:00,The @satoshiisland project receives Vanuatu’s Prime Minister's blessing to develop a fully crypto-operated smart ci… https://t.co/VuflFd9cQ8
1507407992920043523,2022-03-25 17:24:06+00:00,"Ethereum price broke its multi-month downtrend by rallying to $3,200, and data suggests that bulls expect the uptre… https://t.co/EKevqhKVhh"
1507407470557286404,2022-03-25 17:22:01+00:00,The European Union draft on Markets in Crypto Assets seems to move forward as banning PoW-based digital assets is n… https://t.co/wUwfA6I5FA
1507405271768969217,2022-03-25 17:13:17+00:00,"Are you confused about what Web 3 means and how it works?

Don't worry, we've got you covered.

Full video out now:… https://t.co/IsucR2fwRN"
1507404205400596483,2022-03-25 17:09:03+00:00,@BY_DeFi @el33th4xor @avalancheavax Until next time 😄👋 @el33th4xor https://t.co/VgaJev4MtH
1507402708201877507,2022-03-25 17:03:06+00:00,'It is critical to understand that what the finance minister has done by introducing this 1% TDS on the blockchain… https://t.co/vSaLu2tQPs
1507402136270876684,2022-03-25 17:00:50+00:00,"It's about time. 

South Korean tech giant @LGUS has officially added blockchain and cryptocurrency as new business… https://t.co/L5hXkXrvWP"
1507398453512523777,2022-03-25 16:46:12+00:00,"You can surely put the words “blockchain” and “crypto” in the same sentence, but can you explain how they help pros… https://t.co/OeWXlNcE0B"
1507396136264425472,2022-03-25 16:36:59+00:00,Finance minister Mohd Shahar’s remarks came shortly after Malaysia’s deputy communications and multimedia minister… https://t.co/UO8PInWoIC
1507394479443091485,2022-03-25 16:30:24+00:00,"Crypto exchanges in South Korea are now compliant with the country’s Travel Rule, which will flag any transfers wor… https://t.co/58xb59MNGj"
1507394044158222338,2022-03-25 16:28:40+00:00,Play-to-earn gaming presents an amazing opportunity for the youth in Africa who already have a culture of gaming.… https://t.co/U5dd4YEB0I
1507390648042856478,2022-03-25 16:15:11+00:00,"Did you hear the latest news about Jam-Dex?

No, it isn’t a band, it is Jamaica’s anticipated CBDC, and it's launch… https://t.co/FDlGIfKght"
1507389858683453440,2022-03-25 16:12:02+00:00,"“There is 14 billion USD worth of Bitcoin ‘DeFi’ on #Ethereum, controlled by a handful of centralized custodians, b… https://t.co/m85Rrk0RRA"
1507388357831143428,2022-03-25 16:06:05+00:00,"The weekly performance of the majority of the DeFi tokens in the top 100 remained optimistic, with double-digit tra… https://t.co/ThCaM78zZw"
1507388350247833604,2022-03-25 16:06:03+00:00,Want to learn about Web3? Watch Jackson DuMont discuss the topic in the newest episode of Cryptopedia. https://t.co/FejprzChvs
1507386853795717120,2022-03-25 16:00:06+00:00,"Can you mint it like Beckham? 

The iconic footballer becomes a global brand ambassador for the @DigitalBitsOrg blo… https://t.co/y96kS1Y44r"
1507383065991069696,2022-03-25 15:45:03+00:00,"Israel’s Leumi Bank launched a crypto trading platform powered by @PaxosGlobal, and currently operates limited trad… https://t.co/niaSAbEtkm"
1507379371342020610,2022-03-25 15:30:22+00:00,"Rapper @YG appears to be one of the biggest celeb hodlers based on his recent music videos. 

However, Reddit has s… https://t.co/gN5lyv5xVg"
1507375538297618435,2022-03-25 15:15:08+00:00,Republican senator Gillibrand teams up with democrat senator Lummis to work on a regulatory framework on crypto.… https://t.co/aLvYN3SiVN
1507374008135692290,2022-03-25 15:09:03+00:00,"I spy a Bitcoin sell wall! Bitfinex whales look increasingly happy to sell above $45,000. https://t.co/I2oTGrHkOX"
1507371793052581890,2022-03-25 15:00:15+00:00,The 40-page report by U.K. regulators declares that cryptoassets and DeFi pose a “limited” risk to the stability of… https://t.co/DWgDE2pqVx
1507364298791833604,2022-03-25 14:30:28+00:00,"How bullish are you on $ADA? Cardano jumped by around 7.5% in trading Friday, reaching $1.19 over a month after bot… https://t.co/OBSKgvNXUD"
1507363196658597892,2022-03-25 14:26:06+00:00,"Are altcoin investors missing the point? “Bitcoin only” is a growing trend in Europe, with BTC described as a once-… https://t.co/2eU54tRYpi"
1507357918215110664,2022-03-25 14:05:07+00:00,"Good news for Satoshi Island as the Vanuatu Prime Minister says Satoshi Island is ""welcome."" https://t.co/lRoxrqWDjl"
1507356746079162368,2022-03-25 14:00:28+00:00,"Bitcoin appears to be coming out of hibernation, but is it ready for liftoff? 

The yearly open of $46,000 is becom… https://t.co/EtN3S93sB2"
1507353295588937729,2022-03-25 13:46:45+00:00,"🥁 For our #1, Crypto .com heads to Qatar where it will be an official sponsor of the FIFA 22 World Cup.

https://t.co/lh1EAVx9UR"
1507352526202490884,2022-03-25 13:43:42+00:00,"#2 David Beckham, the iconic footballer has become a global brand ambassador for the @DigitalBitsOrg blockchain, la… https://t.co/DYHGzaeh0c"
1507352110408499202,2022-03-25 13:42:03+00:00,Bitcoin and other PoW-based cryptocurrencies have dodged a regulatory bullet in the EU. https://t.co/DQcC2ljKfX
1507351620165808130,2022-03-25 13:40:06+00:00,"For #3 we head to Meta’s HQ where the company has filed 8 digital asset and Web 3 trademark applications.

https://t.co/AO4jCFR7pm"
1507350552442769412,2022-03-25 13:35:51+00:00,"#4 is exciting! GameStop launched its NFT marketplace and it's powered by an Ethereum layer two protocol. 

https://t.co/AjMcgMiIj2"
1507349727238574081,2022-03-25 13:32:34+00:00,"#5 LG Electronics added blockchain and crypto as new areas of business.

https://t.co/KnSg6sZH01"
1507348491147825154,2022-03-25 13:27:40+00:00,"📰 Top Crypto News 📰 
03/25-03/21

👀 LG &amp; Crypto
🆕 GameStop’s NFT marketplace
📂 Meta’s applications
⚽ David Beckham… https://t.co/x08Pvh5dTV"
1507348337380364288,2022-03-25 13:27:03+00:00,It turns out that some US Senators can work across the aisle to address crypto regulation. https://t.co/10i96AqYxL
1507344688352673794,2022-03-25 13:12:33+00:00,"As Jamaica readies the launch of its Jam-Dex CBDC, hopes rise that it can address the country's issues of price gou… https://t.co/g2sWaXCS9B"
1507343022048043009,2022-03-25 13:05:56+00:00,"Among the big four exchanges Upbit, Bithumb, Coinone, and Korbit, there are two Travel Rule systems. Each system fu… https://t.co/N7FpC7QVxX"
1507341776281128974,2022-03-25 13:00:59+00:00,"Welcome aboard! 

South Korean tech giant @LGUS has officially added blockchain and cryptocurrency as new business… https://t.co/LGWqFDGBTU"
1507339986248650771,2022-03-25 12:53:52+00:00,"Beckham will release a series of NFTs and “other Blockchain-based digital assets,” according to the brand ambassado… https://t.co/XS8OqhrKjK"
1507334039069499395,2022-03-25 12:30:14+00:00,"A conflict of interest may cause Marc Andreessen to step down from Meta. 

The billionaire co-founder of crypto ven… https://t.co/GcAOrt8N4g"
1507332608094457857,2022-03-25 12:24:33+00:00,Major Israeli bank Leumi is launching a crypto trading service through its digital platform Pepper Invest via a par… https://t.co/JXJzLRL9Bh
1507328582187724804,2022-03-25 12:08:33+00:00,"@GoldmanSachs While not bullish, Bitcoin’s Fear &amp; Greed Index has escaped “extreme fear” and is now in the “fear” s… https://t.co/bHHG6CfSEj"
1507327452040757256,2022-03-25 12:04:04+00:00,"Coincidence? Bitcoin heads for $45,000 as Terra's BTC hoard passes 20,000 coins. https://t.co/TYmwcXzFSz"
1507326701499564037,2022-03-25 12:01:05+00:00,"Setting the record straight. 

El Salvador President Nayib Bukele took to Twitter on Wednesday evening, hitting out… https://t.co/0ZpeH2MWT4"
1507324079514308621,2022-03-25 11:50:39+00:00,@DigitalBitsOrg Beckham said the NFT collections were an “opportunity to create new experiences for my fans online.”
1507321129979072523,2022-03-25 11:38:56+00:00,@DigitalBitsOrg 👀 https://t.co/MGQ3g9KrBR
1507318931727466501,2022-03-25 11:30:12+00:00,"South Korean crypto exchanges are now compliant with the country’s Travel Rule, which will flag any transfers worth… https://t.co/Zx1iYO76BM"
1507314846571929601,2022-03-25 11:13:58+00:00,"The project reportedly will take excess gas from oil wells in North Dakota to run BTC miners, using 18 million cubi… https://t.co/OAQ1zQbHkU"
1507311461508472871,2022-03-25 11:00:31+00:00,"Can you mint it like Beckham? 

The iconic footballer has become a global brand ambassador for the @DigitalBitsOrg… https://t.co/vGlp8BYFea"
1507308983924707328,2022-03-25 10:50:40+00:00,"There is justice, and it is coming to the NFT space. 

The Department of Justice has taken action against an allege… https://t.co/tHFQqN7RKn"
1507307558494691360,2022-03-25 10:45:01+00:00,"Rapper @YG appears to be one of the biggest celeb hodlers based on his recent music video, but Reddit has some ques… https://t.co/HpjTqCkUIK"
1507306979538214914,2022-03-25 10:42:42+00:00,LG added two crypto-related objectives during its annual general meeting. These included “the development and selli… https://t.co/kx5A7nJ3Zm
1507303906371637248,2022-03-25 10:30:30+00:00,"Now that's what I call a #FridayFeeling!

The crypto market is looking green as the weekend approaches, with $BTC l… https://t.co/a084GP8FYH"
1507296272834781207,2022-03-25 10:00:10+00:00,The 40-page report by U.K. regulators states that cryptoassets and DeFi pose a “limited” risk to the stability of t… https://t.co/QEziRSCMBE
1507292460602507268,2022-03-25 09:45:01+00:00,"While Biden’s executive order headlined for not proposing a feared crypto crackdown, it also revealed the U.S gover… https://t.co/y2AcqwzPhS"
1507291837932789764,2022-03-25 09:42:32+00:00,Cardano did a near-perfect reversal after plunging 40% earlier this year. But bearish risks remain. https://t.co/iofmVrq0b0
1507251710221189121,2022-03-25 07:03:05+00:00,LG Electronics has expanded its corporate charter to include the development of cryptocurrency and blockchain-relat… https://t.co/wVhApmKFP6
1507248921692753933,2022-03-25 06:52:00+00:00,"Bitcoin as legal tender in Honduras? Not so fast, friends. The central bank said ""for the time being"" Bitcoin will… https://t.co/FUXyKSPI5V"
1507241374814457871,2022-03-25 06:22:01+00:00,"GameStop is unveiling an NFT marketplace, and it's available right now. Click through to read the full story. https://t.co/dypuATwZ4u"
1507237356146884612,2022-03-25 06:06:03+00:00,South Korean crypto users may now only transfer funds to and from a short list of verified exchanges if they want t… https://t.co/nc4mgOmA4r
1507232061010157569,2022-03-25 05:45:01+00:00,Boxing legend @FloydMayweather is entering the ring one more time with the “Mayweverse.” https://t.co/BkpL2l9O6C
1507228543180173316,2022-03-25 05:31:02+00:00,"After posting BTC holdings worth a whopping $30 million in his latest music video, Redditors are calling it fake du… https://t.co/1Nk2zsaUMW"
1507226531180941324,2022-03-25 05:23:02+00:00,Former football star David Beckham is set to launch his own NFT collection through an ambassadorship with DigitalBi… https://t.co/e46W38C4WQ
1507224514513580050,2022-03-25 05:15:01+00:00,"One of the biggest energy producers is going to be gassing up crypto, is reportedly powering Bitcoin miners with ex… https://t.co/MPgxvSwfkP"
1507216964988678153,2022-03-25 04:45:01+00:00,"Biden’s executive order made headlines for not proposing a feared crypto crackdown, but it also revealed the U.S go… https://t.co/bHcUusN97I"
1507211687790669832,2022-03-25 04:24:03+00:00,The FPC stated in its report that cryptoassets and DeFi pose a “limited” risk to the stability of the UK financial… https://t.co/FnX82uaBMI
1507209412229926913,2022-03-25 04:15:01+00:00,Crypto saw a breath of life recently. Institutions like @GoldmanSachs are showing that big money could be flowing i… https://t.co/KjXoerh2tj
1507207910606077957,2022-03-25 04:09:03+00:00,Marc Andreessen could be stepping down from Meta’s board of directors due to a16z’s Web3 and crypto investments com… https://t.co/xo7Twpz3mO
1507199851058061317,2022-03-25 03:37:01+00:00,"As Colorado plans to allow residents to pay taxes in cryptocurrency as early as the summer of 2022, is nationwide a… https://t.co/IiA16tQRkV"
