id,created_at,text1576950504428642304,2022-10-03 15:01:13+00:00,"Keeping up with the Kardashians. 

Kim Kardashian will pay $1.26 million to the SEC for promoting EthereumMax to he… https://t.co/vcHecYfYPU"
1576948559949467651,2022-10-03 14:53:29+00:00,"Bitcoin running away from $20,000 like: https://t.co/Z0pGnSyjoL"
1576946172656291840,2022-10-03 14:44:00+00:00,"How will Bitcoin react to stock markets' behavior in the next few weeks?

According to crypto analyst and trader Al… https://t.co/9impnelHKK"
1576940637961818114,2022-10-03 14:22:00+00:00,"It went from vinyl discs to magnetic tapes, then CDs to mp3. 

Now, the future of music seems to be in NFTs. https://t.co/BfANzJYRke"
1576937129506377728,2022-10-03 14:08:04+00:00,"While NFTs made an astronomical entrance into the crypto market, they are not in their sweetest moment right now. W… https://t.co/BO1KK4h6q7"
1576936862228381696,2022-10-03 14:07:00+00:00,"Binance 🤝 Kazakhstan 

The crypto exchange has signed a memorandum of understanding with the country as part of its… https://t.co/BJk6Ibysmr"
1576935525847531525,2022-10-03 14:01:42+00:00,"Don't miss the best market analysis and tune in The Market Report with @BY_DeFi @noshitcoins &amp; @forgeforth_ 

Tomor… https://t.co/HGVLKpEJdS"
1576935369114718210,2022-10-03 14:01:04+00:00,What are we calling this month?
1576935349133185024,2022-10-03 14:00:59+00:00,Ethereum Merge spikes block creation with a faster average block time. https://t.co/dAl0yU70Ee
1576932523967270913,2022-10-03 13:49:46+00:00,"@philibe93 Grammarly did not catch it, sorry."
1576932317960220672,2022-10-03 13:48:57+00:00,@ghcryptoguy https://t.co/lyWHu6vcWY
1576929313521373185,2022-10-03 13:37:00+00:00,The Department of Justice has submitted an objection to Celsius' motion to reopen withdrawals for select customers… https://t.co/9lXVIoZbQL
1576925453062795264,2022-10-03 13:21:40+00:00,🥁 And at #1... The Department of Justice (DOJ) has submitted an objection to Celsius’ motion to reopen withdrawals… https://t.co/G1WBjvbCa0
1576924237402546178,2022-10-03 13:16:50+00:00,All is not lost at #2 after a quick response from a number of blockchain security companies helped facilitate the r… https://t.co/VdYjvR4vvV
1576923748619685888,2022-10-03 13:14:54+00:00,The Celsius fallout continues at #3 after news emerged that founder and former CEO Alex Mashinsky allegedly withdre… https://t.co/hAqyYbgCDG
1576923636526555136,2022-10-03 13:14:27+00:00,Read more here: https://t.co/vyinEzxnzO
1576923538782818305,2022-10-03 13:14:04+00:00,"'Cause the power you're supplying It's electrifying! The Lighting Network reaches 5,000 Bitcoin. https://t.co/UAnpjy8meH"
1576922683945943045,2022-10-03 13:10:40+00:00,"At #4, Bitcoin ATMs are feeling the bear market as September 2022 recorded negative growth in global net installati… https://t.co/YsxwkFJ6Wx"
1576921182749618177,2022-10-03 13:04:42+00:00,"Our countdown begins with positive news for Ethereum post-Merge.

#5 sees a steep increase in daily block creation… https://t.co/HHh0Hd0wUj"
1576920409949278214,2022-10-03 13:01:38+00:00,"📰 Top Crypto News 📰 

⬆️ Block creation spikes post-Merge
🏧 Net Bitcoin ATMs growth drops globally 
🤔 Celsius found… https://t.co/OyUhLCczvb"
1576917988762083328,2022-10-03 12:52:00+00:00,"A team of security finance firms joined forces and traced back the hacker of Transit Swap.

They recovered so far 7… https://t.co/c2otTbvkMJ"
1576916514590306304,2022-10-03 12:46:09+00:00,Kim Kardashian to pay $1.26 million to SEC for promoting EthereumMax to her Instagram followers without disclosing… https://t.co/QWzFexlO6N
1576912545411104771,2022-10-03 12:30:23+00:00,"Is bankruptcy on the horizon? 

Withdraw $10 million. https://t.co/IMCTFvg8Ec"
1576908693832355841,2022-10-03 12:15:04+00:00,Binance signed an MoU with Kazakhstan's financial regulator as a part of its global law enforcement training progra… https://t.co/nSRAgS3PSu
1576908676509614080,2022-10-03 12:15:00+00:00,"Bitcoin could reach $20,500 amid hope for a final push, but the overall trend is still not looking too favorable fo… https://t.co/vYFAkeaJmf"
1576903753352896512,2022-10-03 11:55:26+00:00,🚨 Kim Kardashian will pay $1.26 million over SEC allegations for failing to disclose she was paid for a crypto token promotion.
1576901128196964352,2022-10-03 11:45:01+00:00,"From bandwidth consumption to ease of setup, some in the Ethereum community don't think staking is for the common u… https://t.co/0vhxMGgiXB"
1576899741367291905,2022-10-03 11:39:30+00:00,The withdrawal was cited by sources from the Financial Times who said Mashinsky withdrew the funds in “mid to late… https://t.co/8E2ZHgm1kJ
1576895338794860547,2022-10-03 11:22:00+00:00,"DeFi has broken multiple business stereotypes, including the typical investor profile.

Here is an overview of the… https://t.co/nZ7Cz8Y32P"
1576894094898778113,2022-10-03 11:17:04+00:00,"“Web3 and existing platforms help us build a new chapter of the music industry,” Takayuki Suzuki, CEO at MetaTokyo… https://t.co/BmDqDllB3A"
1576889800904396801,2022-10-03 11:00:00+00:00,A bug in the code allowed a hacker to make way with an estimated $21 million. 👀 https://t.co/J6jtf0eckr
1576887313853952001,2022-10-03 10:50:07+00:00,"What are your expectations for ""Uptober""?"
1576886027410706432,2022-10-03 10:45:00+00:00,"Is the worst for Bitcoin bulls over? 

Analysts say not yet. https://t.co/qR4wH12vwr"
1576885155062767616,2022-10-03 10:41:32+00:00,"The author appears to be backing Bitcoin again. In a recent Tweet he said:

“When FED pivots and drops interest rat… https://t.co/oVmzydJyPO"
1576882264402796545,2022-10-03 10:30:03+00:00,What keeps you up at night? https://t.co/l1xRacMCIt
1576880554514841601,2022-10-03 10:23:15+00:00,RT @Cointelegraph: Triggered. https://t.co/GbVYvoDjcQ
1576879604525957122,2022-10-03 10:19:29+00:00,Some of the evident improvements experienced by the blockchain post-Merge include a steep increase in daily block c… https://t.co/yZAVUDwRjR
1576878475297931266,2022-10-03 10:15:00+00:00,"This is how we like it in the town! 

Robert Kiyosaki, businessman and best-selling author of Rich Dad Poor Dad, ha… https://t.co/6XmiPXkeqW"
1576876461960708096,2022-10-03 10:07:00+00:00,"Interpol issued a Red Notice to locate and arrest Do Kwon, and pro-centralization Vladimir Putin grants citizenship… https://t.co/oyOsiU50vM"
1576874879097487360,2022-10-03 10:00:42+00:00,"Unspectacular but steady. 

A relatively uneventful weekend sees Bitcoin continue to hover below $20K, but will thi… https://t.co/gJFY7wCF2Q"
1576872687896502276,2022-10-03 09:52:00+00:00,"Will FTX buy Celsius? 

Sam Bankman-Fried has shared details on how his firm would approach a buy-up of Celsius’ as… https://t.co/UBJSqQP0Ey"
1576868558801620992,2022-10-03 09:35:35+00:00,"From bandwidth consumption to ease of setup, some in the Ethereum community don't think staking is for the common u… https://t.co/o5g03Gy2mf"
1576867173984833536,2022-10-03 09:30:05+00:00,"How will Bitcoin react to stock markets' behavior in the next few weeks?

According to crypto analyst Alessio Rasta… https://t.co/KsXzDT6eag"
1576859615635062784,2022-10-03 09:00:03+00:00,How decentralizing data on Web3 could save companies like Uber a lot of trouble. https://t.co/rPRkn9lolu
1576853815717945346,2022-10-03 08:37:00+00:00,"It went from vinyl discs to magnetic tapes, then compact discs to mp3. 

Now, the future of music seems to be in NF… https://t.co/BOV5IiftQ3"
1576842505437720581,2022-10-03 07:52:04+00:00,"What's on the menu for sub-$20,000 Bitcoin this week? Here are 5 things to keep in mind. https://t.co/Ieb1HHqCBC"
1576831167625678848,2022-10-03 07:07:01+00:00,"Opinion piece: Regulators need to step up their fraud-fighting game. Until then, do your own due diligence. Thought… https://t.co/PKTf6FLGA2"
1576814470055215107,2022-10-03 06:00:40+00:00,The House of Representatives proposed new draft legislation to impose a two-year ban on new algorithmically stablec… https://t.co/nsmqxJxy7q
1576806768180891650,2022-10-03 05:30:03+00:00,"Rich Dad Poor Dad author Robert Kiyosaki expects the surging U.S. dollar to hit a brick wall by January next year,… https://t.co/jFX2YkWLIU"
1576803123091636224,2022-10-03 05:15:34+00:00,"Sam Bankman-Fried says a Celsius bailout would follow the same route as Voyager, with FTX looking to help customers… https://t.co/PXjWDmkcoE"
1576800966875160576,2022-10-03 05:07:00+00:00,Ethereum is experiencing post-Merge evident improvements with an increase in daily blockchain creation and a lower… https://t.co/xnscaklHAM
1576784174425456640,2022-10-03 04:00:17+00:00,"Bitcoin to reach $20,500? https://t.co/Z3fHaVbP3m"
1576769004949086211,2022-10-03 03:00:00+00:00,The bugged code allowed a hacker to make way with an estimated $21 million. https://t.co/J6jtf0eckr
1576763857514958848,2022-10-03 02:39:33+00:00,"A U.S. Trustee for the DOJ has objected to the plan from Celsius to reopen withdrawals to certain customers, saying… https://t.co/CQFaLapPP7"
1576760085027901441,2022-10-03 02:24:33+00:00,Several blockchain security companies teamed up with Transit Swap to track down and reach out to the hacker behind… https://t.co/RPXgPVLBL1
1576753907593781249,2022-10-03 02:00:00+00:00,The Interpol has issued a Red Notice to locate and arrest Do Kwon and Pro-centralization Vladimir Putin grants citi… https://t.co/2T4tkzcFcB
1576752666457550848,2022-10-03 01:55:04+00:00,Celsius founder Alex Mashinsky reportedly withdrew $10 million from the crypto lending platform just weeks before t… https://t.co/Qz5LyTRCs1
1576743725178720257,2022-10-03 01:19:33+00:00,Social media platforms such as TikTok have the potential to democratize the investing process — and open investing… https://t.co/f0BmIitjQO
1576738829033168899,2022-10-03 01:00:05+00:00,How decentralizing data on Web3 could save companies like Uber from a major vulnerability.  https://t.co/rPRkn9lolu
1576731270217965569,2022-10-03 00:30:03+00:00,"Legend says you will turn into a howling creature if you don't drink your coffee in the morning. 

And no mug, no c… https://t.co/a3S7sV5mzK"
1576723744952836097,2022-10-03 00:00:09+00:00,"Jeremy Allaire explained that for crypto mass crypto adoption to happen, participants would need to be introduced t… https://t.co/9sXQ41hNOo"
1576710370445639680,2022-10-02 23:07:00+00:00,"Regulators need to step up their fraud-fighting game. Until then, do your own due diligence. https://t.co/Hsv5OclOn8"
1576693506902560768,2022-10-02 22:00:00+00:00,New proposed draft legislation on stablecoins to impose a two-year ban on new algorithmically stablecoins like Terr… https://t.co/UAFq1sgSr1
1576679178048798725,2022-10-02 21:03:03+00:00,The music industry has seen successive waves of disruption and change over the last century. Are NFTs the next driv… https://t.co/lNcHehO5AC
1576678549456650244,2022-10-02 21:00:34+00:00,Ethereum is experiencing evident improvements post-Merge with an increase in daily blockchain creation and a lower… https://t.co/5FWpJj6Ef5
1576663445344247814,2022-10-02 20:00:33+00:00,"Bitcoin could reach $20,500 but the overall trend is still not looking too favorable for traders. https://t.co/Z3fHaVbP3m"
1576648308264771587,2022-10-02 19:00:24+00:00,A bug in the code allowed a hacker to make way with an estimated $21 million. https://t.co/J6jtf0eckr
1576640662556086272,2022-10-02 18:30:01+00:00,Triggered. https://t.co/GbVYvoDjcQ
1576633151060844546,2022-10-02 18:00:10+00:00,Interpol has issued a Red Notice to locate and arrest Do Kwon and Pro-centralization Vladimir Putin grants citizens… https://t.co/VItYhum9Xc
1576632613095485441,2022-10-02 17:58:02+00:00,"A bit of coffee in your Bitcoin mug might get the bull market bit by bit come back.
https://t.co/lyq7uBefHa https://t.co/1EwSuCeNiP"
1576625612491554817,2022-10-02 17:30:12+00:00,A new statement from Nexo clarified that the withdrawal is in fact a funds transfer related to operational costs.  https://t.co/kQf7tGJftd
1576618028070060033,2022-10-02 17:00:04+00:00,A major vulnerability for companies like Uber could be eliminated by decentralizing data on Web3. https://t.co/rPRkn9lolu
1576610541233049601,2022-10-02 16:30:19+00:00,@FosterTheLinkin Amen 🙌
1576610492210102275,2022-10-02 16:30:08+00:00,"Tired of your job?

What about $300K to work for a DAO?
(Via @CointelegraphZN) 
https://t.co/7QQ8bJiwSY"
1576604305389686784,2022-10-02 16:05:32+00:00,"Find out why the next few weeks will be ""critical"" for both the stock market and #Bitcoin in our latest interview w… https://t.co/5wOG9Q1QcS"
1576603142162186242,2022-10-02 16:00:55+00:00,🎙️Our lovely host @PigniGiovanni sat down with forex trader and crypto analyst @alessiorastani to discuss the decli… https://t.co/dfOqFK1sJ5
1576602910208806912,2022-10-02 16:00:00+00:00,You have exactly 40 hours to tune in The Market Report and not missing the coolest analysis by @BY_DeFi… https://t.co/1IEn8aqGxY
1576587971205238789,2022-10-02 15:00:38+00:00,Thoughts? https://t.co/Hsv5OclOn8
1576572810956259328,2022-10-02 14:00:24+00:00,Dexter has mad game y'all: https://t.co/luMRqcpjBY
1576559894798675968,2022-10-02 13:09:04+00:00,"The Terra collapse has put stablecoins between a rock and a hard place, as regulators keep citing it when having re… https://t.co/BnsLpTsLVH"
1576557615445934080,2022-10-02 13:00:01+00:00,We had the chance to sit down with Tennis legend @MariaSharapova and discuss her stance on NFTs and her passion for… https://t.co/jZu6kiZIFJ
1576542564043395074,2022-10-02 12:00:12+00:00,Do you know what is wrapped Ethereum or wETH? How different is it from regular ETH? Learn more and improve your cry… https://t.co/I16u1vSJQR
1576527551643750400,2022-10-02 11:00:33+00:00,We had the chance to sit down with Tennis legend @MariaSharapova and discuss her stance on NFTs and her passion for… https://t.co/qa4frTl3rv
1576520649430159360,2022-10-02 10:33:07+00:00,So what did The Merge do for #Ethereum? Data reveals a positive impact. https://t.co/3ylbKRYDWU
1576512347413282816,2022-10-02 10:00:08+00:00,"Let's talk impact!

 Learn more on how can cryptocurrencies protect against inflation and help economies in times o… https://t.co/HQpHF828Vf"
1576502767312842753,2022-10-02 09:22:04+00:00,"No sign of ""Uptober"" yet — can Bitcoin clinch another run at $20,000? https://t.co/FRFGSNPlCL"
1576482132570083330,2022-10-02 08:00:04+00:00,"Your nearest Bitcoin ATM may not be there anymore.

New data reveals that the total number of Bitcoin ATMs installe… https://t.co/pHD99skkGv"
1576459479759060992,2022-10-02 06:30:03+00:00,United States Senator Bill Hagerty is seeking a safe harbor for crypto exchanges from “certain” SEC enforcement act… https://t.co/Ex4U25e47O
1576457966924214273,2022-10-02 06:24:03+00:00,An internal bug in Transit Swap allowed a hacker to make away with $21 million. The episode further highlights the… https://t.co/Zf46VzGNxj
1576444379048419329,2022-10-02 05:30:03+00:00,Wisdom of the day: with great valuations comes great scrutiny from tech-savvy financial regulators. https://t.co/1TZUjWX9ob
1576421717064519680,2022-10-02 04:00:00+00:00,Do you know what is wrapped Ethereum or wETH? How different is it from regular ETH? Learn more and get smarter. https://t.co/897LwMpEBx
1576406622032859139,2022-10-02 03:00:01+00:00,We had the chance to sit down with Tennis legend @MariaSharapova and discuss her stance on NFTs and her passion for… https://t.co/hdS95bmTJy
1576391532936155141,2022-10-02 02:00:04+00:00,"Let's talk impact! 

How can cryptocurrencies protect against inflation and help economies in times of recession? L… https://t.co/c0Ms13OfLi"
1576368886538190848,2022-10-02 00:30:04+00:00,"Are you more of a Werewolf fan or a Frankenstein lover?

Don't be scared to check out our new Halloween collection.… https://t.co/H20Fqmf1kD"
1576361329719386113,2022-10-02 00:00:03+00:00,"The nearest Bitcoin ATM to you may not be there anymore. 

Data confirms that the total number of Bitcoin ATMs inst… https://t.co/N5NZqZoXrZ"
1576331214675484674,2022-10-01 22:00:23+00:00,The new legislation could guarantee a safe harbor for crypto exchanges from “certain” SEC enforcement actions. https://t.co/1zTHluZTGx
1576321694436044800,2022-10-01 21:22:33+00:00,Decentralizing data on Web3 would reduce Uber's vulnerability to hackers. The company should take advantage of the… https://t.co/b4LkEoXFg1
1576318064911847424,2022-10-01 21:08:07+00:00,The California Department of Financial Protection and Innovation accused 11 entities last month of violating state… https://t.co/CXm7lXo6kJ
1576316039129956354,2022-10-01 21:00:04+00:00,You know what they say: with great valuations comes great scrutiny from tech-savvy financial regulators. https://t.co/1TZUjWX9ob
1576308470609051650,2022-10-01 20:30:00+00:00,Hong Kong-based Amber Group shows how easy it was to hack Wintermute with simple gear available to regular consumer… https://t.co/Yr0gxsRbHg
1576300951027204097,2022-10-01 20:00:07+00:00,Do you know what is wrapped Ethereum or wETH? How different is it from regular ETH? Find out more about the topic.  https://t.co/897LwMpEBx
1576292473516699649,2022-10-01 19:26:26+00:00,RT @Cointelegraph: What your older family members see when you’re trying to explain crypto to them: https://t.co/rP1ooVqFCT
1576285950598152193,2022-10-01 19:00:31+00:00,🤣 https://t.co/gQpiSP17xa
1576276261235728384,2022-10-01 18:22:01+00:00,Describe this market in three emojis 👇
1576270870791815170,2022-10-01 18:00:35+00:00,"Let's talk impact!

Find out how can cryptocurrencies protect against inflation and help economies in times of rece… https://t.co/bhbzaso7ur"
1576270223199584258,2022-10-01 17:58:01+00:00,"Why get cold on the last summer nights of the season when you could have a Bitcoin hoodie?

Get yours today, and ge… https://t.co/SxcUFeB0lS"
1576255723343941633,2022-10-01 17:00:24+00:00,"Nexo is in deep waters. 

The crypto platform is facing serious allegations after a wallet with the same name withd… https://t.co/BAh3NqJHFy"
1576248071436079108,2022-10-01 16:30:00+00:00,"Connecting blockchain and the planet.

Here is how good ideas can contribute to fighting climate change.
(Via… https://t.co/YEqVi4dqwu"
1576240762370625538,2022-10-01 16:00:57+00:00,"The nearest Bitcoin ATM to you may not be there anymore. 

According to data, the total number of Bitcoin ATMs inst… https://t.co/ffBLmGg0bA"
1576240702287187968,2022-10-01 16:00:43+00:00,"If you like having the best crypto analysis in the space, you have a date with @BY_DeFi @noshitcoins &amp; @forgeforth_… https://t.co/lIc3iZr6o5"
1576237255194480640,2022-10-01 15:47:01+00:00,What your older family members see when you’re trying to explain crypto to them: https://t.co/rP1ooVqFCT
1576225495980679169,2022-10-01 15:00:17+00:00,"Do you know what is ""regenerative finance"" or ""ReFi""?

Find out how this new concept can help promote environmental… https://t.co/H8P9uiRWcK"
1576224323999875078,2022-10-01 14:55:38+00:00,"As Web3 grows, a burning issue has emerged: How can users demonstrate credibility and trustworthiness across multip… https://t.co/TZYiMJqb0A"
1576210340295098376,2022-10-01 14:00:04+00:00,The new legislation is seeking a safe harbor for crypto exchanges from “certain” SEC enforcement actions. https://t.co/1zTHluZTGx
1576202411102076928,2022-10-01 13:28:33+00:00,We sat down with Tennis legend Maria Sharapova to discuss her growing interest in Web3. This is what she had to say: https://t.co/8N8fVZzYhK
1576195349428977664,2022-10-01 13:00:30+00:00,You know what they say… with great valuations comes great scrutiny from tech-savvy financial regulators. https://t.co/1TZUjWX9ob
1576181409617948672,2022-10-01 12:05:06+00:00,"Have you ever heard of wrapped Ether? While it has the same value as its unwrapped counterpart, there is so much mo… https://t.co/uDFkN1fPWS"
1576181400897990656,2022-10-01 12:05:04+00:00,"As the world deals with inflation and growing concern over a potential recession, what role will crypto have during… https://t.co/vxDago7kCI"
1576180203793121280,2022-10-01 12:00:19+00:00,"Bitcoin is in the spotlight. 

A 6.5% increase in the last seven days left the mainstream media no choice but to pu… https://t.co/usAq4NgzzR"
1576172463725375488,2022-10-01 11:29:33+00:00,"All eyes on Nexo as 7,758.8 WBTC transferred from MakerDAO to a wallet named Nexo: 0x8fd https://t.co/EgCL0OmLNF"
1576142394289954816,2022-10-01 09:30:04+00:00,"Did you buy your Bitcoin for more than $30K?

Charts show traders who entered the market between 6 and 18 months ag… https://t.co/KGPsUEOUHT"
1576136628124667905,2022-10-01 09:07:10+00:00,There's a first time for everything: Total active #Bitcoin ATMs dipped in September 2022. What do you think changed? https://t.co/H5j0fCcWQp
1576110673016365057,2022-10-01 07:24:01+00:00,4 steps to using the Lens Protocol https://t.co/56ae4Hd9Ts
1576090585202847744,2022-10-01 06:04:12+00:00,Sen. Bill Hagerty introduces a bill seeking regulatory clarity to encourage investments and job creation in #crypto. https://t.co/Ug0GyGNA7Q
1576063104802234368,2022-10-01 04:15:00+00:00,"Bitcoin is in the spotlight. 

A 6.5% increase in the last week left the media no choice but to put BTC in the head… https://t.co/iRDk8Nl9Gt"
1576053540858073088,2022-10-01 03:37:00+00:00,Hong Kong-based Amber Group reproduces Wintermute hack with a MacBook in less than 48 hours.  https://t.co/IZn6kqTBRS
1576048006482300929,2022-10-01 03:15:00+00:00,"Decentralization becomes a serious matter for elections.

Data from polls suggest voters are more likely to lean fo… https://t.co/e3x7mMVNks"
1576044261216292865,2022-10-01 03:00:08+00:00,"Four key factors continue to place pressure on BTC price, says @big_smokey1. https://t.co/zW8Opm9vMP"
1576040454864486401,2022-10-01 02:45:00+00:00,"Do you know what is ""regenerative finance"" or ""ReFi""?

Find out how this concept can help promote environmental and… https://t.co/CkxUOAr0Um"
1576034665835675650,2022-10-01 02:22:00+00:00,"Did you buy Bitcoin for more than $30K?

Charts show traders who entered the market between 6 and 18 months ago hav… https://t.co/kAp2h3c3PR"
1576027116625330176,2022-10-01 01:52:00+00:00,The winner of the Voyager auction is... https://t.co/PtPrwN3uos
1576021579330457600,2022-10-01 01:30:00+00:00,"Bitcoin and altcoins hold well and didn't give up much ground on the last day of September. 

How are we starting t… https://t.co/NhBIMfV86o"
1576017806276980736,2022-10-01 01:15:00+00:00,"While war crimes are unfortunately still part of the world today, blockchain could be able to help verify and repor… https://t.co/3Zwu0UlrL0"
1576010261735022595,2022-10-01 00:45:01+00:00,"We all need Halloween as much as your coffee needs this mug.

The cool thing is that the mug lasts all year long.… https://t.co/exHte38Ya0"
1576004468252065793,2022-10-01 00:22:00+00:00,"Let’s talk about DEX, baby. 

Major decentralized exchange @Uniswap is in the early stages of raising funds to furt… https://t.co/lIBFEj2n3p"
1576000693508476935,2022-10-01 00:07:00+00:00,"Todd allegedly pumped up the price of DGTX tokens in an effort to inflate Digitex’s holdings, according to court fi… https://t.co/TDZfkyGe9S"
1575999454884532224,2022-10-01 00:02:05+00:00,"A regulatory reckoning is coming for Axie Infinity, Bored Apes, and other projects that have thrown caution to the… https://t.co/qcmCCUCuwC"
1575996720705437696,2022-09-30 23:51:13+00:00,Double-checking the wallet address after sending crypto https://t.co/C3giitgfQd
1575995156477759489,2022-09-30 23:45:00+00:00,"Decentralization becomes a serious matter for elections.

Data suggests voters are more likely to lean for a pro-cr… https://t.co/CqjSZsD7tM"
1575991380056367105,2022-09-30 23:30:00+00:00,Web3 is common knowledge that nobody understands yet. But @CointelegraphZN can shine some light. https://t.co/Hkd7OYKQ7K
1575984005060694047,2022-09-30 23:00:41+00:00,Serious work! https://t.co/rOBCy4KIEf
1575978042857558034,2022-09-30 22:37:00+00:00,What does luxury look like in the world of NFT? https://t.co/F88USh7SJI
1575972507651395584,2022-09-30 22:15:00+00:00,"Bitcoin is in the spotlight. 

A 6.5% increase in the last seven days left the media no choice but to put BTC in th… https://t.co/R1hu0WkV4K"
1575968857403047950,2022-09-30 22:00:30+00:00,"When in doubt, maybe zoom out farther this time. 

Bitcoin's long-term profitability declines to levels last seen d… https://t.co/FfXNfWkpLx"
1575964958294253569,2022-09-30 21:45:00+00:00,"Elon Musk’s effort to purchase Twitter almost had a high-profile wingman. 

Crypto billionaire and CEO of FTX excha… https://t.co/0SKR00pxtW"
1575962256789016576,2022-09-30 21:34:16+00:00,"Watching your friends buy into a project, praying the smart contracts have been audited. https://t.co/RBaArvJ8gc"
1575961458411999232,2022-09-30 21:31:06+00:00,"Nobody knows if “fortune” will continue “to favor the brave,” but @Big_Smokey1 says 5 critically important Bitcoin… https://t.co/Chb7GF9jOo"
1575961450170167296,2022-09-30 21:31:04+00:00,"If you don’t register, the CFTC is going to come for you, and they’re doing just that with this exchange. Read more… https://t.co/YqUZsibqym"
1575961199350530056,2022-09-30 21:30:04+00:00,"Crypto is only a decentralized Ponzi scheme according to JPMorgan CEO Jamie Dimon. 

More memorable quotations from… https://t.co/Am8oxr8cz8"
