id,created_at,text1551525070677360643,2022-07-25 11:09:37+00:00,"@ezrareguerra According to Boston Consulting Group, only 0.3% of individual wealth is invested in crypto, which is… https://t.co/oPIiTFKJtR"
1551523527571955715,2022-07-25 11:03:29+00:00,"Drop closing in TWO HOURS

If you had a chance at receiving drawings from a multi-million dollar collection by Cris… https://t.co/1hbh5i2ZCC"
1551522956970524672,2022-07-25 11:01:13+00:00,"What will virtual reality look like in the Metaverse? 

Experts are divided on the technology’s potential role. https://t.co/gKExvXAKg0"
1551518891326701569,2022-07-25 10:45:04+00:00,"Resistance returned over the weekend, but optimism is still cautiously rising as we enter Monday. 

Are you expecti… https://t.co/yTd8Dm4DI3"
1551516079373144064,2022-07-25 10:33:53+00:00,"The Merge, a long-awaited upgrade that will complete Ethereum’s transition from a proof-of-work (PoW) to a proof-of… https://t.co/h8NVdIlxmG"
1551515102758768642,2022-07-25 10:30:00+00:00,"It's time for class in the Metaverse. 

The University of Tokyo, also known as Todai, is set to offer a range of st… https://t.co/4BkT53F1zO"
1551511850998632450,2022-07-25 10:17:05+00:00,Thailand’s SEC launched an online reporting form for Zimpex customers affected by withdrawals’ pause after asking t… https://t.co/ycL3ltFdAC
1551509828714909696,2022-07-25 10:09:03+00:00,"Tether, Bitfinex and Hypercore took the bear market for building motto seriously with the launch of an encrypted P2… https://t.co/kYcZSy1Hud"
1551509804228689921,2022-07-25 10:08:57+00:00,"“Ethereum does have, just from an economic perspective and because of the effect of the supply shock, a chance to f… https://t.co/7QoSHpu1Rg"
1551507822202032128,2022-07-25 10:01:05+00:00,"Law firm Scott+Scott alleges that Yuga Labs promoted a chance at huge returns on investment to ""unsuspecting invest… https://t.co/tlYqEQQ7t9"
1551500521705336833,2022-07-25 09:32:04+00:00,"Paystand CEO Jeremy Almond said that during the bear market, companies who are making the most impact will naturall… https://t.co/51rEsodRU4"
1551500027188715523,2022-07-25 09:30:06+00:00,Stablecoin projects need to take a more collaborative approach to grow each other's liquidity and the ecosystem as… https://t.co/gNyoUeur0C
1551492490406019072,2022-07-25 09:00:09+00:00,Voyager Digital Holdings has rejected an offer from FTX and its investment arm Alameda Ventures to buy out its digi… https://t.co/etwH0ndx60
1551484989971349505,2022-07-25 08:30:21+00:00,"Are you bullish about the new week? 

If Bitcoin clears its overhead resistance level, ETH, BCH, AXS, and EOS could… https://t.co/ruUsLV3RIH"
1551479114317631489,2022-07-25 08:07:00+00:00,"Currently, crypto laws and regulations are inconsistent in Asian countries. The regulatory framework is fragmented… https://t.co/M2jQfwj1YV"
1551473088386048006,2022-07-25 07:43:03+00:00,Bitcoin misses a key weekly close level ahead of Fed rate hike week. https://t.co/BjJif47Poh
1551469824055861249,2022-07-25 07:30:05+00:00,"If you had a chance at receiving drawings from a multi-million dollar collection by Cristóbal Balenciaga, would you… https://t.co/ykjg43dgmg"
1551464016240852993,2022-07-25 07:07:00+00:00,"Buckle up!

If you want Bitcoin to avoid a crash, it must stay around the $20,000 mark, suggests a trader. https://t.co/j96rq7ia0q"
1551452827553124352,2022-07-25 06:22:33+00:00,"The University of Tokyo is launching a Metaverse study program, offering students a chance to take courses in engin… https://t.co/tOh64kSady"
1551451322095833088,2022-07-25 06:16:34+00:00,"Are VR Metaverses a fad or the future? Experts say there’s a natural fit for VR within the Metaverse, but some beli… https://t.co/V44kEHBn3D"
1551450625598185472,2022-07-25 06:13:48+00:00,Less than 7 hours left on the drop! Grab an NFT while you still can 🚀 https://t.co/WwxNoJgudF
1551447159404462080,2022-07-25 06:00:01+00:00,"BTC miners might need an accountant because their expenses are going up in comparison to their income. 

Here's why: https://t.co/dsA3KRn6AL"
1551432185378488321,2022-07-25 05:00:31+00:00,"You’re still early!

A report by Boston Consulting Group projects one billion crypto users in 2030. 

(Reporting vi… https://t.co/QD4qD5uSns"
1551416990673289217,2022-07-25 04:00:09+00:00,The real estate industry has been a staple in the traditional finance world for almost centuries but combined with… https://t.co/pEgFSSsLn9
1551412685287264257,2022-07-25 03:43:02+00:00,Yuga Labs is facing a potential class action lawsuit for allegedly using celebrity endorsement to pump the price of… https://t.co/FcoGrex1x3
1551401878474424321,2022-07-25 03:00:06+00:00,"Major corporations have already launched in the Metaverse, but is there room for everyone? 

For small businesses l… https://t.co/9x7bHA04DI"
1551397838931693569,2022-07-25 02:44:03+00:00,"Can't we all just get along? Sam Kazemian, founder of Frax Finance believes that stablecoins need to collaborate, n… https://t.co/xPjARVp23H"
1551396834115043331,2022-07-25 02:40:03+00:00,"Now's your chance to snipe an Ultra Rare NFT from the To the Moon collection for $100!

Ultra Rares are going for 1… https://t.co/r3KfGblRWB"
1551386780141850627,2022-07-25 02:00:06+00:00,"🇺🇦 Ukraine will invest $1.3 million from NFT sales in the restoration of cultural institutions.

“Blockchain techno… https://t.co/TaBIJBgzGA"
1551386387684896769,2022-07-25 01:58:32+00:00,Voyager Digital’s lawyers have balked at Sam Bankman-Fried’s proposal to buy out its digital assets and outstanding… https://t.co/2nnTnPeRFB
1551371776344604675,2022-07-25 01:00:29+00:00,"Rejoice Cali residents. 

California lifts the crypto ban, and donations for candidates running for local and state… https://t.co/gJejxDinyn"
1551364150751797250,2022-07-25 00:30:11+00:00,"Ethereum lover? 

Put yourself ahead of the Merge celebrations by swimming in the sea with style. You can pay in cr… https://t.co/Qdv50pshOq"
1551359844338352129,2022-07-25 00:13:04+00:00,"Last chance to mint a Cristóbal Balenciaga: To The Moon NFT!🏃

Only 12 hours left ⏰

Mint NOW 👇 https://t.co/VtLkNxOnBQ"
1551356692381720577,2022-07-25 00:00:32+00:00,"Will ETH become the world's #1 cryptocurrency? 

In our recent interview with Vivek Raman, an ETH researcher, we di… https://t.co/bRQsBTnncG"
1551343223607644163,2022-07-24 23:07:01+00:00,"Do you want to know how to get the maximum crypto value out of your shrinking fiat?

Here are some tips: https://t.co/WBxjVIVCfk"
1551328130643673088,2022-07-24 22:07:03+00:00,"What would you do if you won one of Cristóbal Balenciaga’s original drawings?

Frame it on the wall? Sell it to an… https://t.co/AQ2wLzmemp"
1551326415223652356,2022-07-24 22:00:14+00:00,"Exploit alert!

A hacker made away with over $1 million from exploiting decentralized music platform Auduis. https://t.co/f8Bzp0ZP6I"
1551311389565779968,2022-07-24 21:00:31+00:00,"Is tokenomics really to blame? 🔊 @crypto_raiders founders @SpeculatorArt, @davvv and @cryptotyrael chat with… https://t.co/b99UeNt8et"
1551303724965961734,2022-07-24 20:30:04+00:00,"It’s not every day that you get a chance to own a piece of fashion history!  

Cristóbal Balenciaga’s genius is imm… https://t.co/hhfEZITqSx"
1551296306194300928,2022-07-24 20:00:35+00:00,"Our six questions this week go to @thisisPatDuffy, co-founder of @TheGivingBlock, which raised over $100,000,000 in… https://t.co/37OPrFfoyf"
1551292140558225408,2022-07-24 19:44:02+00:00,Bitcoin’s shallow correction to lower support levels increases the possibility of a move higher and this could trig… https://t.co/tEJKlNz7FB
1551288624376958977,2022-07-24 19:30:04+00:00,"🚨Down to the FINAL hours of the To the Moon NFT drop🚨

-Exquisite Art 💃 
-Exciting Redeemables 💰 
-Strong Resale Vo… https://t.co/ymiaHaFFKQ"
1551281718123954181,2022-07-24 19:02:37+00:00,"RT @Cointelegraph: 🚀 TO THE MOON CONTEST 🧑‍🚀

$1K giveaway &amp; an ORIGINAL drawing from Cristóbal Balenciaga 💃

Rules:
1️⃣ RT + 🧡
2️⃣ Tag 3 f…"
1551281060847165441,2022-07-24 19:00:00+00:00,"Will ETH become the world's leading cryptocurrency? 

In our recent interview with Vivek Raman, an ETH researcher,… https://t.co/KDDXlxdMJy"
1551266013265764354,2022-07-24 18:00:13+00:00,"Uh oh, another crash might be on the way for AXS! https://t.co/xkLZZGEvpk"
1551258445499842561,2022-07-24 17:30:09+00:00,"Now's your chance to snipe an Ultra Rare NFT from the To the Moon collection for $100!

Ultra Rares are going for 1… https://t.co/HxNlwTCehy"
1551251023733342208,2022-07-24 17:00:39+00:00,"Could another country soon adopt #Bitcoin? 

Prince Philip of Serbia thinks so! https://t.co/9owIqBofoY"
1551245212323758082,2022-07-24 16:37:34+00:00,What will the transition to PoS mean for #Ethereum? Will #TheMerge help ETH take over #Bitcoin? Find out in our lat… https://t.co/PMQyuu5kZb
1551243380423794688,2022-07-24 16:30:17+00:00,"RT @Cointelegraph: The To The Moon NFT drop is going BIG on secondary 😲 

You'll find 3x, 4x, even 18x sale price!

Hodlers just may get:
✨…"
1551242324453253121,2022-07-24 16:26:05+00:00,"We are LIVE! 🔥

Come get a history lesson from @animalconcerts, @rebeccalhaynes, and @0xBrady_  to learn about the… https://t.co/R6xLe7zLq4"
1551236127767826433,2022-07-24 16:01:28+00:00,"Will ETH become the world's leading cryptocurrency? 

In our recent interview with @VivekVentures, an ETH researche… https://t.co/UgTBhCkC6h"
1551223014368452608,2022-07-24 15:09:21+00:00,The never before seen collection of original drawings by Cristóbal Balenciaga is being given away to select NFT hol… https://t.co/FPnHlSdMxY
1551220794268815360,2022-07-24 15:00:32+00:00,"Buckle up.

If you want Bitcoin to avoid a crash, it must stay around the $20,000 mark, suggests a trader. https://t.co/j96rq7ia0q"
1551215865995067392,2022-07-24 14:40:57+00:00,"If you like #Formula1 and crypto, here is a post-race read:

https://t.co/67XqL9wKbb"
1551214458965458946,2022-07-24 14:35:21+00:00,"The Ferrari team getting P1 🤝 The ETH merge

Getting delayed"
1551212136319295488,2022-07-24 14:26:08+00:00,"With high-profile crypto hacks regularly hitting the headlines, smart contract audits have never been more importan… https://t.co/ZSBuPS47pz"
1551207967474606080,2022-07-24 14:09:34+00:00,Anoth big crash could be on the horizon for Axie Infinity AXS. https://t.co/gTQyV1ry04
1551206798375387137,2022-07-24 14:04:55+00:00,"🚨 Only 24 HOURS remain until the To the Moon NFT drop concludes 🚨
 
If you’re still on the fence, better HUSTLE bec… https://t.co/NwZXxcZOL7"
1551205994017030144,2022-07-24 14:01:43+00:00,"RT @CointelegraphZN: Our six questions this week go to @thisisPatDuffy, co-founder of @TheGivingBlock, which raised over $100,000,000 in cr…"
1551205698532433922,2022-07-24 14:00:33+00:00,"Exploit alert.

A hacker made away with over $1 million from exploiting decentralized music platform Auduis. https://t.co/f8Bzp0ZP6I"
1551201593600921600,2022-07-24 13:44:14+00:00,"RT @Cointelegraph: 🚀 ONCE IN A LIFETIME CONTEST 🧑‍🚀

$1000 giveaway &amp; an ORIGINAL drawing from a multi-million dollar collection by Cristób…"
1551190566163156994,2022-07-24 13:00:25+00:00,"You’re still early. 

A report by Boston Consulting Group projects one billion crypto users in 2030. 

(Reporting v… https://t.co/qRd6066VvB"
1551182447794163715,2022-07-24 12:28:09+00:00,"RT @CointelegraphZN: The 3AC saga continues, Minecraft bans NFTs and more exciting news in our Hodler's Digest. https://t.co/udhlLTMvrI"
1551179778862075906,2022-07-24 12:17:33+00:00,"The To The Moon NFT drop is going BIG on secondary 😲 

You'll find 3x, 4x, even 18x sale price!

Hodlers just may g… https://t.co/DU75GsmT0J"
1551175524852154369,2022-07-24 12:00:39+00:00,The real estate industry has been a staple in the traditional finance world for a very long time. Combined with the… https://t.co/Cchwef59GD
1551160307459964928,2022-07-24 11:00:11+00:00,"Major corporations have already launched in the Metaverse, but is there room for everyone? 

For small businesses l… https://t.co/6qzbd4N9F9"
1551153475676827651,2022-07-24 10:33:02+00:00,"Can Bitcoin avoid diving below $15,000 with a solid weekly close? https://t.co/LoSzjLk9N5"
1551145309170016257,2022-07-24 10:00:35+00:00,"What are the differences between proof-of-time and proof-of-stake? 

Let us tell you: https://t.co/vfZfVMa6xG"
1551130205430898688,2022-07-24 09:00:34+00:00,#Bitcoin miners might need an accountant because their expenses are going up in comparison to their income. Here's… https://t.co/KuFt8GM92T
1551114964802363392,2022-07-24 08:00:00+00:00,Will this bank prop up digital currency after the Central African Republic adopted #Bitcoin as a legal tender? https://t.co/KySysjKQYD
1551103643314708485,2022-07-24 07:15:01+00:00,"DeFi is celebrating gains as many tokens hit double-digit returns and Razer gets into crypto. 

We have the details… https://t.co/SZmDqhZuHS"
1551092373354070016,2022-07-24 06:30:14+00:00,"The To The Moon NFT drop is going BIG on secondary 😲

You'll find 3x, 4x, even 18x sales!

Hodlers just may get:
✨N… https://t.co/7wkr4VVc06"
1551084788571848708,2022-07-24 06:00:06+00:00,"Do you want to know how to get the maximum crypto value out of your shrinking fiat?

Here are some tips. https://t.co/WBxjVIVCfk"
1551076599625175045,2022-07-24 05:27:33+00:00,Hacker receives 18 million $AUDIO tokens (worth $5.9 million) as the community approves malicious governance propos… https://t.co/P1Gal20gzh
1551069796854374400,2022-07-24 05:00:31+00:00,The real estate industry has been a staple in the traditional finance world for centuries but combined with the use… https://t.co/Hyr041B5AS
1551054588731596800,2022-07-24 04:00:05+00:00,"What's going on with 3AC now? 

Glad you asked, buckle up. https://t.co/wsd33pzRSB"
1551039610008080389,2022-07-24 03:00:34+00:00,"California lifts the crypto ban, and donations for candidates running for local and state offices are allowed again. https://t.co/tktMfgSSCn"
1551024368431644675,2022-07-24 02:00:00+00:00,"Bitcoin miners might need an accountant because their expenses are going up in comparison to their income. 

Here's… https://t.co/L8yZL5v0fu"
1551009268169580545,2022-07-24 01:00:00+00:00,Here's how proof-of-time is different from proof-of-stake. https://t.co/vfZfVMa6xG
1551001739888820224,2022-07-24 00:30:05+00:00,"There is no reason not to shine like a crypto star.

And yes, you can pay in crypto.
https://t.co/1JS7GhImFL https://t.co/de4ruTurlA"
1550995685603950593,2022-07-24 00:06:02+00:00,"RT @Cointelegraph: 🧵- THREAD

These historic drawings are going to be given to select NFTs holders of the Cristóbal Balenciaga: To The Moon…"
1550994226762203139,2022-07-24 00:00:14+00:00,"Sports and NFTs seem compatible, but the fans want to move past the hype.

They'd prefer making investments based o… https://t.co/aXII2sq1kZ"
1550994188623388672,2022-07-24 00:00:05+00:00,"Don’t forget to jump into our HUGE CONTEST! 👇

We are giving away one drawing from the multi-million dollar collect… https://t.co/xdi1CbQGwD"
1550986634413412353,2022-07-23 23:30:04+00:00,"Animoca Brands' co-founder called out Mojang Studios, claiming that their decision to ban NFTs is ""hypocritical."" https://t.co/RTn27nmUrf"
1550964090016862214,2022-07-23 22:00:29+00:00,"Miners: Here's a breath of fresh air.

It is now 5% easier to mine #Bitcoin. https://t.co/hIyx7n9CPQ"
1550952395705913344,2022-07-23 21:14:01+00:00,"A few ultra-rares have already been minted, one selling for $1800 on the secondary market! 

Redeemables include $1… https://t.co/t5D3czT8d8"
1550950633049657344,2022-07-23 21:07:00+00:00,"ETH has been seeing gains recently, rebounding 40% against BTC since June 13, but according to a classical pattern,… https://t.co/wVaATG90kn"
1550948882221236225,2022-07-23 21:00:03+00:00,"Is blockchain gaming dead? 🚨 @crypto_raiders founders @SpeculatorArt, @davvv and @cryptotyrael chat with @ohihello1… https://t.co/Ivx1RDKClE"
1550943847814946819,2022-07-23 20:40:03+00:00,"If you had a chance at receiving drawings from a multi-million dollar collection by Cristóbal Balenciaga, would you… https://t.co/GG62eXKUul"
1550941322319626241,2022-07-23 20:30:00+00:00,BTC miners might need an accountant because their expenses are going up in comparison to their income. Here's why: https://t.co/dsA3KRn6AL
1550933911705903105,2022-07-23 20:00:34+00:00,Hmm... How are they going to do it? https://t.co/EALxLNsd6H
1550926785977749505,2022-07-23 19:32:15+00:00,"Don't miss your chance at some designer gear, gift cards, or even an original drawing by Cristóbal Balenciaga! 🔥😲… https://t.co/MqhGLiI87m"
1550922728135327746,2022-07-23 19:16:07+00:00,"🚀 ONCE IN A LIFETIME CONTEST 🧑‍🚀

$1000 giveaway &amp; an ORIGINAL drawing from a multi-million dollar collection by Cr… https://t.co/UIlWk1VucZ"
1550918823355858944,2022-07-23 19:00:36+00:00,Here's how proof-of-time is different from proof-of-stake: https://t.co/vfZfVMa6xG
1550903746900754434,2022-07-23 18:00:42+00:00,"Is blockchain gaming in good health?

NFT Steez hosts Alyssa Exposito and Ray Salmond interviewed @crypto_raiders f… https://t.co/uYq7VLpP1G"
1550901064236355584,2022-07-23 17:50:02+00:00,More gains are anticipated for ETH/BTC ahead due to a cup and handle setup. https://t.co/7hQ1PJ9bzG
1550893256434765826,2022-07-23 17:19:01+00:00,"Are you feeling HAUTE yet? 🔥 

One of these dresses could be yours to wear in the metaverse!

Get your hands on the… https://t.co/FL8FktBBJ2"
1550888864683810818,2022-07-23 17:01:34+00:00,@kk_capital Calling Guenther rn 📞
1550888600665001986,2022-07-23 17:00:31+00:00,Not too shabby! A new report by Boston Consulting Group predicts that Crypto will reach 1 billion users in 8 years. https://t.co/tb3T11Ms4d
1550879872511246338,2022-07-23 16:25:50+00:00,"Live on Instagram talking markets, all thing NFTs, and the Cristobal Balenciaga drop!

We are ALSO talking to the c… https://t.co/vc18nxxLwk"
1550875921791565825,2022-07-23 16:10:08+00:00,@oneclicreator An art project
1550875697358553089,2022-07-23 16:09:14+00:00,"@kk_capital We are not an F1 stan account, yet..."
1550875153835368448,2022-07-23 16:07:05+00:00,"George Russel is the type of guy to say ""oh my, what do we have here"" when he sees the price of ETH go up. #FrenchGP"
1550873540752187393,2022-07-23 16:00:40+00:00,"""So If I buy a Nickelodeon NFT, can the utility mean that I can meet SpongeBob? Asking for a friend...""

Check out… https://t.co/0iQ14gF6Ac"
1550866247033790465,2022-07-23 15:31:41+00:00,"The original drawings seen in the article are a priceless value add to our community. 

We couldn't be more excited… https://t.co/PpGeMvgv1q"
1550865883584659456,2022-07-23 15:30:14+00:00,"Run, Bitcoin, run. https://t.co/KzBV1sMOqN"
1550865082174918656,2022-07-23 15:27:03+00:00,"The drawings that we are giving away are part of a multi-million dollar collection. 

These are original art pieces… https://t.co/3w2fGCj8KO"
1550858394025820161,2022-07-23 15:00:29+00:00,"While sports and NFTs seem compatible, the fans want to move past the hype.

They'd prefer making investments based… https://t.co/5YcuZN4bMb"
1550853254002757634,2022-07-23 14:40:03+00:00,"The secondary market is on fire for the To The Moon NFT collection! 🔥

Hyper-rares selling for 4x 😲

Ultra-rares se… https://t.co/OPPmNMV6Yk"
1550851244188524544,2022-07-23 14:32:04+00:00,"When it comes to profitability for Bitcoin miners, it's determined by much more than price. What's causing the decl… https://t.co/y9t689emqp"
1550848243973718018,2022-07-23 14:20:09+00:00,"Do you think @kevinolearytv is still increasing his crypto bags? 🧐 

Full interview: https://t.co/EaKSPfzBil https://t.co/1B0qjRrPDL"
1550846952245436421,2022-07-23 14:15:01+00:00,"We have had hyper-rare Cristóbal Balenciaga: To The Moon NFTs sell for 4x the purchase price! 🙀

You don't want to… https://t.co/mwG24mjnPY"
1550844014144143360,2022-07-23 14:03:20+00:00,"Snag your NFT NOW for a chance to become part of Web3 fashion history 🏆

We are still LIVE on @cryptocomnft!

Go he… https://t.co/k2gBX3ksbq"
1550843176348520450,2022-07-23 14:00:01+00:00,"The co-founder of Animoca Brands called out Mojang Studios, claiming that their decision to ban NFTs on Minecraft i… https://t.co/UyqG90U3XF"
1550842815546114049,2022-07-23 13:58:35+00:00,"MASSIVE REDEEMABLES

🔸 Designer bags
🔸 $500 gift cards
🔸 Metaverse concert tickets to your favorite artists
🔸 Origi… https://t.co/BekOkc6caO"
1550841819021410306,2022-07-23 13:54:37+00:00,"🧵- THREAD

These historic drawings are going to be given to select NFTs holders of the Cristóbal Balenciaga: To The… https://t.co/dgnSQ0A8dL"
1550831357055488000,2022-07-23 13:13:03+00:00,"You've certainly heard of them, but do you know the differences between proof-of-work, proof-of-stake, and proof-of… https://t.co/1eySucKbSf"
1550828194441347073,2022-07-23 13:00:29+00:00,"Miners, here's a breath of fresh air.

It is now 5% easier to mine #Bitcoin. https://t.co/hIyx7n9CPQ"
1550811491112292352,2022-07-23 11:54:06+00:00,"The secondary market is getting haute! 

There's only a limited supply of these stunning hyper-rare Cristobal Balen… https://t.co/sERtBgnyRP"
1550805176558260224,2022-07-23 11:29:01+00:00,"RT @animalconcerts: Beautiful drawings from the #ToTheMoon NFT Collection 😍

If you haven't gotten yours yet, don't miss out 💰

Get access…"
1550797892151132160,2022-07-23 11:00:04+00:00,"NFT Steez Episode 4 🔊 @crypto_raiders founders @SpeculatorArt, @davvv and @cryptotyrael chat with @ohihello1 and… https://t.co/NNJqExFZm4"
1550790841513390084,2022-07-23 10:32:03+00:00,#Sports and #NFTs go like peanut butter and jelly. But fans chose to move beyond the hype. https://t.co/u3qd69sOLj
1550752683069513735,2022-07-23 08:00:25+00:00,"Breath, @Zipmex clients.

After two days since they halted transactions, the Thailand-based firm is resuming withdr… https://t.co/eFXKmPwqOA"
1550741263158222849,2022-07-23 07:15:03+00:00,"Come experience the hottest fashion trends in the metaverse with the Cristobal Balenciaga ""To The Moon"" NFT collect… https://t.co/Zlr2wZ1oqQ"
1550737746339041281,2022-07-23 07:01:04+00:00,Was the Minecraft #NFT ban “hypocritical”? Animoca co-founder Yat Siu shares how #Minecraft excluded users and NFT… https://t.co/JsWGkHOxTq
1550715591677251584,2022-07-23 05:33:02+00:00,A life-changing window of opportunity: It is now officially 5% easier to mine #Bitcoin. https://t.co/5K2LfOhe4z
1550699764156612608,2022-07-23 04:30:09+00:00,"What's the latest news from 3AC? 

Glad you asked, buckle up. https://t.co/wsd33pzRSB"
1550673307967578113,2022-07-23 02:45:01+00:00,"Major corporations have already launched in the Metaverse, but is there room for everyone? 

For small businesses t… https://t.co/hpeIu9rqzZ"
1550665757046063104,2022-07-23 02:15:01+00:00,"You’re still early. 

A report by Boston Consulting Group predicts one billion crypto users in 2030. 

(Reporting v… https://t.co/a3QWCDTmyc"
1550652421239705603,2022-07-23 01:22:01+00:00,"Is blockchain gaming in good health?

NFT Steez hosts Alyssa Exposito and Ray Salmond interviewed @crypto_raiders f… https://t.co/Wgr4Njuxwq"
1550648645325832195,2022-07-23 01:07:01+00:00,"Be careful with getting overexcited.

Pro crypto traders warn this doesn't look like a solid recovery. https://t.co/mlsJorOv5z"
1550643106160283648,2022-07-23 00:45:00+00:00,"Could another country soon adopt Bitcoin?

(Reporting via @JoeNakamoto) https://t.co/1jSmhevIWv"
1550639383220551680,2022-07-23 00:30:13+00:00,"Welcome to Cyprus @cryptocom! 

The exchange became the latest crypto firm officially authorized to operate in the… https://t.co/XkaWhmo7Lx"
1550633547391803394,2022-07-23 00:07:01+00:00,"Ukraine will invest $1.3 million from NFT sales in the restoration of cultural institutions.

“Blockchain technolog… https://t.co/W14729oQKF"
1550632195525574656,2022-07-23 00:01:39+00:00,"A captivating look at Cristobal Balenciaga's original drawings from the 1950s.

Imagine getting a flashy, ultra-rar… https://t.co/rw3mE3TW6h"
1550628009702555648,2022-07-22 23:45:01+00:00,"Breath, @Zipmex clients.

After two days since they froze transactions, the Thailand-based firm is resuming withdra… https://t.co/okjnD2QZCY"
1550624270602358784,2022-07-22 23:30:09+00:00,"A cause for concern? 

Centralized crypto lender BlockFi discloses that as of the end of Q2, it had $1.8 billion in… https://t.co/h1lpArLDMu"
1550618444638339075,2022-07-22 23:07:00+00:00,"Do you want to know how to get the maximum crypto value out of your shrinking fiat?

Here are some tips. https://t.co/WBxjVIVCfk"
1550614672847544327,2022-07-22 22:52:01+00:00,"Bitcoin cools down and hovers at $23.5K after finding resistance at $24K.

In the meantime, ETH marked its highest… https://t.co/7x5tBzscOL"
1550611028731371526,2022-07-22 22:37:32+00:00,"RT @Cointelegraph: Looks like someone just minted a hyper-rare! 👀

Could they win a Balenciaga bag, an original drawing, or a massive gift…"
1550609192985284611,2022-07-22 22:30:15+00:00,"Would you buy a tokenized property? 

With a market cap 300 times greater than crypto, the real estate industry was… https://t.co/xzY57ZJFf2"
