id,created_at,text
1584190406291443713,2022-10-23 14:30:00+00:00,"Directional liquidity, what is it? and how does it benefit DeFi users? https://t.co/V4Co2PpgW1"
1584182939591376897,2022-10-23 14:00:20+00:00,"Who is @Zaptio and what is @RTFKT?

Find out right here: https://t.co/Hrs6tTzeSt https://t.co/naevDLUgcW"
1584178391233679361,2022-10-23 13:42:15+00:00,"Director of research at Chainanalysis, @KimberlyGrauer shares her opinion on the biggest issue currently in the ind… https://t.co/qspferNsYG"
1584175337805533184,2022-10-23 13:30:07+00:00,"From drinking water from a well as a kid to running one of the most successful crypto exchanges in the world.

This… https://t.co/yIqOO0QdP9"
1584167860750147584,2022-10-23 13:00:25+00:00,"Want to mint your own Solana NFTs? This is the guide for you.
https://t.co/XmiyvMZexw"
1584162827203678209,2022-10-23 12:40:24+00:00,An agreement on the use of robotics for the common good of humanity between @bengoertzel and @RealSophiaRobot at th… https://t.co/yrkzpBq3s8
1584154228540739584,2022-10-23 12:06:14+00:00,Morning Twitter! Have a... https://t.co/TRUtLSQhlZ
1584152814321684481,2022-10-23 12:00:37+00:00,WWVentures attract venture capital interest in recent funding blitz. https://t.co/RSEGIC09dF
1584146251993731073,2022-10-23 11:34:33+00:00,3Commas users noticed unauthorized trades for DMG cryptocurrency trading pairs on FTX. Investigations reveal a 3rd-… https://t.co/VCqnnhemTo
1584141334582992897,2022-10-23 11:15:00+00:00,More crypto regulation may be coming to the UK in the form of a new amendment. https://t.co/ZIA0GulGGI
1584137714051743745,2022-10-23 11:00:37+00:00,"Want to get into mining but don't have the setup for it? Worry not, your phone will also do the deed. https://t.co/xSE4KtlfRU"
1584130408585007104,2022-10-23 10:31:35+00:00,Energy-rich Kazakhstan is in no mood to leave its position as the third-largest #Bitcoin mining hub. https://t.co/8HZH6f0usf
1584130041881198592,2022-10-23 10:30:08+00:00,"Polkadot co-founder leaves his undesired CEO role at Parity, the development firm behind the ecosystem. https://t.co/Zp9hsStrp9"
1584126603160064000,2022-10-23 10:16:28+00:00,RT @Cointelegraph: Me at 3 AM wondering where I put my seed phrase: https://t.co/l5rBAo2dPz
1584122537440841729,2022-10-23 10:00:19+00:00,"New all-time highs are closer than many might think, says Credible Crypto, but so is a brutal bear market unlike an… https://t.co/BS0biDO5Gk"
1584107490383659008,2022-10-23 09:00:31+00:00,Minting Sloana NFTs simplified. Give it a read and thank us later. https://t.co/RSEGIBJ6bF
1584092259234242561,2022-10-23 08:00:00+00:00,What makes Bitcoin transactions traceable? And is it possible to have an anonymous wallet? Learn more through here: https://t.co/lHK8wieY5x
1584080935146131456,2022-10-23 07:15:00+00:00,"Directional liquidity, what is it? and how does it benefit DeFi users? We did the research so that you don't have t… https://t.co/zpxU0nKDSy"
1584069610717863936,2022-10-23 06:30:00+00:00,"Viva España! 

Spain currently hosts 215 crypto ATMs, pushing El Salvador down to the fourth position. https://t.co/30JD9xIzwR"
1584063098566377473,2022-10-23 06:04:07+00:00,"The US and China have the biggest #Web3 talent pool, but India is on its way to changing that. https://t.co/WiYYOIqwDm"
1584062097595727874,2022-10-23 06:00:09+00:00,"Learning To Trade 101: There are flags. Then there are bull flags. 
https://t.co/Tf1bplLsMJ"
1584039436823953408,2022-10-23 04:30:06+00:00,"Read it. Collect it. 

Commemorate the industry’s biggest moments with our Historical NFT collection, in which ever… https://t.co/TgatiClr0y"
1584031876209332226,2022-10-23 04:00:03+00:00,WWVentures attract venture capital interest in latest funding blitz. https://t.co/RSEGIBJ6bF
1584024311261966338,2022-10-23 03:30:00+00:00,"How important is a Bitcoin hash rate? 

Let us explore: https://t.co/Fh7hDIyLEz"
1584009213785014272,2022-10-23 02:30:00+00:00,Send this article to your mom or grandma to make things easier… you’re welcome: https://t.co/rcMqLLHpQQ
1584001664612470786,2022-10-23 02:00:00+00:00,Bitcoin might hit $100k sooner than you think. But so is a brutal bear market. https://t.co/XDB0Lcdt5d
1583994123086094337,2022-10-23 01:30:02+00:00,"Go up #Bitcoin, PLEASE! https://t.co/QcwHySnVuZ"
1583986694055137280,2022-10-23 01:00:31+00:00,Here is why a metaverse can thrive and scale better on blockchain rails. https://t.co/lHK8wieY5x
1583979013395329026,2022-10-23 00:30:00+00:00,"Explained: Understanding what $YFI is, how it works, and the reason why people use it. 
https://t.co/mm4Y3uf3MI"
1583971477720006657,2022-10-23 00:00:03+00:00,"Want to mint your own Solana NFTs? This is the guide for you!
https://t.co/XmiyvMZexw"
1583963913825067008,2022-10-22 23:30:00+00:00,"Directional liquidity, what is it? and how does it benefit DeFi users? https://t.co/V4Co2PpgW1"
1583963125065617408,2022-10-22 23:26:52+00:00,@james_six8jay FACTS
1583959377039724544,2022-10-22 23:11:58+00:00,@_hamtheBlink https://t.co/csifiMwNO2
1583959113884520448,2022-10-22 23:10:55+00:00,@GMills202 Not too shabby.
1583957225055301632,2022-10-22 23:03:25+00:00,@Newyorkez @Bridge2Bitcoin @eyeguneet @BitcoinConfUK Too expensive.🤷
1583956999523692544,2022-10-22 23:02:31+00:00,@_SparkGM Yes it is💪
1583948814834348033,2022-10-22 22:30:00+00:00,"Web2 dev wanting to get involved in Web3? Here is a good place to start:
https://t.co/BThonHoaRi"
1583943026720006146,2022-10-22 22:07:00+00:00,This is how pro traders intend to get some gold out of BTC breaking the $20K barrier.  https://t.co/wmef1ZwWEB
1583941265464627200,2022-10-22 22:00:00+00:00,"Spain takes the lead with 3 crypto ATMs, pushing El Salvador down to the fourth position.
https://t.co/30JD9y0IKZ"
1583933715968708608,2022-10-22 21:30:00+00:00,"Copying wallet addresses might be too stressful, so here is how you can buy ETH using PayPal: https://t.co/rcMqLLpgCI"
1583927932702969857,2022-10-22 21:07:01+00:00,A small W is still a W. 🤷 https://t.co/ZbqMKEya7s
1583926556594167808,2022-10-22 21:01:33+00:00,Japan's hostility to cryptocurrency is providing an opportunity for other countries to take the lead on crypto game… https://t.co/kIAdxkukXl
1583926295188377600,2022-10-22 21:00:31+00:00,"When it sounds too good to be true, then it probably is...

A fake website is promoting a fake giveaway and asking… https://t.co/djbOyK9ZPK"
1583921132956135425,2022-10-22 20:40:00+00:00,Bottom here for BTC? Here are three metrics that are getting traders excited. https://t.co/HWKP22wn3H
1583918644840796160,2022-10-22 20:30:07+00:00,"Explained: How important is #Bitcoin hash rate? 
 https://t.co/Fh7hDIyLEz"
1583917508079542272,2022-10-22 20:25:36+00:00,"@Bridge2Bitcoin @eyeguneet @BitcoinConfUK Wrap-up scenes for the UK Bitcoin conference by 
@BitcoinConfUK in Edinbu… https://t.co/IOVAwu56np"
1583911179486826496,2022-10-22 20:00:27+00:00,WWVentures attract venture capital interest in the latest funding blitz. https://t.co/RSEGIC09dF
1583905839731310592,2022-10-22 19:39:14+00:00,"And we are here too!
@CoinAgenda https://t.co/2qmArSlAlf"
1583903539163561988,2022-10-22 19:30:05+00:00,Oanda &amp; Paxos partner up to enable investors to spot-trade cryptocurrencies through mobile platform. https://t.co/dg6862rMPt
1583896090495311873,2022-10-22 19:00:29+00:00,Want to get into mining but don't have the setup for it? Worry not! you can mine using your phone as well. https://t.co/xSE4KtlfRU
1583890637312520192,2022-10-22 18:38:49+00:00,"Moderated by @dougscrib, panelists @bobbyclee, Jim Blasco from @aspirecrypto and @BrianSantoshi discuss whether the… https://t.co/rWFH7SkOlD"
1583888564013928448,2022-10-22 18:30:35+00:00,Did you miss the latest VC news from the crypto sector? Our latest VC Roundup provides a hand-picked selection of f… https://t.co/UC1ugZDLqi
1583884642741932032,2022-10-22 18:15:00+00:00,"Bulls? Flags? We are here to explain:
https://t.co/Tf1bpm2vOJ"
1583880986085187584,2022-10-22 18:00:28+00:00,#Bitcoin at $100k? This crypto trader thinks so. https://t.co/XDB0Lcdt5d
1583879071104004096,2022-10-22 17:52:52+00:00,"And so it begins! @michaelterpin and @bobbyclee  reminiscing about Bobby’s early foray into  #BITCOIN.

""The techno… https://t.co/rzaOSoH2Pb"
1583877201090338816,2022-10-22 17:45:26+00:00,"Cointelegraph checking in at CoinAgenda, the longest-running conference in Crypto. 👀

Stay tuned for live updates! https://t.co/WqfeAgeWEH"
1583874462373797893,2022-10-22 17:34:33+00:00,"Crypto mining in the palm of your hand? Believe it or not, it is a thing. https://t.co/7lyb2tXKpS"
1583873365827211265,2022-10-22 17:30:12+00:00,"Read it. Collect it. 

Commemorate the industry’s biggest moments with our Historical NFT collection, where every C… https://t.co/bXSQXJONWZ"
1583865954261700608,2022-10-22 17:00:44+00:00,"Trading volume in the Metaverse plummeted in Q3, but the NFTs fever isn't gone.  https://t.co/QucwpdVpDy"
1583862641042558976,2022-10-22 16:47:35+00:00,"Educational content is crucial for helping newcomers to crypto make informed decisions, but this platform also plac… https://t.co/Gjjf47YDmn"
1583858234884251653,2022-10-22 16:30:04+00:00,Are you a developer looking to enter the Web3 space? Today’s your lucky day: https://t.co/BThonHoaRi
1583854443849977856,2022-10-22 16:15:00+00:00,Thinking about jumping into DeFi? Check out these three important factors first. https://t.co/f0q3A03Py3
1583853451683205120,2022-10-22 16:11:04+00:00,"Think Bitcoin will go to $100,000 next year? How about $10,000 in 2025, asks @CredibleCrypto. https://t.co/Kj4Zyp8JrQ"
1583853126422999040,2022-10-22 16:09:46+00:00,"@Bridge2Bitcoin takes the prize home for the Pitching competition!

Reporting via @eyeguneet from @BitcoinConfUK https://t.co/1VHEzeoukf"
1583851006802432001,2022-10-22 16:01:21+00:00,"Let's talk about the crypto market!

Market Talks, every Thursday at 12 pm ET!
Tune it in here: https://t.co/5N4Z9Li2kt"
1583845849054208000,2022-10-22 15:40:51+00:00,📢Cointelegraph reporter @JoeNakamoto sat down with UK MP @DrLisaCameronMP where she explained that if she were to b… https://t.co/FpFkO9YwUy
1583843500163928064,2022-10-22 15:31:31+00:00,"In a conversation with @natbrunell, expert @LawrenceLepard declared that #Bitcoin whitepaper is the most important… https://t.co/kTKtXDqUrO"
1583843140531720193,2022-10-22 15:30:05+00:00,What song would you use to describe the current market conditions?  🤔
1583839393994768384,2022-10-22 15:15:12+00:00,"""The future is now, and everyone has a role to play in this new future""- @RTFKT co-founder @Zaptio).

Find out abou… https://t.co/RTTulMAZnS"
1583835625228468226,2022-10-22 15:00:13+00:00,"Directional liquidity, what is it? and how does it benefit DeFi users? All you need to know about the matter. https://t.co/V4Co2P8dU1"
1583832647511728129,2022-10-22 14:48:24+00:00,"""The biggest advantage that the network provides is borderlessness. An advantage neither Visa nor Mastercard can co… https://t.co/odQKS0qjBN"
1583824245221601280,2022-10-22 14:15:00+00:00,"How would you feel about a non-transferable NFT that can certify your identity?

Although still in an early stage,… https://t.co/kaSgkwfsp3"
1583820784019308550,2022-10-22 14:01:15+00:00,🎙️Media commentator @natbrunell thinks that lack of education and financial illiteracy is the biggest challenge in… https://t.co/SYyN09xRzg
1583820623184203776,2022-10-22 14:00:37+00:00,"Viva España! 🇪🇸

 Spain currently hosts 215 crypto ATMs, pushing El Salvador down to the fourth position. https://t.co/30JD9xIzwR"
1583814667557666817,2022-10-22 13:36:57+00:00,"🎙️Why do people leave their keys with the exchange?
According to @adam3us:
- They are not actively trading.
- They… https://t.co/5zer4ZtSnf"
1583814500972564481,2022-10-22 13:36:17+00:00,"🎤Cointelegraph's @JoeNakamoto hosted the ""Not Your Keys, Not Your Coins"" panel with @obi, @ShimonLazarov, and… https://t.co/fP1RNRCLl0"
1583806391277727744,2022-10-22 13:04:04+00:00,"For those who dislike traditional liquidity pools, get to know ""directional liquidity pooling,"" the new method to t… https://t.co/8aDVOicR9f"
1583805587460358145,2022-10-22 13:00:52+00:00,"Your wallet for a 500,000 USDT giveaway. 

The fake website is promoting a giveaway and asking users to connect wal… https://t.co/F9pqjXAmyW"
1583800496183119875,2022-10-22 12:40:38+00:00,Happy Saturday! How's your portfolio looking this weekend?
1583797294406963201,2022-10-22 12:27:55+00:00,"🎙️How is #Bitcoin providing hope?
@jllemus: ""It's showing a new system of governance that is way more decentralized… https://t.co/3JfBUj8MnL"
1583791092889051136,2022-10-22 12:03:16+00:00,"Aaaand we are back for day two from Edinburgh!

Reporting live Cointelegraph reporters @JoeNakamoto and @eyeguneet… https://t.co/dSLobgxuBy"
1583790420407918593,2022-10-22 12:00:36+00:00,"Web2 got too boring for you? 

Here is how you can get involved in Web3 as a developer: https://t.co/BThonHFdTi"
1583768774842683393,2022-10-22 10:34:35+00:00,The race is on. Spain overtook #bitcoin-friendly El Salvador in total #crypto ATM installations. https://t.co/NnVHXwmSJF
1583767661313658880,2022-10-22 10:30:10+00:00,"Polkadot co-founder leaves vacant his undesired CEO role at Parity, the development firm behind the ecosystem. https://t.co/Zp9hsStrp9"
1583745129088630784,2022-10-22 09:00:37+00:00,"What does ""not your keys, not your coins"" actually mean?

Find out at @BitcoinConfUK's panel with Cointelegraph's r… https://t.co/IkJsDOb1LR"
1583718547355598848,2022-10-22 07:15:00+00:00,Experts believe that a lack of education around Web3 is creating a barrier to entry for women. Initiatives aim to b… https://t.co/v6SfbE0KKt
1583707233841741825,2022-10-22 06:30:03+00:00,"Thinking about jumping into DeFi? 

Check out these 3 important factors first. https://t.co/f0q3A03Py3"
1583692152390832128,2022-10-22 05:30:07+00:00,"Read it. Collect it. 

Commemorate the industry’s biggest moments with the Historical NFT collection, in which ever… https://t.co/5EOWyDMWfX"
1583690395502141446,2022-10-22 05:23:08+00:00,Stay away from this giveaway: The official Twitter account of crypto exchange Gate. io was compromised and is being… https://t.co/zQvX25gOpg
1583677046718312448,2022-10-22 04:30:05+00:00,Additional crypto regulation may be coming to the UK in the form of a new amendment. https://t.co/ZIA0GulGGI
1583669545763381250,2022-10-22 04:00:17+00:00,"The BitBTC bridge got some unexpected help as a Twitter user helped stop a hack before it happened. 

All this and… https://t.co/x6U8iV9wL3"
1583663685708697600,2022-10-22 03:37:00+00:00,"Uzbekistan isn't joking when it comes to cryptocurrencies.

Local law enforcement is getting extensive training on… https://t.co/WStxjVcdJ8"
1583656135911182341,2022-10-22 03:07:00+00:00,"New CBDCs are here, but this one out from Hong Kong has a twist. https://t.co/Rk3IgWHuIk"
1583648588365602817,2022-10-22 02:37:00+00:00,The idea was first teased by the company founder Pavel Durov in late August this year when he proposed a marketplac… https://t.co/IsluDc6LQv
1583641036530020352,2022-10-22 02:07:00+00:00,"Back with a bang! 

Hong Kong is taking action to regain its status as a global cryptocurrency hub after launching… https://t.co/g0hubkdD0i"
1583633486824747009,2022-10-22 01:37:00+00:00,Oanda’s new trading service developed in partnership with Paxos allows investors easy access to crypto through mobi… https://t.co/ikmositRvb
1583627986674520064,2022-10-22 01:15:09+00:00,"Join our Telegram... we have stickers! (and the news, of course): 
https://t.co/9EnmFE305B https://t.co/E2C9OvgPCR"
1583620401560948736,2022-10-22 00:45:00+00:00,"Bitcoin miners are feeling the brunt of the global energy crisis. 

The latest Q3 mining report highlights several… https://t.co/xr0XLTuOZH"
1583616625680429056,2022-10-22 00:30:00+00:00,"Is @OpenSea's NFT ranking system good for assets and collectors? 

Reporting via @ezrareguerra 

https://t.co/Q6IxfKWf4e"
1583612850899013632,2022-10-22 00:15:00+00:00,"Web3 🤝 Women inclusivity.  

Due to a notable lack of diversity within the sector, new project initiatives aim to i… https://t.co/RLzsyAKSsJ"
1583607061740687360,2022-10-21 23:52:00+00:00,"In this Crypto Biz recap: the bears rage on, Voyager Digital claims insurance, and Silvergate Capital sees a drop i… https://t.co/zYriUhzKYT"
1583603286900293632,2022-10-21 23:37:00+00:00,"Elon Musk is predicting a global recession, but what could that mean for Bitcoin? 

(Reporting via @WilliamSuberg) https://t.co/TXUOsrwh66"
1583599514648121344,2022-10-21 23:22:00+00:00,"Thinking about jumping into DeFi? 

Check out these three important factors first. https://t.co/f0q3A0kSA3"
1583595739112157186,2022-10-21 23:07:00+00:00,"Polkadot co-founder leaves his undesired CEO role at Parity, the development firm behind the ecosystem. https://t.co/Zp9hsStrp9"
1583591963282276353,2022-10-21 22:52:00+00:00,"Uzbekistan isn't joking when it comes to crypto.

Local law enforcement is getting extensive training on seizing cr… https://t.co/PR42syNZwx"
1583588191499849728,2022-10-21 22:37:01+00:00,More crypto regulation may be coming to the UK in the form of a new amendment. https://t.co/ZIA0Gu4DEI
1583584413970898945,2022-10-21 22:22:00+00:00,This is how pro traders intend to get some gold out of BTC breaking the $20K barrier.  https://t.co/wmef1ZNZGB
1583584085624385536,2022-10-21 22:20:42+00:00,"The bear market is tough for investors, but also difficult for hard-working people in the crypto sector. As layoffs… https://t.co/czgFVqGr9M"
1583580640527515648,2022-10-21 22:07:00+00:00,"The BitBTC bridge got some unexpected help as a Twitter user helped stop a hack before it happened. 

This and more… https://t.co/nTHpMzWFri"
1583579787439706112,2022-10-21 22:03:37+00:00,https://t.co/SrGxgDJie2
1583579382274138117,2022-10-21 22:02:00+00:00,@PsycheGame 😆
1583579347843108864,2022-10-21 22:01:52+00:00,@nwocryptomoney We are Ironman.
1583579287210192896,2022-10-21 22:01:38+00:00,"@hohhle When you're right, you're right."
1583578892497215488,2022-10-21 22:00:04+00:00,"What are the biggest challenges associated with mass adoption and crypto today, and how can these be overcome? 

We… https://t.co/7ZeVVP2ZbP"
1583576863225499648,2022-10-21 21:52:00+00:00,The idea was first teased by company founder Pavel Durov in late August this year when he proposed a marketplace th… https://t.co/HWuJEvP8pQ
1583573925346230272,2022-10-21 21:40:19+00:00,"Did we mention he is speaking tomorrow?

Stay tuned for @BitcoinConfUK's panel ""Not your Keys, Not Your Coins"" with… https://t.co/KMwXye2hgv"
1583571352749232128,2022-10-21 21:30:06+00:00,"Read it. Collect it. 

Commemorate the industry’s biggest moments with our Historical NFT collection, in which ever… https://t.co/l4h0yo3KBp"
1583567551467991040,2022-10-21 21:15:00+00:00,Back with a bang! Hong Kong takes action to regain its status as a global cryptocurrency hub by launching several l… https://t.co/142TLAyu94
1583564297019740160,2022-10-21 21:02:04+00:00,"This year proved that investing in DeFi is risky, but there are ways to avoid getting rekt. @Big_Smokey1 shares thr… https://t.co/Aed29Yf8SR"
1583563804272906240,2022-10-21 21:00:06+00:00,"Coinbase says the adoption of USD Coin is “more conservative” outside of the U.S., but why? https://t.co/WafxUEpNtr"
1583558743828008960,2022-10-21 20:40:00+00:00,Bitcoin has reached this week's rock bottom. https://t.co/ZXZ5632nBW
1583557736889032705,2022-10-21 20:36:00+00:00,"Hey, @TheRock, do you own any Bitcoin? https://t.co/Gy8xbGWvaB"
1583557138823401473,2022-10-21 20:33:37+00:00,"The third week of October brought some hope back to the DeFi community, as some of the hacked protocols recovered a… https://t.co/tOTFd9SbfF"
1583557131189760002,2022-10-21 20:33:35+00:00,The U.K.’s Financial Services and Markets Bill power over crypto is extended. https://t.co/FKew0lv37T
1583557126441431041,2022-10-21 20:33:34+00:00,Can we all agree that the #BlackAdam logo is similar to the #Cointelegraph logo? 👀 😂
1583555809341939712,2022-10-21 20:28:20+00:00,"You just need a headset and a cup of coffee to enjoy Market Talks to the full on Thursday at 12 pm ET.

Set your re… https://t.co/429T7D8fuQ"
1583552454901104640,2022-10-21 20:15:00+00:00,"Is @OpenSea's NFT ranking system beneficial for assets and collectors? 

Reporting via @ezrareguerra 

https://t.co/Q6IxfKWf4e"
1583548859921272834,2022-10-21 20:00:43+00:00,"New CBDCs are here, but this one from Hong Kong has a twist. https://t.co/Rk3IgWYxKk"
1583546666967502848,2022-10-21 19:52:00+00:00,"Bitcoin miners are feeling the brunt of the global energy crisis. 

The latest Q3 mining report has highlighted sev… https://t.co/RWczh2SEfA"
1583542889673433088,2022-10-21 19:37:00+00:00,"Ripple CEO @bgarlinghouse after getting Hinman docs in their hands:
 
""The SEC wants you to think that it cares abo… https://t.co/BZhT6xYeR6"
1583542153325981697,2022-10-21 19:34:04+00:00,"It's a change of title for Gavin Wood, as he steps down as CEO of Parity to become the new chief architect. He will… https://t.co/dDCNGuesbc"
1583539117400653824,2022-10-21 19:22:00+00:00,"The stock market is up, but so is the DXY. 

Can BTC and alts rise above the fray?  https://t.co/aFVnujtU5x"
1583538628516810752,2022-10-21 19:20:04+00:00,"Bitcoin is still pinned under $20,000, but @noshitcoins says options traders have a profitable strategy that they w… https://t.co/o3qc2wdF9b"
1583535340177850368,2022-10-21 19:07:00+00:00,Oanda &amp; Paxos partner up to enable investors to spot-trade cryptocurrencies through mobile platform. https://t.co/dg6862rMPt
1583531566667796480,2022-10-21 18:52:00+00:00,"Elon Musk predicted a global recession, but what could that mean for Bitcoin? 

(Reporting via @WilliamSuberg) https://t.co/TXUOsrOqke"
1583531332143304704,2022-10-21 18:51:04+00:00,"There's a new CBDC game in town, and Hong Kong has created a version of it like no other. https://t.co/eRrsySwRVH"
1583526111140810753,2022-10-21 18:30:20+00:00,"Trading volume in the Metaverse plummeted in Q3, but the NFTs fever is far from gone.  https://t.co/QucwpdVpDy"
1583522254121730048,2022-10-21 18:15:00+00:00,"Due to a notable lack of diversity within the sector, new project initiatives aim to include more Latin American wo… https://t.co/XbB8jPPvBX"
1583520509295472640,2022-10-21 18:08:04+00:00,"Imagine losing $53,000 per day waiting for Celsius to pay their bills. That is how Core Scientific is feeling right… https://t.co/Q0iGSAJchx"
1583518636500975616,2022-10-21 18:00:37+00:00,"Trading volume in the Metaverse sank in Q3, but the NFTs fever isn't gone.  https://t.co/QucwpdVpDy"
1583518494611877888,2022-10-21 18:00:04+00:00,The slight recovery in Bitcoin and the S&amp;P 500 followed investors’ expectations that the Federal Reserve could slow… https://t.co/kliOlkuHWx
1583514711567790081,2022-10-21 17:45:02+00:00,"Uzbekistan isn't joking when it comes to cryptocurrencies.

Local law enforcement is getting extensive training on… https://t.co/QJogIVPJhC"
1583512693549387776,2022-10-21 17:37:01+00:00,"Bottom here for BTC? 

Here are three metrics that are getting traders excited. https://t.co/HWKP22wn3H"
1583510965852983296,2022-10-21 17:30:09+00:00,Former FBI special agent BJ Kang hired by @Binance to direct its new investigative unit against crypto crime in the… https://t.co/0yaLE3uLOR
1583508956042838019,2022-10-21 17:22:09+00:00,"From drinking water from Well as a kid to running one of the most successful crypto exchanges in the world.

This i… https://t.co/LYGjj5AMtt"
1583507154841243648,2022-10-21 17:15:00+00:00,"Headsets on, Interpol. https://t.co/T0os4w6dym"
1583505141805686785,2022-10-21 17:07:00+00:00,"In this Crypto Biz recap: the bears rage on, Voyager Digital claims insurance, and Silvergate Capital sees a drop i… https://t.co/PCd2jXfKIS"
1583503911809605632,2022-10-21 17:02:07+00:00,"Bear markets are for building, and forex broker Oanda is getting into crypto right in the middle of it. https://t.co/1D8U3Dy1D7"
1583503423986540559,2022-10-21 17:00:11+00:00,The idea was first teased by the company founder Pavel Durov in late August this year when he proposed a marketplac… https://t.co/cGkQoknrXw
1583499609707778050,2022-10-21 16:45:01+00:00,Me at 3 AM wondering where I put my seed phrase: https://t.co/l5rBAo2dPz
1583495934448500747,2022-10-21 16:30:25+00:00,"Is ETH at the edge? 

Ethereum witnessed a substantial drop in its daily active address count over the last four mo… https://t.co/5kG7wdIxds"
1583492825718870017,2022-10-21 16:18:04+00:00,Decreasing BTC price volatility and more on-chain metrics point to a Bitcoin price bottom. https://t.co/BoFo4XlbgI
1583492059989540867,2022-10-21 16:15:01+00:00,"Currently, crypto laws and regulations are inconsistent in Asian countries. The regulatory framework is fragmented… https://t.co/MM6h1QxH7Q"
1583488286928302080,2022-10-21 16:00:02+00:00,Back with a bang! Hong Kong is taking action to regain its status as a global cryptocurrency hub by launching sever… https://t.co/Ln0lGWnE4M
1583484505771298816,2022-10-21 15:45:00+00:00,"Coinbase says that the adoption of USD Coin has been “more conservative” outside of the U.S., but why? https://t.co/WafxUE7Efj"
1583480788620029952,2022-10-21 15:30:14+00:00,"The mid-2022 DeFi crisis showed the weakness of the so-called ""yield farming"", also known as ""ponzinomics"" resultin… https://t.co/7tj5sgh1mm"
