id,created_at,text1513539960917434373,2022-04-11 15:30:21+00:00,"Castles, villas, and chateaus on the blockchain. 

The #Metaverse may be the answer to preserving historic sites. https://t.co/aPqUiEs1fH"
1513538361558024193,2022-04-11 15:24:00+00:00,@animalconcerts https://t.co/ZMSn3wXgDQ
1513536101457317888,2022-04-11 15:15:01+00:00,"Data indicates that #SOL hodlers can remain bullish despite the latest dip. 

Solana’s strategy to focus on NFT mar… https://t.co/HALPtURAPI"
1513534219074502660,2022-04-11 15:07:32+00:00,"While many in the developed world are happy to have crypto, ownership has become essential for those who reside in… https://t.co/OWyoTcCLkc"
1513532567630364675,2022-04-11 15:00:58+00:00,The TON Foundation has chosen the $250M TONCoin fund in order to support the development of DEX and NFT projects wi… https://t.co/xqnnfsCtLt
1513528300546764803,2022-04-11 14:44:01+00:00,"The markets may be red, but whales remain unfazed.

One large investor continued to buy $1 million of #Bitcoin ever… https://t.co/uZNCAqoSh2"
1513524923293224964,2022-04-11 14:30:36+00:00,"The @Nitro_HQ marketplace is live!

Did you know Cointelegraph collaborated with the Nitro team to birth the Nitro… https://t.co/CC4erKcqK1"
1513523716369563656,2022-04-11 14:25:48+00:00,@EverRise https://t.co/zITDw7CY1r
1513523650615386117,2022-04-11 14:25:32+00:00,"Bitcoin may hit $30,000 in June, but central banks will pay the price in the end, argues @CryptoHayes. https://t.co/m98jBLQQ92"
1513522926192148482,2022-04-11 14:22:40+00:00,@Anc_Eliezer https://t.co/IphIEZbltd
1513522529968734213,2022-04-11 14:21:05+00:00,"@EverRise Not too shabby, ngl https://t.co/IpIFegkaCY"
1513521016848494605,2022-04-11 14:15:04+00:00,"You might want to take notes for tomorrow's show...

Our hosts @BY_DeFi, @noshitcoins, @CryptoDuality, and… https://t.co/paopRj0FqP"
1513518989967769607,2022-04-11 14:07:01+00:00,"CT Twitter, how are we feeling today?"
1513515896299528198,2022-04-11 13:54:44+00:00,"🥁 For #1, Binance receives in-principle approval to operate in Abu Dhabi, marking its third regulatory approval in… https://t.co/NMAGV15ipR"
1513514602029625354,2022-04-11 13:49:35+00:00,#2 has the EU taking a stronger stance against Russia following the invasion of Ukraine as it rolls out a a package… https://t.co/Z7OPODJKYV
1513513401141665797,2022-04-11 13:44:49+00:00,"At #3, while it was a down weekend for most tokens, there was still some green to be found.

Monero defied the mark… https://t.co/dIymyvPGbO"
1513512117571305477,2022-04-11 13:39:43+00:00,"Order in the court!

#4 sees the New York State Supreme Court rule in favor of cryptocurrency mining firm Greenidge… https://t.co/oo7maG5gba"
1513510852221091840,2022-04-11 13:34:41+00:00,"Our countdown begins in India, where at #5 Coinbase suspends crypto payment services only days after its India laun… https://t.co/S5Oh3iJQN8"
1513509726822227972,2022-04-11 13:30:13+00:00,"📰 Top Crypto News 📰 

✅ Binance gets approval from Abu Dhabi
👮 EU cracks down on crypto in Russia
📈 Monero defies m… https://t.co/Cw42SGNxx1"
1513509433623531528,2022-04-11 13:29:03+00:00,Spreading the gospel of cryptocurrency. Crypto advocates across America have launched grassroots initiatives aimed… https://t.co/x1ayUvxzmm
1513508116599607300,2022-04-11 13:23:49+00:00,"RT @CointelegraphZN: Digital nomad, @MichelleLegge_, is now head of crypto tax education at @koinly

Check out what her message for the you…"
1513505231287562241,2022-04-11 13:12:21+00:00,Coinbase reiterated that it was “committed to working with NPCI and other relevant authorities to ensure that we ar… https://t.co/5GCgwVFHWW
1513502510673121283,2022-04-11 13:01:32+00:00,The Democratic Republic of the Congo disclosed plans to launch a stablecoin based on the TON blockchain amid the $2… https://t.co/4EZPfsfofu
1513502347321917442,2022-04-11 13:00:53+00:00,"A step forward for crypto’s carbon-neutral future. 

Two new carbon-neutral cryptocurrency exchange-traded products… https://t.co/dp7VmdtLyr"
1513500883572514819,2022-04-11 12:55:04+00:00,This partnership will empower investors to hold their fund shares as digital tokens. https://t.co/CC0pGWLgAP
1513496798576394250,2022-04-11 12:38:50+00:00,"A key to maintaining financial stability during the introduction of digital currency, European Central Bank executi… https://t.co/dhjW0Z5IbE"
1513494660915904528,2022-04-11 12:30:21+00:00,"What goes up… 

Axie Infinity’s price has fallen by nearly 30% two weeks after losing $625 million to a hacking inc… https://t.co/VF2haQTkam"
1513489367716839428,2022-04-11 12:09:19+00:00,"According to analytics firm @chainalysis, Africa’s crypto market increased in value by more than 1,200% between July 2020 and June 2021."
1513487214088499207,2022-04-11 12:00:45+00:00,"Alé Milan alé! 

Italian professional soccer club @acmilan will be releasing its first-ever NFT project in collabor… https://t.co/K1LYBARV39"
1513482380165611520,2022-04-11 11:41:33+00:00,The BTCO2 and ETH2O ETPs seek to expose investors to two leading cryptocurrencies while offsetting their carbon foo… https://t.co/3ivCdHqW4W
1513481995472588800,2022-04-11 11:40:01+00:00,"ADGM serves as an international financial free zone within the capital of the United Arab Emirates, which historica… https://t.co/LY6OCxmtcZ"
1513480755413803011,2022-04-11 11:35:05+00:00,Axie Infinity AXS price technicals hint at a possible bounce this month. https://t.co/wRFa5aCe2g
1513479511702224900,2022-04-11 11:30:09+00:00,"Feeling bearish? 

While concerns are rising, not everything is looking bad for Bitcoin this week. 

(Reporting via… https://t.co/OU7XyICAQy"
1513474022939537411,2022-04-11 11:08:20+00:00,The in-principle approval from the Abu Dhabi Global Market (ADGM) allows Binance to operate as a broker-dealer in d… https://t.co/IAUC5WBMAq
1513472024726941700,2022-04-11 11:00:24+00:00,"Thank U, next. 

Crypto investment company @ARKInvest founder Cathie Wood dumps her PayPal holdings as she sees gre… https://t.co/CcPs3MPPhT"
1513469655272280065,2022-04-11 10:50:59+00:00,"Hodlers woke up on Monday seeing red, but some altcoins are managing to buck the trend and record some gains. 

Wha… https://t.co/DPVPoodpOa"
1513468154940465156,2022-04-11 10:45:01+00:00,NFTs have succeeded in giving content creators control of their work and finances without third-party intermediarie… https://t.co/jkmgQQRt91
1513464376870805508,2022-04-11 10:30:00+00:00,"BIG NEWS: @Nitro_HQ just went live with their marketplace 🚀

The Cointelegraph inspired Nitro Bots provide a unique… https://t.co/iww8Fbyngr"
1513457002080575490,2022-04-11 10:00:42+00:00,Coinbase has stopped payment services through United Payments Interface on its platform for Indian users just three… https://t.co/xjIDHCT5IS
1513451041437757441,2022-04-11 09:37:01+00:00,"Castles, villas, and chateaus on the blockchain. 

The Metaverse may be the answer to preserving historic sites. https://t.co/aPqUiEs1fH"
1513449413607186435,2022-04-11 09:30:33+00:00,"The Rossoneri will soon have its first NFT collection with 75,817 up for grabs, the same amount of seats at the clu… https://t.co/bSzqrgpBhP"
1513443488892796928,2022-04-11 09:07:00+00:00,"Data indicates that $SOL hodlers can remain bullish despite the latest dip. 

Solana’s strategy to focus on NFT mar… https://t.co/KEjMLcxpDZ"
1513435941863632902,2022-04-11 08:37:01+00:00,"The markets may be red, but whales remain unfazed.

One large investor continued to buy $1 million of Bitcoin every… https://t.co/hFsQPJBVKN"
1513420595676934146,2022-04-11 07:36:02+00:00,"Bullish or bearish, there's plenty to consider when it comes to Bitcoin price action this week. https://t.co/PTaDDNKYbl"
1513415314490408967,2022-04-11 07:15:03+00:00,"Mabrook!

Binance received approval to operate as a broker-dealer in digital assets in Abu Dhabi. https://t.co/CxRVq6nxna"
1513396556732538880,2022-04-11 06:00:31+00:00,"BIG NEWS: @Nitro_HQ just went live with their marketplace 🚀

The Cointelegraph inspired Nitro Bots provide a unique… https://t.co/OsRLazCBvN"
1513391779948597252,2022-04-11 05:41:32+00:00,"Ark Invest founder Cathie Wood decided that PayPal’s growth strategy for Venmo made it just a follower of Cash App,… https://t.co/hy9eNyzFdY"
1513381331819978752,2022-04-11 05:00:01+00:00,"A truly free-to-use DApp is what many aspire to.

But how is that possible, and what is blockchain mana? Dive into… https://t.co/uI8swTo41M"
1513375300209414144,2022-04-11 04:36:03+00:00,The NFT space has opened the door to a whole new scope of opportunities for content creators and artists. Tokenizin… https://t.co/l7dWVSOjNV
1513366370792226816,2022-04-11 04:00:34+00:00,"Have a Pumpkin Spice Latte in the Metaverse as Starbucks hops on the NFT train.

Check out what else happened in th… https://t.co/LfUiTc8KkM"
1513353534875439105,2022-04-11 03:09:34+00:00,Coinbase exchange suspended a buy order service for its users in India after local finance regulators denied knowle… https://t.co/Et4UY2DHV6
1513351128225927172,2022-04-11 03:00:00+00:00,"Wars disrupt traditional systems. And in the case of the war in Ukraine,
crypto played a vital role in directly sup… https://t.co/kJb2z9CgMb"
1513336029608038401,2022-04-11 02:00:00+00:00,"Case dismissed. 

A New York State Supreme Court judge in Yates County ruled in favor of cryptocurrency mining firm… https://t.co/CpFhuZyHZz"
1513321060380430336,2022-04-11 01:00:31+00:00,A European Central Bank representative laid out the central bank's current take on CBDCs. They said central bank di… https://t.co/0vYOolI5NZ
1513305888311894019,2022-04-11 00:00:14+00:00,"Don't sleep on the digital economy in Africa!

The last year has witnessed massive growth in cryptocurrency transac… https://t.co/lDeu9uSxeR"
1513298305845022728,2022-04-10 23:30:06+00:00,"HUGE NEWS: The @Nitro_HQ marketplace is LIVE!

Did you know that Cointelegraph collaborated with the Nitro team to… https://t.co/otjHyiLvn6"
1513292495869943815,2022-04-10 23:07:01+00:00,"Woo-hoo!

Binance received approval to operate as a broker-dealer in digital assets in Abu Dhabi. https://t.co/CxRVq6nxna"
1513275776422055939,2022-04-10 22:00:35+00:00,"We have all heard about crypto scams, but would you be able to spot one? 

Dubai-based OTC trader Amin Rad shares h… https://t.co/5BrsJJCRSk"
1513268137743069190,2022-04-10 21:30:13+00:00,"#Bitcoin is for everyone, according to @danheld 

Do you agree? https://t.co/oROLKv3Vup"
1513261422150492162,2022-04-10 21:03:32+00:00,Historical metaverses could give tourists one-of-a-kind experiences and help maintain historic sites. https://t.co/YNwvVRMtsg
1513260543703982087,2022-04-10 21:00:03+00:00,"Milan? Paris? No, this fashion week was in the Metaverse, and it was breathtaking, to say the least. https://t.co/PXsVqhEqXP"
1513254127706378244,2022-04-10 20:34:33+00:00,"Solana price stalled near $140, but the current correction does not undermine bullish factors like NFT marketplace… https://t.co/mNMTMgNNKu"
1513253023308562432,2022-04-10 20:30:10+00:00,"The @Nitro_HQ marketplace is live!

Did you know Cointelegraph collaborated with the Nitro team to birth the Nitro… https://t.co/RW6itqtgPA"
1513237893891780610,2022-04-10 19:30:03+00:00,"Bitcoin price is climbing back toward a key resistance level, and if overcome, $NEAR, $FTT, ETC and XMR could also… https://t.co/fEJEe1ob7f"
1513230462696759304,2022-04-10 19:00:31+00:00,"Digital nomad, @MichelleLegge_, is now head of crypto tax education at @koinly

Check out what she thinks the world… https://t.co/plj0ijrsFA"
1513215234378543104,2022-04-10 18:00:00+00:00,"Bitcoin is preparing for its lowest weekly close this month as it is trading at around $42,000.

What will next wee… https://t.co/pQIAPaT6sh"
1513207721130143748,2022-04-10 17:30:09+00:00,"BIG NEWS: @Nitro_HQ just went live with their marketplace 🚀

The Cointelegraph inspired Nitro Bots provide a unique… https://t.co/mizatcUsjj"
1513200171018072083,2022-04-10 17:00:09+00:00,"Mabrook!

Binance received approval to operate as a broker-dealer in digital assets in Abu Dhabi. https://t.co/CxRVq6nxna"
1513185035314253825,2022-04-10 16:00:00+00:00,"A truly free-to-use DApp is what many aspire to. But how is that possible, and what is blockchain mana? 

Dive into… https://t.co/DWujDwGh1q"
1513180766171066371,2022-04-10 15:43:02+00:00,"Bitcoin is giving us a buy the dip signal, argues @RektCapital as Dogecoin outshines major altcoins this week. https://t.co/utjWXnABTI"
1513169963309322245,2022-04-10 15:00:07+00:00,"Milan? Paris? No, this fashion week was in the Metaverse, and it was mesmerizing, to say the least. https://t.co/PXsVqhEqXP"
1513162991121874950,2022-04-10 14:32:24+00:00,"RT @CointelegraphZN: Have a Pumpkin Spice Latte in the Metaverse as Starbucks hops on the NFT train.

Check out what else happened in the i…"
1513154894831755273,2022-04-10 14:00:14+00:00,"The earning part in play-to-earn attracts many to play the games, as playability is still an issue with many of the… https://t.co/VeJu0uiYnd"
1513139950459441162,2022-04-10 13:00:51+00:00,"Blockchain technology has been discussed in many climate change conferences, such as COP26, and it seems that the p… https://t.co/ESg5ILvxoP"
1513124767993409537,2022-04-10 12:00:31+00:00,"Wars disrupt traditional systems. Luckily, cryptocurrency is not traditional.

In many cases, crypto has provided s… https://t.co/sABsPKhLzu"
1513114592007712773,2022-04-10 11:20:05+00:00,"While they may not grab the headlines of other crypto hubs, countries across Africa have been at the forefront of c… https://t.co/FvWm938Swe"
1513109553872789512,2022-04-10 11:00:04+00:00,"Part 2 of our three-part series on DAO regulations in Australia is here.

A blockchain researcher explains the curr… https://t.co/pvmZdwvBaf"
1513103762373574657,2022-04-10 10:37:03+00:00,Approved: Binance receives #crypto license in Abu Dhabi during #Ramadan. https://t.co/EdPzB8vKzs
1513094513375559682,2022-04-10 10:00:18+00:00,"For many, the Metaverse seems like the next logical step. 

However, considered the biggest technological disruptio… https://t.co/7DRIS5u7AJ"
1513081866252808196,2022-04-10 09:10:03+00:00,Will Monero XMR price see more upside as privacy takes center stage? https://t.co/xnfuuE3GxI
1513079454020644867,2022-04-10 09:00:28+00:00,"Russia is becoming a country of hodlers. 

The Russian prime minister Mikhail Mishustin declared that Russians coll… https://t.co/24RsgMfD3x"
1513064372003868673,2022-04-10 08:00:32+00:00,"Kraken CEO, Jesse Powell announces that @krakenfx will close its global headquarters because the city “is not safe.… https://t.co/WIifQyxGkG"
1513052916172603407,2022-04-10 07:15:01+00:00,"Get ready for more Bitcoin, powered by Tesla technology and a 3.8 MW solar array. https://t.co/jql8vBT5a6"
1513034079205273600,2022-04-10 06:00:09+00:00,The crypto crackdown on Russia is not letting up. Now the EU is banning specific digital asset services to the coun… https://t.co/vWxRO411b2
1513023229677375488,2022-04-10 05:17:03+00:00,"When building DApps, is it possible to be free-to-use for users and beneficial for blockchain developers?… https://t.co/mGHe5U2XQc"
1513019069888401410,2022-04-10 05:00:31+00:00,"BIG NEWS: @Nitro_HQ just went live with their marketplace 🚀

The Cointelegraph inspired Nitro Bots provide a unique… https://t.co/kCtHWNYqun"
1513003959312596998,2022-04-10 04:00:28+00:00,Bitcoin miners: Improving the world one transaction at a time. https://t.co/ijnMXp3SUc
1512988883352494090,2022-04-10 03:00:34+00:00,"Blockchain technology has been at the center of many climate change conferences, such as COP26, and it seems that t… https://t.co/nfeJ7H8ion"
1512978185855516672,2022-04-10 02:18:03+00:00,"As the first-ever Metaverse Fashion Week continues to make waves, fashion blogger Inna Komvarova relives the experi… https://t.co/fznCLVhbOI"
1512973671509467142,2022-04-10 02:00:07+00:00,"Wars disrupt traditional systems. And in the case of the war in Ukraine,
crypto played a vital role in directly sup… https://t.co/rfK9d5uc99"
1512969867938476033,2022-04-10 01:45:00+00:00,"HUGE NEWS: The @nitro_hq marketplace is LIVE 

Did you know that Cointelegraph collaborated with the Nitro team to… https://t.co/BkaSQcWd4S"
1512958541782568964,2022-04-10 01:00:00+00:00,"Are DAOs a solution to government regulations?

A blockchain researcher explains the current issues in DAO operatio… https://t.co/L2C0BZiYA2"
1512935921410269186,2022-04-09 23:30:07+00:00,"For many, the Metaverse is the future.

However, considered the biggest technological disruption to human life, som… https://t.co/2KYhFqiwxK"
1512913273708060677,2022-04-09 22:00:07+00:00,Set your DVR (or VPN). #60Minutes is airing an episode on El Salvador's #BitcoinBeach on Sunday. https://t.co/t08CdCrXu9
1512899414947352576,2022-04-09 21:05:03+00:00,"Multi-chain expansion to ten different blockchains, integration with Uniswap v3 and participation in Avalanche’s ne… https://t.co/Tq35JPEIzv"
1512898143838523397,2022-04-09 21:00:00+00:00,"They said Bitcoin can only benefit our wallets. They were wrong.

Here are 7 times BTC miners made the world a bett… https://t.co/wyxurPXoDu"
1512893113014042626,2022-04-09 20:40:00+00:00,"Having a booth at the Grammys gave @CEEK a new level of exposure to the project, allowing their CEEK to make 100% g… https://t.co/Bmp5jBiDOq"
1512890613812846601,2022-04-09 20:30:05+00:00,"Where NFTs meet crypto mining!

Non-fungible miners are providing a unique utility and Cointelegraph collaborated w… https://t.co/pytrhpdNMD"
1512883044285399040,2022-04-09 20:00:00+00:00,"We've all heard about crypto scams, but not as much about how to recognize them. Dubai-based OTC trader Amin Rad sh… https://t.co/HIsofwinWm"
1512875496127803403,2022-04-09 19:30:00+00:00,The number of crypto firms allowed to operate in the UK under temporary registration status used to be 12. It has n… https://t.co/7jXEASfHhj
1512870982104469511,2022-04-09 19:12:04+00:00,Major exchange listings and steady developments in virtual reality and Metaverse projects translated to a triple-di… https://t.co/GkpwgjpVhX
1512868036230975489,2022-04-09 19:00:22+00:00,"Blockchain technology has been discussed in many climate change conferences, such as COP26, and it seems that the p… https://t.co/RgYAmGMDTo"
1512856625480192007,2022-04-09 18:15:01+00:00,"SOL might crash, but we could witness a pullback scenario if the bearish megaphone setup falls short of achieving i… https://t.co/4V1UK3BYHG"
1512852926070460433,2022-04-09 18:00:19+00:00,"Wars disrupt traditional systems. Luckily, cryptocurrency is not traditional.

In many cases, crypto has provided s… https://t.co/2PW2oUhEyn"
1512837747475681291,2022-04-09 17:00:00+00:00,"Part 2 of our three-part series on DAO regulations in Australia is here.

A blockchain researcher explains the curr… https://t.co/pMU9Qy3mcP"
1512823610230161411,2022-04-09 16:03:50+00:00,"Good morning to everyone who just keeps stacking.

Yes, that's you, Terra. We saw you bought an additional $230 mil… https://t.co/S1AhJkAIyV"
1512815132287635458,2022-04-09 15:30:08+00:00,"Will Bitcoin go to $40,000? Apparently, it does not matter for the whales, as they continue stacking. https://t.co/u9WOEfkEAy"
1512807653650673673,2022-04-09 15:00:25+00:00,"For many, the Metaverse seems like the next logical step. 

However, considered the biggest technological disruptio… https://t.co/ohTu6FUGgB"
1512800890075312131,2022-04-09 14:33:33+00:00,Weakening Solana price technicals are putting SOL at risk of a major drop. https://t.co/V3VUB7vME4
1512797240049356800,2022-04-09 14:19:03+00:00,"They often find themselves an easy target for critics, but Bitcoin miners are far from bad. These seven occasions s… https://t.co/nPorchBb5f"
1512792600608223237,2022-04-09 14:00:36+00:00,"A Bitcoiner has ""pooled"" off another mining innovation.

The 'waste' heat generated by mining Bitcoin is used to wa… https://t.co/IfacU1zy8k"
1512784536614043648,2022-04-09 13:28:34+00:00,"Believe it or not, Bitcoin whales are buying BTC again at $42,500. https://t.co/vZ9O9dihF9"
1512777385984286723,2022-04-09 13:00:09+00:00,"The earning part in play-to-earn is what attracts many to play the games, as playability is still an issue with man… https://t.co/d4D7L0YmOS"
1512751188537532417,2022-04-09 11:16:03+00:00,"Blockchain technology has the potential to lead the fight against climate change argues @janeathomason, who explain… https://t.co/UjxSBTo17y"
1512747178791518211,2022-04-09 11:00:07+00:00,"Considering that almost everyone on the internet engages with hyper-centralized environments, can decentralized soc… https://t.co/garXxUEsWh"
1512716708103876608,2022-04-09 08:59:02+00:00,"It is real people, not the corrupt elites, who benefit from crypto when the world comes crashing down. https://t.co/VRpIORVyKh"
1512660713503830017,2022-04-09 05:16:32+00:00,Are government regulations what DAOs are trying to solve? In Part 2 of an analysis of Australia's regulatory effort… https://t.co/Hvri2oHiDB
1512656648602587143,2022-04-09 05:00:23+00:00,"The Axie Infinity hacked coins are on the move, Yearn pushes for a new standard, and DApp usage soars. All this and… https://t.co/x0FrLXHWsZ"
1512641595564302337,2022-04-09 04:00:34+00:00,"Case dismissed. 

A New York State Supreme Court judge in Yates County rules in favor of cryptocurrency mining firm… https://t.co/AA3l7zsKLK"
1512637682211508225,2022-04-09 03:45:01+00:00,"Put on your favorite Travis Scott track and enter ASTRO world. 

xASTRO staking helped the token's price shoot towa… https://t.co/EEvAvngM9k"
1512633997020565510,2022-04-09 03:30:22+00:00,"What's the secret behind @avalabsofficial's success? Well, we sat down with the founder and CEO, @el33th4xor, and h… https://t.co/8iaw0oiskh"
1512630132317560841,2022-04-09 03:15:01+00:00,"A nostalgic comeback or the dawn of the dead? 

Defunct brands are using Web3 to cash in, leaving the industry divi… https://t.co/fKe2K0SObU"
1512626419230285826,2022-04-09 03:00:16+00:00,"The crypto crackdown on Russia is not letting up. 

Now the EU is banning specific digital asset services to the co… https://t.co/Ss9uQBeTju"
1512622582591283206,2022-04-09 02:45:01+00:00,"VCs went all out in crypto in 2021, spending $30.5B in capital investments compared to $4.9 billion in 2020. The to… https://t.co/YJrHvtxDTA"
1512618805289172994,2022-04-09 02:30:00+00:00,"We've all heard about crypto scams, but not as much about how to recognize them. 

Dubai-based OTC trader Amin Rad… https://t.co/Ds6uC9lRX9"
1512616551383404544,2022-04-09 02:21:03+00:00,"The Metaverse has made massive strides in recent years. However, its current state has clear shortcomings that show… https://t.co/jyLEblzj3i"
1512611255055433728,2022-04-09 02:00:00+00:00,"It could be a long weekend, and not in a good way. 

Analyst @rektcapital warns that Bitcoin could dip as low as $3… https://t.co/NwHcC4rUpb"
1512599945282531332,2022-04-09 01:15:04+00:00,"Mugs are great because you can sip on all your favorite drinks: coffee, tea, hot chocolate… or some wine, depending… https://t.co/hgpRtnbeC5"
1512596282719805440,2022-04-09 01:00:31+00:00,"Get ready for more Bitcoin, powered by Tesla technology and a 3.8 megawatt solar array. https://t.co/jql8vBT5a6"
1512592384181387267,2022-04-09 00:45:01+00:00,"For those who still watch TV, #60Minutes is airing an episode on El Salvador's #BitcoinBeach on Sunday. https://t.co/t08CdCrXu9"
1512588618388459520,2022-04-09 00:30:03+00:00,"What are the implications of @Shopify’s Bitcoin-integration? 

Crypto researcher @MattAhlborg believes that the eve… https://t.co/MTnXkflpvY"
1512584843758088194,2022-04-09 00:15:03+00:00,A European Central Bank representative laid out the central bank's current take on CBDCs. They said central bank di… https://t.co/lCgWvR4joC
1512581071002644495,2022-04-09 00:00:04+00:00,"Kraken CEO, Jesse Powell announces that @krakenfx will shut down its global headquarters because the city “is not s… https://t.co/N2exlkhyBm"
1512577281620942850,2022-04-08 23:45:00+00:00,You have 96 million pounds. What do you do with it? That's the question @NFTInvestPLC is trying to answer right now. https://t.co/g4LwMLqa0p
1512573507384877062,2022-04-08 23:30:01+00:00,"Russia is becoming a country of hodlers. 

The Russian prime minister Mikhail Mishustin declared that Russians coll… https://t.co/wq5btDxk8C"
1512567718658121731,2022-04-08 23:07:00+00:00,The Polkadot system is heating up. Is DOT going to be at the crest of an altcoin wave? https://t.co/A19enKxg2T
1512563944996671488,2022-04-08 22:52:01+00:00,South Africa has moved one step closer to a CBDC after the South African Reserve Bank concludes a technical proof-o… https://t.co/sWpzoDnhXP
1512560171888881670,2022-04-08 22:37:01+00:00,"If you build it, they will come. 

Entrepreneur @Excellion said on Thursday that he has started a new company calle… https://t.co/23eGEgfw4m"
1512558408100196360,2022-04-08 22:30:01+00:00,The number of crypto firms allowed to operate in the UK under temporary registration status used to be 12. It has n… https://t.co/N2VX97gTwy
1512556396914659339,2022-04-08 22:22:01+00:00,"The Axie Infinity hacked coins are on the move, Yearn pushes for a new standard, and DApp usage soars. 

All this a… https://t.co/3vowETH4Ul"
