id,created_at,text1579839377798467585,2022-10-11 14:20:34+00:00,Smart contracts and coding language are an unbreakable marriage that makes blockchains possible. Here is how. https://t.co/14kW5YYOjK
1579838306447421442,2022-10-11 14:16:18+00:00,Get a recap here: https://t.co/WOccVtmtbB
1579837987235692546,2022-10-11 14:15:02+00:00,"Bread secured. 

Singapore-based crypto bank MinePlex has secured $100 million that will be used to develop new ban… https://t.co/O6AcMWnB00"
1579834489399713792,2022-10-11 14:01:08+00:00,"New episode of The Market Report today hosted by @BY_DeFi &amp; @forgeforth_  

Tune it at 12pm ET here: https://t.co/Dq7yQ7BjmQ"
1579834411909976065,2022-10-11 14:00:50+00:00,"The advertising industry moves millions of dollars every day, but how does it work when you include crypto and spor… https://t.co/e44vuXhYlU"
1579833035662688258,2022-10-11 13:55:22+00:00,@CYVOio We'll give you a heads up 😂 https://t.co/CoTNFCA2ft
1579832189575122944,2022-10-11 13:52:00+00:00,"Japan is investing in the Metaverse, Norway is cracking down on Bitcoin miners, and more in this week’s Law Decoded. https://t.co/da4eSIZjcq"
1579831952273977344,2022-10-11 13:51:03+00:00,"Walid Abou Zaki, the founder of Unlock Blockchain, argued that it’s better to create new journalists instead of mov… https://t.co/abriIjbQeg"
1579828415766859778,2022-10-11 13:37:00+00:00,Was $17.6k the bottom for Bitcoin? This trader thinks so. https://t.co/Cs7nJTXujT
1579826774908620800,2022-10-11 13:30:29+00:00,"@KristinaLCorner @dxbontheblock Our Editor-in-Chief, @KristinaLCorner rocking it on stage!

Watch the panel here:… https://t.co/yrq5DtffB8"
1579824642260234240,2022-10-11 13:22:01+00:00,"Can zero-knowledge KYC increase global crypto-adoption?

John Henderson from Australian-based Airtree Ventures thin… https://t.co/kLqjees2Hp"
1579820631532916739,2022-10-11 13:06:04+00:00,The Polkadot ecosystem continues to grow as interoperability drives compounding effects through its network. https://t.co/RX8g2vJEzl
1579819380502056960,2022-10-11 13:01:06+00:00,"Now you can use NFTs to support up-and-coming sports stars.

And to connect with them.  https://t.co/DMJJyVwBKm"
1579815328565317632,2022-10-11 12:45:00+00:00,"Elon Musk’s $44B Twitter takeover is back on, and both Binance and Sequoia Capital have indicated that they will pu… https://t.co/W6FfhIWePk"
1579811593507901440,2022-10-11 12:30:10+00:00,"Great ideas start with a cup of coffee! ☕

That’s why we’ll be enjoying three expertly-brewed cups during our sit-d… https://t.co/V5WIAF3IjN"
1579807849471176705,2022-10-11 12:15:17+00:00,Read more here: https://t.co/j8gZrm1zsq
1579807779166248960,2022-10-11 12:15:00+00:00,"Do you like NFTs? You'll love our Nifty News. 

In this edition: Logan Paul made flipped an NFT from $600K to $10. https://t.co/9w4OMY2d7P"
1579807061764079616,2022-10-11 12:12:09+00:00,🚨 @Google has selected @coinbase to take cloud payments with cryptocurrencies and is going to use its custody tool.
1579804146659516424,2022-10-11 12:00:34+00:00,Can you see the bulls? https://t.co/NnoLPWIaEQ
1579801993282871299,2022-10-11 11:52:01+00:00,"Multiverse Labs launched Sharjahverse in the UAE, a metaverse city that encompasses the emirate’s 1,000 square-mile… https://t.co/wQzGrOXzKS"
1579800227631882241,2022-10-11 11:45:00+00:00,Malware pretending to be a Solana wallet security update is draining crypto through NFT airdrops.  https://t.co/PVTDVbqfWS
1579799862643937280,2022-10-11 11:43:33+00:00,"Tether has blacklisted fewer Ethereum-based USDT addresses this year so far than in 2021, according to data compile… https://t.co/LadaIFggkU"
1579796458307395584,2022-10-11 11:30:01+00:00,"The Dollar is up, but what does that mean for Bitcoin? 

Cointelegraph’s @JoeNakamoto appears alongside @OlUkolova,… https://t.co/AFdxZ7h083"
1579790698475565056,2022-10-11 11:07:08+00:00,"With many delegates flying from various countries, Blockchain Economy Dubai Summit 2022 showed that Dubai is going… https://t.co/A8OH6p2doy"
1579788904021970944,2022-10-11 11:00:00+00:00,The Sandbox and Decentraland disagree with DappRadar's numbers.  https://t.co/ZucIBEjFuw
1579785141433511936,2022-10-11 10:45:03+00:00,"Bitcoin has an enormous amount of lovers, but the bag of haters isn't precisely empty.

Cointelegraph’s… https://t.co/nrjrE6LH88"
1579781690905759750,2022-10-11 10:31:20+00:00,"RT @Cointelegraph: “Ethereum is the Hotel California of cryptocurrency, you can check in but you can’t check out” -@IOHK_Charles
 
The foun…"
1579781490644504576,2022-10-11 10:30:32+00:00,"It's a different day, but Bitcoin and Ethereum are still in the red.

When will we witness a rally?

Get the full p… https://t.co/SfQCs5XKtx"
1579780858990690304,2022-10-11 10:28:02+00:00,Institutional investors and high-net-worth individuals are keen to gain exposure to crypto. @coinhako allows them t… https://t.co/WtKYzdk8ZH
1579779341151793152,2022-10-11 10:22:00+00:00,Coinbase is on the right path to getting its license to operate in Singapore. https://t.co/U8mJMspmvO
1579778225752113152,2022-10-11 10:17:34+00:00,"Economists Ben Bernanke, Douglas Diamond and Philip Dybvig win the Nobel Prize thanks to their research on the soci… https://t.co/ksHpkSDTZB"
1579774198431776768,2022-10-11 10:01:34+00:00,"GEM Digital has just poured $100 million into Singapore-based crypto bank MinePlex, which is bridging the gap betwe… https://t.co/FEbp0qq1mX"
1579772184163418116,2022-10-11 09:53:34+00:00,Portugal's latest State Budget document proposes new taxes aimed at cryptocurrencies in 2023. https://t.co/95VKUy8UIN
1579771793191014400,2022-10-11 09:52:00+00:00,"When the crypto market goes crazy, customer service drives crazier.

Ask the exchanges.  https://t.co/caC3JPaeIk"
1579765032879288320,2022-10-11 09:25:09+00:00,"Can $19,000 avoid a support/resistance flip as Bitcoin lingers lower? https://t.co/JWlzRTLINU"
1579764243418652672,2022-10-11 09:22:00+00:00,"Sam Bankman-Fried announced in a series of tweets that FTX is getting updated during the next month.

According to… https://t.co/Ord4rsLsXD"
1579759225706008576,2022-10-11 09:02:04+00:00,"In a recent survey, the online educational platform https://t.co/UC58hud3pA found that 64% of the parents and 67% o… https://t.co/qrvKyi9FZN"
1579758851821563904,2022-10-11 09:00:35+00:00,"AI firm Multiverse Labs launched Sharjahverse in the UAE, a metaverse city that encompasses the emirate’s 1,000 squ… https://t.co/ITVOWbryc4"
1579747391078510593,2022-10-11 08:15:02+00:00,"Where would you live as a digital nomad?

Here is the story of some crypto expats in Thailand.
 https://t.co/fcLIYzrKc7"
1579736825006272512,2022-10-11 07:33:03+00:00,"Hot legislation season in the EU, Kardashian settles with the SEC, Japan invests in Metaverse — the major regulatio… https://t.co/f0JhrvyS58"
1579734803510796288,2022-10-11 07:25:01+00:00,"You don’t want to miss this! 

Cointelegraph’s @JoeNakamoto will join @izakaminska and @pete_rizzo_ to discuss the… https://t.co/pYrg1fFU19"
1579732292485804033,2022-10-11 07:15:03+00:00,"Somethings brewing over at @cartesiproject! ☕

Join us for Coffee with Cartesi to discuss how they’re empowering de… https://t.co/YllwTUg7rZ"
1579729162600058883,2022-10-11 07:02:36+00:00,"With Elon Musk’s $44B Twitter takeover back on, both Binance and Sequoia Capital have indicated that they will push… https://t.co/qsLEMWgt2q"
1579728620591144960,2022-10-11 07:00:27+00:00,"Join the Telegram side... we have stickers!

Click here: https://t.co/9EnmFE305B https://t.co/0vpXyCeYTX"
1579727014424350720,2022-10-11 06:54:04+00:00,"YouTuber Logan Paul's NFT saw a dramatic loss in value from the $623,000 he paid in 2021, but after trending on soc… https://t.co/6mqOz4sYGa"
1579713424187355136,2022-10-11 06:00:04+00:00,"Do you DAO?

Check this up if you want to know how! https://t.co/w0vdIh0JYV"
1579708772146348032,2022-10-11 05:41:35+00:00,A zero-knowledge Know Your Customer (KYC) system could be the solution for privacy-loving Web3 users. https://t.co/2LDFzQaAMq
1579702083694886912,2022-10-11 05:15:00+00:00,"Now that the ETH merge is over, what was it all about anyway? https://t.co/J88hpwqoPW"
1579692521667502080,2022-10-11 04:37:01+00:00,The OECD has released a framework to let tax authorities get more clarity on crypto transactions and users. https://t.co/mjM5cFmpsb
1579690770927616001,2022-10-11 04:30:03+00:00,"Another malware scam targeting crypto users has been uncovered, this time masquerading as a new Phantom wallet secu… https://t.co/H2SZv8D30k"
1579684747097550849,2022-10-11 04:06:07+00:00,NFTs provide new ways to democratize the success of upcoming athletes. https://t.co/8b0fwK6mzY
1579684739191308288,2022-10-11 04:06:05+00:00,"Ahead of zkSync’s L2 mainnet launch later this month, the project has revealed an L3 ""Pathfinder"" prototype aimed a… https://t.co/ZB7GzC7Bt9"
1579679473343270912,2022-10-11 03:45:10+00:00,Can you spot the Fight Club reference? Try to find it as Josipa Majic narrates her incredible blockchain journey of… https://t.co/wftEpA5KKA
1579671882659348480,2022-10-11 03:15:00+00:00,"Who asked for a way to make money on hashrates? 

A new hashprice-based derivative from Luxor's OTC Bitcoin could b… https://t.co/l7mu8AAqoz"
1579668498854580224,2022-10-11 03:01:33+00:00,"Metaverse heavyweights have hit back at what they claim is a flawed metric measuring Daily Active Users, arguing th… https://t.co/nBwRTg8Nx8"
1579664332652044289,2022-10-11 02:45:00+00:00,"Woops, that's not good. 

TrueFi sends a default notice to Blockwater Technologies over a sizeable BUSD loan. But a… https://t.co/2liQ8bnFJ3"
1579658544265457664,2022-10-11 02:22:00+00:00,APR or APY? You decide what’s best for you. https://t.co/RKjJpieBrW
1579654772101025793,2022-10-11 02:07:00+00:00,"Bitcoin doesn't have easy days ahead, but it didn't retest its lows from last June.
Get an overview of the market w… https://t.co/fSLIzP3ijv"
1579649235129335808,2022-10-11 01:45:00+00:00,"Rather sooner than later we are all likely to have a digital wallet.

Don't fall behind. 
https://t.co/PrykO6Jz7I"
1579643445433356288,2022-10-11 01:22:00+00:00,APR or APY? You decide what’s best for you. https://t.co/RKjJphWsdO
1579639955948961792,2022-10-11 01:08:08+00:00,"Coinbase says it has received ""in-principle"" approval to provide Digital Token Payment services in Singapore, a “ke… https://t.co/gmNg19vRd8"
1579635896894509056,2022-10-11 00:52:00+00:00,"There is a lot of useful stuff to listen to n Market Talks, especially when we have @koreanjewtrading as a guest.… https://t.co/7HGbfjLYjs"
1579630374677671936,2022-10-11 00:30:04+00:00,"Ted Mul called owning digital art a “cool concept”. And that’s at most. Does the CEO of Kuma Games have a point?

C… https://t.co/KRebDfhgAu"
1579628345838346240,2022-10-11 00:22:00+00:00,"Have you ever wondered how blockchains are created?

Here is an overview
https://t.co/SBbe0GkTRN"
1579623075687313408,2022-10-11 00:01:03+00:00,Elon Musk's posts about Dogecoin can cause crypto exchange account sign-ups to rocket up to seven times the daily a… https://t.co/Sp8uP2LZjA
1579622939129176064,2022-10-11 00:00:31+00:00,What’s the deal with Bitcoin’s hash rate? All is revealed within this article. https://t.co/Fh7hDIyLEz
1579613455119978496,2022-10-10 23:22:50+00:00,"Nobody:

Traders who lost all their trades: https://t.co/fH9hHBOti5"
1579613245521788929,2022-10-10 23:22:00+00:00,"Online payment network PayPal has reneged on a controversial policy that could've seen users fined $2,500 for sprea… https://t.co/HD1cmlgzfQ"
1579610450542866441,2022-10-10 23:10:53+00:00,"RT @Cointelegraph: A little dash of mystery never hurt anyone.

Read more here: https://t.co/dGk3IOqJPD"
1579609476516438016,2022-10-10 23:07:01+00:00,"Ever wondered what the new era of toys and entertainment may bring? 

Tune in to hear @horushughes and @ohihello1 c… https://t.co/lf8CAhrBAE"
1579607130344017926,2022-10-10 22:57:42+00:00,"“You’ll have less and less Ether trading in the marketplace,” he explained. “And then what will ultimately happen i… https://t.co/nwwo06JS4V"
1579605699684073475,2022-10-10 22:52:01+00:00,"Do you know how to keep your crypto safe?

Hint: 2FA might not be enough.
https://t.co/OJyFEhqCSU"
1579603196993232896,2022-10-10 22:42:04+00:00,"Without the havoc wrought by Terraform Labs and Celsius Network, cryptocurrency would be down a little more than 15… https://t.co/CtCwyp8kea"
1579600167308652545,2022-10-10 22:30:02+00:00,"BNB Chain has launched a three-week startup incubator for European Web3 initiatives.

In addition, the incubator wi… https://t.co/eNjceDRixT"
1579596385225043968,2022-10-10 22:15:00+00:00,"This phenomenon copied behavior from 2019, and if history repeats, an ""equilibrium"" period should now be ensuing fo… https://t.co/ZxVccvxmzH"
1579594374941319168,2022-10-10 22:07:01+00:00,"Does the bear market affect hiring?

Some might argue that the layoffs were positive since more talent is available… https://t.co/hjs5FfNeaf"
1579590598541332480,2022-10-10 21:52:00+00:00,The OECD has released a framework aimed at letting tax authorities get more clarity on crypto transactions and the… https://t.co/vWzNC13wmk
1579586959512854528,2022-10-10 21:37:33+00:00,"Everyone likes an upgrade, and SBF has responded in kind. Get ready for an efficiency update for FTX soon. https://t.co/pTzF2nCD86"
1579586822518161408,2022-10-10 21:37:00+00:00,"Web3 is the future, but the constant flow of news can be intimidating for those on the outside looking in. 

This h… https://t.co/lmXZ1y2081"
1579583048982491136,2022-10-10 21:22:00+00:00,"Nothing like negotiating with a hacker, eh? $2M worth of funds will be returned to Transit Swap users. https://t.co/G3ThRsaVtG"
1579577655644803072,2022-10-10 21:00:34+00:00,Tourism in the metaverse? Dubai is banking on it with a virtual city. https://t.co/OUQAWG2EKc
1579577566779699201,2022-10-10 21:00:13+00:00,"Bitcoin’s support and resistance zones remain unchallenged, but is this the week that changes? 

(Reporting via… https://t.co/Hc5TX24zHv"
1579573738592301056,2022-10-10 20:45:00+00:00,What does @IOHK_Charles think the downfalls of Ethereum and Bitcoin are? https://t.co/IANTRBthKs
1579572506943332352,2022-10-10 20:40:07+00:00,"Who asked for a way to make money on hashrates? 

A new hashprice-based derivative from Luxor's OTC Bitcoin might b… https://t.co/GAex8CmFtH"
1579570481841471488,2022-10-10 20:32:04+00:00,"Tax evasion, in this economy? Digital assets are getting more scrutiny from the OECD. https://t.co/9MIRsdLmdo"
1579569961327919104,2022-10-10 20:30:00+00:00,"While they can’t sell, purchase or gift their NFTs, withdraw funds from their accounts or add to their balances, us… https://t.co/DXHX57Ov7l"
1579566973805277185,2022-10-10 20:18:08+00:00,"The Nasdaq hit a two-year low, but a positive sign is Bitcoin price has managed to stay well above its June low. https://t.co/t0CFZpeDSb"
1579566186093649921,2022-10-10 20:15:00+00:00,"Rough patches in the Ethereum migration? Popular protocols like @AaveAave and @Uniswap are enabling this newsystem. https://t.co/0yG8mnFIhY"""
1579562533203365888,2022-10-10 20:00:29+00:00,BTC and ETH trying to get to new all-time highs: https://t.co/ppMLOxQFG6
1579560405457809409,2022-10-10 19:52:02+00:00,How is your DeFi portfolio looking this week? https://t.co/iLuNLwykzL
1579558637173092352,2022-10-10 19:45:00+00:00,"Woops, that's not good. 

TrueFi sends a default notice to Blockwater Technologies. But are more on the way? https://t.co/JFQfc2N01G"
1579557907972390912,2022-10-10 19:42:06+00:00,"Bitcoin price lingering below $20,000 has put some BTC miners in financial distress, but hashprice-based derivative… https://t.co/b7oIYtX6q8"
1579556622782722051,2022-10-10 19:37:00+00:00,"Miners: What bear market?

Bitcoin mining difficulty has increased by 13.5%, reaching a new all-time high.  https://t.co/VMTVUz9yne"
1579552897930780672,2022-10-10 19:22:12+00:00,"With hard work and consistency, anything can be achieved. That’s exactly what Josipa Majic proved after defining al… https://t.co/Nq2v47uEJj"
1579548208233316354,2022-10-10 19:03:34+00:00,The proposal aims to create a consistent regulatory framework for crypto among the 27 EU member states. https://t.co/QKqz7MZ53s
1579545303153156096,2022-10-10 18:52:01+00:00,"How do you like your coffee? ☕

We like it with @cartesiproject while discussing how they’re shattering the limitat… https://t.co/3VnDm9qpUN"
1579541320544423936,2022-10-10 18:36:11+00:00,Traders are starting to believe that Bitcoin’s bottom resides below the current yearly low now that on-chain data s… https://t.co/h7D0xybejq
1579541313183440896,2022-10-10 18:36:10+00:00,The missed payment on the $3.4 million loan was the first declared default on the platform to date. https://t.co/H5i1AMHMqm
1579535990099623936,2022-10-10 18:15:01+00:00,"Bitcoin won't make this ""error.""

Online payment network PayPal has reneged on a controversial policy that could've… https://t.co/M8pdrvA2z2"
1579533975780880384,2022-10-10 18:07:00+00:00,Is Bitcoin going to go wild on CPI volatility? https://t.co/NiLrN5m1mC
1579532511939424256,2022-10-10 18:01:11+00:00,"Our very own Editor-in-Chief, @KristinaLCorner, will be speaking at @dxbontheblock in a panel titled: ""Crypto &amp; Med… https://t.co/adUnxG5c9r"
1579532355500666880,2022-10-10 18:00:34+00:00,"Earlier this year, F1 filed two trademark applications for Las Vegas Strip Circuit events where the company’s brand… https://t.co/D3ZeE7JnYD"
1579528439920734208,2022-10-10 17:45:00+00:00,"The government of the UAE has taken initiatives to foster crypto and Web3 adoption. 

According to new research, th… https://t.co/Og5SsMOXIM"
1579525441614118912,2022-10-10 17:33:06+00:00,"The new protocol, dubbed LlamaLend, gives NFT collection owners the ability to serve as liquidators in the event of… https://t.co/gvqu035Rlx"
1579522648903557122,2022-10-10 17:22:00+00:00,"Ten months were enough.
 
OpenSea's CFO Brian Roberts steps down and will remain in the firm in an advisory role. https://t.co/la2LcEtnwY"
1579519897104965632,2022-10-10 17:11:04+00:00,Crypto and Tradfi analysts say volatility metrics point toward a sharp price move for Bitcoin and equities markets.… https://t.co/I1NJAofKFR
1579517113563127814,2022-10-10 17:00:00+00:00,"If you had to start from zero, what part of crypto would you start with?"
1579516643159728129,2022-10-10 16:58:08+00:00,Paul Tudor Jones still has Bitcoin exposure in this environment. Do you agree with the allocation? https://t.co/mwDVhDsxUZ
1579516349554241536,2022-10-10 16:56:58+00:00,@SBF_FTX 🧐
1579513337980690440,2022-10-10 16:45:00+00:00,"Even during a bear market, don't scratch Turkey off the crypto map just yet. https://t.co/wTwaeKVRAA"
1579511087472730113,2022-10-10 16:36:03+00:00,A happy ending after all? The Transit Swap hacker's profile was immediately doxxed by security experts following th… https://t.co/J5vgnF0VZB
1579509562943901697,2022-10-10 16:30:00+00:00,"Web3 may be the future, but the constant flow of news can be intimidating for those on the outside looking in. 

Th… https://t.co/RGy5LuQLSI"
1579506446081093632,2022-10-10 16:17:37+00:00,"'We're still early' — @CatheonGaming says blockchain games currently have a market share of just 5%, and is buildin… https://t.co/0WSFKQL2fc"
1579505807011745792,2022-10-10 16:15:04+00:00,"BNB Chain has launched a three-week startup incubator for European Web3 initiatives.

In addition, the incubator wi… https://t.co/ZCA4cZzIyR"
1579504418873315329,2022-10-10 16:09:33+00:00,"Polygon zkEVM Public Testnet enables cross-compatibility with existing smart contracts, developer tools, and wallet… https://t.co/bTOP4iFZrF"
1579503775458283520,2022-10-10 16:07:00+00:00,"Bitcoin’s support and resistance zones continue to remain unchallenged, but is this the week that changes? 

(Repor… https://t.co/uGv5uBIRk2"
1579502559366385664,2022-10-10 16:02:10+00:00,Cardano founder Charles Hoskinson has pointed out the flaws in both Bitcoin and Ethereum. Find out what those are i… https://t.co/du2TR94jgv
1579502551866937344,2022-10-10 16:02:08+00:00,"Traders expect ""massive"" volatility in Bitcoin price with the October 12 CPI print in focus. https://t.co/zswDdhY9WG"
1579502200480739330,2022-10-10 16:00:44+00:00,"“Ethereum is the Hotel California of cryptocurrency, you can check in but you can’t check out” -@IOHK_Charles
 
The… https://t.co/WseGkH28zY"
1579500007153340416,2022-10-10 15:52:02+00:00,"Need something hot and fresh to start your day?

We’re sitting down with the founders of @cartesiproject over fresh… https://t.co/XHnutzK8th"
1579498248653262848,2022-10-10 15:45:02+00:00,"Does the crypto market situation affect hiring?

Some might argue that the layoffs were positive since more talent… https://t.co/4ttDA4W9fO"
1579496057930940417,2022-10-10 15:36:20+00:00,Searching for you seed phrase like: https://t.co/Mr462v7zFQ
1579494463969558529,2022-10-10 15:30:00+00:00,"While they can’t sell, purchase or gift their NFTs, withdraw funds from their accounts or add to their balances, us… https://t.co/67K1kVfuhB"
1579487201590915073,2022-10-10 15:01:08+00:00,"The advertising industry moves millions every day, but how does it work when you include crypto and sports in the f… https://t.co/ikuHCJjXww"
1579481125957013506,2022-10-10 14:37:00+00:00,"Miners: What bear market?

Bitcoin mining difficulty has increased by 13.5%, reaching a new all-time high. 

(Repor… https://t.co/PtU44MFsVr"
1579475590368792576,2022-10-10 14:15:00+00:00,"The government of the UAE has taken initiatives to foster crypto and Web3 adoption. According to new research, the… https://t.co/Lz6xVhkvsd"
1579473357879521282,2022-10-10 14:06:08+00:00,BNB Chain launches a three-week startup incubator for European Web3 initiatives https://t.co/DVyzRIXafA
1579471965156278273,2022-10-10 14:00:36+00:00,"The chief operating officer for the Helium Foundation is not happy with @Binance.

Multiple trading pairs of the He… https://t.co/EGID8kQ7tr"
1579468907278372864,2022-10-10 13:48:27+00:00,@KryptoniteAli Starting the week strong!! 😎
1579468688880988160,2022-10-10 13:47:35+00:00,@StevenG43114152 Maybe if we all shake our wallets…
1579468048242614272,2022-10-10 13:45:02+00:00,"Such a U-turn. 

Online payment network PayPal has reneged on a controversial policy that could've seen users fined… https://t.co/sA10Gbi2p6"
1579463541459161088,2022-10-10 13:27:07+00:00,"🥁 And at #1... The industry sees another departure as the chief financial officer of OpenSea, Brian Roberts, has be… https://t.co/P6kI9RjPPg"
1579462641831284740,2022-10-10 13:23:33+00:00,"The bear market is having an impact on crypto's presence at major sporting events, with #2 seeing Crypto .com repor… https://t.co/JVpjVEYU0X"
1579460673385697280,2022-10-10 13:15:44+00:00,"Coming in at #3, Crypto exchange Huobi Global announced that About Capital Management (HK) Co. Ltd, a Hong Kong bas… https://t.co/XVOQ4onUIW"
1579460643648057344,2022-10-10 13:15:37+00:00,"@IcoCalendar You got this! Remember this too shall pass ✨

Have an awesome week!"
1579459244260495360,2022-10-10 13:10:03+00:00,"@AyvazDaran We appreciate that, Daran!"
1579459196327985152,2022-10-10 13:09:51+00:00,"Expanded sanctions against Russia has an impact on Dapper Labs at #4, with the flow blockchain developers suspendin… https://t.co/DKM6ENLeQ4"
1579459074688954368,2022-10-10 13:09:22+00:00,"@Retired0nCrypto Welp, new fear unlocked 🫣"
1579458834976116740,2022-10-10 13:08:25+00:00,@Koala_Dragon_ https://t.co/4RO0eZgocl
1579458736636440577,2022-10-10 13:08:02+00:00,@IcoCalendar You’re doing it in style tho 👌
1579458042583609345,2022-10-10 13:05:16+00:00,"#5 is one for the historians as Jim Blasko, a crypto enthusiast, claims to have unearthed “the official oldest know… https://t.co/zMvMyqesq7"
1579457608477741056,2022-10-10 13:03:33+00:00,"When you're building, does it matter if it's a bear market? After hiring freezes and layoffs, more companies are st… https://t.co/T3Slh0HLXx"
1579456893616996353,2022-10-10 13:00:42+00:00,"📰 Top Crypto News 📰 

🔍 ‘Long lost Satoshi Bitcoin code’ found? 
🇷🇺 Dapper Labs suspends Russian accounts 
🤑 Huobi… https://t.co/JM18MPHRdj"
1579452947108618241,2022-10-10 12:45:02+00:00,"After many rejections and plot twists, Josipa Majic managed to launch the first-ever ICO on Cardano. Listen to the… https://t.co/hm8jsCYpNW"
1579450708642131968,2022-10-10 12:36:08+00:00,It’s not all doom and gloom: Your Bitcoin is safer than ever as the miners around the network contribute more and m… https://t.co/enzJdeYNA8
1579450306207059976,2022-10-10 12:34:32+00:00,"In the past few days, Bitcoin has managed to avoid a collapse even when the U.S. equities markets were being clobbe… https://t.co/BedMZKqnAm"
1579449260655153152,2022-10-10 12:30:23+00:00,"From Hasbro to Blockchain, here’s how Josipa Majic launched the first ICO on Cardano surprising everyone. Even her… https://t.co/DNCgpbkcQs"
1579445391417782272,2022-10-10 12:15:00+00:00,"In Turkey, they believe that the bear market is an opportunity to build. https://t.co/wTwaeKVRAA"
1579443704355753985,2022-10-10 12:08:18+00:00,@blockfinexcom 🫡
1579441757791870976,2022-10-10 12:00:34+00:00,"According to data, MENA is the fastest-growing crypto market, EU regulators ban cross-border payments from Russian… https://t.co/0CBUa9QVZG"