id,created_at,text1546964132124979201,2022-07-12 21:06:04+00:00,"CKB price saw a sharp breakout shortly after Nervous Network launched a new NFT marketplace and released Godwoken,… https://t.co/P1n3oxOzay"
1546962751851036673,2022-07-12 21:00:35+00:00,M1 CEO and founder Brian Barnes explained the launch of crypto trading accounts and trading services by noting it “… https://t.co/Au0ta2IwSe
1546960600143519744,2022-07-12 20:52:02+00:00,Multicoin's Venture Fund III is ready to invest over $400M into blockchain companies. (Reporting via @forgeforth_) https://t.co/v3q5Zrzw62
1546958831229538306,2022-07-12 20:45:01+00:00,"Bitcoin OG Kyle Chasse dreams of setting up a community for digital nomads, and despite setbacks, he still keeps on… https://t.co/yf2rbwyriW"
1546955108583358468,2022-07-12 20:30:13+00:00,The price of cryptocurrency mining hardware is expected to continue falling in the near future amid the ongoing cry… https://t.co/dqtd9rSwhr
1546952928761589760,2022-07-12 20:21:33+00:00,French EU presidency ends with wholesale CBDC achievements. https://t.co/hj2hit1WWc
1546951281419378689,2022-07-12 20:15:01+00:00,"Watches, chocolate and crypto, Switzerland has it all. 

Some 2.6 million users that bank with the country’s post o… https://t.co/cb52Vu11cI"
1546950393497894917,2022-07-12 20:11:29+00:00,@iAMhirro Surely he would love that 🤣
1546949519610347520,2022-07-12 20:08:01+00:00,@idexio https://t.co/y9LTkslniq
1546947562523033600,2022-07-12 20:00:14+00:00,"Bank of England deputy governor for financial stability Jon Cunliffe sees crypto and blockchain as ""flying in an un… https://t.co/xysK4dkKGX"
1546945985204858880,2022-07-12 19:53:58+00:00,@satstacker5 We tried 😓
1546945633600212992,2022-07-12 19:52:34+00:00,Protestors in Sri Lanka stormed the President's residence. Now the Central Bank of Sri Lanka is warning the public… https://t.co/l1379F3fCJ
1546943747002626048,2022-07-12 19:45:04+00:00,An uptick in transitions and daily active users suggests that crypto advocates are enduring the bear market by seek… https://t.co/HE7fTDWhRw
1546943733530255360,2022-07-12 19:45:01+00:00,The fintech giant Dunamu aims to open offices in major cities across the country as well as develop training progra… https://t.co/TDF6aAOmZz
1546941725624504320,2022-07-12 19:37:02+00:00,"Several blockchain firms contribute to the latest funding round by Amioca Brands, scooping $75 million to invest in… https://t.co/3ISFuyVjYx"
1546940429609816064,2022-07-12 19:31:53+00:00,@Bob00859646 Not exactly... 👀
1546939489984978945,2022-07-12 19:28:09+00:00,"There's something hidden in the picture, by the way 👀"
1546937944359010305,2022-07-12 19:22:01+00:00,"As NFTs continue to garner interest, calls for clarity grow. 

The U.S. Patent and Trademark Office and U.S. Copyri… https://t.co/b47pg7NPV8"
1546934168701095936,2022-07-12 19:07:01+00:00,"Sandbox 🤝 Playboy.

According to a Monday announcement, this virtual version of the Playboy mansion will feature a… https://t.co/IOw73M1RrO"
1546932511531483136,2022-07-12 19:00:26+00:00,"After nearly a month of inactivity, the co-founder of 3AC is back on Twitter and stirring up controversy. https://t.co/epFxRm4ULd"
1546930403239510019,2022-07-12 18:52:03+00:00,Who saw the Webb telescope pictures today? 👀 https://t.co/0rbcPlcOGe
1546929492672688128,2022-07-12 18:48:26+00:00,"RT @Cointelegraph: Don’t click that link! Uniswap V3 users are being targeted in a sophisticated phishing campaign, using malicious tokens,…"
1546928632186167297,2022-07-12 18:45:01+00:00,"Remember the bottoms of 2015 and 2018?

The same indicators are flashing now. https://t.co/GYzwYyxbPw"
1546924612742627328,2022-07-12 18:29:02+00:00,"Bitcoin price is back below $20,000, and @noshitcoins says three key market valuation metrics suggest the correctio… https://t.co/NkdoTFWHzA"
1546922845833404417,2022-07-12 18:22:01+00:00,"Gaming giant GameStop launched its own nonfungible token marketplace on Monday. 

The new #NFT marketplace intends… https://t.co/8adGCemjdu"
1546919098751373312,2022-07-12 18:07:08+00:00,"The ""To The Moon"" NFT drop will be full of real-world utility and redeemables:

💃Official Balenciaga gear
💳Gift car… https://t.co/o6yGCJDTNs"
1546917446766002176,2022-07-12 18:00:34+00:00,"Should owning stablecoins prevent you from determining the regulations on them? 

That could be the case if an advi… https://t.co/jE2ED91YKd"
1546917060923428866,2022-07-12 17:59:02+00:00,"A 3AC co-founder appeared on Twitter amid rumors of “going missing,” and shared two screenshots of emails from thei… https://t.co/MDZ0SL6wb8"
1546911933768425473,2022-07-12 17:38:39+00:00,Here's some tips to learn more about crypto storage. https://t.co/pwezZaXSLp
1546909876475011073,2022-07-12 17:30:29+00:00,The Central Bank of Russia says nyet to private stablecoins and describes them as “characterized by higher risks” b… https://t.co/knk9Yt5Qws
1546907964358807553,2022-07-12 17:22:53+00:00,"If I text you 🔑 it means not your keys, not your coins."
1546905990582394881,2022-07-12 17:15:02+00:00,"“An unmitigated bare-faced lie.” 

@VitalikButerin took to Twitter to respond to PoS critics. https://t.co/VOiWS0pKDo"
1546904658924302337,2022-07-12 17:09:45+00:00,"RT @CointelegraphMT: Bitcoin to $24,000? The chances of that over ""nuking"" lower are slim, says @Crypto_Ed_NL. https://t.co/tPUdS8OqN9"
1546904372772306945,2022-07-12 17:08:37+00:00,"That's all for today, we'll see you next week! https://t.co/CQ1Gj7D22o"
1546904237774217217,2022-07-12 17:08:05+00:00,"Bank of England deputy governor for financial stability Jon Cunliffe asks regulators to ""get on the job"" of regulat… https://t.co/eHgPLFIhHa"
1546903265824194562,2022-07-12 17:04:13+00:00,"""If you don't know where the yield is coming from, you are the yield."" -@noshitcoins"
1546903181132800002,2022-07-12 17:03:53+00:00,"""Accumulate if possible, and always research the upcoming innovations on crypto and blockchain."" -@forgeforth_"
1546902994482040832,2022-07-12 17:03:08+00:00,"""Bear markets are for building. This is a good time to do some deep research on emerging sectors in crypto. Gaming… https://t.co/WVLzOs0Rxs"
1546901712593616898,2022-07-12 16:58:02+00:00,"""I don't think DeFi is a safe environment. Use it a little, but you shouldn't have more than 20% of your funds in there."" -@noshitcoins"
1546900380969222145,2022-07-12 16:52:45+00:00,"""We are all greedy at times and get caught up in the FOMO. People put way too much trust into these platforms, but… https://t.co/NhQpYEINW2"
1546900195782397953,2022-07-12 16:52:01+00:00,"Forget TRNSMT, something even bigger is coming to Scotland. 

Internationally recognized Bitcoin experts, authors a… https://t.co/Ogkt5Ru36A"
1546895714231455752,2022-07-12 16:34:12+00:00,"We will give away a free one-month Markets Pro subscription (valued at $100) 

Join the YouTube stream to drop your… https://t.co/sj2lNAQWLK"
1546894977162256391,2022-07-12 16:31:17+00:00,"""Looking at the 4-year cycle, we'll come to a bottom in Q3 or Q4. We are probably gearing up for a very volatile fa… https://t.co/eJ8ZNfZ5cm"
1546894928881471488,2022-07-12 16:31:05+00:00,Cloud mining is the process of mining cryptocurrency without the direct use of mining equipment or hardware. While… https://t.co/FhZfbTaYUJ
1546894758202728450,2022-07-12 16:30:24+00:00,"A happy ending for Helium. 

The Internet of Things blockchain has resolved an error that caused a shut down for ab… https://t.co/6QKyzEPTAu"
1546892778239496192,2022-07-12 16:22:32+00:00,"Bitcoin to $24,000? The chances of that over ""nuking"" lower are slim, sa ys @Crypto_Ed_NL. https://t.co/MRjWNrIpk2"
1546892111567618048,2022-07-12 16:19:53+00:00,"""The USD has turned every other fiat currency into algorithmic stablecoins. It makes us crypto people feel better,… https://t.co/lYCILvSKD7"
1546891069903687681,2022-07-12 16:15:45+00:00,"RT @Cointelegraph: For about four hours, the Helium network was full of hot air as validators could not produce new blocks. The problem was…"
1546890882577743874,2022-07-12 16:15:00+00:00,M1 CEO and founder Brian Barnes explained the decision to launch crypto trading accounts and trading services by no… https://t.co/UJUNgdMFQu
1546890881675952129,2022-07-12 16:15:00+00:00,"""We're seeing that the US dollar has been rising substantially over the past 6-7 months, and it shows that Europe i… https://t.co/Wn3HmLMpR0"
1546887321928183810,2022-07-12 16:00:51+00:00,Why are crypto platforms going bankrupt? Is your crypto safe? | The Market Report https://t.co/xGJqbOcM4V
1546887264462147585,2022-07-12 16:00:38+00:00,"Glassnode analysts suggest that we are not out of the woods yet. 

#Bitcoin wealth is being distributed from weak h… https://t.co/H3z3sdgxRo"
1546883339709075457,2022-07-12 15:45:02+00:00,"Not great. 

A phishing campaign targeting liquidity providers of the Uniswap v3 protocol saw attackers make off wi… https://t.co/tgfbB2MfKw"
1546879590957780992,2022-07-12 15:30:08+00:00,The price of cryptocurrency mining hardware is likely to continue falling in the near future amid the ongoing crypt… https://t.co/FFOJCIYfGB
1546878470776569857,2022-07-12 15:25:41+00:00,@BtcLeaks https://t.co/MzfiSmGeNd
1546876969479987201,2022-07-12 15:19:43+00:00,Have you ever mined any crypto? What was your experience? ⛏️
1546875978105995265,2022-07-12 15:15:47+00:00,@YemCurrency Pulling up to the conference like: https://t.co/1cdpxTeMw7
1546875795204968448,2022-07-12 15:15:03+00:00,"Watches, chocolate and crypto, Switzerland has it all. 

Some 2.6 million users that currently bank with the countr… https://t.co/RzKmEJVrKB"
1546875726963638272,2022-07-12 15:14:47+00:00,@UpliftDao https://t.co/pYkGBGRprP
1546875454082138112,2022-07-12 15:13:42+00:00,@elcosmonauta14 ¡Mi Buenos Aires querido!
1546875168219435008,2022-07-12 15:12:34+00:00,@OperacaoPheonix Meu Brasil brasileiro 🎵🇧🇷😄
1546873782161252354,2022-07-12 15:07:03+00:00,"Why are crypto companies going bankrupt? 

Join The Market Report hosts @BY_DeFi, @forgeforth_, @CryptoDuality, and… https://t.co/023XOnbkWf"
1546872068091875329,2022-07-12 15:00:15+00:00,"Isn't it annoying to dig in your backpack looking for stuff?

Get a cool fanny pack and reduce the time to find you… https://t.co/D4usnj4YWi"
1546870759242563585,2022-07-12 14:55:03+00:00,"GBPT is said to be fully backed by the British pound, which means that every token issued will have an equivalent value held in reserves."
1546867981262675968,2022-07-12 14:44:00+00:00,The fintech giant Dunamu aims to open offices in major cities across the country and develop training programs to i… https://t.co/n8O41jmlfu
1546867500993978368,2022-07-12 14:42:06+00:00,"At the time of writing, the floor price for the Rabbitar NFTs on OpenSea sits at 0.19 Ether (ETH) or roughly $206,… https://t.co/ZEkN1VbCeb"
1546864456789118977,2022-07-12 14:30:00+00:00,North Korea-backed cyberattacks on crypto and tech firms will only become more sophisticated over time as the count… https://t.co/ehHjzNsC5m
1546861758991720448,2022-07-12 14:19:17+00:00,"The MetaMansion also builds on Playboy’s Rabbitars NFT project, which consists of 11,953 tokenized bunny avatars th… https://t.co/5EGGbsh697"
1546860706305396738,2022-07-12 14:15:06+00:00,"As NFTs continue to garner interest, calls for clarity grow. 

The U.S. Patent and Trademark Office and U.S. Copyri… https://t.co/U7pqa5j33T"
1546858670759333890,2022-07-12 14:07:01+00:00,"Sandbox 🤝 Playboy.

According to a Monday announcement, this virtual version of the Playboy mansion will feature a… https://t.co/UpVWvKJPmh"
1546857777213095936,2022-07-12 14:03:27+00:00,"At 10:20 am EST, the Consensus Group stopped producing blocks at block height 1435692 on the Helium blockchain, acc… https://t.co/4YDoLCnbug"
1546856925110886401,2022-07-12 14:00:04+00:00,"It's going to be a bumpy week.

Bitcoin falls below $20K, but will it stay there?

Get the full picture here:… https://t.co/gUSTyuadgz"
1546853165248774145,2022-07-12 13:45:08+00:00,"Don’t get optimistic just yet. 

Bitcoin carried through threats of new local lows July 12 as the White House warne… https://t.co/XjBnXu6c00"
1546849557853749248,2022-07-12 13:30:48+00:00,"Gaming giant GameStop launched its own nonfungible token marketplace on Monday. 

The new NFT marketplace intends t… https://t.co/rE4DBdecx8"
1546849497938100224,2022-07-12 13:30:34+00:00,Bitcoin Pi Cycle bottom indicator is about to cross this week for only the third time in history. https://t.co/lWCpQmrsOT
1546845592395071491,2022-07-12 13:15:02+00:00,"Between the Balenciaga gear and gift cards to high-end designer brands, to live and Metaverse concert tickets and a… https://t.co/NQgneotTXi"
1546844686849015808,2022-07-12 13:11:26+00:00,"During the outage, devices transferring data over the network were not affected, but miner rewards and token transf… https://t.co/PT3pe4Ehga"
1546843853373595650,2022-07-12 13:08:08+00:00,"“If equipment owners cannot secure power and capacity at a competitive price level, a lot of newbies who hopped on… https://t.co/k6eGXYy0lp"
1546841913915052032,2022-07-12 13:00:25+00:00,"Should owning stablecoins prevent you from determining regulations on them? 

That could be the case if an advisory… https://t.co/VJ64DY6llJ"
1546841819886956544,2022-07-12 13:00:03+00:00,"Bitcoiner Nick Payton called out “Proof-of-Stakers,” saying that voting to change properties makes the assets secur… https://t.co/AF7ojnaZ1a"
1546838079964696576,2022-07-12 12:45:11+00:00,Does the US realize how revolutionary Bitcoin actually is for the rest of the world? @CryptoJebb wonders. https://t.co/wjs7jxPWWw
1546836975520555008,2022-07-12 12:40:48+00:00,"What about Edinburgh, Scotland? 

If you haven't thought about it before, you will very soon. https://t.co/eXQkivEBIJ"
1546834278645907456,2022-07-12 12:30:05+00:00,"The Central Bank of Russia says nyet to private stablecoins, describing them as “characterized by higher risks” bec… https://t.co/PUZfCRPG9Z"
1546832892348665856,2022-07-12 12:24:34+00:00,Swiss Post’s banking arm is developing a crypto trading service as users call for in-house custody. https://t.co/uUcseTR9Ar
1546830485678161920,2022-07-12 12:15:01+00:00,"An In-N-Out manager salary can be as high as $100,000.

Crypto Twitter might want to update the @McDonalds meme 👀"
1546829995338862593,2022-07-12 12:13:04+00:00,What is your dream location for a crypto conference? 🌞🌴😎
1546826707247693827,2022-07-12 12:00:00+00:00,"Forget TRNSMT, something even bigger is coming to Scotland. 

Internationally recognized Bitcoin experts, authors a… https://t.co/bZzIpAcIdQ"
1546823010128207872,2022-07-12 11:45:18+00:00,"Jordan Walker, CEO of the Bitcoin Collective, told Cointelegraph, “the conference is solely Bitcoin related, as thi… https://t.co/FIMo1P0CaD"
1546820053965762560,2022-07-12 11:33:34+00:00,"Korean fintech giant Dunamu is reportedly planning to invest 500 billion won to generate 10,000 jobs in the Web3 ec… https://t.co/XdTKT85B3X"
1546819163745882112,2022-07-12 11:30:01+00:00,"A happy ending for Helium. 

The Internet of Things blockchain resolves an error that caused a shut down for about… https://t.co/iBlmv6uN5j"
1546816023990390784,2022-07-12 11:17:33+00:00,"The impact of intellectual property rights of NFTs is under the spotlight as U.S. Patent and Trademark, Copyright O… https://t.co/O14R1jlTj0"
1546815543767977986,2022-07-12 11:15:38+00:00,"Organized by the Bitcoin Collective, a newly formed Bitcoin company, and in partnership with Bitcoin and crypto exc… https://t.co/Qxn7Go0hHk"
1546815393985138691,2022-07-12 11:15:03+00:00,Always remember to https://t.co/wY7kxwIDfd
1546811646366154752,2022-07-12 11:00:09+00:00,M1 CEO and founder Brian Barnes explained launching crypto trading accounts and trading services by noting it “has… https://t.co/54nNWjAFkz
1546810862177988608,2022-07-12 10:57:02+00:00,"Bitcoin, Ethereum sell off to weekly lows ahead of what promises to be some grim U.S. inflation numbers. https://t.co/rfNZL44H56"
1546807824285564928,2022-07-12 10:44:58+00:00,"@sniko_ At least $4.7 million in ETH has been lost in the attack, according to a Twitter post from Binance CEO Chan… https://t.co/uHUkWWVfnZ"
1546804059834880001,2022-07-12 10:30:00+00:00,"Not great. 

A phishing campaign targeting liquidity providers of the Uniswap v3 protocol has seen attackers make o… https://t.co/zQVVrACac2"
1546800402628321280,2022-07-12 10:15:28+00:00,"MetaMask security researcher @sniko_ was one of the first to raise the alarm bells of the attack, telling his 13,00… https://t.co/GLvJ6B1NLA"
1546799168261275648,2022-07-12 10:10:34+00:00,Should owning stablecoins prevent you from determining regulations on them? That could be the case if an advisory n… https://t.co/rW3GbbO8X7
1546796798110466048,2022-07-12 10:01:09+00:00,"Glassnode analysts suggest that we are not out of the woods yet. 

Bitcoin wealth is being distributed from weak ha… https://t.co/xJ4zrYJ17H"
1546788960432709632,2022-07-12 09:30:00+00:00,North Korea-backed cyberattacks on cryptocurrency and tech firms will only become more sophisticated over time as t… https://t.co/dH2LciHfdp
1546785953024339968,2022-07-12 09:18:03+00:00,A representative of Russia's central bank said that private stablecoins “are characterized by higher risks.” https://t.co/eCD7Ee1kW9
1546781512909131777,2022-07-12 09:00:25+00:00,"Sandbox 🤝 Playboy.

According to a Monday announcement, this virtual version of the Playboy mansion will feature a… https://t.co/NU3Xu34pbK"
1546776517333508096,2022-07-12 08:40:34+00:00,The U.K.'s first global Bitcoin conference comes to Edinburgh in October. https://t.co/eXQkivn0k9
1546773860053356544,2022-07-12 08:30:00+00:00,"Gaming giant GameStop launched its own nonfungible token marketplace on Monday. 

The new NFT marketplace intends t… https://t.co/rRbfgOG0O5"
1546751226636902401,2022-07-12 07:00:04+00:00,"The ""To The Moon"" NFT drop is on the horizon

Here's a sneak peek at some utility it'll offer

1️⃣Official Balencia… https://t.co/lQmA9qOAv3"
1546733098284396545,2022-07-12 05:48:02+00:00,"For about four hours, the Helium network was full of hot air as validators could not produce new blocks. The proble… https://t.co/OVMxyBkXYw"
1546727442936606723,2022-07-12 05:25:33+00:00,M1 Finance CEO and founder Brian Barnes stated the move to support digital assets came after nearly 50% of the cust… https://t.co/zw5PZRhOOH
1546722027850960896,2022-07-12 05:04:02+00:00,"Don’t click that link! Uniswap V3 users are being targeted in a sophisticated phishing campaign, using malicious to… https://t.co/HiYQIQGeaS"
1546702137266143234,2022-07-12 03:45:00+00:00,"A new stablecoin, GBPT, enters the market.

The ""poundtoken"" will be lbacked by the British pound and it will be au… https://t.co/cNP0k1IWva"
1546698363596308481,2022-07-12 03:30:00+00:00,"Is this the bottom?

Data suggests it's too soon to be overly happy. https://t.co/dlGMeIOfgh"
1546690320242393089,2022-07-12 02:58:03+00:00,"Bitcoin may be testing the bottom now, but to determine whether it is on the “ultimate floor,” the pain needs to be… https://t.co/j01xDmBTAU"
1546688802009370625,2022-07-12 02:52:01+00:00,"What makes an NFT successful?

There is no magic formula, but nothing is worth it without a good story. https://t.co/6cGVe9QMP6"
1546684788727132160,2022-07-12 02:36:04+00:00,"Be on the lookout. North Korean crypto-hacking operatives are set to get smarter and more sophisticated, says forme… https://t.co/N5KxrSkZHy"
1546683266400505856,2022-07-12 02:30:01+00:00,"Voyager has a plan to reimburse users, but they might not get all of what's owed. https://t.co/tOnhBD8qqp"
1546680758105821184,2022-07-12 02:20:03+00:00,Users of The Sandbox will soon be able to attend exclusive social and gaming events at Playboy’s upcoming MetaMansi… https://t.co/GwP8skqtST
1546679489295425538,2022-07-12 02:15:00+00:00,"According to a report by Reuters, Iranian users have been trading on Binance despite a self-imposed a ban from oper… https://t.co/oRLpKxv6vl"
1546675725322821642,2022-07-12 02:00:03+00:00,"Short sellers have their sights set on Tether. 

While it has maintained its peg to the U.S. dollar, what can the c… https://t.co/3ZnRfeJMfw"
1546671939783200771,2022-07-12 01:45:00+00:00,"How will DAOs be affected by the Lummis-Gillibrand bill on crypto regulation?

One of the most impactful sections h… https://t.co/moQjJjrz6r"
1546668202867974145,2022-07-12 01:30:09+00:00,"Filipino @binance users can breathe a sigh of relief. 

A proposal to ban the global cryptocurrency exchange from o… https://t.co/7x3K16dqZU"
1546664390627319809,2022-07-12 01:15:01+00:00,South Korean giant SK Telecom is teaming up with blockchain companies AhnLab Blockchain and Atomix Lab to launch a… https://t.co/sdTK6bDI8u
1546658603469361153,2022-07-12 00:52:01+00:00,"Investors in SOL might want to look at these reasons it could spike 5,000%. https://t.co/HuceIzObBj"
1546653119341289473,2022-07-12 00:30:13+00:00,"The Pyctor offering compliments GMEX’s MultiHub service, an institutional cross-platform business launched last yea… https://t.co/1oH7OBUCRH"
1546649308308684804,2022-07-12 00:15:05+00:00,"How far could a Terra-like contagion spread? 

The European Central Bank releases a report analyzing the growth of… https://t.co/XimMihTdRz"
1546647286784167936,2022-07-12 00:07:03+00:00,"What can you expect from the ""To The Moon"" NFT drop?

Free Metaverse concert tickets, wearables, and access to futu… https://t.co/49Q3b3p8J5"
1546645661017309185,2022-07-12 00:00:35+00:00,"Patience is a virtue. 

Craig Salm, chief legal officer at asset manager Grayscale, has estimated that it could tak… https://t.co/s1V1Y7IBMA"
1546641742132396033,2022-07-11 23:45:01+00:00,"Mo’ (digital) money, mo’ regulations. 

The Bank of England deputy governor for financial stability recommends form… https://t.co/DDgnhcJFC9"
1546641257522274306,2022-07-11 23:43:05+00:00,"Find, create, buy, sell and trade NFTs through the newly launched GameStop NFT marketplace. The marketplace is a no… https://t.co/Ius3iCTWXk"
1546638995911852033,2022-07-11 23:34:06+00:00,@maxminted Are the friends rare or well done?
1546638578129817606,2022-07-11 23:32:26+00:00,@thunder_meat https://t.co/qy0S9i3JAy
1546638037769125889,2022-07-11 23:30:18+00:00,"What’s next for Celsius? 

The crypto lending platform reportedly hires lawyers from Kirkland &amp; Ellis LLP to advise… https://t.co/Txdemxq7An"
1546634190401277955,2022-07-11 23:15:00+00:00,Higher security and lower inflation derived from the Merge will put ETH as a serious aspirant to the throne of cryp… https://t.co/5WrR74pvVj
1546632139931676672,2022-07-11 23:06:51+00:00,"@AlamedaTrabucco What are those, some sort of of physical token? 😂"
1546631452611133440,2022-07-11 23:04:07+00:00,@aztimazzi So like... little pieces of steak all over the world?
1546631324403781633,2022-07-11 23:03:37+00:00,@benjamin_abbaci With a knife.
1546631233915867137,2022-07-11 23:03:15+00:00,@nofudADA We were waiting for the staking jokes. A little disappointed they didn't come sooner.
1546631070107328512,2022-07-11 23:02:36+00:00,While we're on the subject 👀⛏  https://t.co/TSG77Uezxz
1546630475074215936,2022-07-11 23:00:14+00:00,We're all in this together. Maybe. Huge players in legacy finance want a joint effort on CBDCs. Here's why. https://t.co/5eUzYEAsb7
1546630125000671232,2022-07-11 22:58:51+00:00,"RT @Cointelegraph: 📰 Top Crypto News 📰 

🔵 Man City inks deal with OKX
🔥 Axie Infinity volume surges 205%
🙅Tether liquidates Celsius positi…"
1546629229407719424,2022-07-11 22:55:17+00:00,"@xavierchua Thank you!

Oh, you mean the steak."
1546629142744932353,2022-07-11 22:54:57+00:00,@FantohmDAO https://t.co/etAyAg3m8h
1546628982996496384,2022-07-11 22:54:19+00:00,@thepoorchef10 You like your steak fished?
1546628788095631363,2022-07-11 22:53:32+00:00,@LunarCrush 😂 https://t.co/YKoQVVm4Yd
1546628401892573185,2022-07-11 22:52:00+00:00,How do you like your steak? 🥩
1546628220870569984,2022-07-11 22:51:17+00:00,Throwing your friends into the market at the top https://t.co/aRzSgSv2wP
1546626643137105922,2022-07-11 22:45:01+00:00,Don't wait to click. Here's your price analysis. https://t.co/q8Shnz1bUm
1546625413622796289,2022-07-11 22:40:08+00:00,Which cryptocurrencies are watching YOU this week? 👀 https://t.co/JEAlcLDbQq
1546624572866170880,2022-07-11 22:36:47+00:00,"RT @Cointelegraph: The meaning of identity is constantly changing in the digital world.

While your Web2 identity was heavily tied to email…"
1546622908990111746,2022-07-11 22:30:11+00:00,"Terra is gone, but the projects live on. 

More than 48 different crypto projects formerly based on the failed ecos… https://t.co/wXidB4vDDq"
1546619642919079936,2022-07-11 22:17:12+00:00,@BinanceUS Don't poke the bear market.
1546619274130870274,2022-07-11 22:15:44+00:00,@MommaENS That's a W combo in our book 🔥
1546619092626509824,2022-07-11 22:15:01+00:00,"Can we call it the worst bear market ever?

Take a look at what @_Checkmatey_ from Glassnode shared with Cointelegr… https://t.co/sLy7ZQmujo"
1546616821935091712,2022-07-11 22:05:59+00:00,"@surrealxtreme We have succeeded. Thank you, it's an honor to serve you. 🫡"
