id,created_at,text1549366387130384387,2022-07-19 12:11:47+00:00,"According to an advisory published on Monday by the securities and intelligence agency, cybercriminals have created… https://t.co/T5YduSqjrX"
1549364949394157568,2022-07-19 12:06:04+00:00,NFT marketplace MetaMundo debuts 3D NFTs that are interoperable across popular metaverses. https://t.co/LrNlHObnjr
1549363477264875522,2022-07-19 12:00:13+00:00,"Want to work in the Metaverse? Dubai is hiring. 

The emirate launches the Dubai Metaverse Strategy that aims to tu… https://t.co/lDpEGRK4xo"
1549359413122592768,2022-07-19 11:44:04+00:00,"Would you tip a busker in Bitcoin, BTC? @BTCSessions did just that and gave a free lesson in the Lightning Network! https://t.co/Ko79sUAXwc"
1549358099684892672,2022-07-19 11:38:51+00:00,"Ongoing at @EthCC 👀.

Underwriting in DeFi: Study of Current Practices. Speaker: Will Nuelle, Galaxy Digital. #ETHCC https://t.co/lL7sq6CppT"
1549357346471698433,2022-07-19 11:35:51+00:00,"As a result, Celsius is free to “use, sell, pledge, and rehypothecate those coins” as it wishes."
1549354066454757378,2022-07-19 11:22:49+00:00,"@LidoFinance L2’22, right?"
1549352187473657856,2022-07-19 11:15:21+00:00,"^ In case you are wondering why we are asking. 

Crypto staking service provider @LidoFinance has announced plans t… https://t.co/5In0liyM2R"
1549352186504794112,2022-07-19 11:15:21+00:00,"At the first bankruptcy hearing for Celsius on Monday, lawyers from the Kirkland law firm led by Pat Nash detailed… https://t.co/00aP8fHmNP"
1549352185443516416,2022-07-19 11:15:21+00:00,Where would you like to stake your Ethereum?
1549348483882274816,2022-07-19 11:00:38+00:00,"Will Bitcoin’s energy consumption really reach 100x? 

Not without an ""absurd"" future price tag argues @provoost.… https://t.co/MCAv5OGulu"
1549344071772168192,2022-07-19 10:43:06+00:00,"The trillion dollar mark was welcome news to crypto advocates on Twitter. 

They were quick to celebrate the moment… https://t.co/UvAITbyig0"
1549343053193822208,2022-07-19 10:39:03+00:00,"Gm Paris 🇫🇷!

Cointelegraph is live at the Ethereum Community Conference. Follow all the updates and highlights acr… https://t.co/DODEu30LkT"
1549340775154155521,2022-07-19 10:30:00+00:00,"Be careful out there. 

Bored Ape Yacht Club creator @yugalabs warned there may soon be a “coordinated attack” targ… https://t.co/0u9A4bIJse"
1549337017728864258,2022-07-19 10:15:04+00:00,Crypto staking service provider @LidoFinance has announced plans to expand staked Ether support across the ecosyste… https://t.co/wo9U1SN8GT
1549335651878928385,2022-07-19 10:09:39+00:00,"In the case of Bitcoin and most mined cryptocurrencies, the ""market cap"" refers to the total value of all mined coi… https://t.co/UAWc8YEjdF"
1549333322299498497,2022-07-19 10:00:23+00:00,"Bitcoin is struggling against resistance, but there's still plenty of green in the market.

Which coin are you expe… https://t.co/c0L9qlSLOa"
1549331212996673540,2022-07-19 09:52:01+00:00,"The United States FBI has issued a public warning about fraudulent cryptocurrency applications, which have swindled… https://t.co/zBbDvcSnts"
1549328969123504129,2022-07-19 09:43:06+00:00,Symbiosis Finance is using stablecoins to make way for one-click liquidity swaps without any impermanent loss for t… https://t.co/XY7e0w4G5p
1549325765908512769,2022-07-19 09:30:22+00:00,"RUNE pumps after killswitch activation. 

Cross-chain exchange and proof-of-bond network THORChain has finally acti… https://t.co/PjAqjKmIam"
1549322945805160448,2022-07-19 09:19:09+00:00,"Aave is now working with a decentralized Web3 infrastructure provider, Pocket Network, to provide developers more s… https://t.co/Ibv1N0iGNW"
1549322937102061568,2022-07-19 09:19:07+00:00,Otherside hype prevents ApeCoin price from breaking down. https://t.co/O3JmWBiuxX
1549318196078977025,2022-07-19 09:00:17+00:00,"Could various layers of a blockchain help solve the blockchain trilemma? 

We delve deeper into the various layers… https://t.co/BZLnSbhSTo"
1549317507466477568,2022-07-19 08:57:33+00:00,Developers across the Global South are creating solutions to bring Bitcoin to billions. https://t.co/rsoqK8xI5y
1549312354180931584,2022-07-19 08:37:04+00:00,"Extended reality, augmented reality, virtual reality, mixed reality and digital twins are the key pillars of the Du… https://t.co/YLQxsuutKw"
1549310575460720640,2022-07-19 08:30:00+00:00,"What is a parachain? 

A parachain, formally a parallelizable chain, is an individual layer-one blockchain that fun… https://t.co/q7vnV8HiIx"
1549308318430023681,2022-07-19 08:21:02+00:00,"Bitcoin using more energy? Not without an ""absurd"" future price tag, argues @provoost. https://t.co/ok8lciJfV6"
1549295504282058757,2022-07-19 07:30:07+00:00,"Winklevoss twins' firm, Gemini, keeps cutting off stuff to reduce expenses.

According to @TechCrunch, a source clo… https://t.co/fDwWwSUYhI"
1549287944963461120,2022-07-19 07:00:05+00:00,"The ""To The Moon"" NFT drop is full of real-world utility and redeemables:

💃Official Balenciaga gear
💳Gift cards to… https://t.co/8pcHjSkHcB"
1549274103202254853,2022-07-19 06:05:04+00:00,Question everything. Yuga Labs has flagged an imminent “coordinated attack” from a “persistent threat group” that w… https://t.co/IRNPW4gkN5
1549274094754861056,2022-07-19 06:05:02+00:00,Lido Finance will first roll out ETH staking on layer-two networks via bridges and wrapped stETH before launching d… https://t.co/6fvUiFctxa
1549266799182524418,2022-07-19 05:36:03+00:00,Marathon Digital Holdings is nearly set to switch on more miners in Texas and North Dakota. The firm has secured th… https://t.co/7IgxlOcLB4
1549246402739535872,2022-07-19 04:15:00+00:00,Popular auction house Christie's bids in LayerZero Labs in their jump to supporting technology related to art in th… https://t.co/00R9STZl34
1549238855982895105,2022-07-19 03:45:01+00:00,"Is #Bitcoin recovering?

Even though there is some optimism in the market, analysts argue it won't be a sustained r… https://t.co/MJJXUwUVWg"
1549232830827229184,2022-07-19 03:21:04+00:00,Celsius depositors face the reality that they transferred title and ownership of their crypto to the firm when they… https://t.co/WwqBjYSYnh
1549229290285371393,2022-07-19 03:07:00+00:00,Russian tokenization platform Atomyze partnered with Rosbank and announced a palladium-backed token on July 18th.… https://t.co/Cq1BAhrgCo
1549221743012741120,2022-07-19 02:37:01+00:00,"Winklevoss twins' firm, Gemini, keeps firing people to cut expenses.

According to @TechCrunch, a source close to t… https://t.co/gNB9rl5qWG"
1549214575983112192,2022-07-19 02:08:32+00:00,"The FBI has issued a public warning about fraudulent cryptocurrency apps, which have seen around 244 U.S. investors… https://t.co/rb54AWDnAf"
1549214190870609922,2022-07-19 02:07:00+00:00,"It’s not just the temperature that’s rising. 

Ether successfully avoids a bearish technical setup to reach a two-m… https://t.co/u2kFwDIRND"
1549208795200438272,2022-07-19 01:45:34+00:00,THORchain’s long-awaited killswitch has been activated to make BNB.RUNE and ETH.RUNE worthless as the project pushe… https://t.co/sPEye8b7Hd
1549206644260757504,2022-07-19 01:37:01+00:00,"Who doesn't like playing on a green field?

Bitcoin keeps its weekend rally and makes traders wonder if it had alre… https://t.co/kBNVqzzD61"
1549202866816024580,2022-07-19 01:22:00+00:00,Three Arrows is trying to stave off more legal bouts during complex financial deals. https://t.co/9gLLV6woni
1549199672358498310,2022-07-19 01:09:19+00:00,"RT @Cointelegraph: Bitcoin hodlers are leaving their coins untouched, with most of the supply now dormant. Glassnode says the activity has…"
1549199091145576450,2022-07-19 01:07:00+00:00,"One country alone won’t determine the future of crypto. 

Indian finance minister Nirmala Sitharaman calls for glob… https://t.co/VcqddynPSP"
1549195316297191429,2022-07-19 00:52:00+00:00,"Blockchain isn’t less disruptive just because the market is down. 

FTX crypto exchange CEO @SBF_FTX highlighted us… https://t.co/LSLhVnCTq3"
1549193314079068167,2022-07-19 00:44:03+00:00,What does #Bitcoin say to those who thought the market was down forever? https://t.co/Qvj5vIh8Av
1549189830256599041,2022-07-19 00:30:12+00:00,Bitcoin and the main altcoins breakout on July 18th while traders celebrate the total market capitalization hit abo… https://t.co/Eu1zJGo3K8
1549186004849934338,2022-07-19 00:15:00+00:00,Popular auction house Christie's gets into the Web3 announcing it will support technology related to art and luxury… https://t.co/ZRuWMhvTFu
1549183992871751680,2022-07-19 00:07:01+00:00,"When it gets too hot, you have to look at Celsius. This is why the firm just went bankrupt. https://t.co/7lZviUtKcr"
1549182261546950656,2022-07-19 00:00:08+00:00,"Feeling déjà vu? 

With BTC’s per transaction cost coming down to $56.846 on July 14, the ecosystem unveiled a cycl… https://t.co/Ugk6Hoxt4t"
1549178455178317825,2022-07-18 23:45:00+00:00,"Blockchain isn’t less disruptive just because the market is down. 

FTX crypto exchange CEO @SBF_FTX highlights use… https://t.co/ZWNJoLqwoO"
1549174721044008962,2022-07-18 23:30:10+00:00,"Starting off strong. 

Around 4,500 people jump into the “first trip” tech demo of the Otherside Metaverse project… https://t.co/2jpGq7aplF"
1549170907515473920,2022-07-18 23:15:01+00:00,Russian tokenization platform Atomyze partnered with Rosbank and announced a palladium-backed token on July 18th.… https://t.co/Y7rUM2uw3l
1549167276624060421,2022-07-18 23:00:35+00:00,Is $14K the next stop before a bull run for Bitcoin? https://t.co/dNFhNYBX7O
1549167155761012743,2022-07-18 23:00:06+00:00,"Is #Bitcoin already recovering?

Even though there is some optimism in the market, analysts argue it won't be a sus… https://t.co/KlcA7Bx1k6"
1549163356040331264,2022-07-18 22:45:00+00:00,Good news for Coinbase! The exchange announced it has secured approval to offer crypto services in Italy. https://t.co/ls2fCXY0Fo
1549159592575336451,2022-07-18 22:30:03+00:00,Australian central bank Governor Phillip Lowe said that a private solution “is going to be better” for crypto as lo… https://t.co/UuO010Wn50
1549158574227701765,2022-07-18 22:26:00+00:00,"Even when Bitcoin is low, it's comps look nice. Here's how a versus with gold looks like for BTC. https://t.co/1rYfNysuKb"
1549155822638448642,2022-07-18 22:15:04+00:00,"Think twice before posting that NFT.

Even if you own it, you might be breaking intellectual property law. https://t.co/8oYjfvky4m"
1549152042479927299,2022-07-18 22:00:03+00:00,"Finally! 

On Sunday, Ripple Labs co-founder Jed McCaleb finally emptied the last of his 9 billion XRP from his fam… https://t.co/eOyg35azYU"
1549149411338362880,2022-07-18 21:49:36+00:00,"Several on-chain metrics suggest that the strongest Bitcoin capitulation already took place, but one Glassnode indi… https://t.co/tc3FAYZZXw"
1549149403973185536,2022-07-18 21:49:34+00:00,Liquidators are sorting out 3AC finances in preparation for claims. https://t.co/G9fOTkCo2n
1549148258337017856,2022-07-18 21:45:01+00:00,"Africa is determined to take advantage of blockchain to its fullest.

“With the help of blockchain, Africa can crea… https://t.co/cThfyXIqhz"
1549147766034558976,2022-07-18 21:43:03+00:00,Will Circle spur the framework for US crypto policy? The firm's Chief Strategy Officer laid out 18 principles to he… https://t.co/q9ciGoIHy2
1549144481135468551,2022-07-18 21:30:00+00:00,"Paraguay is one step closer to a crypto framework. 

The Paraguayan Senate passes a bill establishing a tax and reg… https://t.co/I2rQMZNcaR"
1549142483157803016,2022-07-18 21:22:04+00:00,"Steady, steady, carefuuuuullllllll https://t.co/kWHA8aqjof"
1549140708564549633,2022-07-18 21:15:01+00:00,"Have we been here before? 

The majority of Bitcoin has been hodled for at least three months in behavior bearing a… https://t.co/oddY0wZJRv"
1549139154751041537,2022-07-18 21:08:50+00:00,@MsCryptomom1 @TheSandboxGame Was in Paris!
1549136992021233665,2022-07-18 21:00:15+00:00,"Woah! So many blockchain layers these days. 

We explain the buzz around Layer 0, Layer one, Layer two, and Layer t… https://t.co/Xn0Rm9qP1r"
1549133159224197120,2022-07-18 20:45:01+00:00,"Could we see a bullish spring? 

Grayscale Investment's latest Insight report suggested the current bear market cou… https://t.co/4gsYJ0SUlE"
1549130781179514880,2022-07-18 20:35:34+00:00,"Celsius files Chapter 11, court takes Ripple's side, Andorra is nearing its crypto framework and other major highli… https://t.co/sRnwbJ3vAN"
1549129382270230529,2022-07-18 20:30:00+00:00,Oh no! Binance has been fined $3M in the Netherlands for failing to obtain regulatory approval to operate in the co… https://t.co/tNI91Rtjxc
1549127627356508160,2022-07-18 20:23:02+00:00,"Institutional investors are exposed to $15.9 billion worth of Bitcoin, yet BTC price trades under $22,000.… https://t.co/EwDEG4ROWM"
1549125607673454593,2022-07-18 20:15:00+00:00,"It’s not just the temperature that’s rising. 

Ether successfully avoided a bearish technical setup to reach a two-… https://t.co/Z5vLS92Igk"
1549121856371924994,2022-07-18 20:00:06+00:00,"Hello again, $1T crypto market cap. We've missed you. https://t.co/gaK11SXDLz"
1549120962825555969,2022-07-18 19:56:33+00:00,"RT @CointelegraphMT: NFTs have the power to give people identity 🦸‍♀️ 

@gareb on NFT Steez: https://t.co/vRKuCuyQ4D https://t.co/QbodvbEGl8"
1549118060887478272,2022-07-18 19:45:01+00:00,"One country alone won’t determine the future of crypto. 

Indian finance minister Nirmala Sitharaman called for glo… https://t.co/e5VCrS3WeJ"
1549115930457780224,2022-07-18 19:36:33+00:00,"Bitcoin, Ethereum and MATIC are holding onto their weekly gains and propelling the total crypto market capitalizati… https://t.co/gPR7LsJsqz"
1549114321317371907,2022-07-18 19:30:10+00:00,"Forced selling from Bitcoin miners raises concern about #BTC price, but the use of renewable energy and the oil and… https://t.co/p93Fb0NN84"
1549114314811797509,2022-07-18 19:30:08+00:00,"Apparently, Gemini's Slack is a bit thin. As crypto prices increase, a 10% staff cut is reportedly hitting the firm. https://t.co/3AQcUbdhMP"
1549110526147452930,2022-07-18 19:15:05+00:00,"Between the Balenciaga gear and gift cards to high-end designer brands, to live and Metaverse concert tickets and a… https://t.co/NukCrsUpd9"
1549106882769571843,2022-07-18 19:00:36+00:00,"Feeling déjà vu? 

With BTC’s per transaction cost coming down to $56.846 on July 14, the ecosystem has unveiled a… https://t.co/JO85jCoI6B"
1549106231507181569,2022-07-18 18:58:01+00:00,RT @CointelegraphCS: At a glance the $14.67 billion invested in Q2 is no big change from the $14.66 invested in Q1 but in reality #Web3 and…
1549106113504694272,2022-07-18 18:57:33+00:00,@CryptoPatrika https://t.co/NnydpGQNdX
1549105189109411840,2022-07-18 18:53:52+00:00,But is the pump in price for real? Maybe not. https://t.co/Lj0jfS8CBy
1549104720026935304,2022-07-18 18:52:00+00:00,"$14.67 billion was invested into the crypto industry in Q2. 

But why was the largest amount of that 14 billion inv… https://t.co/wa4WjngVQD"
1549103710793498624,2022-07-18 18:48:00+00:00,"After hesitating near the 20-day EMA ($20,986) for two days, Bitcoin made a decisive move higher on July 18. The up… https://t.co/z7L0swP6e6"
1549102958603894786,2022-07-18 18:45:00+00:00,"Blockchain isn’t less disruptive just because the market is down. 

FTX crypto exchange CEO @SBF_FTX highlighted so… https://t.co/NygumxMH5k"
1549102815389175809,2022-07-18 18:44:26+00:00,"Bitcoin rose above $22,000 and Ether traded above $1,500 on July 18, indicating that bulls are gradually returning… https://t.co/l33LRp3ESW"
1549100280406429697,2022-07-18 18:34:22+00:00,"Did someone say rooftop party? 👀 🌴 🏙 

Tons of #EthCC excitement 🎉 

Check back in tomorrow for live @EthCC coverag… https://t.co/31RU1BFjZ5"
1549099247856783361,2022-07-18 18:30:16+00:00,"Starting off strong. 

Around 4,500 people  jumped into the “first trip” tech demo of the Otherside Metaverse proje… https://t.co/bs63cQcSXp"
1549097306401648641,2022-07-18 18:22:33+00:00,"Bitcoin, Ethereum and other large-cap altcoins made a notable move to start the week, but real proof of a trend rev… https://t.co/s84EyDIiHn"
1549095427391115266,2022-07-18 18:15:05+00:00,"Africa is determined to take advantage of the blockchain technology to its fullest.

“With the help of blockchain,… https://t.co/Bb5pwVeahm"
1549091664265748480,2022-07-18 18:00:08+00:00,"Bitcoin rebounds strongly off the weekly close, but for $BTC miners, it may be a case of “too little too late.” 

W… https://t.co/NqNltnBfQp"
1549087860506038272,2022-07-18 17:45:01+00:00,Australian central bank Governor Phillip Lowe said that a private solution “is going to be better” for cryptocurren… https://t.co/NImU9x8tNx
1549087177811697664,2022-07-18 17:42:18+00:00,RT @CointelegraphMT: What does it mean?! 🛸 https://t.co/tVNNwjsMZa
1549084164296790018,2022-07-18 17:30:20+00:00,Polkadot's secret weapon to fix the blockchain scalability problem? Introducing Parachains! https://t.co/VUljMpHXNC
1549080310347796481,2022-07-18 17:15:01+00:00,Ripple Labs co-founder Jed McCaleb finally emptied the last of his 9 billion $XRP from his famed “Tacostand” wallet… https://t.co/IJrVVDvKnA
1549076845160693762,2022-07-18 17:01:14+00:00,"Paraguay is one step closer to a crypto framework. 

The Paraguayan Senate has passed a bill establishing a tax and… https://t.co/OgFR4kzGBY"
1549074741490864128,2022-07-18 16:52:53+00:00,Not sure? Check out the latest edition of 5 things to know in Bitcoin this week. https://t.co/tbZJYmlBWk
1549072760307036161,2022-07-18 16:45:01+00:00,"Have we been here before? 

The majority of Bitcoin has been hodled for at least three months in behavior that bear… https://t.co/pSSq0pv0RY"
1549071752805892096,2022-07-18 16:41:00+00:00,Director of blockchain strategy at zero-fee NFT marketplace discusses project mainnet launch and Tron ecosystem in… https://t.co/N4X9KxGFvV
1549068984321945600,2022-07-18 16:30:00+00:00,"Not your usual suspect, but this cat attacked a #Bitcoin node. 

The story of one Bitcoiner’s cat that sought to di… https://t.co/rPmH6EDq7A"
1549067433796947968,2022-07-18 16:23:51+00:00,What price do you expect Bitcoin to end the week at?
1549065974053097472,2022-07-18 16:18:03+00:00,Can the numbers lie? Cointelegraph Research analyzes all the deals and trends from venture capital in the blockchai… https://t.co/um0tYQ19gB
1549065294001295361,2022-07-18 16:15:20+00:00,What is @kevinolearytv's big problem with Bitcoin? https://t.co/EaKSPfhZTL https://t.co/OLqzcOOcyS
1549063836778520576,2022-07-18 16:09:33+00:00,"One of the world's first micro-video sites is stepping into the world of Web3, wth a brand-new, blockchain-driven a… https://t.co/wcSNLia2VD"
1549061859461853184,2022-07-18 16:01:42+00:00,"No direct ban, but tighter scrutiny.

The upcoming EU regulation has several areas of concern, including stringent… https://t.co/pz91vgn6oi"
1549058556317421568,2022-07-18 15:48:34+00:00,Christie's is making a big bid on Web3. The auction house launches an investment fund to support emerging companies… https://t.co/mi5OgaZJay
1549057662410801164,2022-07-18 15:45:01+00:00,"Could we see a bullish spring? 

Grayscale Investment's latest Insight report suggests the current bear market coul… https://t.co/sZgTMNylrb"
1549054076276686849,2022-07-18 15:30:46+00:00,"Forced selling from Bitcoin miners raises concern about $BTC price, but the use of renewable energy and the oil and… https://t.co/hQi4g3kf7N"
1549051872706605057,2022-07-18 15:22:01+00:00,Good news for @coinbase The exchange announced it has secured approval to offer crypto services in Italy. https://t.co/ls2fCYfBwW
1549050875250823168,2022-07-18 15:18:03+00:00,Sanctioned Nornickel CEO Vladimir Potanin aims to displace #Bitcoin with tokenized assets backed by precious metals. https://t.co/1XRFHqJE6X
1549050137208668162,2022-07-18 15:15:07+00:00,"It’s not just the temperature that’s rising. 

Ether has successfully avoided a bearish technical setup to reach a… https://t.co/lllqqcCCSz"
1549047227493994497,2022-07-18 15:03:33+00:00,Bitcoin analysis expects 'prime time' as $22K becomes BTC price focus https://t.co/28aqmHHOPY
1549046449912123392,2022-07-18 15:00:28+00:00,"This is going to make you sad, but you missed out on a heck of a Twitter space 😔  

In order to thwart your FOMO, t… https://t.co/DgM0yH3oLD"
1549042308208726017,2022-07-18 14:44:00+00:00,"One country won’t determine the future of crypto. 

Indian finance minister Nirmala Sitharaman has called for globa… https://t.co/GMYLwQXBPY"
1549038855042371586,2022-07-18 14:30:17+00:00,"Blockchain isn’t less disruptive because the market is down. 

FTX crypto exchange CEO @SBF_FTX highlighted use cas… https://t.co/ctpj9sYlbr"
1549036771467567105,2022-07-18 14:22:00+00:00,"Oh no! 

@binance has been fined $3M in the Netherlands for failing to obtain regulatory approval to operate in the… https://t.co/w42GKWN4r8"
1549035010899968000,2022-07-18 14:15:00+00:00,"Bitcoin rebounds strongly off the weekly close, but for BTC miners, it may be a case of “too little too late.” 

Wi… https://t.co/5llPaAkM9m"
1549031489832189953,2022-07-18 14:01:01+00:00,"Feeling déjà vu? 

With BTC’s per transaction cost coming down to $56.846 on July 14, the ecosystem unveiled a cycl… https://t.co/AsPKnr2byZ"
1549029224270413828,2022-07-18 13:52:01+00:00,"Hello again, $1T crypto market cap. 

We've missed you. https://t.co/gaK11SXDLz"
1549028228852944896,2022-07-18 13:48:03+00:00,"People like to know what they're buying. As concerns over intellectual property issues in the NFT industry rise, wh… https://t.co/kQXw8C91GO"
1549023735222501381,2022-07-18 13:30:12+00:00,"Starting off strong. 

Around 4,500 people have jumped into the “first trip” tech demo of the Otherside Metaverse p… https://t.co/xE2vARLLkZ"
1549022278947860481,2022-07-18 13:24:25+00:00,🥁And at #1... Bitcoin entered its longest-ever 'extreme fear' period. https://t.co/ihdO6LDr6L
1549021211253948416,2022-07-18 13:20:10+00:00,"We head to Russia for #2, where President Vladimir Putin forbids paying for goods and services with crypto. https://t.co/66c1mhuSuF"
1549019799778430976,2022-07-18 13:14:34+00:00,"Coming in at #3, Jaime Lizárraga takes the baton from exiting commissioner Allison Lee at the SEC. https://t.co/eTXbpO7v79"
1549018555127144452,2022-07-18 13:09:37+00:00,"The theme of finality continues at #4. 

Ripple Labs co-founder Jed McCaleb emptied the last of his 9 billion XRP f… https://t.co/WDkOLZvh9C"
1549017551572815873,2022-07-18 13:05:38+00:00,"The final judgment is at #5.

The SEC gives its ruling on late entrepreneur John McAfee and accomplice Jimmy Gale W… https://t.co/YXgACBv01W"
1549016558734872579,2022-07-18 13:01:41+00:00,"RT @CointelegraphZN: Crypto winter dominates the headlines. 

Celsius files for bankruptcy, OpenSea lays off 20% of its staff, and more in…"
1549016222662025223,2022-07-18 13:00:21+00:00,"📰 Top Crypto News 📰 

🙅 SEC dismisses claims against John McAfee
💰 Ripple founder empties XRP wallet after eight-ye… https://t.co/ZJ90J6RHlz"
1549012755751047168,2022-07-18 12:46:34+00:00,"Not sure where to look? 

Check out our preview of the week ahead: https://t.co/e178zsVJVj"
1549012377739427840,2022-07-18 12:45:04+00:00,Join us in a Spaces with @cryptocomnft and @collymonster from @animalconcerts as we talk about the Cristobal Balenc… https://t.co/CSIYhD22Q1
1549009223798796294,2022-07-18 12:32:32+00:00,"Allen Wei said that even though the African region has a lot of potential, many local projects struggle in terms of… https://t.co/11RYMICNDK"
1549008587107848193,2022-07-18 12:30:01+00:00,Australian central bank Governor Phillip Lowe said that a private solution “is going to be better” for cryptocurren… https://t.co/HZiSApeL0S
1549007217600364546,2022-07-18 12:24:34+00:00,"Did you enjoy your weekend?

The crypto market had a good one, as it enters Monday in the green.

Get the full pict… https://t.co/MnICVgmJCv"
1549005575043747842,2022-07-18 12:18:02+00:00,Coinbase crypto exchange follows Binance in winning the Crypto Asset Service Provider approval from the Italian AML… https://t.co/Vlem3L0S0Z
1549001557512884224,2022-07-18 12:02:05+00:00,"Initiate launch sequence: The crypto market has reclaimed another zero! At a trillion-dollar market cap, crypto com… https://t.co/E39U3h7LIb"
1549001140532117504,2022-07-18 12:00:25+00:00,"Finally! 

Ripple Labs co-founder Jed McCaleb finally emptied the last of his 9 billion XRP from his famed “Tacosta… https://t.co/fc7jXlFDhQ"
1548997540024049664,2022-07-18 11:46:07+00:00,"According to the Glassnode chart, other times that saw similar levels of Bitcoin hodling were during the end of the… https://t.co/LU9we1UJAk"
1548997523917836288,2022-07-18 11:46:03+00:00,Ethereum is looking stronger than Bitcoin. But there's a catch. https://t.co/28KuqCaQ99
1548995779112476672,2022-07-18 11:39:07+00:00,True DeFi projects survive 2022 market acid test - as Grayscale draws parallels with previous bear markets. https://t.co/hznlpYXLxL
