id,created_at,text
1554407837765210112,2022-08-02 10:04:42+00:00,"@RyanSAdams Getting into crypto this early is a once in a lifetime opportunity.

Risk management is important thoug… https://t.co/Cp5zlNpzDr"
1554407094291296257,2022-08-02 10:01:45+00:00,@BarryFried1 We need some decentralized insurance.
1554405347372150785,2022-08-02 09:54:48+00:00,"@shivsakhuja A lot of industries could benefit from the uniqueness and transferability properties of NFTs.

Real es… https://t.co/u7uLMDvkPE"
1554403349704740864,2022-08-02 09:46:52+00:00,@thedefiedge Couldn't agree more ser.
1554311545353424896,2022-08-02 03:42:04+00:00,"The most important things in my life:

1. DeFi
2. Crypto
3. Web3"
1554259756067393536,2022-08-02 00:16:17+00:00,"RT @cryptoPothu: Web3 could change the way we use the internet.

Wallet aware sites are one interesting application.

They allow you to per…"
1554228186669469696,2022-08-01 22:10:50+00:00,"a16z estimate there are somewhere between 7 million and 50 million active Ethereum, based on various on-chain metri… https://t.co/EFHLV94QQA"
1554187792887844864,2022-08-01 19:30:19+00:00,@yala_nftclub I agree. Most successful people have been around for at least one full cycle
1554187652726829057,2022-08-01 19:29:46+00:00,@Pintodc193 Well said
1554184236382375936,2022-08-01 19:16:11+00:00,What are the most important skills to succeed in crypto?
1554174770538692608,2022-08-01 18:38:35+00:00,@the_advisor_btc Thank you ser.
1554054143551029249,2022-08-01 10:39:15+00:00,"I spent the last 7 hours moving to my new house. 

Now I'm researching and threading. 

I think I might be addicted."
1554042778253791232,2022-08-01 09:54:05+00:00,"If you liked this, subscribe to my newsletter to receive more insights:
https://t.co/81FG6sUzXm"
1554042775674318848,2022-08-01 09:54:05+00:00,"Imagine if these preferences could be carried across the web in your wallet.

Given access, dApps could act on this… https://t.co/p1fOAN0qIE"
1554042773090643968,2022-08-01 09:54:04+00:00,"Think about your YouTube home page. It's tailored for you, based on your preferences and watch history. 

YouTube k… https://t.co/vDwnRLIRcO"
1554042770502717440,2022-08-01 09:54:03+00:00,"Web3 could change the way we use the internet.

Wallet aware sites are one interesting application.

They allow you… https://t.co/k9pFI9OwRj"
1553588461587664896,2022-07-31 03:48:48+00:00,"Most successful people, have a strong work ethic.

If you want to accomplish anything worthwhile, you have to put i… https://t.co/DB4VkYIE85"
1553483541505196032,2022-07-30 20:51:53+00:00,"1. In 2022, over $37 billion has already been spent on NFTs. 

2. DEXs handled over $1 trillion in volume.

3. Ther… https://t.co/cMLjPhEBkj"
1553483539709960192,2022-07-30 20:51:52+00:00,"Web3 and crypto have come pretty far.

The industry is nascent. But it's also far bigger than most make it out to be.

Here are some stats:"
1553458573736173568,2022-07-30 19:12:40+00:00,"RT @thedefiedge: Doing your own research is the most powerful Edge in Crypto. 

But most people suck at research.

Here are my Crypto resea…"
1553175777134329857,2022-07-30 00:28:56+00:00,"Solana's launching a physical store called ""Solana Spaces"" in NYC.

What other crypto projects would you like to se… https://t.co/17dGg7CrQV"
1553042917241102336,2022-07-29 15:41:00+00:00,"The crypto market has been showing positive signs.

I don’t know when crypto will fully bounce back, but I’m confid… https://t.co/DoVUEvkNao"
1552969949110345728,2022-07-29 10:51:03+00:00,"RT @cryptoPothu: GameFi and web3 gaming could be on the rise in the next 2-3 years.

Here’s why:"
1552830611659767808,2022-07-29 01:37:22+00:00,"If you liked this, subscribe to my newsletter to receive more insights:

https://t.co/isijTAdoXk"
1552829836606840832,2022-07-29 01:34:17+00:00,"GameFi is going to take in-game virtual economies to the next level.

Players will have more control. Games will be… https://t.co/mgmYSaWfDz"
1552829834467823616,2022-07-29 01:34:17+00:00,"The overlap makes perfect sense. Take NFTs for example.

NFTs will let players:
- Truly own in-game items like skin… https://t.co/Yz73ENJ9xb"
1552829832488030208,2022-07-29 01:34:16+00:00,"Game developers from AAA studios have started to build for Web3. 

We’ll start to see these games roll out in the next year or two."
1552829830621605888,2022-07-29 01:34:16+00:00,"Good web and mobile products take a long time to build. AAA games take much longer. 

A team of 100+ people take an… https://t.co/4erNT6TVVE"
1552829828637675521,2022-07-29 01:34:15+00:00,"No Web3 game has stood out yet. Most of them have sucked.

It takes time to build a good game.

So while Web3 has m… https://t.co/buAkkmCmla"
1552829827551375361,2022-07-29 01:34:15+00:00,"GameFi and web3 gaming could be on the rise in the next 2-3 years.

Here’s why:"
1552801264404049920,2022-07-28 23:40:45+00:00,RT @Cov_duk: Great thread on using Dune
1552742260025860096,2022-07-28 19:46:18+00:00,RT @sabocrypto: Great for anyone that wants to start using Dune Analytics
1552733507247431680,2022-07-28 19:11:31+00:00,What needs to happen for crypto to become mainstream?
1552539517285908486,2022-07-28 06:20:40+00:00,"Imagine throwing away a hard drive full of Bitcoin.

James Howells made that mistake in 2013.

He threw away 8,000… https://t.co/ZdeoqRYLj2"
1552410033958182912,2022-07-27 21:46:09+00:00,Who are the best devs on crypto twitter?
1552345349116678144,2022-07-27 17:29:07+00:00,RT @DuneAnalytics: Great thread 🔥
1552336890027593728,2022-07-27 16:55:30+00:00,"RT @cryptoPothu: Dune Analytics might be the best place to find real-time alpha for free.

It’s home to thousands of free dashboards that d…"
1552166220857688064,2022-07-27 05:37:19+00:00,@santajustica I'm trying to equip people with the tools they need to be successful.
1552161216776155139,2022-07-27 05:17:26+00:00,"There’s a lot more to Dune, and I’ll be posting more guides soon. 

If you enjoyed this one:
1. Follow me… https://t.co/e2sOa7nsQG"
1552160904384372737,2022-07-27 05:16:12+00:00,"Dune makes on-chain data accessible to all.

You can do a lot with Dune. It’s a great collaboration tool.

Dune mak… https://t.co/uKh0bRoCvo"
1552160903113543680,2022-07-27 05:16:11+00:00,"I added a few visualizations to a dashboard.

I created a dashboard that gives you an overview of the Ethereum NFT… https://t.co/5CnyybSxiX"
1552160901700018177,2022-07-27 05:16:11+00:00,"Click on Edit and then Add Visualization.

You have the option to add queries you’ve created as well as queries cre… https://t.co/ZaGLj7Ef6O"
1552160900370481154,2022-07-27 05:16:11+00:00,"Here you can name the dashboard and create a custom URL.

Dashboards are public by default, but pro users can limit… https://t.co/T2FDzUgmNA"
1552160899099529217,2022-07-27 05:16:10+00:00,"To start, head over to the Dune homepage and click on New dashboard: https://t.co/axhpTbfY3E"
1552160897572806656,2022-07-27 05:16:10+00:00,"4. Creating custom dashboards

A dashboard is just a group of queries.

By selecting and displaying related queries… https://t.co/gArvoOBxlo"
1552160402930159617,2022-07-27 05:14:12+00:00,"In the resulting visualization we can see the market share of different DEXs over a specified time period.

This ca… https://t.co/w3U7ltFP26"
1552160401441271809,2022-07-27 05:14:12+00:00,"Now we edit the chart options.

The option below means that we’re creating a pie chart where each section represent… https://t.co/f1Ilz418L2"
1552160400120066050,2022-07-27 05:14:11+00:00,"When you create a visualization you can choose from several options.

Let’s make an pie chart to create a market sh… https://t.co/yk5xClz5W5"
1552160398777888768,2022-07-27 05:14:11+00:00,"For a given query, you can create visualizations or edit existing ones.

Let’s look at the Monthly DEX Volume By Pr… https://t.co/3GxD8o0yNG"
1552160397544656896,2022-07-27 05:14:11+00:00,"3. Creating visualizations

Query results are usually hard to analyze.

Visualizations present query results in a d… https://t.co/1brBEAf7Mm"
1552160396169007105,2022-07-27 05:14:10+00:00,"PostgreSQL is really popular, and there are a lot of great resources out there.

The official documentation is a gr… https://t.co/2f7jTmsgLt"
1552160394952581120,2022-07-27 05:14:10+00:00,"All the abstractions are stored in a GitHub repository.

The repo is a huge collection of SQL scripts that you can… https://t.co/3iRzgS0W0E"
1552160393048379393,2022-07-27 05:14:10+00:00,"It’s good to know how queries work, but you’re rarely going to build queries from scratch.

Usually, you’ll fork so… https://t.co/m7bquyVdEi"
1552160391798484993,2022-07-27 05:14:09+00:00,"To summarize, the query is looking at the usd amount of all DEX transactions from the past week.

This is added tog… https://t.co/Jb6l8fkoLh"
1552160390611472384,2022-07-27 05:14:09+00:00,"The condition narrows down the data the query extracts. Only transactions from the past week are considered.

AND i… https://t.co/aOtPO8Xwcc"
1552159660194824192,2022-07-27 05:11:15+00:00,"The query extracts the usd_amount column from the dex.”trades” table.

It then applies an operation to the columns… https://t.co/fAnEo1eBQc"
1552158765784317953,2022-07-27 05:07:42+00:00,"Let’s take a look at a simple query.

We’re going to look at the 7 days DEX volume query. https://t.co/4MCc7rTVef"
1552158755839623168,2022-07-27 05:07:39+00:00,"We can also specify a condition using WHERE. Only data records that fulfill the condition are extracted.

It’s esse… https://t.co/E8pzoKoC8U"
1552158749216845824,2022-07-27 05:07:38+00:00,"With SELECT, we choose some data (here, we are choosing the “columnName”) FROM a table (a collection of data).

For… https://t.co/YC2leehMeA"
1552158746364678145,2022-07-27 05:07:37+00:00,"Each query returns rows or columns of data.

When creating visualizations, querying columns are most common.

Most… https://t.co/ZX8jwlFLZY"
1552158740488413184,2022-07-27 05:07:36+00:00,"Here are some PostgreSQL basics:

SQL databases are organized into rows and columns (like spreadsheets).

Each row… https://t.co/CH5W2zSmbi"
1552158738001596416,2022-07-27 05:07:35+00:00,"2. Extracting data with queries

Dune aggregates blockchain data into SQL databases.

SQL is a common database syst… https://t.co/OFcRvcn4JE"
1552158734595473408,2022-07-27 05:07:34+00:00,"You can run the query to get updated metrics on the dashboard.

You can also fork the dashboard.

Forking will allo… https://t.co/IkaJGSX1dR"
1552158725808406528,2022-07-27 05:07:32+00:00,"We now see more information about the query.

We can see the query's PostgresSQL code.

We can also see the associa… https://t.co/4bc6zD5mC9"
1552158717042298880,2022-07-27 05:07:30+00:00,"You can select an individual query in a dashboard to view more information about it.

Let’s take a look at the Mark… https://t.co/RDwTlKXhfq"
1552158706791460864,2022-07-27 05:07:28+00:00,"Let’s take a look at a DEX metrics dashboard by @hagaetc.

We can see some useful stats about DEXs.

There are also… https://t.co/NXbcENJD0E"
1552158690651672576,2022-07-27 05:07:24+00:00,"When you’re looking for information about a specific project, dashboards and queries by other Dune users are probab… https://t.co/4f3K2Nglm1"
1552158681801711617,2022-07-27 05:07:22+00:00,"1. Community dashboards

The easiest way to use Dune is to look at dashboards that others have created.

You can se… https://t.co/AO4pX3Xi9i"
1552158672251260928,2022-07-27 05:07:19+00:00,"Dune Analytics makes it easy to view and understand on-chain data.

In this guide I’ll cover:
• Community dashboard… https://t.co/pu8hQC4cd6"
1552158669759848450,2022-07-27 05:07:19+00:00,"Dune Analytics might be the best place to find real-time alpha for free.

It’s home to thousands of free dashboards… https://t.co/nXUoRZslEX"
1551894866388430848,2022-07-26 11:39:03+00:00,"To clarify, I mean for people in general.

Not for programmers."
1551894572661256192,2022-07-26 11:37:53+00:00,@iMustBeNewLOL Just in general
1551894100797820928,2022-07-26 11:36:01+00:00,How important is it to be able to read smart contracts in crypto?
1551612855128010752,2022-07-25 16:58:26+00:00,"RT @cryptoPothu: Where’s the crypto market headed?

Between the Eth merge and macroeconomic conditions, it’s hard to say.

I dove into Chai…"
1551486680309194752,2022-07-25 08:37:04+00:00,"You can download a copy of the report here:

https://t.co/PheXD4ONGJ"
1551486664182099968,2022-07-25 08:37:00+00:00,"If you enjoyed this thread:

1. Follow me @cryptoPothu for more of these
2. RT the tweet below to share this

https://t.co/XzB4Ifc6gS"
1551486125671215105,2022-07-25 08:34:52+00:00,"I don’t know when crypto will bounce back, but I’m confident it will.

Don’t step away from Web3, unless you want t… https://t.co/6VU5j1nCqf"
1551486123221733376,2022-07-25 08:34:51+00:00,"Benjamin Graham put it best when he once said “It’s best to pay no mind to “Mr. Market”, who frequently boomerangs… https://t.co/RP5yKNhigj"
1551486120747143168,2022-07-25 08:34:51+00:00,"The merge is just a single catalyst. I think the market is going to take a while to recover.

There will likely nee… https://t.co/VWnp4EMzFJ"
1551486118222147584,2022-07-25 08:34:50+00:00,"Yet, it might take a while for prices to pick up.

Institutional investment was just starting to get off the ground… https://t.co/tcVbqA5I1S"
1551486115730755584,2022-07-25 08:34:49+00:00,"Crypto is still risky, but it’s not going to tank or go away overnight. There are too many people using it.

There… https://t.co/Y61w03oYyb"
1551486113197355008,2022-07-25 08:34:49+00:00,"7. So what’s going to happen to the crypto market?

Based on the report, it’s clear that Web3 is far more establish… https://t.co/NzEwURDFMU"
1551486110231973888,2022-07-25 08:34:48+00:00,"What do most DAOs do?

DeFi currently Dominates DAOs.

DeFi-related ventures hold around 83% of the capital in DAOs… https://t.co/GQKBm5hdQR"
1551486103399518209,2022-07-25 08:34:46+00:00,"6. DAOs have a long way to go

DAOs give people the ability and freedom to create things and make collective financ… https://t.co/48udqwmI8S"
1551486096810262529,2022-07-25 08:34:45+00:00,"How did DEXs take the lead?

Most CEX transactions happen off-chain on centralized databases.

The rapid growth of… https://t.co/UTycVWuWAU"
1551486093849071617,2022-07-25 08:34:44+00:00,"5. DEXs are bigger than CEXs

Decentralized exchanges have managed to do over $1 trillion in volume.

When compared… https://t.co/7eT3EZZqft"
1551486085905014784,2022-07-25 08:34:42+00:00,"PoS blockchains vary widely in yield.

Be careful when staking though. Most crypto assets are extremely volatile.… https://t.co/YQJlSeHoU6"
1551486078879617024,2022-07-25 08:34:41+00:00,"4. Over $40 billion is staked across major networks

Staking is one of the most popular ways to earn yield.

Take a… https://t.co/zatLcYLjnB"
1551486072151871490,2022-07-25 08:34:39+00:00,"@SecretNetwork @TornadoCash @MineApp, a privacy startup, estimates that the average consumer’s personal data is hel… https://t.co/xxUmj6IufK"
1551486065306849280,2022-07-25 08:34:37+00:00,"3. Web3 has the potential to make the internet safer

Web2 has failed to protect consumers.

Web3 can solve interne… https://t.co/qoMdd3RT3W"
1551486062421102594,2022-07-25 08:34:37+00:00,"As late as April 2022, there were over 4000 institutional transactions each month. https://t.co/eBF3PJGDrm"
1551486055219507200,2022-07-25 08:34:35+00:00,"Who is buying NFTs?

There are a lot of retail investors. Transactions smaller than $10k command ~90%+ of the frequ… https://t.co/Yt8zIbXFiZ"
1551486048391245825,2022-07-25 08:34:33+00:00,"n 2022, over $37 billion have already been spent on NFTs.

This outpaces 2021. In 2021, there was a total of $40 bi… https://t.co/UeCUz85bml"
1551486045371240448,2022-07-25 08:34:33+00:00,"2. NFTs are far from dead

A lot of people think that the bear market has killed NFTs.

NFTs are still going strong… https://t.co/v45NWXz3Gv"
1551486038329008128,2022-07-25 08:34:31+00:00,"The number of individual transfers hasn’t fallen.

This suggests that more individual investors are entering the ecosystem."
1551486035434954752,2022-07-25 08:34:30+00:00,"1. People use crypto even when prices are falling

On-chain transaction volume has since leveled off over the past… https://t.co/ZyO8ZEN3n1"
1551486026647908352,2022-07-25 08:34:28+00:00,"The Chainalysis report covers a lot.

Some of the most interesting things it covers are:

• Institutional investmen… https://t.co/Wtzl2Z0Ua7"
1551486024101945345,2022-07-25 08:34:28+00:00,"Where’s the crypto market headed?

Between the Eth merge and macroeconomic conditions, it’s hard to say.

I dove in… https://t.co/qtjkCD9j1k"
1551334978763595781,2022-07-24 22:34:16+00:00,"Between the approaching Eth merge and the current macroeconomic environment, it's hard to tell what's going to happ… https://t.co/iDogN11XQL"
1550949360371847168,2022-07-23 21:01:57+00:00,RT @Timccopeland: Finished in 2097
1550948612837822464,2022-07-23 20:58:59+00:00,Great resource for any current or aspiring community managers👇 https://t.co/f1Thypa9bN
1550882776487903232,2022-07-23 16:37:22+00:00,"RT @cryptoPothu: Vitalik Buterin says that Ethereum's development is only 55% done after the merge.

At ETHCC, Buterin outlined the 5 main…"
1550724833855492096,2022-07-23 06:09:46+00:00,"5. The Splurge 

The bulk of the work has been completed. 

Now there's time to work on what Buterin calls ""fun stu… https://t.co/CYpuLeuUWJ"
1550724831502430209,2022-07-23 06:09:45+00:00,"4. The Purge 

Excess historical data will be ""purged.""

This reduces network congestion and hard drive space requirements for validators."
1550724829006819334,2022-07-23 06:09:44+00:00,"3. The Verge

Storage is optimized through Verkle Trees.

Node sizes shrink and Ethereum becomes more scalable.

Us… https://t.co/bcUJaG2k1X"
1550724826473439232,2022-07-23 06:09:44+00:00,"2. The Surge 

Scalability is greatly improved through sharding.

Sharding involves splitting up the network into s… https://t.co/al5BEIMeOG"
1550724823935885312,2022-07-23 06:09:43+00:00,"1. The Merge:

Ethereum moves to a Proof of Stake system.

The Merge will reduce Ethereum's energy consumption by ~… https://t.co/ioLvkqVSDA"
1550724821377437696,2022-07-23 06:09:43+00:00,"Vitalik Buterin says that Ethereum's development is only 55% done after the merge.

At ETHCC, Buterin outlined the… https://t.co/YhQRiSfnwY"
1550413109461864448,2022-07-22 09:31:05+00:00,"I'm still reluctant to buy a lot of crypto right now because of macro conditions.

This pump could be temporary.

I… https://t.co/FfNBzNyiYV"
1550053492173090817,2022-07-21 09:42:05+00:00,"Networking is so important in crypto.

Not only does it help me make meaningful connections, but it also motivates… https://t.co/SMUOMS7zoM"
1549514502315470849,2022-07-19 22:00:20+00:00,"RT @sabocrypto: Every project has a community.

But most people don't understand how to manage it.

Here are 17 things that every community…"
1549270620428328960,2022-07-19 05:51:14+00:00,"The most successful people in the world are consistent. They work hard day in and day out.

Anyone can grind for a… https://t.co/D2yFc9M6Yo"
1549092609028608008,2022-07-18 18:03:53+00:00,"Just found a fake account that's copying my profile.

This is not me. Take a close look at the Twitter handle and t… https://t.co/y7noSd7hSR"
1548212535383322625,2022-07-16 07:46:47+00:00,"@RyanSAdams I think it takes time.

We need great Web3 products and services to reach the mainstream.

This include… https://t.co/KBYmXvPl95"
1548208491327737857,2022-07-16 07:30:43+00:00,"In two days, GameStop's NFT marketplace moved well over 3,000 ETH.

This is nearly twice the all-time trading volum… https://t.co/xeoi9Nfo9D"
1548044136237785094,2022-07-15 20:37:38+00:00,"The Eth Merge could be as soon as September 19th.

Ethereum is going to be moving from a PoW to PoS system.

This i… https://t.co/K9Cbza6BUN"
1547971347766161408,2022-07-15 15:48:23+00:00,"RT @Cov_duk: Tokenomics is one of the most important aspects of Crypto

If you don't understand tokenomics, you're not gonna make it. 

Her…"
1547858464432541698,2022-07-15 08:19:50+00:00,@the_advisor_btc Keep writing. It'll pay off for sure.
1547855740928282630,2022-07-15 08:09:01+00:00,"Sometimes you just have to put your head down and grind.

It's not always easy and results are never instant.

But… https://t.co/GhjbM6bnyx"
1547695976680288257,2022-07-14 21:34:10+00:00,"RT @shivsakhuja: I have learned an INCREDIBLE amount through Twitter.

What I've learned here for FREE has been far more valuable than what…"
1547619816185335809,2022-07-14 16:31:32+00:00,"RT @cryptoPothu: 99% of people who fail in crypto don’t know how to hunt for alpha.

Goode alpha can make the difference between going brok…"
1547512052737904645,2022-07-14 09:23:19+00:00,"RT @alpha_pls: Celsius have now confirmed their bankruptcy. Most users will likely never get their money back.

The world runs on contracts…"
1547504827248193538,2022-07-14 08:54:36+00:00,"RT @cryptoPothu: Inflation reached a 40 year high of 9.1% last month.

What does this mean for crypto?

Here's what you need to know:"
1547434879058464768,2022-07-14 04:16:39+00:00,"If you enjoyed this thread:

1. Follow me @cryptoPothu for more of these
2. RT the tweet below to share this

https://t.co/RXpkuCClhv"
1547430741880975360,2022-07-14 04:00:13+00:00,"@nellimkopi Find a group

There’s so much alpha out there. Too much for any one person.

Find an alpha group and sh… https://t.co/lYNbhVit2Q"
1547430739049795584,2022-07-14 04:00:12+00:00,"@nellimkopi Learn how to analyze communities

Community is really important in crypto. Seemingly worthless projects… https://t.co/PCDhjpANFj"
1547430736449327104,2022-07-14 04:00:12+00:00,"@nellimkopi Social sentiment

Watch the ‘Trending Search’ Feature on sites like CoinGecko or DexScreener.

See what… https://t.co/KRXLbLGMCH"
1547430733848854530,2022-07-14 04:00:11+00:00,"@nellimkopi Fundamentals aren’t everything

There are many factors that determine where the price of a token will g… https://t.co/UKZ2GgdIEg"
1547430731277684736,2022-07-14 04:00:10+00:00,"@nellimkopi Keep an eye on GitHub

Almost all crypto projects are open source - we can look at the source code and… https://t.co/f1cNr3l9NV"
1547430728735985664,2022-07-14 04:00:10+00:00,"@nellimkopi Keep an eye on devs and see what they’re building

Like digging through crypto job listings,

looking i… https://t.co/ZRL6cHvcli"
1547430726131273728,2022-07-14 04:00:09+00:00,"@nellimkopi Crypto Job Listings

For a project to blow up, they need a strong team, and it’s going to need to be la… https://t.co/3rtZfmz2Qm"
1547430723480539136,2022-07-14 04:00:09+00:00,"@nellimkopi Here's my guide on using Twitter effectively:

/10

https://t.co/zVSwgxirla"
1547430720708026368,2022-07-14 04:00:08+00:00,"@nellimkopi Twitter is a great source for alpha.

Spend a lot of time on it.  Twitter’s a great place to find out a… https://t.co/rnRV1yLnKf"
1547430717998505985,2022-07-14 04:00:07+00:00,Nansen is a blockchain analytics platform. It has a huge database of labeled wallets. Learn how to use Nansen with… https://t.co/iNZKNllnHW
1547430715255508992,2022-07-14 04:00:07+00:00,"Etherscan is a block explorer. You can use it to learn about anything that happens on the Ethereum chain.

Learn ho… https://t.co/eikSfsfaFp"
1547430712571097088,2022-07-14 04:00:06+00:00,"Find wallets to track and keep an eye on what big players are doing.

Here’s my guide to whale watching:

https://t.co/fJYsLOlbtF

/6"
1547430709962321923,2022-07-14 04:00:05+00:00,"Follow Smart Money

Keep an eye on what VCs are interested in. Some of them are early to everything:

A16z, Dragonf… https://t.co/ya7g3BDG5Z"
1547430707114323969,2022-07-14 04:00:05+00:00,"Read Whitepapers

Go straight to the source. Whitepapers can reveal a lot about a project. Most of them aren’t too… https://t.co/1i2KhJZtbJ"
1547430704392257537,2022-07-14 04:00:04+00:00,"That's easier said than done.

In this thread I'll explain how to research, understand data, and network to find alpha.

/3"
1547430701858836480,2022-07-14 04:00:03+00:00,"Alpha hunting comes down to 3 things:

• Researching
• Understanding
• Networking

/2"
1547430699283582977,2022-07-14 04:00:03+00:00,"99% of people who fail in crypto don’t know how to hunt for alpha.

Goode alpha can make the difference between goi… https://t.co/IWNcEEbb9B"
1547364387463110657,2022-07-13 23:36:33+00:00,"If you liked this checkout my newsletter:

https://t.co/chEZfNz28m"
1547363746514960384,2022-07-13 23:34:00+00:00,"The Fed's goal is to get inflation under control. 

Markets are an afterthought at the moment. 

My strategy will c… https://t.co/Vspw9b8kyK"
1547363743839186944,2022-07-13 23:33:59+00:00,"Traditionally, when interest rates rise, stocks take a hit. 

So it's going to be extremely difficult for the crypt… https://t.co/VZ3i3S0j3D"
