id,created_at,text
1584092260152803328,2022-10-23 08:00:00+00:00,Forbes #Blockchain50 members hail from all parts of the world. We are looking for billion-dollar blockchain trailbl… https://t.co/X5MGG6oT9H
1584077162834968576,2022-10-23 07:00:01+00:00,The Queens Of Crypto: The VC Making A $100 Million Investment In Web3 Infrastructure: by @AmySho https://t.co/jAX91Vlndv
1583971467271688193,2022-10-23 00:00:01+00:00,Rarible Looks To Enlarge NFT Marketplace With New Aggregator Feature: by @marigra21sl https://t.co/dyEHGuLMFL
1583880866136145922,2022-10-22 18:00:00+00:00,Financing Entertainment Of The Future: Should Hollywood Have Its Own Blockchain?: by @whoisjoshwilson https://t.co/hubLh9m0NQ
1583820469035114497,2022-10-22 14:00:00+00:00,Don't miss the opportunity to see these major crypto leaders share the stage with leading forces in finance. Click… https://t.co/L5JPPoIFF8
1583684573799469056,2022-10-22 05:00:00+00:00,"Ethereum’s ‘Merge’ Still A Dud For Investors, writes @BRICbreaker https://t.co/u7vpeJpB3h"
1583578881457459201,2022-10-21 22:00:01+00:00,The Queens Of Crypto: The VC Making A $100 Million Investment In Web3 Infrastructure: by @AmySho https://t.co/jAX91VCY53
1583548680748924928,2022-10-21 20:00:01+00:00,Grayscale’s Bitcoin Case Gets Support From View Of Capricious SEC: by @ninabambysheva https://t.co/JY6XdLWT8S
1583523972968169473,2022-10-21 18:21:50+00:00,.@ForbesCrypto Director of Research – Digital Assets @Steven_Ehrlich joins @JillMalandrino on @Nasdaq #TradeTalks f… https://t.co/vWBgISVT6X
1583518481885982721,2022-10-21 18:00:01+00:00,Andreessen Horowitz's Crypto Lobbying Blitz Is Paying Off: by @DavidJeans2 @SarahNEmerson https://t.co/yaoASlkj86
1583510081718480896,2022-10-21 17:26:38+00:00,RT @TradeTalks: .@ForbesCrypto Director of Research – Digital Assets @Steven_Ehrlich joins @JillMalandrino on @Nasdaq #TradeTalks for #Cybe…
1583496271243153408,2022-10-21 16:31:45+00:00,"Ethereum’s ‘Merge’ Still A Dud For Investors, writes @BRICbreaker https://t.co/u7vpeJHKhp"
1583412794489131008,2022-10-21 11:00:03+00:00,Nvidia Fashions Industrial-Strength Metaverse-As-A-Service: by @ninabambysheva https://t.co/QFkEY2gvsf
1583337288016097281,2022-10-21 06:00:01+00:00,Rarible Looks To Enlarge NFT Marketplace With New Aggregator Feature: by @marigra21sl https://t.co/dyEHGuLMFL
1583279906359738368,2022-10-21 02:12:00+00:00,Grayscale’s Bitcoin Case Gets Support From View Of Capricious SEC: by @ninabambysheva https://t.co/JY6XdLFihk
1583276887643602947,2022-10-21 02:00:00+00:00,Nominations are pouring in for the Forbes #Blockchain50 list of billion-dollar companies using the technology. We'r… https://t.co/1M8FehwMxy
1583246688507994113,2022-10-21 00:00:00+00:00,Andreessen Horowitz's Crypto Lobbying Blitz Is Paying Off: by @DavidJeans2 @SarahNEmerson https://t.co/yaoASlkj86
1583219005086748673,2022-10-20 22:10:00+00:00,Rarible’s new aggregated marketplace is the company’s answer to a changing NFT market: by @marigra21sl https://t.co/dyEHGuubOd
1583216494661468167,2022-10-20 22:00:01+00:00,Nvidia Fashions Industrial-Strength Metaverse-As-A-Service: by @ninabambysheva https://t.co/QFkEY2y6QP
1583213991266246658,2022-10-20 21:50:04+00:00,Rarible Looks To Enlarge NFT Marketplace With New Aggregator Feature: by @marigra21sl https://t.co/dyEHGuuJDL
1583133964499554305,2022-10-20 16:32:05+00:00,RT @HaileyLennonBTC: Good time to repost one of my first @ForbesCrypto article I wrote with @prestonjbyrne about Craig Wright's claims that…
1583128795456106496,2022-10-20 16:11:32+00:00,RT @ForbesCrypto: Crypto and traditional investors share a stage on this year's #ForbesIconoclast Summit on November 3. Get your tickets he…
1583050404094427137,2022-10-20 11:00:02+00:00,Crypto and traditional investors share a stage on this year's #ForbesIconoclast Summit on November 3. Get your tick… https://t.co/6UUR8gnjvW
1582990003151388677,2022-10-20 07:00:01+00:00,Bitcoin ETF Case Gives Friends Of Grayscale Another Chance To Show Support: by @ninabambysheva https://t.co/1siQhzjRQ3
1582899406176649217,2022-10-20 01:00:01+00:00,Why Do Blockchains Need Oracles?: by @Matt_Mastando https://t.co/Xh8MXOpaQr
1582869215001837568,2022-10-19 23:00:03+00:00,Cracks At Kraken: Crypto’s Near Empty C-Suite: by @Steven_Ehrlich https://t.co/mONXPXMwar
1582854466755493888,2022-10-19 22:01:27+00:00,Grayscale’s Bitcoin ETF Case Gets Support From View Of Capricious SEC: https://t.co/yopWG4LYYZ by @ninabambysheva
1582854103457099777,2022-10-19 22:00:00+00:00,Crypto Rules Likely To Follow European Models As U.S. Fiddles: by @Rosemarietv https://t.co/FiHCKrbx8a
1582839002633232403,2022-10-19 21:00:00+00:00,Nvidia Fashions Industrial-Strength Metaverse-As-A-Service: by @ninabambysheva https://t.co/QFkEY2y6QP
1582830786008715265,2022-10-19 20:27:21+00:00,"RT @unblockedfuture: Ceding so much vital infrastructure to a few companies is “like a kill switch on society”.

-Michiel Leenaars 
@NLnetF…"
1582808664615706624,2022-10-19 18:59:27+00:00,"RT @Steven_Ehrlich: Jesse Powell’s anti-establishment ethos helped fuel the company’s growth. But as Kraken matured, Powell became a liabil…"
1582807263571374080,2022-10-19 18:53:53+00:00,"Jesse Powell’s anti-establishment ethos helped fuel the company’s growth. But as Kraken matured, Powell became a li… https://t.co/OxNw1FjWzb"
1582806089770274817,2022-10-19 18:49:13+00:00,RT @DelRayMan: Jesse Powell was one of the last 1st-generation cryptocurrency exchange CEOs still in power. His departure feels like crypto…
1582790861695307777,2022-10-19 17:48:42+00:00,Cracks At Kraken: Crypto’s Near Empty C-Suite: by @Steven_Ehrlich https://t.co/iato3SjHXS
1582784164495253504,2022-10-19 17:22:06+00:00,U.S. Dollar Climbs To Highest Since 1990 Against Japanese Yen https://t.co/MDvhcnvQlk https://t.co/k6yEjSM1qX
1582766404335710208,2022-10-19 16:11:31+00:00,"RT @TheWAAnderson: Coinbase has a browser in their app now, and its a kinda a really big deal.

https://t.co/0PAp6M8Uyh

#blockchain @Forbe…"
1582753437405642753,2022-10-19 15:20:00+00:00,"Squabbling regulators, lack of laws have Washington playing catch-up: by @Rosemarietv https://t.co/FiHCKqTWgC"
1582748664769875968,2022-10-19 15:01:02+00:00,"RT @DelRayMan: @jack Hi Jack! Invitation is still open to talk about the Twitter than could have been, and might still be someday: https://…"
1582748597384515584,2022-10-19 15:00:46+00:00,"RT @DelRayMan: @chainyoda @jack The guy who hired Jack had this to say: ""the primary social interaction should be based on intrinsic motiva…"
1582748421961703433,2022-10-19 15:00:04+00:00,Crypto Rules Likely To Follow European Models As U.S. Fiddles: by @Rosemarietv https://t.co/FiHCKqTWgC
1582733316117221378,2022-10-19 14:00:02+00:00,Chipmaker sees 3D version of the internet with ‘a whole bunch of robots’ as it expands factory-oriented tools: by… https://t.co/xJ3lIaEnkI
1582725796216864768,2022-10-19 13:30:10+00:00,JUST IN: Nvidia Fashions Industrial-Strength Metaverse-As-A-Service: by @ninabambysheva https://t.co/QFkEY2yEGn
1582725503097544709,2022-10-19 13:29:00+00:00,RT @SarahNEmerson: NEW: @DavidJeans2 + I looked at the crypto campaign of A16Z after noticing that w/in months of investors throwing an “Et…
1582718211958751234,2022-10-19 13:00:01+00:00,Andreessen Horowitz's Crypto Lobbying Blitz Is Paying Off: by @DavidJeans2 @SarahNEmerson https://t.co/yaoASlBUwG
1582657821157597184,2022-10-19 09:00:03+00:00,Financing Entertainment Of The Future: Should Hollywood Have Its Own Blockchain?: by @whoisjoshwilson https://t.co/hubLh94pWi
1582597411188490241,2022-10-19 05:00:00+00:00,Do We Need Bitcoin For What It’s Become? https://t.co/Ay2DDJJe2s
1582506812204617728,2022-10-18 23:00:00+00:00,Bitcoin ETF Case Gives Friends Of Grayscale Another Chance To Show Support: by @ninabambysheva https://t.co/1siQhzBteD
1582491716606578690,2022-10-18 22:00:01+00:00,Silvergate Stock Tumbles As 3Q Deposits Retreat For Banker To Crypto Exchanges: by @emilymason00 https://t.co/e3XuGd6pko
1582476759621988352,2022-10-18 21:00:35+00:00,More Than $750 Million' Worth Of Bitcoin Has Left Crypto Exchanges Today: by @CharlesLBovaird https://t.co/tGragV0HNK
1582452705762676762,2022-10-18 19:25:00+00:00,"Partners at A16Z held a fundraiser for New York congressman Ritchie Torres. Soon after, he pressured an industry gr… https://t.co/OPcjSEgmcX"
1582446422154219526,2022-10-18 19:00:02+00:00,Andreessen Horowitz's Crypto Lobbying Blitz Is Paying Off: by @DavidJeans2 @SarahNEmerson https://t.co/yaoASlBUwG
1582438866098696194,2022-10-18 18:30:00+00:00,Do We Need Bitcoin For What It’s Become? https://t.co/Ay2DDJrCDS
1582431319543382018,2022-10-18 18:00:01+00:00,How is blockchain rewiring Wall St? Michael Sonnenshein of Grayscale Investments and Christine Moy of Apollo Global… https://t.co/2J9YiZTfd8
1582423765383663618,2022-10-18 17:30:00+00:00,Bitcoin ETF Case Gives Friends Of Grayscale Another Chance To Show Support: by @ninabambysheva https://t.co/1siQhzjRQ3
1582416224142737408,2022-10-18 17:00:02+00:00,Financing Entertainment Of The Future: Should Hollywood Have Its Own Blockchain?: by @whoisjoshwilson https://t.co/hubLh94pWi
1582406149009293314,2022-10-18 16:20:00+00:00,Regulators claim both companies are running unlicensed money-transfer businesses: by @Mitchtopia https://t.co/pckB3yDM6p
1582401119413846018,2022-10-18 16:00:01+00:00,"FTX-Voyager Deal Draws Objection, Investigation From Texas: by @Mitchtopia https://t.co/pckB3yDM6p"
1582401118767751169,2022-10-18 16:00:00+00:00,CALL FOR NOMINATIONS #Blockchain50 2023: We look for businesses valued at $1 billion or more or those that generate… https://t.co/pqtpO8mWxs
1582397341591650304,2022-10-18 15:45:00+00:00,Rising interest rates provide income boost but business withers with bitcoin price: by @emilymason00 https://t.co/e3XuGdo0IY
1582392143481819136,2022-10-18 15:24:21+00:00,JUST IN: Silvergate Stock Tumbles As 3Q Deposits Retreat For Banker To Crypto Exchanges: by @emilymason00 https://t.co/e3XuGdoyyw
1582369940426063873,2022-10-18 13:56:07+00:00,"RT @DelRayMan: Like it or not, crypto is influencing American politics. a16z's leadership has donated more than $2 million to political cam…"
1582367758611718144,2022-10-18 13:47:27+00:00,"RT @DavidJeans2: Partners at Andreessen Horowitz, which has $7B for Web3 investments, held a fundraiser for Bronx congressman Ritchie Torre…"
1582162190563352577,2022-10-18 00:10:36+00:00,"Asset manager hoping for strong follow-up to 11,000 letters sent to the SEC in support of a spot-market fund:… https://t.co/znXgZAfdes"
1582144432522072092,2022-10-17 23:00:02+00:00,Staking Rewards Are Taxable – What Investors Need To Know: by @SeanSteinSmith https://t.co/WMYnrJXUv2
1582080114803605504,2022-10-17 18:44:27+00:00,"RT @RufasKe: By acting as a store of value that governments cannot inflate away through central bank monetary expansion, Bitcoin grants peo…"
1581978330102132736,2022-10-17 12:00:00+00:00,Sign Up! Your Essential Briefing On What's Driving The Day In Bitcoin And Crypto: https://t.co/oNPTOk5dqA by @BillyBambrough
1581970276874608652,2022-10-17 11:28:00+00:00,Mark Cuban sat down with @jemimacmcevoy to predict how crypto will evolve to meet our needs: https://t.co/r1HuEDd0Vo
1581715095528173568,2022-10-16 18:34:00+00:00,Some of the most influential investors in crypto join #ForbesIconoclast Summit on November 3. Get your tickets here… https://t.co/AWuKG1QMZi
1581706544323903489,2022-10-16 18:00:01+00:00,Crypto Rule Suggestions From U.S. Panel Seek To Plug Holes: by @Rosemarietv https://t.co/2md3yjckNC
1581676341908455426,2022-10-16 16:00:00+00:00,"Crypto’s Biggest Asset Manager Launches Bitcoin Mining Fund, Wants To Take Advantage Of Fire Sale Prices From Under… https://t.co/3QRSSrkzHb"
1581661995916414976,2022-10-16 15:03:00+00:00,Four Reasons Why Its Essential For Women in Afria to Own Crypto: by @WRoselyne_ https://t.co/ptQB9p8d93
1581631044184604672,2022-10-16 13:00:00+00:00,Sign Up! Your Essential Briefing On What's Driving The Day In Bitcoin And Crypto: https://t.co/depB4cuQRV by @BillyBambrough
1581555547051917312,2022-10-16 08:00:00+00:00,"IoT, Meet Blockchain—Knox Matrix Is Samsung's New Peer To Peer IoT Security Platform: by @PatrickMoorhead https://t.co/bpt2HaR6kg"
1581449849035116544,2022-10-16 01:00:00+00:00,"Warner Music Group Hedges Towards A Web3 Future, And Empowered Artists, With New Partnership: by @LeeorShimron https://t.co/HZTjZFMJ9G"
1581374351475036160,2022-10-15 20:00:00+00:00,Ethereum Merge Highlights Differing Visions For America’s Energy Future: by @JamesBroughel https://t.co/JuLeBBbTo5
1581313963999973377,2022-10-15 16:00:03+00:00,Apecoin Swan Dive Follows Report Of Hairy Eyeball From SEC: by @marigra21sl https://t.co/u4WRaIy4zC
1581283762364715010,2022-10-15 14:00:02+00:00,HT Token’s 26% Pop Shows Enthusiasm For Huobi Acquisition But Fundamental Questions Linger: by @eltrade https://t.co/pdn67rFAzF
1581268657715302400,2022-10-15 13:00:01+00:00,Sign Up! Your Essential Briefing On What's Driving The Day In Bitcoin And Crypto: https://t.co/A89rWs0Hy1 by @BillyBambrough
1581208264720535552,2022-10-15 09:00:02+00:00,Why Pillow Thinks Digital Assets Will Set Emerging Markets Free: by @davidprosserind https://t.co/dLkC5Xqrc0
1581178062191968259,2022-10-15 07:00:01+00:00,Why Do Blockchains Need Oracles?: by @Matt_Mastando https://t.co/Xh8MXOpaQr
1581117666923782145,2022-10-15 03:00:02+00:00,Staking Rewards Are Taxable – What Investors Need To Know: by @SeanSteinSmith https://t.co/WMYnrJXUv2
1581072361180258306,2022-10-15 00:00:00+00:00,Mark Cuban sat down with @jemimacmcevoy to predict how crypto will evolve to meet our needs: https://t.co/r1HuEDd0Vo
1581042165261783043,2022-10-14 22:00:01+00:00,Legendary Value Investor Bill Miller Says Buy Bitcoin And Eight Other Stock Bargains: by @skleb1234 https://t.co/3hOCyIgHnD
1581027565388541952,2022-10-14 21:02:00+00:00,"IoT, Meet Blockchain—Knox Matrix Is Samsung's New Peer To Peer IoT Security Platform: by @PatrickMoorhead https://t.co/bpt2HaR6kg"
1581023287060078592,2022-10-14 20:45:00+00:00,"Scam enables “trojan horse” tactic, facilitating “wholesale permission” to access crypto wallet: by @cfarivar https://t.co/RSRrLpdB8d"
1581016995838906368,2022-10-14 20:20:00+00:00,Victims Claim Coinbase Didn't Protect Them From $21 Million Crypto Scam: by @cfarivar https://t.co/RSRrLpvbZL
1581013540562882561,2022-10-14 20:06:16+00:00,Ether Prices Climbed More Than 10% In Roughly 24 Hours https://t.co/pJzBtwQKx6 https://t.co/5eobhZn2XH
1580996871945871360,2022-10-14 19:00:02+00:00,".@SBF_FTX and @Scaramucci join this year's inaugural Forbes Iconoclast Summit, a gathering of the world's most infl… https://t.co/bncSQZgpzo"
1580992019690049537,2022-10-14 18:40:45+00:00,RT @CharlesLBovaird: Ether Prices Climbed Over 10% In Roughly 24 Hours. Analysts Offered Several Takes On What Drove These Gains. https://t…
1580980302088146945,2022-10-14 17:54:11+00:00,RT @DelRayMan: Legendary value investor Bill Miller says buy bitcoin: https://t.co/dURWqzkd7I by @skleb1234 via @ForbesCrypto
1580972495968284675,2022-10-14 17:23:10+00:00,RT @ForbesCrypto: Why Do Blockchains Need Oracles?: by @Matt_Mastando https://t.co/Xh8MXOpaQr
1580951567557136386,2022-10-14 16:00:01+00:00,Why Pillow Thinks Digital Assets Will Set Emerging Markets Free: by @davidprosserind https://t.co/dLkC5XI2AA
1580946155646902272,2022-10-14 15:38:30+00:00,"RT @SeanSteinSmith: Staking Rewards Are Taxable – What Investors Need To Know 

But will that always be the case? 🤓
 @forbes @ForbesCrypto…"
1580946134792491009,2022-10-14 15:38:25+00:00,"RT @CharlesLBovaird: Bitcoin Prices Climb To Roughly $19,500 After Recovering From Today’s Drop https://t.co/n1EllIMZm8 @ForbesCrypto #bitc…"
1580921803815649281,2022-10-14 14:01:44+00:00,"RT @DeanEigenmann: my fur coat made it to a frontpage feature of @Forbes, great article by @JeffKauflin talking about the world of MEV.
htt…"
1580891168514056194,2022-10-14 12:00:00+00:00,Sign Up! Your Essential Briefing On What's Driving The Day In Bitcoin And Crypto: https://t.co/lYE69qgKlR by @BillyBambrough
1580845871553732608,2022-10-14 09:00:01+00:00,Help us identify the most mature blockchain projects from the most talented teams in the world #Blockchain50:… https://t.co/238QCXlWhw
1580755274628927489,2022-10-14 03:00:01+00:00,Coinbase Wins Crypto License In Singapore As City-State Aims To Become Web3 Hub: by @zinnialee23 https://t.co/xQOofPAbY5
1580725573051027456,2022-10-14 01:01:59+00:00,"Bitcoin Prices Climb To Roughly $19,500 After Recovering From Today’s Drop https://t.co/dAbLwGXwlr https://t.co/VuVMrqp7DL"
1580694876936511488,2022-10-13 23:00:01+00:00,Sailing League Backed By Billionaire Larry Ellison And World Champion Russell Coutts Charts New Course Into Web3: b… https://t.co/Y9k6l9AfQJ
1580664677524275203,2022-10-13 21:00:01+00:00,"The Secretive World Of MEV, Where Bots Front-Run Crypto Investors For Big Profits: by @JeffKauflin https://t.co/1f5wauCDYb"
1580636966600990720,2022-10-13 19:09:54+00:00,"RT @dambisamoyo: I am delighted to have been invited as a speaker for the @Forbes Iconoclast Summit, which will take place next month in Ne…"
1580636934770405376,2022-10-13 19:09:46+00:00,"RT @CharlesLBovaird: Fed Overwhelmingly Likely To Hike Rates 75 Basis Points In November, Says FedWatch Tool https://t.co/K0pjWGmQid @Forbe…"
1580636918316163073,2022-10-13 19:09:42+00:00,"RT @DelRayMan: I survived every bitcoin bear market since October 2011, and this is the FIRST time I felt like the recovery was almost cert…"
1580634476408983552,2022-10-13 19:00:00+00:00,"With A $150 Million Debut Venture Fund, BlockTower Is Ready To Take Advantage Of The Crypto Winter: by @alexrkonrad https://t.co/0UJAnC8thl"
1580628431972098048,2022-10-13 18:35:59+00:00,"RT @DelRayMan: Carl Icahn, Ray Dalio and Sam Bankman-Fried all in one place? See you there! #ForbesIconoclast"
1580589181465657344,2022-10-13 16:00:01+00:00,Why Do Blockchains Need Oracles?: by @Matt_Mastando https://t.co/Xh8MXOpaQr
1580581628186722304,2022-10-13 15:30:00+00:00,Mark Cuban sat down with @jemimacmcevoy to predict how crypto will evolve to meet our needs: https://t.co/r1HuEDuBMW
1580580883332882437,2022-10-13 15:27:03+00:00,"RT @alexrkonrad: Crypto VCs are often known for big teams and even bigger online presences. BlockTower barely has a website.

But under new…"
1580574088334032896,2022-10-13 15:00:02+00:00,SailGP is aiming to have a professional sailing team owned and operated by a DAO that complies with the U.S. securi… https://t.co/ReOrY9J0uq
1580570302748270597,2022-10-13 14:45:00+00:00,Sailing League Backed By Billionaire Larry Ellison And World Champion Russell Coutts Charts New Course Into Web3: b… https://t.co/7GsrhuEc6q
1580566891340263424,2022-10-13 14:31:27+00:00,RT @DelRayMan: Why do blockchain's need oracles? @ForbesCrypto's @Matt_Mastando breaks it down: https://t.co/7Zrb5A0Lu7
1580566748746481664,2022-10-13 14:30:53+00:00,Crypto Markets Dip To Two-Year Low After Disappointing Inflation Report https://t.co/8omQ8Iu1qQ
1580558970334285825,2022-10-13 13:59:58+00:00,Ooki DAO And ConstitutionDAO Challenge The Established Order https://t.co/rLMCtG8U9r https://t.co/uYPuacrv7V
1580554269106659328,2022-10-13 13:41:17+00:00,RT @AndreaTinianow: DAOs have the capacity to challenge the world order. ⁦⁦@gnovak_⁩ ⁦@JohnLegere⁩ ⁦⁦@KayvanSadeghi⁩ ⁦@DonnaRedel⁩ ⁦@Forbes…
1580542550980501505,2022-10-13 12:54:43+00:00,RT @Steven_Ehrlich: $BTC not reacting well to today’s #inflation news https://t.co/zAq3E30Kct
1580528779105284096,2022-10-13 12:00:00+00:00,Sign Up! Your Essential Briefing On What's Driving The Day In Bitcoin And Crypto: https://t.co/lAaR42xMi0 by @BillyBambrough
1580498590291484673,2022-10-13 10:00:02+00:00,"Often hesitant to embrace new technologies that could weaken control over artists and royalties, Warner Music Group… https://t.co/8TqvK3w7SX"
1580468388345716738,2022-10-13 08:00:02+00:00,https://t.co/ptQB9p8d93
1580438685169774595,2022-10-13 06:02:00+00:00,Ethereum Merge Highlights Differing Visions For America’s Energy Future: by @JamesBroughel https://t.co/JuLeBBbTo5
1580382816549801984,2022-10-13 02:20:00+00:00,"A16z Crypto Leads $14 Million Bet On Rye, New Web3 Commerce Startup From Justin Kan: by @alexrkonrad https://t.co/NKa9jUny0I"
1580347587550486530,2022-10-13 00:00:00+00:00,"Crypto Darling Helium Promised A ‘People’s Network.’ Instead, Its Executives Got Rich: @DavidJeans2 explains on For… https://t.co/pfrWdpGh4t"
1580324938115751936,2022-10-12 22:30:00+00:00,NFTs said to draw interest as potential securities: by @marigra21sl https://t.co/GovSFt5041
1580319398660751361,2022-10-12 22:08:00+00:00,Apecoin Swan Dive Follows Report Of Hairy Eyeball From SEC: by @marigra21sl https://t.co/patwSCZzyN
1580317385264865281,2022-10-12 22:00:00+00:00,Futures manipulation creates phantom collateral for loans that were whisked off decentralized exchange: by… https://t.co/yr1XCLKiSR
1580316262734839809,2022-10-12 21:55:32+00:00,"High Interest Rates Are Not Likely To Come Down Soon, FOMC Minutes Indicate https://t.co/SqBypvbpPu https://t.co/QjQj001PPu"
1580314170951467008,2022-10-12 21:47:13+00:00,Mango Smashed As Attacker Holds $100 Million Hostage Over Debt Gripe: by @ninabambysheva https://t.co/GaUZq7RcIf
1580304218199846912,2022-10-12 21:07:40+00:00,DeFi protocol in trouble as attacker holds $100 million hostage over debt gripe: https://t.co/a1szBGQl2y by @ninabambysheva
1580302285891985410,2022-10-12 21:00:00+00:00,Four Reasons Why It’s Essential For Women In Africa To Own Crypto Assets: by @WRoselyne_ https://t.co/ptQB9p8d93
1580283664478658560,2022-10-12 19:46:00+00:00,"Forbes #Blockchain50, the list of billion-dollar companies making meaningful use of the technology popularized by b… https://t.co/hLJV5jTqoz"
1580272087264071690,2022-10-12 19:00:00+00:00,Crypto Rule Suggestions From U.S. Panel Seek To Plug Holes: by @Rosemarietv https://t.co/2md3yjckNC
1580256997181517824,2022-10-12 18:00:02+00:00,How To File Crypto Taxes Ahead Of The Final Deadline For 2021 Returns: by @TheCryptoCPA https://t.co/3h6g4Nrd0t
1580240454586486785,2022-10-12 16:54:18+00:00,Surging Yields Could Create Substantial Headwinds For Cryptocurrencies https://t.co/aN3XRd5nEE https://t.co/avcn9UrIfN
1580226791930662912,2022-10-12 16:00:01+00:00,Don't miss the opportunity to see these major crypto leaders share the stage with leading forces in finance. Click… https://t.co/fxeYYpIPQq
1580211691320709121,2022-10-12 15:00:00+00:00,Ethereum Merge Highlights Differing Visions For America’s Energy Future: by @JamesBroughel https://t.co/JuLeBAUiwx
1580189207842390017,2022-10-12 13:30:40+00:00,Zuckerberg Seeks Metaverse Cool With Microsoft-Meta Partnership: @marigra21sl https://t.co/sONxj2Cqmp
1580166391398748163,2022-10-12 12:00:00+00:00,Sign Up! Your Essential Briefing On What's Driving The Day In Bitcoin And Crypto: https://t.co/wmbqgPZiZL by @BillyBambrough
1580105999607906304,2022-10-12 08:00:01+00:00,Coinbase Wins Crypto License In Singapore As City-State Aims To Become Web3 Hub: by @zinnialee23 https://t.co/xQOofPRNmF
1580060701254615040,2022-10-12 05:00:01+00:00,"The Secretive World Of MEV, Where Bots Front-Run Crypto Investors For Big Profits: by @JeffKauflin https://t.co/1f5wauCDYb"
1580015399936172033,2022-10-12 02:00:01+00:00,HT Token’s 26% Pop Shows Enthusiasm For Huobi Acquisition But Fundamental Questions Linger: by @eltrade https://t.co/pdn67rFAzF
1579985197122084865,2022-10-12 00:00:00+00:00,Crypto Rule Suggestions From U.S. Panel Seek To Plug Holes: by @Rosemarietv https://t.co/2md3yjckNC
1579943672879071233,2022-10-11 21:15:00+00:00,J.P. Morgan And Visa Bridge Their Private Blockchain Networks To Streamline Global Payments: by @emilymason00 https://t.co/UFNJ7cnIw1
1579939905353891841,2022-10-11 21:00:01+00:00,"Meta Platforms, which is not exactly having fun in the metaverse, has decided to drag work into it: by @marigra21sl https://t.co/L6lORoSKX2"
1579930713713160192,2022-10-11 20:23:30+00:00,Zuckerberg Seeks Metaverse Cool With Microsoft Partnership: by @marigra21sl https://t.co/vZRiKQJ7Ms
1579914732374409217,2022-10-11 19:20:00+00:00,"A16z Crypto Leads $14 Million Bet On Rye, New Web3 Commerce Startup From Justin Kan: by @alexrkonrad https://t.co/NKa9jUny0I"
1579894604119216129,2022-10-11 18:00:01+00:00,"Cofounded by ex-Twitch cofounder Kan and five others, Rye is promising merchants online sales at a lower cut, due t… https://t.co/D4ua5p01Qf"
1579884533599567874,2022-10-11 17:20:00+00:00,"True believers say crypto is more transparent than traditional finance. Yet that openness, combined with clunky inf… https://t.co/sux78MXAAI"
1579879501059612679,2022-10-11 17:00:00+00:00,"The Secretive World Of MEV, Where Bots Front-Run Crypto Investors For Big Profits: by @JeffKauflin https://t.co/1f5wauUePJ"
1579869433912098825,2022-10-11 16:20:00+00:00,The Nasdaq-listed company announced on Tuesday its Singapore unit had received in-principle approval from the Monet… https://t.co/OSSQYGqOWI
1579864408741892099,2022-10-11 16:00:02+00:00,Coinbase Wins Crypto License In Singapore As City-State Aims To Become Web3 Hub: by @zinnialee23 https://t.co/xQOofPRNmF
1579856852728299520,2022-10-11 15:30:00+00:00,"A16z Crypto Leads $14 Million Bet On Rye, New Web3 Commerce Startup From Justin Kan: by @alexrkonrad https://t.co/NKa9jU5X9a"
