id,created_at,text1554555370458300417,2022-08-02 19:50:57+00:00,How could House Speaker Nancy Pelosi’s visit to Taiwan impact #crypto markets? @ForbesCrypto Director of Research –… https://t.co/srVOBeMahT
1554542548626046979,2022-08-02 19:00:00+00:00,"How Snoop Dogg's NFT Release Of Death Row Session, Vol. 2 Is Opening Up New Possibilities For Independent Artists:… https://t.co/UR3YzrDKEx"
1554527451463680000,2022-08-02 18:00:00+00:00,The IRS Is Working On A New Tax Form To Capture Your Crypto Activity: by @TheCryptoCPA https://t.co/TEDdPieZwW
1554525632071073792,2022-08-02 17:52:47+00:00,RT @Forbes: New York’s financial regulator has fined Robinhood’s cryptocurrency subsidiary $30 million after an investigation. https://t.co…
1554514340392435714,2022-08-02 17:07:54+00:00,RT @TradeTalks: How could House Speaker Nancy Pelosi’s visit to Taiwan impact #crypto markets? @ForbesCrypto Director of Research – Digital…
1554506059552792576,2022-08-02 16:35:00+00:00,It’s testament to LVMH owned Tiffany &amp; Co’s new and thoroughly modern approach to marketing that Arnault can single… https://t.co/RuRseBnP87
1554499515188666368,2022-08-02 16:09:00+00:00,"Tiffany &amp; Co Releases Those CryptoPunk Pendants And They Are Expensive, Here’s All The Intel: by @stiffyhm https://t.co/1XweWf0P7T"
1554482150958923780,2022-08-02 15:00:00+00:00,11 Charged In Alleged $300 Million Crypto Pyramid Scheme By Forsage: by @derek_saul https://t.co/Xs6Od5kkjS
1554472087590473728,2022-08-02 14:20:01+00:00,"Like many crypto supporters, Toomey and Sinema appear to want tokens treated as both money and property: by… https://t.co/3712mHHkyM"
1554466033209073669,2022-08-02 13:55:57+00:00,"Cryptocurrency Should Be Taxed As Investments, Not Money: by @howard_gleckman https://t.co/XwB42QhJNM"
1554451953786167299,2022-08-02 13:00:00+00:00,Understanding Three Challenges That Make Cryptocurrency Regulation Difficult For Nation States: by @WRoselyne_ https://t.co/Yi0WQl0DJt
1554436855013277696,2022-08-02 12:00:00+00:00,Sign Up! Your Essential Briefing On What's Driving The Day In Bitcoin And Crypto: https://t.co/PhmS1Gk8w1 by @BillyBambrough
1554421502589665280,2022-08-02 10:59:00+00:00,The Gap Between The Crypto Industry And Regulators Has Never Been Wider: by @JeffKauflin https://t.co/LjAANjJJdE
1554376454019973122,2022-08-02 08:00:00+00:00,Check out our daily show with @Rosemarietv for the latest crypto news! https://t.co/0wzQR7kQMr
1554352798258630656,2022-08-02 06:26:00+00:00,Cryptocurrency exchanges may soon have to report their customer's earnings and losses in the IRS's newest tax form:… https://t.co/AMLnFlJWMF
1554339712382500870,2022-08-02 05:34:00+00:00,". @CFTCpham and @Steven_Ehrlich discuss the status of crypto regulation, the Lummis-Gillibrand bill, the historical… https://t.co/1Yp1ECCnFL"
1554337198140538880,2022-08-02 05:24:00+00:00,The crypto and blockchain industry continues to feel the pain of the $60 billion Terra Luna crash that saw a $3 tri… https://t.co/JXK1bfA45l
1554314799630131205,2022-08-02 03:55:00+00:00,How EdTech Firms Are Bringing Higher Education To The Metaverse https://t.co/sqyRrgqCWZ
1554293913166430211,2022-08-02 02:32:00+00:00,"Bankrupt crypto lender Celsius Network claimed to operate like a bank, only better. However, because it was not act… https://t.co/vMupTKwEjW"
1554282813263908865,2022-08-02 01:47:54+00:00,"RT @HaileyLennonBTC: “The premise of bitcoin was always self-custody, which means users don’t earn returns but also means they act as their…"
1554275038932729856,2022-08-02 01:17:00+00:00,WATCH NOW! Helium Exaggerates Tech Partnerships: https://t.co/qDrC6QHfeC by @Rosemarietv and @megchristensen
1554250372788768770,2022-08-01 23:39:00+00:00,"RT @CarolineDPham: Watch my @Forbes @ForbesCrypto full interview with @Steven_Ehrlich to catch our discussion of #Tether #USDC, the history…"
1554241817331351552,2022-08-01 23:05:00+00:00,Crypto Price Declines Are Laying The Foundation For Future Growth: by @SeanSteinSmith https://t.co/cfKA9Xpt5X
1554216413392474113,2022-08-01 21:24:03+00:00,CFTC Commissioner Pushes Back Against Claims The Regulator Cannot Police Digital Markets: by @Steven_Ehrlich https://t.co/esxdOk1noo
1554184736163217409,2022-08-01 19:18:11+00:00,RT @Steven_Ehrlich: This outstanding report from @HaileyLennonBTC is a tour de force! https://t.co/PDAjo5JLVE
1554184534111014912,2022-08-01 19:17:22+00:00,Bankrupt Crypto Lender Celsius Could Leave Customers Last In Line To Get Paid: by @HaileyLennonBTC https://t.co/9W8B0OKB4W
1554180161670729729,2022-08-01 19:00:00+00:00,Understanding Three Challenges That Make Cryptocurrency Regulation Difficult For Nation States: by @WRoselyne_ https://t.co/n8CmULG9fd
1554172612238008327,2022-08-01 18:30:00+00:00,Check out our daily show with @Rosemarietv for the latest crypto news! https://t.co/gvprv7PU7Y
1554168610297466882,2022-08-01 18:14:06+00:00,WATCH NOW! Helium Exaggerates Tech Partnerships: https://t.co/eg3C9ElY0C by @Rosemarietv and @megchristensen
1554161288888156163,2022-08-01 17:45:00+00:00,"‘Sell Now’—Reality Bites For Dogecoin As Expert Panel Says Joke Cryptocurrency Is Heading To Zero, Cuts Price Forec… https://t.co/Sp1UnlEqNA"
1554134864689074177,2022-08-01 16:00:00+00:00,White House Could Have Crypto Advisor Thanks To New Bill: by @RegulatoryJason https://t.co/GGAjJGY4WR
1554114732260483078,2022-08-01 14:40:00+00:00,The crypto industry is in a stunning place—there's nearly 100% disagreement between regulators and crypto companies… https://t.co/oSQma0CU9j
1554108516679532544,2022-08-01 14:15:18+00:00,JUST OUT: The Gap Between The Crypto Industry And Regulators Has Never Been Wider: by @JeffKauflin https://t.co/dyWmc6m4ck
1554106915529150464,2022-08-01 14:08:57+00:00,"RT @JeffKauflin: Here's why the SEC hasn’t provided more regulatory clarity on which cryptocurrencies are securities: it would put them ""in…"
1554104667545690114,2022-08-01 14:00:01+00:00,Crypto Exchange Zipmex Seeks Bankruptcy Protection In Singapore As Crypto Crisis Spreads: by @zinnialee23 https://t.co/NN9RqjdpEW
1554100312222404611,2022-08-01 13:42:42+00:00,The IRS Is Working On A New Tax Form To Capture Your Crypto Activity: by @TheCryptoCPA https://t.co/TEDdPieZwW
1554074465327357955,2022-08-01 12:00:00+00:00,Sign Up! Your Essential Briefing On What's Driving The Day In Bitcoin And Crypto: https://t.co/fyWRJrMlCN by @BillyBambrough
1554044266359521282,2022-08-01 10:00:00+00:00,Reimagining Customer Experiences In The Next Web: What Are The Big Questions Brands Should Ask To Create Value In W… https://t.co/1Zgx20ONvd
1554009536486334465,2022-08-01 07:42:00+00:00,"WATCH NOW: ""Few People Seem To Able To Define What Web3 Is,"" Says Cryptographer @adam3us in conversation with… https://t.co/qrcykXsIlA"
1553953668285734912,2022-08-01 04:00:00+00:00,"Crypto Exchange Zipmex Seeks Bankruptcy Protection In Singapore As Crypto Crisis Spreads: by @zinnialee23 
https://t.co/999Hw56Fkp"
1553897045433491457,2022-08-01 00:15:00+00:00,"The chairman of the Senate Banking Committee, Sen. Sherrod Brown, has written letters to Tim Cook of Apple and Sund… https://t.co/f7U64E9faJ"
1553855523681878023,2022-07-31 21:30:00+00:00,Crypto Exchange Zipmex Seeks Bankruptcy Protection In Singapore As Crypto Crisis Spreads: by @zinnialee23 https://t.co/h1Cr2o4QGI
1553802682002989057,2022-07-31 18:00:02+00:00,"RT @ErikSherman: New crypto scam, so be on guard. Something of mine on @Forbes, @ForbesCrypto.

https://t.co/kyaDEELMlR"
1553802677083144192,2022-07-31 18:00:01+00:00,"Claims That DeFi Is Unraveling Or Structurally Flawed Are Unfounded: by @DushyantRBLT
https://t.co/oAd7iGcHWK"
1553798271252021248,2022-07-31 17:42:30+00:00,"WATCH NOW: ""Few People Seem To Able To Define What Web3 Is,"" Says Cryptographer @adam3us in conversation with… https://t.co/3pRRxjA7Os"
1553772475724464128,2022-07-31 16:00:00+00:00,DNA VR in London Blends The Virtual And Physical Worlds: by @the_blagmeister https://t.co/jPps1qx2Jm
1553727178193440770,2022-07-31 13:00:00+00:00,Sign Up! Your Essential Briefing On What's Driving The Day In Bitcoin And Crypto: https://t.co/mVVQ2n0KR6 by @BillyBambrough
1553681878049345537,2022-07-31 10:00:00+00:00,Mr. Clean Onboards Washing Masses To The Metaverse: by @marigra21sl https://t.co/6MpqXdV8G8
1553636579528294406,2022-07-31 07:00:00+00:00,How iHeartMedia Is Bringing Podcasts To The Metaverse (And The Metaverse To Podcasts): @johnkoetsier https://t.co/yx4Nsod5UR
1553591283352051713,2022-07-31 04:00:00+00:00,Bitcoin Prices Extend Recent Gains After U.S. GDP Report Heightens Recession Fears: by @CharlesLBovaird https://t.co/bF48v5MKAQ
1553545982201167875,2022-07-31 01:00:00+00:00,Mr. Clean Onboards Washing Masses To The Metaverse: by @marigra21sl https://t.co/0lNKcHkZLP
1553515783866798081,2022-07-30 23:00:00+00:00,Following a lawsuit alleging insider trading of nine crypto assets deemed securities hundreds of exchanges are left… https://t.co/ZJZBZxfqzJ
1553490114826977282,2022-07-30 21:18:00+00:00,"Bitcoin Could Solve Zimbabwe’s Hyperinflation Problem – Instead, The Country Is Telling Impoverished Citizens To ‘J… https://t.co/ktGALBlyWZ"
1553478035533340673,2022-07-30 20:30:00+00:00,WATCH NOW! Meta Takes 2.8 Billion Dollar Loss On Its Metaverse Bet: https://t.co/XgTFQfrIqS by @Rosemarietv and @megchristensen
1553455386073653250,2022-07-30 19:00:00+00:00,"Apple And Google Are Hosting Fake Crypto Apps Designed To ‘Defraud Investors,’ Senator Says: by @cfarivar https://t.co/Dcv5XVvoIx"
1553440287405506560,2022-07-30 18:00:00+00:00,Challenges And Opportunities For KYC In The Crypto Industry In Africa: by @WRoselyne_ https://t.co/dqhqQyzmCb
1553406314751066114,2022-07-30 15:45:00+00:00,The Absurd Quest VR Price Hike Emphasizes Meta's Untenable Metaverse Dreams: by @PaulTassi https://t.co/5t9EKz7rTu
1553364789329629184,2022-07-30 13:00:00+00:00,Sign Up! Your Essential Briefing On What's Driving The Day In Bitcoin And Crypto: https://t.co/MRjJMgBTKd by @BillyBambrough
1553349688329396226,2022-07-30 12:00:00+00:00,Reimagining Customer Experiences In The Next Web: What Are The Big Questions Brands Should Ask To Create Value In W… https://t.co/6ahaA9rdT5
1553325530832855040,2022-07-30 10:24:00+00:00,Mr. Clean Onboards Washing Masses To The Metaverse: by @marigra21sl https://t.co/KT2FyQhgt0
1553274191272624128,2022-07-30 07:00:00+00:00,U.S. Government Cracks Down On Crypto (Video): https://t.co/nAHtWs553B by @Rosemarietv and @megchristensen
1553236443442593797,2022-07-30 04:30:00+00:00,Crypto Exchange Zipmex Seeks Bankruptcy Protection In Singapore As Crypto Crisis Spreads: by @zinnialee23 https://t.co/NdG7bh7oi4
1553198693859328000,2022-07-30 02:00:00+00:00,Reimagining Customer Experiences In The Next Web: What Are The Big Questions Brands Should Ask To Create Value In W… https://t.co/k9QnSaFVXr
1553153396055605251,2022-07-29 23:00:00+00:00,"""When a new platform arises like Roblox with 200 million monthly active users or Epic’s Fortnite with 100 million m… https://t.co/maovXzAYYp"
1553129334071824384,2022-07-29 21:24:23+00:00,The notion that DeFi is to blame for the current problems in Crypto originates from a lack of fundamental understan… https://t.co/IwHCgjpxtC
1553101807387377664,2022-07-29 19:35:00+00:00,How EdTech Firms Are Bringing Higher Education To The Metaverse https://t.co/Ye46tTnTnh
1553081523607306240,2022-07-29 18:14:24+00:00,"Crypto Winter Watch: All The Big Layoffs, Record Withdrawals And Bankruptcies Sparked By The $2 Trillion Crash:… https://t.co/8skJDPAeJQ"
1553062800037220355,2022-07-29 17:00:00+00:00,Following a lawsuit alleging insider trading of nine crypto assets deemed securities hundreds of exchanges are left… https://t.co/2stNIvRuUd
1553059227744325633,2022-07-29 16:45:48+00:00,RT @zinnialee23: . @zipmex has become the latest victim of the ongoing #crypto crash after running into liquidity problems that it blames o…
1553048705909100544,2022-07-29 16:04:00+00:00,"Carrefour, P&amp;G experiment gets users to spend as time on virtual washing as a typical Netflix show takes: by… https://t.co/9AujU4faJV"
1553046260755701762,2022-07-29 15:54:17+00:00,"RT @Forbes: CRYPTO: Sen. Elizabeth Warren: ""Crypto has made it faster and cheaper than ever before to rip off consumers."" https://t.co/lWrD…"
1553046143692677120,2022-07-29 15:53:49+00:00,RT @marigra21sl: Can the metaverse be useful for retailers outside the luxury retail sector? Carrefour and P&amp;G certainly think so. Read mor…
1553046110557687809,2022-07-29 15:53:41+00:00,RT @megchristensen: .@adam3us + @ninabambysheva talk about web3 at @CoinDesk’s Consensus. s/o to @caseycraig_ for the setup! also s/o to We…
1553038582356615170,2022-07-29 15:23:46+00:00,JUST IN: Mr. Clean Onboards Washing Masses To The Metaverse: by @marigra21sl https://t.co/f2WnvjXdV0
1553035603641516038,2022-07-29 15:11:56+00:00,"RT @megchristensen: new @ForbesCrypto 🎥:@ninabambysheva talks to og cryptographer @adam3us (cited in Satoshi’s bitcoin white paper, no big…"
1553032602755407872,2022-07-29 15:00:01+00:00,"Apple And Google Are Hosting Fake Crypto Apps Designed To ‘Defraud Investors,’ Senator Says: by @cfarivar https://t.co/9uB1L2WFIv"
1553009194621616134,2022-07-29 13:27:00+00:00,The Absurd Quest VR Price Hike Emphasizes Meta's Untenable Metaverse Dreams: by @PaulTassi https://t.co/RYdJTzFmgN
1552975467698864128,2022-07-29 11:12:59+00:00,RT @JRBuckley68: Worthwhile read on a great effort to link #podcasts and the #metaverse
1552972202110324737,2022-07-29 11:00:00+00:00,Sign Up! Your Essential Briefing On What's Driving The Day In Bitcoin And Crypto: https://t.co/lj4VBtt50L by @BillyBambrough
1552934453126828032,2022-07-29 08:30:00+00:00,WATCH NOW! Meta Takes 2.8 Billion Dollar Loss On Its Metaverse Bet: https://t.co/w9d06Eznyd by @Rosemarietv and @megchristensen
1552920864689213441,2022-07-29 07:36:00+00:00,"KYC is a legal requirement in the financial service industry, more so for crypto, because it's the first layer of c… https://t.co/Ckec2CsTMU"
1552881606939086849,2022-07-29 05:00:00+00:00,"Claims That DeFi Is Unraveling Or Structurally Flawed Are Unfounded: by @DushyantRBLT
https://t.co/94RmMjAL8T"
1552851405119131649,2022-07-29 03:00:00+00:00,The Absurd Quest VR Price Hike Emphasizes Meta's Untenable Metaverse Dreams: by @PaulTassi https://t.co/NYvlnNOUSv
1552851405085483010,2022-07-29 03:00:00+00:00,WATCH NOW! Meta Takes 2.8 Billion Dollar Loss On Its Metaverse Bet: https://t.co/ECRYOM3X4V by @Rosemarietv and @megchristensen
1552827748850302976,2022-07-29 01:26:00+00:00,"How iHeartMedia Is Bringing Podcasts To The Metaverse, And The Metaverse To Podcasts: by @johnkoetsier https://t.co/YADnY0rMUA"
1552809122546032641,2022-07-29 00:11:59+00:00,RT @megchristensen: let's talk mark zuckerberg's metaverse. $2.8 billion dollars... 2.8 BILLION DOLLARS 😐 new @ForbesCrypto  vid w/ @Rosema…
1552797551920824320,2022-07-28 23:26:00+00:00,WATCH NOW! U.S. Government Cracks Down On Crypto (Video): https://t.co/4eRxtWqKnA by @Rosemarietv and @megchristensen
1552785224915984384,2022-07-28 22:37:01+00:00,Bitcoin Prices Extend Recent Gains After U.S. GDP Report Heightens Recession Fears https://t.co/HAthNjW3A8 https://t.co/08bh8y7oDT
1552781447680901120,2022-07-28 22:22:01+00:00,"Despite limited diversity today, the metaverse has the power to drive social equality and inclusion, and bring comm… https://t.co/OzZs2awO2c"
1552764585568083968,2022-07-28 21:15:00+00:00,"The chairman of the Senate Banking Committee, Sen. Sherrod Brown, has written letters to Tim Cook of Apple and Sund… https://t.co/6arBSlJxWV"
1552758527285989391,2022-07-28 20:50:56+00:00,"JUST OUT: Apple And Google Are Hosting Fake Crypto Apps Designed To ‘Defraud Investors,’ Senator Says: by @cfarivar https://t.co/wDIkt8usGu"
1552753258334240768,2022-07-28 20:30:00+00:00,WATCH NOW! Meta Takes 2.8 Billion Dollar Loss On Its Metaverse Bet: https://t.co/LqnelWruhT by @Rosemarietv and @megchristensen
1552745078053130240,2022-07-28 19:57:29+00:00,WATCH NOW! Meta Takes 2.8 Billion Dollar Loss On Its Metaverse Bet: https://t.co/q1o8eK3ccb by @Rosemarietv and @megchristensen
1552730609201680387,2022-07-28 19:00:00+00:00,"Claims That DeFi Is Unraveling Or Structurally Flawed Are Unfounded: by @DushyantRBLT
https://t.co/zb2a4iNQHy"
1552715509396918273,2022-07-28 18:00:00+00:00,DNA VR in London Blends The Virtual And Physical Worlds: by @the_blagmeister https://t.co/qkDV6ETk07
1552700410145787905,2022-07-28 17:00:00+00:00,"Compared with the Reserve Bank of Zimbabwe’s latest move, bitcoin adoption is a shining beacon of maturity, democra… https://t.co/e8cUOk3auv"
1552686318400032768,2022-07-28 16:04:00+00:00,"Usher x Rémy Martin 1738: A Taste of Passion is a global campaign that marks Rémy Martin’s first-ever NFT, encompas… https://t.co/4rXYOgqpDM"
1552674811339489280,2022-07-28 15:18:16+00:00,RT @ForbesCrypto: Following a lawsuit alleging insider trading of nine crypto assets deemed securities hundreds of exchanges are left wonde…
1552670212096417795,2022-07-28 15:00:00+00:00,Challenges And Opportunities For KYC In The Crypto Industry In Africa: by @WRoselyne_ https://t.co/CvPa4L4pUl
1552668496433221634,2022-07-28 14:53:11+00:00,Bitcoin Bounces After Fed Tightening But Tide Hasn’t Turned: by @dylan__sloan https://t.co/angOyl87uZ
1552655114896257026,2022-07-28 14:00:00+00:00,Three Wins Needed For Virtual Asset Service Provider Businesses In Africa: by @WRoselyne_ https://t.co/MERJovbxFG
1552629946119606272,2022-07-28 12:20:00+00:00,"Transformed By The Metaverse, The Virtual Retail Experience Grows More Immersive And Engaging Than Ever Before: by… https://t.co/pZCjkvkWpM"
1552609813644853251,2022-07-28 11:00:00+00:00,Sign Up! Your Essential Briefing On What's Driving The Day In Bitcoin And Crypto: https://t.co/EZfUqwkq8t by @BillyBambrough
1552579615683710977,2022-07-28 09:00:00+00:00,Following a lawsuit alleging insider trading of nine crypto assets deemed securities hundreds of exchanges are left… https://t.co/ZWeI1JcKg6
1552565773230645249,2022-07-28 08:05:00+00:00,Coinbase Crypto ‘Nightmare’ Is Just Beginning Amid Wild Bitcoin And Ethereum Price Swings: by @BillyBambrough https://t.co/QDvX3OeX4o
1552564515186909186,2022-07-28 08:00:00+00:00,WATCH NOW! U.S. Government Cracks Down On Crypto (Video): https://t.co/5SfP9ZY0QY by @Rosemarietv and @megchristensen
1552556965720690691,2022-07-28 07:30:00+00:00,"With a new unicorn valuation, Unstoppable Domains offers users control of their data, takes IDs out of wallets: by… https://t.co/c61g9brDoV"
1552534319037648897,2022-07-28 06:00:01+00:00,The Metaverse As A Force For Good: by @MartinBoyd_FIS https://t.co/QKymV6xbzC
1552519217676787717,2022-07-28 05:00:00+00:00,"Pulp Fiction NFT Lawsuit (Miramax V. Tarantino, Et Al.): A Preview Of Coming Attractions: by Neil Elan https://t.co/Mix2CiXJTj"
1552496568921628672,2022-07-28 03:30:00+00:00,"Unstoppable Domains Raises $65 Million To Make Website Domains Into NFTs: by @marigra21sl 
https://t.co/aoRrs6IxWV"
1552487507920621569,2022-07-28 02:54:00+00:00,WATCH NOW! U.S. Government Cracks Down On Crypto (Video): https://t.co/UGgJqOwuyi by @Rosemarietv and @megchristensen
1552478450895790080,2022-07-28 02:18:01+00:00,"Bitcoin Could Solve Zimbabwe’s Hyperinflation Problem – Instead, The Country Is Telling Impoverished Citizens To ‘J… https://t.co/Fsh6hqjFAR"
1552459071021846528,2022-07-28 01:01:00+00:00,"Rémy Martin Launches First NFT In Collaboration With Usher, BlockBar: by @DaraJillian https://t.co/ZBT8I17sH5"
1552429645987196928,2022-07-27 23:04:05+00:00,RT @megchristensen: what’s up with @krakenfx? 👀 new @ForbesCrypto vid with @Rosemarietv and @marigra21sl edited by @mjcutman42 https://t.co…
1552429503502483457,2022-07-27 23:03:31+00:00,RT @emilymason00: What does the SEC declaring nine crypto assets securities mean for the 100+ exchanges trading them? Find out in my latest…
1552429301802405889,2022-07-27 23:02:42+00:00,"RT @Rosemarietv: Sheesh yet another crypto exchange in hot water @ForbesCrypto 

Special thanks to @marigra21sl for joining us in today's e…"
1552412101267931136,2022-07-27 21:54:22+00:00,WATCH NOW! U.S. Government Cracks Down On Crypto (Video): https://t.co/aohJjrAmVd by @Rosemarietv and @megchristensen
1552404713160822784,2022-07-27 21:25:00+00:00,Following a lawsuit alleging insider trading of nine crypto assets deemed securities hundreds of exchanges are left… https://t.co/0tOYpKpTQ8
1552398423697014789,2022-07-27 21:00:01+00:00,Crypto Exchanges Embrace Zero Fee Trading To Fight 67% Drop In Volume: by @eltrade https://t.co/Ir6DLGTsdx
1552397034698817540,2022-07-27 20:54:29+00:00,RT @DelRayMan: Just out: Crypto exchanges are fighting ‘gravitational pull’ to delist assets deemed securities: https://t.co/e2uqhAV0LU by…
1552397027639808002,2022-07-27 20:54:28+00:00,JUST IN: Crypto Exchanges Fight ‘Gravitational Pull’ To Delist Assets Deemed Securities: by @emilymason00 https://t.co/voNmYQhPdd
1552383323443453955,2022-07-27 20:00:00+00:00,"Despite limited diversity today, the metaverse has the power to drive social equality and inclusion, and bring comm… https://t.co/lPhw0ve64j"
1552368222434902016,2022-07-27 19:00:00+00:00,"Registrar Unstoppable Domains Raises $65 Million To Make Website Domains Into NFTs: by @marigra21sl 
https://t.co/OUiEsERCzQ"
1552353122563022849,2022-07-27 18:00:00+00:00,"During Tesla’s quarterly results webcast last week, Elon Musk admitted to dumping some $936 million of Bitcoin. The… https://t.co/y8gthvzCX0"
1552322922508943361,2022-07-27 16:00:00+00:00,"Bitcoin Failed To Hold Its ‘Reversion To The Mean’ At This Week’s Open, How To Trade It Now?: by @Suttmeier https://t.co/HmmPAKdRmd"
1552309083142848515,2022-07-27 15:05:00+00:00,Coinbase Crypto ‘Nightmare’ Is Just Beginning Amid Wild Bitcoin And Ethereum Price Swings: by @BillyBambrough https://t.co/Q5hIYx9rRQ
1552292727416668160,2022-07-27 14:00:01+00:00,Bitcoin Is Knocking On 10 Downing Street: by @MartinRivers https://t.co/lZdke4wkIX
1552268301161713664,2022-07-27 12:22:57+00:00,What are the chances that the #SEC's investigation into #coinbase spills over to other exchanges? @ForbesCrypto Dir… https://t.co/UdAcSgykaY
1552258492546928641,2022-07-27 11:43:58+00:00,RT @theklineventure: Had the best time talking web3 on the @Forbes panel to help institutions better understand how they can get involved i…
1552258117571936256,2022-07-27 11:42:29+00:00,RT @oOGrannyOo: 👀 Whoa..
1552254975262265344,2022-07-27 11:30:00+00:00,"With a new unicorn valuation, Unstoppable Domains offers users control of their data, takes IDs out of wallets: by… https://t.co/iZHZBz7uzQ"
1552248182377250819,2022-07-27 11:03:00+00:00,"JUST IN: Registrar Unstoppable Domains Raises $65 Million To Make Website Domains Into NFTs: by @marigra21sl 
https://t.co/KaShMCiSD0"
1552247428727840768,2022-07-27 11:00:01+00:00,Sign Up! Your Essential Briefing On What's Driving The Day In Bitcoin And Crypto: https://t.co/2Lo6nq0Ook by @BillyBambrough
1552224777313681410,2022-07-27 09:30:00+00:00,"Right from bans to grey areas, the legal uncertainty facing virtual asset service providers (VASPs) keeps persistin… https://t.co/wzV4Wi1bVW"
1552217227599945731,2022-07-27 09:00:00+00:00,Three Wins Needed For Virtual Asset Service Provider Businesses In Africa: by @WRoselyne_ https://t.co/ZV6xn30DuU
1552202128273334278,2022-07-27 08:00:00+00:00,"Flexibility and communication, not edicts and mandates, are how to successfully regulate crypto: by @SeanSteinSmith https://t.co/Bf7qjI7xdP"
1552202128239861760,2022-07-27 08:00:00+00:00,WATCH NOW! Private Information About Coinbase Brings Crypto Market Lower (Video): https://t.co/F6HrcpU2p6 by… https://t.co/LsfhLKpXLj
1552187027256393731,2022-07-27 07:00:00+00:00,Candy Digital Looks To Innovate Nostalgia In New Baseball Hall Of Fame Partnership: by @wmcdonn25 https://t.co/4vpHEUYev7
1552171929905266689,2022-07-27 06:00:00+00:00,Bill Murray’s NFT Drop On Coinbase Provides A Blueprint For Future Celebrity Launches: by @LeeorShimron https://t.co/VIBSkyINpM
1552162114231586816,2022-07-27 05:21:00+00:00,Sam Bankman-Fried Tries To Rescue Crypto...Again: by @Rosemarietv and @megchristensen https://t.co/MFuDdCe40u
1552138208405774337,2022-07-27 03:46:00+00:00,The Metaverse As A Force For Good: by @MartinBoyd_FIS https://t.co/YT5s8ScGqw
1552126628997767169,2022-07-27 03:00:00+00:00,WATCH NOW! Private Information About Coinbase Brings Crypto Market Lower (Video): https://t.co/Uwmfr8m4Sb by… https://t.co/ilH7xSAbZV
1552096433398054914,2022-07-27 01:00:00+00:00,Bill Murray successful launched an NFT drop on Coinbase's beleaguered NFT marketplace. It could prove to be a bluep… https://t.co/kFWGBifC1i
1552088129078808576,2022-07-27 00:27:01+00:00,Three Wins Needed For Virtual Asset Service Provider Businesses In Africa: by @WRoselyne_ https://t.co/U59nh4su4i
1552058683936448515,2022-07-26 22:30:00+00:00,WATCH NOW! Private Information About Coinbase Brings Crypto Market Lower (Video): https://t.co/CTkHUQuNqP by… https://t.co/BGKjzsPVCT
1552057173861142528,2022-07-26 22:24:00+00:00,Bitcoin Could Hit 10% Adoption Rate By End Of The Decade: by @USFunds https://t.co/AzAs1ddR10
1552055003547717634,2022-07-26 22:15:23+00:00,WATCH NOW! Private Information About Coinbase Brings Crypto Market Lower (Video): https://t.co/ATedR9W3zj by… https://t.co/wk5ZXQPush
1552005836624494594,2022-07-26 19:00:00+00:00,"Crypto Will Benefit From Global Collaboration, Not Monolithic Global Rules: by @SeanSteinSmith https://t.co/8ZD9eyu9AL"
